title,link,time,category
今夜遅くにかけて西～北日本で大気不安定 落雷や竜巻に注意,https://www3.nhk.or.jp//news/html/20231025/k10014236121000.html,10月25日 6時25分,気象
JR山手線 横須賀線 東海道線 いずれも運転再開,https://www3.nhk.or.jp//news/html/20231025/k10014236361000.html,10月25日 6時23分,
米GM 業績見通しを撤回 全米自動車労組ストライキの影響で,https://www3.nhk.or.jp//news/html/20231025/k10014236301000.html,10月25日 6時21分,アメリカ
【25日随時更新】ガザ地区で亡くなった子どもが2000人以上に,https://www3.nhk.or.jp//news/html/20231025/k10014236281000.html,10月25日 6時18分,イスラエル・パレスチナ
“戸籍上の性別変更に手術は必要か” きょう最高裁が判断,https://www3.nhk.or.jp//news/html/20231025/k10014236101000.html,10月25日 6時12分,憲法
国連安保理 イスラエルとパレスチナが非難の応酬,https://www3.nhk.or.jp//news/html/20231025/k10014236291000.html,10月25日 5時52分,イスラエル・パレスチナ
ラグビーワールドカップ 27年大会は出場チーム数が24に拡大,https://www3.nhk.or.jp//news/html/20231025/k10014236241000.html,10月25日 5時44分,ラグビー
犯罪被害者や遺族の心情を加害者に伝える 新制度開始で研修会,https://www3.nhk.or.jp//news/html/20231025/k10014236201000.html,10月25日 5時40分,
きょうから参議院でも代表質問 所得税減税の是非など論戦,https://www3.nhk.or.jp//news/html/20231025/k10014236071000.html,10月25日 5時36分,国会
高速道路の通勤割引 毎日24時間に拡大 来年4月から試験導入へ,https://www3.nhk.or.jp//news/html/20231025/k10014236081000.html,10月25日 5時33分,
ガザ NICUの赤ちゃん“48時間の命” 悪化する子どもたちの環境,https://www3.nhk.or.jp//news/html/20231024/k10014236181000.html,10月25日 5時14分,イスラエル・パレスチナ
冬の訪れを前に 松の木に恒例の「こも巻き」山形 鶴岡,https://www3.nhk.or.jp//news/html/20231025/k10014236161000.html,10月25日 4時48分,山形県
東山魁夷の代表作にも 御射鹿池周辺のカラマツが黄金色に 長野,https://www3.nhk.or.jp//news/html/20231025/k10014236151000.html,10月25日 4時47分,長野県
全米自動車労組ストライキ GM主力工場にも拡大 4万5000人超に,https://www3.nhk.or.jp//news/html/20231025/k10014236251000.html,10月25日 2時13分,アメリカ
東京 江東区長 有料広告で投票呼びかけか 区長室など捜索,https://www3.nhk.or.jp//news/html/20231024/k10014235711000.html,10月25日 1時22分,選挙
イスラエル 地上侵攻を数日間遅らせる意向か 米報道,https://www3.nhk.or.jp//news/html/20231025/k10014236231000.html,10月25日 1時19分,イスラエル・パレスチナ
「化石燃料の需要は2030年までにピーク」IEAが見通し示す,https://www3.nhk.or.jp//news/html/20231024/k10014236191000.html,10月24日 23時38分,環境
【24日詳細】ハマス さらに人質2人を解放 死者は7100人超えに,https://www3.nhk.or.jp//news/html/20231024/k10014235231000.html,10月24日 23時33分,イスラエル・パレスチナ
南海トラフ「後発の巨大地震」の課題を新たに議論,https://www3.nhk.or.jp//news/html/20231024/k10014236171000.html,10月24日 22時40分,地震
袴田さん再審 静岡地裁 本人の出廷免除を認める,https://www3.nhk.or.jp//news/html/20231024/k10014235871000.html,10月24日 22時08分,事件
