title,link,time,category
関東甲信 10日から大雪 東京23区など平地でも積雪のおそれ,https://www3.nhk.or.jp//news/html/20220209/k10013474691000.html,2月9日 6時58分,
JR北海道 札幌－新千歳空港も運転再開 大雪の影響続く,https://www3.nhk.or.jp//news/html/20220209/k10013475101000.html,2月9日 6時46分,
韓国大統領選まで1か月 各陣営 若い世代の取り込みに注力,https://www3.nhk.or.jp//news/html/20220209/k10013474701000.html,2月9日 6時07分,韓国大統領選挙
ビジネスに大きな影響“入国制限緩和を”在日ドイツ商工会議所,https://www3.nhk.or.jp//news/html/20220209/k10013474711000.html,2月9日 6時06分,新型コロナウイルス
孤独で仲間求めるとき脳は？ 理研 マウス実験で“突き止めた”,https://www3.nhk.or.jp//news/html/20220209/k10013474671000.html,2月9日 6時05分,
来週期限の13都県「まん延防止」来月6日までの延長 10日決定へ,https://www3.nhk.or.jp//news/html/20220209/k10013474611000.html,2月9日 6時03分,新型コロナウイルス
仏大統領 ウクライナ大統領と会談 停戦合意徹底の重要性で一致,https://www3.nhk.or.jp//news/html/20220209/k10013474721000.html,2月9日 5時43分,米ロ関係
学校での濃厚接触はどういう場合？具体的事例まとめ都が手引き,https://www3.nhk.or.jp//news/html/20220209/k10013474881000.html,2月9日 4時59分,新型コロナウイルス
救急患者受け入れ一時停止の病院も コロナ対応や職員不足 東京,https://www3.nhk.or.jp//news/html/20220209/k10013474891000.html,2月9日 4時46分,新型コロナウイルス
経済安保の強化法案 重要インフラ担う企業の事前審査は14業種,https://www3.nhk.or.jp//news/html/20220209/k10013474641000.html,2月9日 4時44分,
フィリピン大統領選 選挙戦開始 世論調査でマルコス氏がリード,https://www3.nhk.or.jp//news/html/20220209/k10013474791000.html,2月9日 4時21分,
イラン核合意 立て直しに向けた協議 米高官“最終段階にいる”,https://www3.nhk.or.jp//news/html/20220209/k10013474771000.html,2月9日 4時13分,米イラン対立
全国初 駅ホームに診療所 JR西国分寺駅で4月開業予定,https://www3.nhk.or.jp//news/html/20220209/k10013474631000.html,2月9日 4時09分,新型コロナウイルス
18歳・19歳の実名公表 最高検「重大犯罪の少年は検討の対象」,https://www3.nhk.or.jp//news/html/20220209/k10013474661000.html,2月9日 4時06分,18歳 成人年齢引き下げ 民法改正 少年法改正
北京オリンピック 2月9日（水）の予定,https://www3.nhk.or.jp//news/html/20220209/k10013458861000.html,2月9日 4時02分,北京 冬季オリンピック・パラリンピック
名古屋入管収容の女性死亡受け医療体制強化の報告書案まとめる,https://www3.nhk.or.jp//news/html/20220209/k10013474621000.html,2月9日 3時59分,医療
日本 LNGを欧州に融通する方針固める ウクライナ緊迫化受けて,https://www3.nhk.or.jp//news/html/20220209/k10013475021000.html,2月9日 2時08分,
アカデミー賞4部門で候補に 濱口監督「ドライブ・マイ・カー」,https://www3.nhk.or.jp//news/html/20220208/k10013474981000.html,2月9日 1時59分,
リュージュ 新型コロナと闘う医療従事者が出場 氷の上でも戦う,https://www3.nhk.or.jp//news/html/20220209/k10013475081000.html,2月9日 1時55分,北京 冬季オリンピック・パラリンピック
アイスホッケー 日本は準々決勝でフィンランドと対戦,https://www3.nhk.or.jp//news/html/20220209/k10013475061000.html,2月9日 0時54分,アイスホッケー
