title,link,time,category
【随時更新】ガザ地区 多くの医療機関に被害 市民の治療に影響,https://www3.nhk.or.jp//news/html/20240119/k10014326601000.html,1月19日 19時07分,イスラエル・パレスチナ
インフル患者数 前週からほぼ横ばい 専門家は再拡大を懸念,https://www3.nhk.or.jp//news/html/20240119/k10014327641000.html,1月19日 19時06分,インフルエンザ
被災した日本航空高校石川の野球部 山梨で初の全体練習,https://www3.nhk.or.jp//news/html/20240119/k10014327551000.html,1月19日 19時05分,高校野球
文科省 住民票移さず2次避難先の学校に通学も 支援策を周知,https://www3.nhk.or.jp//news/html/20240119/k10014327621000.html,1月19日 19時02分,文部科学省
食べログ “評価訴訟” 2審は店側の訴え退ける判決 東京高裁,https://www3.nhk.or.jp//news/html/20240119/k10014327471000.html,1月19日 19時00分,
安倍派・二階派の会計責任者 岸田派の元会計責任者を立件,https://www3.nhk.or.jp//news/html/20240119/k10014327051000.html,1月19日 18時58分,政治資金
石川 輪島市の高齢者など 2次避難に向け自衛隊輸送機で移動,https://www3.nhk.or.jp//news/html/20240119/k10014327411000.html,1月19日 18時54分,令和6年能登半島地震
地震 被害の全体像は 復旧は いまわかっていること 【19日】,https://www3.nhk.or.jp//news/html/20240119/k10014326841000.html,1月19日 18時53分,令和6年能登半島地震
岸田首相「政治に対する信頼を損ね 極めて遺憾」陳謝,https://www3.nhk.or.jp//news/html/20240119/k10014327831000.html,1月19日 18時52分,政治資金
防災相が新潟の被災地視察 “復旧・復興に必要な支援進める”,https://www3.nhk.or.jp//news/html/20240119/k10014327581000.html,1月19日 18時51分,令和6年能登半島地震
石川 七尾 岡山県の教職員らのチームが学校再開に向け支援活動,https://www3.nhk.or.jp//news/html/20240119/k10014327631000.html,1月19日 18時50分,令和6年能登半島地震
石川県 避難所以外で生活している人対象の窓口設置 “登録を”,https://www3.nhk.or.jp//news/html/20240119/k10014327701000.html,1月19日 18時49分,令和6年能登半島地震
石川 輪島市 大規模火災現場「朝市通り」集中捜索いったん終了,https://www3.nhk.or.jp//news/html/20240119/k10014327711000.html,1月19日 18時44分,令和6年能登半島地震
自民 青年局 “旧態依然の派閥なら解消を”首相に提言申し入れ,https://www3.nhk.or.jp//news/html/20240119/k10014327601000.html,1月19日 18時42分,政治資金
物価上昇でスーパーは…大容量販売に力入れるところも,https://www3.nhk.or.jp//news/html/20240119/k10014327371000.html,1月19日 18時40分,物価高騰
ウクライナから北陸への避難者 東京へ 支援団体が一時受け入れ,https://www3.nhk.or.jp//news/html/20240119/k10014327481000.html,1月19日 18時37分,令和6年能登半島地震
被災した子供の心の問題 メールで相談を 日本小児精神神経学会,https://www3.nhk.or.jp//news/html/20240119/k10014327491000.html,1月19日 18時31分,令和6年能登半島地震
新春恒例「歌会始」 ことしのお題は「和」,https://www3.nhk.or.jp//news/html/20240119/k10014326861000.html,1月19日 18時29分,皇室
能登半島地震で休校 七尾市の小学校 10日遅れて3学期が始まる,https://www3.nhk.or.jp//news/html/20240119/k10014326801000.html,1月19日 18時26分,石川県
円相場一時148円台後半に値下がり 米で早期利下げの見方後退で,https://www3.nhk.or.jp//news/html/20240119/k10014327651000.html,1月19日 18時23分,株価・為替
