title,link,time,category
ウクライナ “南部クリミアでロシア小型揚陸艦に損傷”と発表,https://www3.nhk.or.jp//news/html/20231111/k10014254461000.html,11月11日 5時26分,ウクライナ情勢
外務・経済産業副大臣 今月下旬にウクライナ訪問へ,https://www3.nhk.or.jp//news/html/20231111/k10014254411000.html,11月11日 5時21分,ウクライナ情勢
自民 麻生副総裁 きょうから豪訪問 連携強化図る重要性 強調へ,https://www3.nhk.or.jp//news/html/20231111/k10014254361000.html,11月11日 5時14分,オーストラリア
明治の瓶詰牛乳から医薬品検出 4万4000本余りを回収 大阪,https://www3.nhk.or.jp//news/html/20231111/k10014254711000.html,11月11日 4時45分,大阪府
「かずのこ」生産量日本一 加工作業が最盛期 北海道 留萌,https://www3.nhk.or.jp//news/html/20231111/k10014254471000.html,11月11日 4時35分,北海道
【随時更新】条件つき含め6割超が停戦支持 イスラエル世論調査,https://www3.nhk.or.jp//news/html/20231111/k10014254441000.html,11月11日 1時47分,イスラエル・パレスチナ
11月11日は多くの“記念日” 企業 自治体で活用広がり登録増加,https://www3.nhk.or.jp//news/html/20231111/k10014254651000.html,11月11日 1時16分,
先月9日 鳥島近海が震源の地震 マグニチュード4.4～5.2と推定,https://www3.nhk.or.jp//news/html/20231111/k10014254701000.html,11月11日 1時07分,地震
パリパラリンピック 聖火リレー 来年8月25日から,https://www3.nhk.or.jp//news/html/20231111/k10014254691000.html,11月11日 0時35分,パリ五輪・パラ
インドネシア 初めてのホスト国 サッカー国際大会開幕,https://www3.nhk.or.jp//news/html/20231111/k10014254681000.html,11月11日 0時29分,サッカー
茨城 牛久 住宅で夫婦の遺体 刃物所持の疑いで40歳息子を逮捕,https://www3.nhk.or.jp//news/html/20231110/k10014254551000.html,11月10日 23時46分,茨城県
なでしこジャパン パリ五輪に向けブラジルと強化試合へ,https://www3.nhk.or.jp//news/html/20231110/k10014254631000.html,11月10日 22時53分,なでしこジャパン
エジプトとカタールが首脳会談 ガザ地区の人質問題など協議か,https://www3.nhk.or.jp//news/html/20231110/k10014254641000.html,11月10日 22時52分,イスラエル・パレスチナ
【10日詳細】“イスラエル 1日4時間 戦闘休止” ガザ地区北部,https://www3.nhk.or.jp//news/html/20231110/k10014253301000.html,11月10日 22時50分,イスラエル・パレスチナ
イスラエル軍 “ハマス拠点の病院”を攻撃 現地メディア報道,https://www3.nhk.or.jp//news/html/20231110/k10014254291000.html,11月10日 22時48分,イスラエル・パレスチナ
米中首脳会談15日実施へ “地球規模の課題について協議”,https://www3.nhk.or.jp//news/html/20231110/k10014254561000.html,11月10日 22時41分,アメリカ
フィギュア GP第4戦 宇野昌磨 今季世界最高得点で前半首位,https://www3.nhk.or.jp//news/html/20231110/k10014254531000.html,11月10日 22時35分,フィギュアスケート
保利耕輔 元文部相が死去 89歳,https://www3.nhk.or.jp//news/html/20231110/k10014254661000.html,11月10日 22時34分,訃報
京都市委託の会社 新型コロナ関連業務 7億8800万円余 過大請求,https://www3.nhk.or.jp//news/html/20231110/k10014254581000.html,11月10日 22時13分,京都府
東海沖 障害の地震津波観測システム 今年度中の復旧目指す,https://www3.nhk.or.jp//news/html/20231110/k10014254571000.html,11月10日 21時58分,地震
