title,link,time,category
福井県 新型コロナ 新たに26人感染確認 県内累計2853人,https://www3.nhk.or.jp//news/html/20210912/k10013255681000.html,9月12日 13時05分,新型コロナ 国内感染者数
テニス全米オープン車いすダブルス 国枝組 上地組ともに準優勝,https://www3.nhk.or.jp//news/html/20210912/k10013255601000.html,9月12日 13時04分,車いすテニス
新型コロナ 重症者2010人 前日より47人減少（12日時点）,https://www3.nhk.or.jp//news/html/20210912/k10013255651000.html,9月12日 12時13分,新型コロナ 国内感染者数
米 同時多発テロ20年 倒壊したビルを光の柱で再現 犠牲者悼む,https://www3.nhk.or.jp//news/html/20210912/k10013255611000.html,9月12日 11時58分,テロ
山形県 新型コロナ 新たに18人感染確認,https://www3.nhk.or.jp//news/html/20210912/k10013255621000.html,9月12日 11時55分,新型コロナ 国内感染者数
台風14号 与那国島が暴風域に 八重山地方は暴風など厳重警戒を,https://www3.nhk.or.jp//news/html/20210912/k10013255461000.html,9月12日 11時53分,台風
福島県 新型コロナ 新たに26人感染確認 県内延べ9238人,https://www3.nhk.or.jp//news/html/20210912/k10013255631000.html,9月12日 11時46分,新型コロナ 国内感染者数
“連休中も県をまたぐ移動 自粛を” 西村経済再生相,https://www3.nhk.or.jp//news/html/20210912/k10013255591000.html,9月12日 11時44分,新型コロナウイルス
アメリカ同時多発テロ事件20年 NYでメッツ・ヤンキースが対戦,https://www3.nhk.or.jp//news/html/20210912/k10013255581000.html,9月12日 11時39分,テロ
低温輸送“コールドチェーン”メーカー間で技術開発強化の動き,https://www3.nhk.or.jp//news/html/20210912/k10013255551000.html,9月12日 11時17分,
外国の潜水艦 浮上しないまま接続水域を航行 中国軍か,https://www3.nhk.or.jp//news/html/20210912/k10013255491000.html,9月12日 11時14分,中国
沖縄 与那国町 全域に避難指示 暴風による被害のおそれ,https://www3.nhk.or.jp//news/html/20210912/k10013255571000.html,9月12日 11時08分,気象
歌舞伎「本興行」海外11か国に向けオンライン配信へ,https://www3.nhk.or.jp//news/html/20210912/k10013255541000.html,9月12日 11時00分,新型コロナウイルス
東京 千代田区 歩道にタクシー突っ込んだ事故 運転手が死亡,https://www3.nhk.or.jp//news/html/20210912/k10013255561000.html,9月12日 10時57分,事故
島根県 新型コロナ 新たに13人感染確認 県内計1520人,https://www3.nhk.or.jp//news/html/20210912/k10013255531000.html,9月12日 10時31分,新型コロナ 国内感染者数
鳥取県 新型コロナ 新たに3人感染確認 県内計1593人,https://www3.nhk.or.jp//news/html/20210912/k10013255521000.html,9月12日 10時30分,新型コロナ 国内感染者数
サッカー オランダ1部リーグ 堂安が今季初出場でゴール決める,https://www3.nhk.or.jp//news/html/20210912/k10013255511000.html,9月12日 10時15分,サッカー
サッカー日本代表 長友 11年ぶりにFC東京に復帰,https://www3.nhk.or.jp//news/html/20210912/k10013255501000.html,9月12日 9時15分,サッカー
アフガニスタン 国民の93％が「十分に食事をとれない事態」に,https://www3.nhk.or.jp//news/html/20210912/k10013255411000.html,9月12日 7時42分,アフガニスタン
米 同時多発テロから20年 追悼式典で祈りささげる,https://www3.nhk.or.jp//news/html/20210912/k10013255471000.html,9月12日 7時29分,テロ
