title,link,time,category
日本の去年1年間の名目GDP ドイツに抜かれ世界4位に後退,https://www3.nhk.or.jp//news/html/20240215/k10014358471000.html,2月15日 18時07分,GDP
米 無人の月着陸船が打ち上げ 民間企業で世界初の着陸目指す,https://www3.nhk.or.jp//news/html/20240215/k10014359541000.html,2月15日 18時05分,アメリカ
兵庫 小学生兄弟放火殺人 伯父に懲役30年の判決 神戸地裁,https://www3.nhk.or.jp//news/html/20240215/k10014359601000.html,2月15日 18時03分,兵庫県
4歳次女中毒死事件 検出の向精神薬 母親がふだんから服用か,https://www3.nhk.or.jp//news/html/20240215/k10014359551000.html,2月15日 18時00分,事件
【石川 給水・入浴情報】輪島・珠洲などで実施（15日予定）,https://www3.nhk.or.jp//news/html/20240215/k10014358731000.html,2月15日 17時52分,令和6年能登半島地震
【被害状況 15日】石川県 242人死亡確認 住宅被害6万8000棟超,https://www3.nhk.or.jp//news/html/20240215/k10014359051000.html,2月15日 17時48分,令和6年能登半島地震
自民 聴き取り結果 “還付総額 おととしまでで5億7949万円に”,https://www3.nhk.or.jp//news/html/20240215/k10014359521000.html,2月15日 17時45分,政治資金
車の所有者の個人情報 知人に情報漏えいの疑いで警察官を逮捕,https://www3.nhk.or.jp//news/html/20240215/k10014359511000.html,2月15日 17時37分,事件
70代女性ドライバー 10代男女はね重体 福島 鏡石町 JR鏡石駅前,https://www3.nhk.or.jp//news/html/20240215/k10014359581000.html,2月15日 17時36分,福島県
キム総書記 軍需工場を視察し生産拡大指示 ロシア供与も念頭か,https://www3.nhk.or.jp//news/html/20240215/k10014359491000.html,2月15日 17時29分,北朝鮮情勢
相模原夫婦死亡 長男 以前起こした問題で父親からしかられたか,https://www3.nhk.or.jp//news/html/20240215/k10014359081000.html,2月15日 16時58分,事件
政治資金事件 谷川元衆院議員や岸田派元会計責任者の有罪確定,https://www3.nhk.or.jp//news/html/20240215/k10014359041000.html,2月15日 16時57分,政治資金
輪島塗の老舗漆器店 事業再開へ動き出し 地震で工房が甚大被害,https://www3.nhk.or.jp//news/html/20240215/k10014359421000.html,2月15日 16時49分,令和6年能登半島地震
山本由伸応援ツアー費 出身地の岡山 備前市が6000万円予算計上,https://www3.nhk.or.jp//news/html/20240215/k10014359411000.html,2月15日 16時42分,山本由伸
がれきから見つかった将棋の駒を棋王戦に「妻も楽しみに」,https://www3.nhk.or.jp//news/html/20240215/k10014359331000.html,2月15日 16時40分,令和6年能登半島地震
株価 400円以上値上がり 3万8100円台で取り引き終える,https://www3.nhk.or.jp//news/html/20240215/k10014358931000.html,2月15日 16時30分,きょうの株価
「少しずつ日常が」のと鉄道 1か月半ぶり一部で運転再開 石川,https://www3.nhk.or.jp//news/html/20240215/k10014358951000.html,2月15日 16時25分,令和6年能登半島地震
横浜の60代女性宅から宝石や現金奪われた強盗事件 容疑者逮捕,https://www3.nhk.or.jp//news/html/20240215/k10014359401000.html,2月15日 16時22分,事件
珠洲 輪島 能登町 穴水町 奥能登地域4つの議会 地震対応を優先,https://www3.nhk.or.jp//news/html/20240215/k10014359381000.html,2月15日 16時14分,令和6年能登半島地震
パリ五輪柔道男子100キロ級のウルフアロン 連覇へ向け思い語る,https://www3.nhk.or.jp//news/html/20240215/k10014359371000.html,2月15日 15時56分,柔道
