title,link,time,category
北京五輪・パラ 一般向けチケット販売せず 招待客のみ 組織委,https://www3.nhk.or.jp//news/html/20220117/k10013435881000.html,1月17日 23時27分,北京 冬季オリンピック・パラリンピック
施錠された郵便受け 勝手に開け配達 郵便局配達員が不適切行為,https://www3.nhk.or.jp//news/html/20220117/k10013435701000.html,1月17日 22時44分,
トンガ大規模噴火 現地の被害把握へ 豪など 軍の哨戒機派遣,https://www3.nhk.or.jp//news/html/20220117/k10013434251000.html,1月17日 22時09分,
福島第一原発1号機 調査延期 原因は電磁波の影響か 東京電力,https://www3.nhk.or.jp//news/html/20220117/k10013435871000.html,1月17日 21時58分,福島第一原発
金子総務相 感染拡大でも行政機能の継続を 自治体に対策を要請,https://www3.nhk.or.jp//news/html/20220117/k10013435891000.html,1月17日 21時56分,新型コロナウイルス
東京地検 特捜部長に市川宏氏 「チームワークで真相解明を」,https://www3.nhk.or.jp//news/html/20220117/k10013435801000.html,1月17日 21時53分,
保健所業務ひっ迫で患者への電話できず 地域の医師が健康観察,https://www3.nhk.or.jp//news/html/20220117/k10013435761000.html,1月17日 21時47分,新型コロナウイルス
自民 茂木幹事長「参院選 自公の選挙協力 党内調整を急ぐ」,https://www3.nhk.or.jp//news/html/20220117/k10013435791000.html,1月17日 21時45分,参院選
サッカーW杯 最終予選に向け 日本代表 国内組が合宿スタート,https://www3.nhk.or.jp//news/html/20220117/k10013435741000.html,1月17日 21時44分,サッカーＷ杯（男子）
DeNAと西武の3選手 新型コロナ感染確認 熊本で自主トレ,https://www3.nhk.or.jp//news/html/20220117/k10013435821000.html,1月17日 21時42分,プロ野球
岐阜県と三重県 「まん延防止等重点措置」の適用を国に要請,https://www3.nhk.or.jp//news/html/20220117/k10013435841000.html,1月17日 21時41分,新型コロナウイルス
スキー場 コース外に入った男性3人と連絡取れず 北海道 富良野,https://www3.nhk.or.jp//news/html/20220117/k10013435851000.html,1月17日 21時38分,気象
サッカーW杯最終予選 観戦にワクチン2回接種か陰性確認求める,https://www3.nhk.or.jp//news/html/20220117/k10013435831000.html,1月17日 21時35分,サッカーＷ杯（男子）
自民 新たな国家安全保障戦略策定に向け 有識者からヒアリング,https://www3.nhk.or.jp//news/html/20220117/k10013435861000.html,1月17日 21時31分,
東京都 コロナ 1人死亡 3719人感染確認 自宅療養者は1万人超に,https://www3.nhk.or.jp//news/html/20220117/k10013435121000.html,1月17日 21時07分,新型コロナ 国内感染者数
阪神・淡路大震災 遺族代表のことば全文 神戸市主催の追悼行事,https://www3.nhk.or.jp//news/html/20220117/k10013435781000.html,1月17日 20時52分,阪神・淡路大震災
新型コロナ 事業継続の取り組みは？ ワクチン3回目接種は？,https://www3.nhk.or.jp//news/html/20220117/k10013434621000.html,1月17日 20時39分,新型コロナウイルス
ゆうちょ銀行 硬貨での預け入れや振り込みに手数料 きょうから,https://www3.nhk.or.jp//news/html/20220117/k10013434661000.html,1月17日 20時26分,
東京 埼玉 千葉 神奈川 「まん延防止」の適用を要請,https://www3.nhk.or.jp//news/html/20220117/k10013435361000.html,1月17日 20時25分,新型コロナウイルス
天然ガス 商業生産可能か調べる試掘へ 約20年ぶり 日本海,https://www3.nhk.or.jp//news/html/20220117/k10013434751000.html,1月17日 19時56分,
