title,link,time,category
別の会社経営者からも詐取疑い ソフトバンク元部長ら再逮捕,https://www3.nhk.or.jp//news/html/20231128/k10014270861000.html,11月28日 12時02分,事件
上野の貴金属店に3人組押し入り 18歳の容疑者2人が出頭し逮捕,https://www3.nhk.or.jp//news/html/20231128/k10014270881000.html,11月28日 11時58分,事件
ある特攻隊員の日記 80年後の大学の後輩が向き合う,https://www3.nhk.or.jp//news/html/20231128/k10014270391000.html,11月28日 11時55分,
【随時更新】イスラエルとハマス 戦闘休止2日間延長で合意,https://www3.nhk.or.jp//news/html/20231128/k10014270631000.html,11月28日 11時55分,イスラエル・パレスチナ
“ガザ地区の戦闘休止 2日間延長で合意” カタール政府,https://www3.nhk.or.jp//news/html/20231128/k10014270891000.html,11月28日 11時53分,イスラエル・パレスチナ
自見万博相 政治資金収支報告書に賃料収入未記載で訂正,https://www3.nhk.or.jp//news/html/20231128/k10014270851000.html,11月28日 11時46分,政治資金
デジタル庁 政府と自治体共同利用のクラウドに日本企業を採択,https://www3.nhk.or.jp//news/html/20231128/k10014270831000.html,11月28日 11時39分,IT・ネット
留置場で男性死亡 署員数人書類送検へ 医療措置怠ったか 愛知,https://www3.nhk.or.jp//news/html/20231128/k10014270841000.html,11月28日 11時36分,愛知県
鈴木総務相 LINE利用者の情報流出“大変遺憾”再発防止徹底を,https://www3.nhk.or.jp//news/html/20231128/k10014270791000.html,11月28日 10時59分,サイバー攻撃
鳥インフル感染確認受け “危機感持って対策徹底を” 宮下農相,https://www3.nhk.or.jp//news/html/20231128/k10014270781000.html,11月28日 10時47分,鳥インフルエンザ
有害性指摘のPFAS 規制対象の物質 新たに1つ追加を閣議決定,https://www3.nhk.or.jp//news/html/20231128/k10014270771000.html,11月28日 10時41分,環境
イスラエルとハマス 戦闘休止2日間延長で合意 カタール政府,https://www3.nhk.or.jp//news/html/20231128/k10014270681000.html,11月28日 8時56分,イスラエル・パレスチナ
米ブリンケン国務長官3回目中東訪問へ 人質解放や人道支援協議,https://www3.nhk.or.jp//news/html/20231128/k10014270751000.html,11月28日 8時36分,イスラエル・パレスチナ
核兵器禁止条約 締約国会議始まる 核軍縮へ機運高められるか,https://www3.nhk.or.jp//news/html/20231128/k10014270611000.html,11月28日 8時18分,核兵器禁止条約
大リーグ挑戦 DeNA今永昇太と日本ハム上沢直之が交渉開始へ,https://www3.nhk.or.jp//news/html/20231128/k10014270741000.html,11月28日 8時06分,大リーグ
バイデン大統領 サプライチェーン強化策発表 有権者アピールか,https://www3.nhk.or.jp//news/html/20231128/k10014270731000.html,11月28日 7時50分,アメリカ大統領選
ロシア側犠牲者増か ウクライナ東部へ攻勢強めているとの見方,https://www3.nhk.or.jp//news/html/20231128/k10014270601000.html,11月28日 7時24分,ウクライナ情勢
マスク氏 ガザ地区などに通信サービス提供でイスラエルと合意,https://www3.nhk.or.jp//news/html/20231128/k10014270691000.html,11月28日 5時35分,イスラエル・パレスチナ
北朝鮮の軍事偵察衛星 国連安保理 緊急会合で非難相次ぐ,https://www3.nhk.or.jp//news/html/20231128/k10014270621000.html,11月28日 5時27分,北朝鮮 ミサイル
JR山手線と京浜東北線 運転再開,https://www3.nhk.or.jp//news/html/20231128/k10014270721000.html,11月28日 5時17分,鉄道
