title,link,time,category
【被害状況 15日】石川県で222人死亡安否不明者22人(14時),https://www3.nhk.or.jp//news/html/20240115/k10014320841000.html,1月15日 17時33分,令和6年能登半島地震
佐渡 金銀山遺跡の地震被害 “直ちに対応必要な箇所なし”,https://www3.nhk.or.jp//news/html/20240115/k10014321711000.html,1月15日 17時27分,令和6年能登半島地震
埼玉 乳児施設の元職員を再逮捕 別の女児にも性的暴行か,https://www3.nhk.or.jp//news/html/20240115/k10014321701000.html,1月15日 17時25分,事件
心霊スポットで恐喝疑い ユーチューバーら3人不起訴 京都地検,https://www3.nhk.or.jp//news/html/20240115/k10014321721000.html,1月15日 17時23分,事件
【交通影響 15日】道路・鉄道・航空（17時）,https://www3.nhk.or.jp//news/html/20240115/k10014320821000.html,1月15日 17時23分,令和6年能登半島地震
台湾総統選 ダライ・ラマ14世が当選の頼清徳氏に祝辞述べる,https://www3.nhk.or.jp//news/html/20240115/k10014321661000.html,1月15日 17時21分,中国・台湾
盗撮やキスの教諭懲戒免職“脂肪ではなく筋肉”尻触らせ停職も,https://www3.nhk.or.jp//news/html/20240115/k10014321641000.html,1月15日 17時20分,東京都
「砂川事件」めぐる裁判 当時の学生らの訴え退ける 東京地裁,https://www3.nhk.or.jp//news/html/20240115/k10014321681000.html,1月15日 17時18分,東京都
【ライフライン 15日】石川県内の給水・入浴支援 いつ どこで,https://www3.nhk.or.jp//news/html/20240115/k10014320831000.html,1月15日 17時13分,令和6年能登半島地震
株価 一時3万6000円台に バブル期以来 約33年11か月ぶり,https://www3.nhk.or.jp//news/html/20240115/k10014321271000.html,1月15日 17時08分,きょうの株価
米政府元高官らが台湾訪問 民進党 頼清徳氏などと会談,https://www3.nhk.or.jp//news/html/20240115/k10014321651000.html,1月15日 17時04分,台湾
南太平洋の島国ナウル 台湾と断交 中国と国交樹立へ 声明発表,https://www3.nhk.or.jp//news/html/20240115/k10014321581000.html,1月15日 17時01分,台湾
石川 中能登町 小中学校で6日遅れ始業式 被災の恐怖で欠席も…,https://www3.nhk.or.jp//news/html/20240115/k10014321241000.html,1月15日 16時57分,令和6年能登半島地震
石川 珠洲 100隻以上の漁船が沈没や転覆 漁協関係者が協議,https://www3.nhk.or.jp//news/html/20240115/k10014321631000.html,1月15日 16時53分,令和6年能登半島地震
リニア中央新幹線 新駅周辺のまちづくり考える検討委 甲府,https://www3.nhk.or.jp//news/html/20240115/k10014321621000.html,1月15日 16時51分,鉄道
石川 奥能登地域 多くの酒蔵が全壊 日本酒製造できず,https://www3.nhk.or.jp//news/html/20240115/k10014321611000.html,1月15日 16時27分,令和6年能登半島地震
中国進出の日系企業 5割近くが投資縮小の方針,https://www3.nhk.or.jp//news/html/20240115/k10014321511000.html,1月15日 16時22分,中国
無理なら無理と教えて… 転校か 再開待つか 小学生の親たちは,https://www3.nhk.or.jp//news/html/20240115/k10014321331000.html,1月15日 16時21分,令和6年能登半島地震
藤井八冠を育てた功績 杉本昌隆八段に「金シャチ賞」 名古屋市,https://www3.nhk.or.jp//news/html/20240115/k10014321531000.html,1月15日 16時09分,藤井八冠
嘉納治五郎の書簡見つかる 幻の1940年東京五輪 招致経緯詳しく,https://www3.nhk.or.jp//news/html/20240115/k10014321551000.html,1月15日 16時04分,柔道
