title,link,time,category
日本海側中心に雪 岐阜や滋賀で記録的大雪 交通影響に厳重警戒,https://www3.nhk.or.jp//news/html/20240124/k10014331921000.html,1月24日 17時32分,気象
野党4党 自民派閥からキックバック議員 役職の辞任要求で一致,https://www3.nhk.or.jp//news/html/20240124/k10014333201000.html,1月24日 17時27分,政治資金
買い物で被災地支援 石川県と福井県の物産展始まる 東京 新宿,https://www3.nhk.or.jp//news/html/20240124/k10014333141000.html,1月24日 17時25分,令和6年能登半島地震
LINEなどSNS通じた「FX取引」 投資トラブル増加 注意呼びかけ,https://www3.nhk.or.jp//news/html/20240124/k10014333151000.html,1月24日 17時19分,金融庁
自販機 災害時どうすれば？災害支援型には複数のタイプが…,https://www3.nhk.or.jp//news/html/20240124/k10014331491000.html,1月24日 17時18分,令和6年能登半島地震
米大統領に似た声の電話 “フェイク音声”で予備選挙に介入か,https://www3.nhk.or.jp//news/html/20240124/k10014333221000.html,1月24日 17時17分,バイデン大統領
石川 七尾 断水などの影響で 豆腐店が営業再開の見通し立たず,https://www3.nhk.or.jp//news/html/20240124/k10014333191000.html,1月24日 17時15分,令和6年能登半島地震
自民末松信介 参院予算委員長が辞任意向 政治資金問題で,https://www3.nhk.or.jp//news/html/20240124/k10014332621000.html,1月24日 17時14分,政治資金
マンションに放火か管理人逮捕 消防団員として活動 東京江東区,https://www3.nhk.or.jp//news/html/20240124/k10014333171000.html,1月24日 17時11分,事件
日本経済“デフレを脱却” 判断分かれる 国内100社アンケート,https://www3.nhk.or.jp//news/html/20240124/k10014333161000.html,1月24日 17時09分,物価高騰
“マウンドで勉強”広島新庄高校監督が不適切指導で処分,https://www3.nhk.or.jp//news/html/20240124/k10014333131000.html,1月24日 17時07分,高校野球
連合「正念場」 賃上げ勢い維持できるか 春闘が事実上スタート,https://www3.nhk.or.jp//news/html/20240124/k10014331841000.html,1月24日 17時05分,春闘
【被害状況 24日】石川県で233人死亡 19人が安否不明,https://www3.nhk.or.jp//news/html/20240124/k10014332181000.html,1月24日 16時51分,令和6年能登半島地震
名神高速 岐阜県関ヶ原IC付近で車両が立往生 解消のメド立たず,https://www3.nhk.or.jp//news/html/20240124/k10014332611000.html,1月24日 16時48分,気象
マーケター 森岡毅氏に聞く 観光×日本の勝ち筋,https://www3.nhk.or.jp//news/html/20240124/k10014332491000.html,1月24日 16時42分,
NBA レイカーズ八村塁 先発出場11得点 チームは敗れる,https://www3.nhk.or.jp//news/html/20240124/k10014332911000.html,1月24日 16時38分,バスケットボール
千代田区議会議員と区の元職員逮捕 入札に関する情報漏えいか,https://www3.nhk.or.jp//news/html/20240124/k10014332431000.html,1月24日 16時35分,事件
ユース五輪 スケートショートトラック混合リレー 日本銅メダル,https://www3.nhk.or.jp//news/html/20240124/k10014332441000.html,1月24日 16時33分,スピードスケート
石川県内 半数余が「自主避難所」中長期的な医療支援など課題,https://www3.nhk.or.jp//news/html/20240124/k10014332531000.html,1月24日 16時30分,令和6年能登半島地震
石川 七尾と羽咋の3郵便局 窓口業務を再開 ATMも利用可,https://www3.nhk.or.jp//news/html/20240124/k10014333121000.html,1月24日 16時18分,令和6年能登半島地震
