title,link,time,category
キーウ近郊 多くの市民死亡 ロシアに厳しい対応求める声強まる,https://www3.nhk.or.jp//news/html/20220404/k10013566111000.html,4月4日 11時50分,ウクライナ情勢
LNGの先物取引が試験的に開始 安定した価格での調達目指す,https://www3.nhk.or.jp//news/html/20220404/k10013566301000.html,4月4日 11時49分,原油価格
大リーグ エンジェルス 大谷翔平 オープン戦3号ホームラン,https://www3.nhk.or.jp//news/html/20220404/k10013566291000.html,4月4日 11時42分,大リーグ
NBA ウィザーズ 八村塁 今シーズン初の無得点 チームも大敗,https://www3.nhk.or.jp//news/html/20220404/k10013566251000.html,4月4日 11時32分,バスケットボール
女子ゴルフ海外メジャー第1戦 渋野日向子 通算10アンダーで4位,https://www3.nhk.or.jp//news/html/20220404/k10013566261000.html,4月4日 11時29分,ゴルフ
石川県珠洲市で震度4の地震 津波の心配なし,https://www3.nhk.or.jp//news/html/20220404/k10013566211000.html,4月4日 10時50分,
島根県 新型コロナ 新たに97人感染確認,https://www3.nhk.or.jp//news/html/20220404/k10013566221000.html,4月4日 10時48分,新型コロナ 国内感染者数
鳥取県 新型コロナ 新たに52人感染確認,https://www3.nhk.or.jp//news/html/20220404/k10013566231000.html,4月4日 10時45分,新型コロナ 国内感染者数
東証「プライム市場」など新たな3市場で取り引き始まる,https://www3.nhk.or.jp//news/html/20220404/k10013566181000.html,4月4日 10時45分,株価・為替
岸田首相 内閣発足半年 “緊張感と危機感持ち課題に取り組む”,https://www3.nhk.or.jp//news/html/20220404/k10013566191000.html,4月4日 10時39分,第2次岸田内閣発足
【随時更新】ロシア ウクライナに軍事侵攻（4日の動き）,https://www3.nhk.or.jp//news/html/20220404/k10013565911000.html,4月4日 10時35分,ウクライナ情勢
人気の揚げ物が小さく… ラマダン開始も食用油の価格高騰で,https://www3.nhk.or.jp//news/html/20220404/k10013566081000.html,4月4日 10時06分,ウクライナ情勢
ウクライナ隣国のハンガリーで議会選挙 与党連合勝利の見通し,https://www3.nhk.or.jp//news/html/20220404/k10013566161000.html,4月4日 10時05分,海外の選挙
米 カリフォルニア州で銃発砲 6人死亡12人けが 犯人は逃走か,https://www3.nhk.or.jp//news/html/20220404/k10013566131000.html,4月4日 8時56分,
フィリピン大統領選を前に最有力候補が2回連続で討論会欠席,https://www3.nhk.or.jp//news/html/20220404/k10013566101000.html,4月4日 8時44分,海外の選挙
新型コロナ 後遺症の発症 半数近くが回復後に 東京都が分析,https://www3.nhk.or.jp//news/html/20220404/k10013566121000.html,4月4日 8時20分,新型コロナウイルス
大リーグ レッズ秋山 ベンチ入り枠外れる オープン戦打率1割台,https://www3.nhk.or.jp//news/html/20220404/k10013566141000.html,4月4日 7時57分,大リーグ
東北新幹線 仙台～一ノ関 運転再開 先月の震度6強の地震以来,https://www3.nhk.or.jp//news/html/20220404/k10013566151000.html,4月4日 7時51分,宮城 福島 震度6強
群馬 みどり 殺人放火事件 死亡男性は複数骨折 執ように暴行か,https://www3.nhk.or.jp//news/html/20220404/k10013566051000.html,4月4日 7時33分,事件
フォークリフトの自動運転 実用化目指す動き広がる,https://www3.nhk.or.jp//news/html/20220404/k10013566031000.html,4月4日 6時59分,働き方改革
