title,link,time,category
大相撲13日目の見どころ 大関 霧島は関脇 大栄翔と対戦,https://www3.nhk.or.jp//news/html/20231124/k10014267241000.html,11月24日 5時07分,大相撲
経済対策裏付け 補正予算案 きょう衆議院通過の見通し,https://www3.nhk.or.jp//news/html/20231124/k10014267281000.html,11月24日 5時03分,国会
国内最大級の洋ラン博覧会 国内外の2万点余が展示 沖縄 本部町,https://www3.nhk.or.jp//news/html/20231124/k10014267051000.html,11月24日 5時01分,沖縄県
ガザ地区 日本時間24日午後2時から戦闘休止 人質13人解放へ,https://www3.nhk.or.jp//news/html/20231123/k10014267311000.html,11月24日 2時03分,イスラエル・パレスチナ
岸田首相が急きょホテルに宿泊 公邸の居住スペースに不具合,https://www3.nhk.or.jp//news/html/20231124/k10014267351000.html,11月24日 0時41分,
【詳細】ガザ地区 “24日7時から戦闘休止” カタール発表,https://www3.nhk.or.jp//news/html/20231123/k10014266621000.html,11月24日 0時02分,イスラエル・パレスチナ
Kアリーナ横浜で女性刺される 傷害疑いで逃げた人物の行方捜査,https://www3.nhk.or.jp//news/html/20231123/k10014267191000.html,11月23日 23時43分,事件
軽乗用車と大型トラック衝突 8歳女児と母親が重体 熊本 菊池,https://www3.nhk.or.jp//news/html/20231123/k10014266971000.html,11月23日 22時05分,事故
オランダ下院選 極右政党が第1党の見通し 難民受け入れに反対,https://www3.nhk.or.jp//news/html/20231123/k10014267301000.html,11月23日 21時44分,オランダ
パリパラリンピック 日本がアーチェリーの出場枠を1つ獲得,https://www3.nhk.or.jp//news/html/20231123/k10014267291000.html,11月23日 21時43分,パリ五輪・パラ
サッカー パリ五輪かけたアジアカップ 日本は韓国などと同組,https://www3.nhk.or.jp//news/html/20231123/k10014267271000.html,11月23日 21時41分,サッカー日本代表
JR中央・総武線 運転再開,https://www3.nhk.or.jp//news/html/20231123/k10014267331000.html,11月23日 21時37分,
巨人 ドラフト1位西舘投手 “1年間1軍にいること目標”,https://www3.nhk.or.jp//news/html/20231123/k10014267261000.html,11月23日 21時24分,プロ野球
フィギュア NHK杯開幕へ 宇野昌磨 鍵山優真などが意気込み,https://www3.nhk.or.jp//news/html/20231123/k10014267031000.html,11月23日 21時18分,フィギュアスケート
大相撲九州場所12日目 霧島と熱海富士 2敗でトップに並ぶ,https://www3.nhk.or.jp//news/html/20231123/k10014267171000.html,11月23日 20時56分,大相撲
巨人 長嶋茂雄さんがイベントに参加「勝つ！勝つ！勝つ！」,https://www3.nhk.or.jp//news/html/20231123/k10014267231000.html,11月23日 20時37分,プロ野球
JR中央・総武線各駅停車 運転見合わせ 阿佐ヶ谷駅で人身事故,https://www3.nhk.or.jp//news/html/20231123/k10014267251000.html,11月23日 20時34分,
日本ハム新庄監督「来年の開幕投手は…」イベントで発表,https://www3.nhk.or.jp//news/html/20231123/k10014267221000.html,11月23日 20時27分,プロ野球
ゼレンスキー大統領“防空能力高める欧米の支援グループ結成”,https://www3.nhk.or.jp//news/html/20231123/k10014267091000.html,11月23日 20時22分,ウクライナ情勢
阪神・オリックス リーグ優勝パレード 多くのファン【動画】,https://www3.nhk.or.jp//news/html/20231123/k10014266881000.html,11月23日 20時16分,プロ野球
