title,link,time,category
カーリング 日本代表決定戦 ロコ・ソラーレ2連敗で女子は混戦,https://www3.nhk.or.jp//news/html/20250912/k10014921401000.html,9月12日 20時34分,#カーリング
14日にかけて 北日本～西日本の広範囲で大雨のおそれ,https://www3.nhk.or.jp//news/html/20250912/k10014920421000.html,9月12日 20時29分,気象
国民 榛葉氏 野党全体で政権交代難しい 理解示す党と連携へ,https://www3.nhk.or.jp//news/html/20250912/k10014921351000.html,9月12日 20時27分,選挙
【中継】ユナイテッド航空機が関空に緊急着陸 乗客は全員脱出,https://www3.nhk.or.jp//news/html/20250912/k10014921411000.html,9月12日 20時25分,航空
三重 いなべ 1312世帯2705人に避難指示,https://www3.nhk.or.jp//news/html/20250912/k10014921441000.html,9月12日 20時20分,三重県
天皇皇后両陛下と愛子さま 長崎の平和公園で戦没者を慰霊,https://www3.nhk.or.jp//news/html/20250912/k10014920271000.html,9月12日 20時18分,皇室
ネパールで若者不満爆発 批判高まる“ネポキッズ”とは？,https://www3.nhk.or.jp//news/html/20250912/k10014921311000.html,9月12日 20時16分,国際特集
能登半島地震 災害関連死 新たに10人答申 死者は666人の見通し,https://www3.nhk.or.jp//news/html/20250912/k10014921371000.html,9月12日 19時41分,令和6年能登半島地震
スーパーのコメ平均価格 5キロ 4155円 6月以来の4000円超,https://www3.nhk.or.jp//news/html/20250912/k10014920771000.html,9月12日 19時38分,コメ
カーリング男子 SC軽井沢クラブ 世界最終予選の日本代表に決定,https://www3.nhk.or.jp//news/html/20250912/k10014921141000.html,9月12日 19時36分,#カーリング
アメリカで拘束の日本人3人含む330人 チャーター機で韓国到着,https://www3.nhk.or.jp//news/html/20250912/k10014921121000.html,9月12日 19時34分,アメリカ
サッカー日本代表 W杯に向け11月に南米ボリビアと強化試合へ,https://www3.nhk.or.jp//news/html/20250912/k10014921381000.html,9月12日 19時31分,#サッカー日本代表
東京 赤坂 オフィスで刃物切りつけ 2人けが 男の容疑者を逮捕,https://www3.nhk.or.jp//news/html/20250912/k10014921361000.html,9月12日 19時30分,事件
身寄りのない高齢者急増 引き取り手ない遺体に負担増す自治体,https://www3.nhk.or.jp//news/html/20250912/k10014921031000.html,9月12日 19時25分,東京都
子どもへの性暴力防止 “防犯カメラの設置が有効” 国の検討会,https://www3.nhk.or.jp//news/html/20250912/k10014921331000.html,9月12日 19時23分,こども家庭庁
三重 菰野町付近に記録的な大雨 災害の危険迫る,https://www3.nhk.or.jp//news/html/20250912/k10014921391000.html,9月12日 19時13分,気象
静岡 国内最大規模と推定の竜巻 発生から1週間 生活再建が課題,https://www3.nhk.or.jp//news/html/20250912/k10014920491000.html,9月12日 19時10分,台風
おせち料理販売で不当表示か ジャパネットに措置命令 消費者庁,https://www3.nhk.or.jp//news/html/20250912/k10014921341000.html,9月12日 19時08分,長崎県
東京港 コンテナ倒れて1人死亡 気象台“突風が要因の1つか”,https://www3.nhk.or.jp//news/html/20250912/k10014921181000.html,9月12日 19時06分,東京都
静岡 竜巻 建物の窓ガラス割れ一気に風が入り込み 被害拡大か,https://www3.nhk.or.jp//news/html/20250912/k10014921301000.html,9月12日 19時05分,静岡県
