title,link,time,category
イスラエル 緊急政府発足へ “ハマスとの戦争を遂行するため”,https://www3.nhk.or.jp//news/html/20231012/k10014223451000.html,10月12日 19時10分,イスラエル・パレスチナ
長野 老人ホーム殺害事件 職場のパソコンに“薬物”の検索履歴,https://www3.nhk.or.jp//news/html/20231012/k10014223411000.html,10月12日 19時08分,事件
セブン＆アイHD半年間の決算発表 スーパー事業立て直しが課題,https://www3.nhk.or.jp//news/html/20231012/k10014223531000.html,10月12日 19時07分,
「年収の壁」企業助成金支給  今月からの取り組み対象で開始へ,https://www3.nhk.or.jp//news/html/20231012/k10014223421000.html,10月12日 19時07分,厚生労働省
イラン大統領とサウジアラビア皇太子 ガザ情勢など意見交換,https://www3.nhk.or.jp//news/html/20231012/k10014223471000.html,10月12日 19時04分,イスラエル・パレスチナ
ファーストリテイリング海外事業好調 売り上げ 利益が過去最高,https://www3.nhk.or.jp//news/html/20231012/k10014223511000.html,10月12日 19時03分,
ラグビーＷ杯 準々決勝の見どころ 今大会の戦いぶりは【前編】,https://www3.nhk.or.jp//news/html/20231012/k10014222871000.html,10月12日 18時54分,ラグビーW杯 2023
スタートアップ企業参入拡大へ 設立手続き一部オンライン化へ,https://www3.nhk.or.jp//news/html/20231012/k10014223481000.html,10月12日 18時47分,法務省
衣料品卸売り会社の決算粉飾か コンサル会社代表ら3人逮捕,https://www3.nhk.or.jp//news/html/20231012/k10014223061000.html,10月12日 18時46分,事件
日銀 野口審議委員 “当面は大規模金融緩和続ける必要ある”,https://www3.nhk.or.jp//news/html/20231012/k10014223491000.html,10月12日 18時46分,日本銀行（日銀）
【随時更新】パレスチナ ガザ地区 唯一の発電所が操業停止,https://www3.nhk.or.jp//news/html/20231012/k10014222521000.html,10月12日 18時41分,イスラエル・パレスチナ
日韓関係「よい」と答えた人の割合 双方で調査開始以来 最高に,https://www3.nhk.or.jp//news/html/20231012/k10014223371000.html,10月12日 18時33分,日韓関係
戸籍上性別変更に手術必要の規定「憲法違反で無効」静岡家裁,https://www3.nhk.or.jp//news/html/20231012/k10014223241000.html,10月12日 18時30分,LGBTQ
イスラエルとハマスの衝突 SNSで報道機関装う偽動画など拡散,https://www3.nhk.or.jp//news/html/20231012/k10014223271000.html,10月12日 18時28分,イスラエル・パレスチナ
自見沖縄・北方相 元島民らの墓参再開 ロシア側に求める考え,https://www3.nhk.or.jp//news/html/20231012/k10014223391000.html,10月12日 18時27分,北方領土
イスラエルから成田空港に帰国した人が現地の緊迫感を語る,https://www3.nhk.or.jp//news/html/20231012/k10014223401000.html,10月12日 18時24分,イスラエル・パレスチナ
円相場 対ドル いくぶん値下がり,https://www3.nhk.or.jp//news/html/20231012/k10014223441000.html,10月12日 18時23分,株価・為替
アフガニスタン地震 食料や飲み水などの支援が課題に,https://www3.nhk.or.jp//news/html/20231012/k10014223361000.html,10月12日 18時22分,アフガニスタン
医療機器の使用めぐる汚職事件 医師を収賄容疑で再逮捕 警視庁,https://www3.nhk.or.jp//news/html/20231012/k10014222921000.html,10月12日 18時00分,事件
大型で猛烈 台風15号 あす小笠原諸島に最接近の見込み 警戒を,https://www3.nhk.or.jp//news/html/20231012/k10014223381000.html,10月12日 17時59分,台風
