title,link,time,category
コロナ患者 搬送時にカプセル状の覆い 新たな機器を開発,https://www3.nhk.or.jp//news/html/20211211/k10013384431000.html,12月11日 14時27分,新型コロナウイルス
居酒屋チェーン 2年足らずで店舗20％減 コロナ禍で撤退進む,https://www3.nhk.or.jp//news/html/20211211/k10013384421000.html,12月11日 14時22分,新型コロナウイルス
拉致被害者家族会 飯塚代表が退任 体調不良で,https://www3.nhk.or.jp//news/html/20211211/k10013384351000.html,12月11日 14時08分,拉致
曽我ひとみさん 拉致被害者の救出訴え署名活動 新潟,https://www3.nhk.or.jp//news/html/20211211/k10013384401000.html,12月11日 13時02分,拉致
SBIホールディングス 新生銀行を子会社化 TOBで48％近く取得,https://www3.nhk.or.jp//news/html/20211211/k10013384411000.html,12月11日 12時52分,
NBA 欠場続く八村塁 チームに“八村モデル”腕時計プレゼント,https://www3.nhk.or.jp//news/html/20211211/k10013384391000.html,12月11日 12時52分,バスケットボール
東日本大震災10年9か月 津波で亡くなった母へ祈り 仙台,https://www3.nhk.or.jp//news/html/20211211/k10013384381000.html,12月11日 12時21分,東日本大震災
愛知 小牧 多重事故 逮捕された運転手勤務の運送会社を捜索,https://www3.nhk.or.jp//news/html/20211211/k10013384371000.html,12月11日 12時18分,事故
仙台 太白区 男性切りつけ事件 刃物を持った女が出頭,https://www3.nhk.or.jp//news/html/20211211/k10013384331000.html,12月11日 12時17分,事件
鹿児島 悪石島 希望者が島外避難 今月4日から地震相次ぐ,https://www3.nhk.or.jp//news/html/20211211/k10013384361000.html,12月11日 11時55分,
東京都 新型コロナ 飲み薬開発へ 宿泊療養施設で治験,https://www3.nhk.or.jp//news/html/20211211/k10013384341000.html,12月11日 11時41分,新型コロナウイルス
春のセンバツ高校野球 21世紀枠 候補校の9校を発表 高野連,https://www3.nhk.or.jp//news/html/20211210/k10013383341000.html,12月11日 11時39分,センバツ
英調査 オミクロン株 追加接種で約70～75％の発症防止効果,https://www3.nhk.or.jp//news/html/20211211/k10013384321000.html,12月11日 11時20分,新型コロナウイルス
政府 北京オリンピックへの閣僚派遣 見送る方向で調整,https://www3.nhk.or.jp//news/html/20211211/k10013384301000.html,12月11日 10時33分,北京 冬季オリンピック・パラリンピック
東京 練馬区 警察官が死亡 交番で拳銃自殺か,https://www3.nhk.or.jp//news/html/20211211/k10013384311000.html,12月11日 10時27分,事件
アメリカ 新型コロナ感染者 1日平均10万人超える,https://www3.nhk.or.jp//news/html/20211211/k10013384291000.html,12月11日 10時24分,新型コロナウイルス
仙台 太白区 男性が女に切りつけられけが 女は走って逃げる,https://www3.nhk.or.jp//news/html/20211211/k10013384281000.html,12月11日 9時47分,事件
米 アフガニスタンへ個人送金認める指針 深刻な食料不足などで,https://www3.nhk.or.jp//news/html/20211211/k10013384271000.html,12月11日 9時36分,アフガニスタン
「デイドリーム・ビリーバー」 モンキーズのネスミスさん死去,https://www3.nhk.or.jp//news/html/20211211/k10013384261000.html,12月11日 9時08分,おくやみ
11月の米消費者物価指数 前年同月比6.8％上昇 39年ぶり高水準,https://www3.nhk.or.jp//news/html/20211210/k10013384131000.html,12月11日 9時02分,新型コロナ 経済影響
