title,link,time,category
【避難指示まとめ】 太平洋沿岸に津波注意報,https://www3.nhk.or.jp//news/html/20231203/k10014276281000.html,12月3日 2時32分,地震
【動画】津波注意報 気象庁会見「解除まで海に近づかないで」,https://www3.nhk.or.jp//news/html/20231203/k10014276211000.html,12月3日 2時28分,地震
【速報中 放送同時提供中】太平洋沿岸に津波注意報 最新情報,https://www3.nhk.or.jp//news/html/20231203/k10014276181000.html,12月3日 2時26分,地震
【随時更新】太平洋沿岸に津波注意報 各地では,https://www3.nhk.or.jp//news/html/20231203/k10014276221000.html,12月3日 2時15分,地震
【解説動画】太平洋沿岸に津波注意報「油断せずに注意続けて」,https://www3.nhk.or.jp//news/html/20231203/k10014276261000.html,12月3日 1時48分,地震
沖縄 避難指示 石垣市・宮古市・竹富町の沿岸部など,https://www3.nhk.or.jp//news/html/20231203/k10014276251000.html,12月3日 1時37分,地震
愛知 豊橋市 沿岸部全域に避難指示 津波注意報受け,https://www3.nhk.or.jp//news/html/20231203/k10014276271000.html,12月3日 1時28分,地震
千葉 富津 海岸付近にいる人に避難指示 津波注意報受け,https://www3.nhk.or.jp//news/html/20231203/k10014276241000.html,12月3日 1時04分,地震
三重 尾鷲 沿岸部対象に避難指示 津波注意報受け,https://www3.nhk.or.jp//news/html/20231203/k10014276231000.html,12月3日 0時57分,地震
千葉 館山 海岸付近にいる人に避難指示 津波注意報受け,https://www3.nhk.or.jp//news/html/20231203/k10014276191000.html,12月3日 0時33分,地震
安倍派の複数議員 キックバック1000万超か 政治資金パーティー,https://www3.nhk.or.jp//news/html/20231202/k10014275881000.html,12月2日 23時44分,政治資金
太田純氏が残したメッセージとは【経済コラム】,https://www3.nhk.or.jp//news/html/20231201/k10014274331000.html,12月2日 23時05分,コラム 株・円相場
新幹線車内でクマ撃退スプレー誤噴射か 乗客5人が目・のど痛み,https://www3.nhk.or.jp//news/html/20231202/k10014275991000.html,12月2日 23時02分,鉄道
COP28“再生可能エネルギーの発電容量3倍へ 110か国以上合意”,https://www3.nhk.or.jp//news/html/20231202/k10014276121000.html,12月2日 22時20分,COP
【2日詳細】イスラエル軍 “1日余りで400以上の標的を攻撃”,https://www3.nhk.or.jp//news/html/20231202/k10014275571000.html,12月2日 22時01分,イスラエル・パレスチナ
競泳 ジャパンOP3日目 男子200mバタフライ 本多灯が4連覇,https://www3.nhk.or.jp//news/html/20231202/k10014276011000.html,12月2日 21時53分,競泳
イスラエル軍 “軍事作戦再開後 1日余で400以上の標的攻撃”,https://www3.nhk.or.jp//news/html/20231202/k10014275941000.html,12月2日 21時52分,イスラエル・パレスチナ
岸田首相 ヨルダン国王と会談 約1億ドルの財政支援へ,https://www3.nhk.or.jp//news/html/20231202/k10014276021000.html,12月2日 21時41分,イスラエル・パレスチナ
鹿児島 出水 養鶏場で鳥インフル疑い 今シーズン全国4例目か,https://www3.nhk.or.jp//news/html/20231202/k10014276031000.html,12月2日 21時34分,鳥インフルエンザ
ガザ地区に支援物資が搬入 戦闘再開以来初めてか,https://www3.nhk.or.jp//news/html/20231202/k10014276111000.html,12月2日 21時31分,イスラエル・パレスチナ
