title,link,time,category
米 新駐日大使 中国念頭に「共通の価値観発展へ 重要な局面」,https://www3.nhk.or.jp//news/html/20220106/k10013416901000.html,1月6日 6時09分,米 バイデン大統領
スキージャンプ男子W杯 小林陵侑が今季6勝目,https://www3.nhk.or.jp//news/html/20220106/k10013416931000.html,1月6日 6時05分,スキージャンプ
伝統の手織物「佐賀錦」のひな人形展 佐賀,https://www3.nhk.or.jp//news/html/20220106/k10013416651000.html,1月6日 5時53分,
航空自衛隊「ブルーインパルス」 ことし初めての飛行訓練 宮城,https://www3.nhk.or.jp//news/html/20220106/k10013416671000.html,1月6日 5時51分,自衛隊
農園でイチゴ狩り始まる 親子連れなどでにぎわう 三重 志摩,https://www3.nhk.or.jp//news/html/20220106/k10013416661000.html,1月6日 5時49分,
カザフスタンで非常事態宣言 燃料高騰で抗議活動 一部が暴徒化,https://www3.nhk.or.jp//news/html/20220106/k10013417011000.html,1月6日 5時24分,
北朝鮮の飛しょう体発射 日米外務・防衛閣僚協議で対応協議へ,https://www3.nhk.or.jp//news/html/20220106/k10013416881000.html,1月6日 5時18分,北朝鮮 ミサイル
日米韓防衛相会談 開催見送り 米国内のコロナ感染急拡大で,https://www3.nhk.or.jp//news/html/20220106/k10013416971000.html,1月6日 5時16分,新型コロナウイルス
沖縄県「まん延防止等重点措置」県内の全自治体を対象に要請へ,https://www3.nhk.or.jp//news/html/20220106/k10013417081000.html,1月6日 5時11分,新型コロナウイルス
山口県と広島県「まん延防止等重点措置」適用要請へ,https://www3.nhk.or.jp//news/html/20220105/k10013417031000.html,1月6日 0時07分,新型コロナウイルス
小池都知事 オミクロン株感染者対応 自宅療養などに切り替えへ,https://www3.nhk.or.jp//news/html/20220105/k10013417061000.html,1月5日 23時47分,新型コロナウイルス
沖縄の南部保健所 6日から窓口業務を一時休止 調査体制強化で,https://www3.nhk.or.jp//news/html/20220105/k10013417051000.html,1月5日 23時45分,新型コロナウイルス
神社の社務所兼住宅で火事 焼け跡から2人の遺体 新潟 長岡,https://www3.nhk.or.jp//news/html/20220105/k10013417041000.html,1月5日 23時40分,
ラグビー リーグワン 7日の開幕戦中止 パナソニック9人陽性で,https://www3.nhk.or.jp//news/html/20220105/k10013416851000.html,1月5日 23時23分,ラグビー
サッカー女子 皇后杯 中高生チームのメニーナ 準決勝で惜敗,https://www3.nhk.or.jp//news/html/20220105/k10013417021000.html,1月5日 22時59分,サッカー
香港政府 コロナ拡大阻止で規制強化へ 7日から夜間の外食禁止,https://www3.nhk.or.jp//news/html/20220105/k10013416991000.html,1月5日 21時30分,新型コロナウイルス
新型コロナ 全国で2638人感染確認 2000人超は去年9月以来,https://www3.nhk.or.jp//news/html/20220105/k10013416551000.html,1月5日 21時15分,新型コロナ 国内感染者数
沖縄県 重点措置めぐり専門家会議 より強い措置求める意見も,https://www3.nhk.or.jp//news/html/20220105/k10013416981000.html,1月5日 21時12分,新型コロナウイルス
東京都 新型コロナ 新たに390人感染確認 この2日で4倍近くに,https://www3.nhk.or.jp//news/html/20220105/k10013415901000.html,1月5日 21時07分,新型コロナ 国内感染者数
「ALSOK」元社員を逮捕 ATMメンテナンス中に約1億円盗んだ疑い,https://www3.nhk.or.jp//news/html/20220105/k10013416961000.html,1月5日 20時55分,事件
