title,link,time,category
新型コロナ対策 “実態に即し重点を変えるべき” 全国知事会,https://www3.nhk.or.jp//news/html/20220215/k10013485731000.html,2月15日 20時08分,新型コロナウイルス
ノルディック複合【速報】渡部暁斗が銅メダル 個人ラージヒル,https://www3.nhk.or.jp//news/html/20220215/k10013484731000.html,2月15日 20時07分,スキーノルディック複合
トンガ沖 海底火山噴火から1か月 水産業への影響 長期化が懸念,https://www3.nhk.or.jp//news/html/20220215/k10013485541000.html,2月15日 20時05分,
フィギュア【速報】女子シングルSP 坂本・樋口・河辺が出場,https://www3.nhk.or.jp//news/html/20220215/k10013484761000.html,2月15日 20時05分,フィギュアスケート
感染拡大で救急医療ひっ迫 「治療タイミング逃がしかねない」,https://www3.nhk.or.jp//news/html/20220215/k10013485721000.html,2月15日 20時04分,新型コロナウイルス
オリンピック【随時更新】大会12日目 15日の競技結果・動き,https://www3.nhk.or.jp//news/html/20220215/k10013484371000.html,2月15日 20時02分,北京 冬季オリンピック・パラリンピック
巨人 大リーグ通算46勝を挙げた大型の右ピッチャーを獲得,https://www3.nhk.or.jp//news/html/20220215/k10013485781000.html,2月15日 20時00分,プロ野球
コロナ担当相と大阪府知事が会談 連携した高齢者対策を確認,https://www3.nhk.or.jp//news/html/20220215/k10013485791000.html,2月15日 19時59分,新型コロナウイルス
パラリンピック アルペン本堂杏実「思い切って楽しんで滑る」,https://www3.nhk.or.jp//news/html/20220215/k10013485681000.html,2月15日 19時55分,パラスキーアルペン
岸田首相とウクライナ大統領 電話会談終わる,https://www3.nhk.or.jp//news/html/20220215/k10013485801000.html,2月15日 19時49分,ロシア
ウクライナ大統領16日は「国民統合の日」と宣言 緊張続く中で,https://www3.nhk.or.jp//news/html/20220215/k10013485751000.html,2月15日 19時47分,ロシア
北京オリンピック 日本メダル13個に 冬最多ピョンチャンと並ぶ,https://www3.nhk.or.jp//news/html/20220215/k10013485581000.html,2月15日 19時37分,北京 冬季オリンピック・パラリンピック
ウクライナ情勢 ロシア国防省 演習終えた部隊 撤収開始と発表,https://www3.nhk.or.jp//news/html/20220215/k10013485771000.html,2月15日 19時35分,ロシア
スピードスケート 女子団体パシュート 日本は銀メダル,https://www3.nhk.or.jp//news/html/20220215/k10013484831000.html,2月15日 19時31分,スピードスケート
日大 田中英壽前理事長 脱税事件の初公判 起訴内容認める,https://www3.nhk.or.jp//news/html/20220215/k10013484841000.html,2月15日 19時27分,事件
【国内感染】新型コロナ236人死亡 8万4221人感染（18:20現在）,https://www3.nhk.or.jp//news/html/20220215/k10013485761000.html,2月15日 19時21分,新型コロナ 国内感染者数
大阪 集合住宅で男女意識不明 男性は女性の娘と面識ある高校生,https://www3.nhk.or.jp//news/html/20220215/k10013484641000.html,2月15日 19時18分,事件
日本海側 あすから18日にかけこの冬一番の大雪の可能性,https://www3.nhk.or.jp//news/html/20220215/k10013485531000.html,2月15日 19時09分,
NTT労組 春闘で2％賃上げ要求へ “人財への投資” 求める,https://www3.nhk.or.jp//news/html/20220215/k10013485691000.html,2月15日 19時08分,春闘
新型コロナ 国内感染者数400万人超に この12日間で100万人増,https://www3.nhk.or.jp//news/html/20220215/k10013484611000.html,2月15日 19時06分,新型コロナ 国内感染者数
