title,link,time,category
米“外交的ボイコット” 岸田首相「国益の観点から判断」,https://www3.nhk.or.jp//news/html/20211207/k10013377761000.html,12月7日 14時29分,北京 冬季オリンピック・パラリンピック
靖国神社に超党派議連の99人が一斉参拝 岸田内閣からは9人,https://www3.nhk.or.jp//news/html/20211207/k10013377661000.html,12月7日 14時28分,
新潟県 新型コロナ 新たに5人感染確認,https://www3.nhk.or.jp//news/html/20211207/k10013378041000.html,12月7日 14時26分,新型コロナ 国内感染者数
自民税調 住宅ローン減税大枠固める 控除期間新築で13年間など,https://www3.nhk.or.jp//news/html/20211207/k10013378031000.html,12月7日 14時24分,
岸田首相 価格転嫁政策 12月中旬までに取りまとめを指示,https://www3.nhk.or.jp//news/html/20211207/k10013378011000.html,12月7日 14時20分,原油価格
長野 善光寺「御開帳」来年4月から 通常より1か月長い88日間で,https://www3.nhk.or.jp//news/html/20211207/k10013378001000.html,12月7日 14時19分,新型コロナウイルス
計1億6千万円余の詐欺被害 「有料サイトで未納料金ある」 札幌,https://www3.nhk.or.jp//news/html/20211207/k10013377951000.html,12月7日 14時10分,事件
株価 一時600円超値上がり 世界経済 先行きへの警戒感 和らぐ,https://www3.nhk.or.jp//news/html/20211207/k10013377961000.html,12月7日 14時07分,株価・為替
第6波対策 “3割増の医療提供体制 11月末までに構築” 厚労相,https://www3.nhk.or.jp//news/html/20211207/k10013377981000.html,12月7日 14時04分,新型コロナウイルス
米軍基地の辺野古移設 沖縄県の不承認受け対抗措置 防衛省,https://www3.nhk.or.jp//news/html/20211207/k10013377921000.html,12月7日 13時46分,基地問題
師走の伝統行事「大根だき」中止で大根配布 京都 千本釈迦堂,https://www3.nhk.or.jp//news/html/20211207/k10013377931000.html,12月7日 13時39分,新型コロナウイルス
福岡 博多港 防波堤に乗り上げていた貨物船 撤去作業終える,https://www3.nhk.or.jp//news/html/20211207/k10013377891000.html,12月7日 13時25分,事故
“ワクチン3回目接種 一律の前倒しは困難” 後藤厚労相,https://www3.nhk.or.jp//news/html/20211207/k10013377941000.html,12月7日 13時20分,新型コロナ ワクチン（日本国内）
マンダム スプレー108万本を自主回収へ 子どもに健康被害,https://www3.nhk.or.jp//news/html/20211207/k10013377851000.html,12月7日 12時50分,
米軍機墜落事故から60年 小学校で語り継ぐ集会 沖縄 うるま,https://www3.nhk.or.jp//news/html/20211207/k10013377831000.html,12月7日 12時47分,基地問題
龍角散“社長のセクハラ行為調査で解雇” 解決金6000万で和解,https://www3.nhk.or.jp//news/html/20211207/k10013377811000.html,12月7日 12時32分,
道後温泉本館で年末恒例の大掃除 松山,https://www3.nhk.or.jp//news/html/20211207/k10013377751000.html,12月7日 12時32分,新型コロナウイルス
埼玉 美里町 鳥インフル検出の養鶏場 約1万7000羽の殺処分進む,https://www3.nhk.or.jp//news/html/20211207/k10013377801000.html,12月7日 12時29分,鳥インフルエンザ
政府 地方財政審議会委員に5人起用の人事案を提示,https://www3.nhk.or.jp//news/html/20211207/k10013377781000.html,12月7日 12時15分,
北朝鮮 キム総書記 軍内部の教育強化を強調 規律の緩み警戒か,https://www3.nhk.or.jp//news/html/20211207/k10013377741000.html,12月7日 12時11分,北朝鮮情勢
