title,link,time,category
イギリス総選挙 労働党 過半数獲得 14年ぶりに政権交代へ,https://www3.nhk.or.jp//news/html/20240705/k10014501861000.html,7月5日 16時18分,イギリス
“障害ある息子の将来悲観”首絞め逮捕の父親供述 千葉 長生村,https://www3.nhk.or.jp//news/html/20240705/k10014502681000.html,7月5日 16時10分,事件
株価 一時4万1100円台 取り引き時間中の史上最高値を更新,https://www3.nhk.or.jp//news/html/20240705/k10014502291000.html,7月5日 15時58分,きょうの株価
児童9人が社会科見学中に熱中症か 3人病院搬送 京都,https://www3.nhk.or.jp//news/html/20240705/k10014502541000.html,7月5日 15時51分,熱中症
5月の景気動向指数 3か月連続で上昇 前月比1.3ポイント↑,https://www3.nhk.or.jp//news/html/20240705/k10014502621000.html,7月5日 15時49分,自動車
都内55人が熱中症疑いで救急搬送 23～90歳の男女（5日 15:00）,https://www3.nhk.or.jp//news/html/20240705/k10014502661000.html,7月5日 15時42分,熱中症
パリ五輪に向け日本選手団の結団式 旗手の選手らが決意述べる,https://www3.nhk.or.jp//news/html/20240705/k10014502461000.html,7月5日 15時37分,パリオリンピック
「協会けんぽ」賃上げによる保険料増などで4600億円余の黒字,https://www3.nhk.or.jp//news/html/20240705/k10014502641000.html,7月5日 15時36分,医療・健康
草刈り中の70代男性が死亡 熱中症疑い きのう熊本 多良木町で,https://www3.nhk.or.jp//news/html/20240705/k10014502651000.html,7月5日 15時32分,熱中症
自民 茂木幹事長“スタートアップ企業成長へNISA活用”,https://www3.nhk.or.jp//news/html/20240705/k10014502631000.html,7月5日 15時28分,IT・ネット
ソフトバンク 野村大樹と西武 齊藤大将 トレード成立,https://www3.nhk.or.jp//news/html/20240705/k10014502571000.html,7月5日 15時19分,プロ野球
小林製薬 紅麹問題 SNSで虚偽の情報が繰り返し拡散 注意必要,https://www3.nhk.or.jp//news/html/20240705/k10014502581000.html,7月5日 15時12分,フェイク対策
宮城 旧優生保護法裁判 最高裁が国の上告退ける 賠償判決確定,https://www3.nhk.or.jp//news/html/20240705/k10014502591000.html,7月5日 15時08分,憲法
こども誰でも通園制度 首相“要支援 受け入れに補助金加算”,https://www3.nhk.or.jp//news/html/20240705/k10014502601000.html,7月5日 15時00分,少子化
三沢基地に米軍がF35配備 木原防衛相“米に地元配慮求める”,https://www3.nhk.or.jp//news/html/20240705/k10014502561000.html,7月5日 14時32分,防衛省・自衛隊
【解説】変わる富士登山 人数制限は何のため?,https://www3.nhk.or.jp//news/html/20240705/k10014502501000.html,7月5日 14時10分,観光
中国 沖ノ鳥島周辺の公海上にブイ設置 政府 情報収集など継続,https://www3.nhk.or.jp//news/html/20240705/k10014502551000.html,7月5日 14時02分,中国
睡眠薬摂取させ性的暴行か 芸能関連会社プロデューサーを逮捕,https://www3.nhk.or.jp//news/html/20240705/k10014502471000.html,7月5日 13時49分,事件
ドジャース 大谷翔平 大リーグ通算103盗塁 日本選手歴代2位に,https://www3.nhk.or.jp//news/html/20240705/k10014502331000.html,7月5日 13時41分,大谷翔平
顧客から約300万円だまし取ったか SMBC日興証券の元社員を逮捕,https://www3.nhk.or.jp//news/html/20240705/k10014502521000.html,7月5日 13時37分,金融
