title,link,time,category
防衛省 26日も朝から消火活動へ 愛媛・岡山・宮崎の山林火災,https://www3.nhk.or.jp//news/html/20250326/k10014760501000.html,3月26日 0時54分,防衛省
サッカー日本代表 サウジと引き分け グループ1位確定,https://www3.nhk.or.jp//news/html/20250325/k10014760221000.html,3月26日 0時46分,#サッカー日本代表
ロシア・ウクライナと黒海安全航行で合意 アメリカ発表,https://www3.nhk.or.jp//news/html/20250326/k10014760491000.html,3月26日 0時38分,アメリカ
“防災庁 避難生活の環境改善への司令塔に” 有識者会議で意見,https://www3.nhk.or.jp//news/html/20250326/k10014760431000.html,3月26日 0時30分,令和6年能登半島地震
スノーボード世界選手権 ビッグエア男子 長谷川帝勝が決勝進出,https://www3.nhk.or.jp//news/html/20250326/k10014760481000.html,3月26日 0時19分,#スノーボード
ガザ地区でけがのパレスチナ人2人 治療のため日本で受け入れへ,https://www3.nhk.or.jp//news/html/20250326/k10014760441000.html,3月26日 0時00分,イスラエル・パレスチナ
スノーボード世界選手権で金 三木が帰国「来年の五輪で優勝」,https://www3.nhk.or.jp//news/html/20250325/k10014760471000.html,3月25日 23時58分,#スノーボード
ウクライナ情勢 米ロ実務者レベル協議 “共同声明採択されず”,https://www3.nhk.or.jp//news/html/20250325/k10014760451000.html,3月25日 23時25分,ウクライナ情勢
「台湾有事」念頭 沖縄離島からの避難計画まとめる 政府,https://www3.nhk.or.jp//news/html/20250325/k10014760131000.html,3月25日 22時45分,沖縄県
旧統一教会に解散命令 東京地裁 経緯は 今後の手続きは,https://www3.nhk.or.jp//news/html/20250325/k10014759591000.html,3月25日 22時03分,旧統一教会
6年ぶり宮中晩さん会開かれる ブラジル大統領夫妻を歓迎,https://www3.nhk.or.jp//news/html/20250325/k10014760391000.html,3月25日 21時48分,皇室
EUと日本 東南アジア対象 グレーゾーン事態の対応学ぶ研修開催,https://www3.nhk.or.jp//news/html/20250325/k10014760411000.html,3月25日 21時28分,EU
石破首相 “新年度予算案の成立後 強力な物価高対策を検討”,https://www3.nhk.or.jp//news/html/20250325/k10014759891000.html,3月25日 21時25分,物価高騰
愛媛 山林火災 避難指示拡大 今治市ほぼ全域で停電のおそれも,https://www3.nhk.or.jp//news/html/20250325/k10014759391000.html,3月25日 21時24分,愛媛県
宮崎市で山林火災 鎮火のめど立たず 70世帯に避難指示,https://www3.nhk.or.jp//news/html/20250325/k10014759961000.html,3月25日 21時19分,宮崎県
債券市場で長期金利上昇 10年もの国債利回り 一時1.58％に,https://www3.nhk.or.jp//news/html/20250325/k10014760381000.html,3月25日 21時06分,金融
ススキノ男性殺害 有罪判決の父親 弁護士が控訴,https://www3.nhk.or.jp//news/html/20250325/k10014760401000.html,3月25日 21時00分,事件
大船渡の山林火災 “避難の判断難しかった” 小学校校長,https://www3.nhk.or.jp//news/html/20250325/k10014760231000.html,3月25日 20時50分,岩手県
アスリートひぼう中傷被害の相談窓口を設置 JOCとJPC,https://www3.nhk.or.jp//news/html/20250325/k10014760341000.html,3月25日 20時48分,IT・ネット
二酸化炭素濃度 国内の観測点でいずれも過去最高更新,https://www3.nhk.or.jp//news/html/20250325/k10014760331000.html,3月25日 20時45分,脱炭素社会への動き
