title,link,time,category
京都 実相院の「床みどり」新緑のカエデが床に映り込む,https://www3.nhk.or.jp//news/html/20240514/k10014447901000.html,5月14日 5時23分,京都府
政治資金規正法の改正 立民・国民 法案の共同提出へ14日も調整,https://www3.nhk.or.jp//news/html/20240514/k10014448201000.html,5月14日 5時10分,政治資金
憲法改正議論「進める必要ある」60％ 新型コロナ感染対策は？,https://www3.nhk.or.jp//news/html/20240514/k10014447631000.html,5月14日 5時01分,憲法
つばさの党事務所など捜索 押収したパソコンなどの分析進める,https://www3.nhk.or.jp//news/html/20240514/k10014448211000.html,5月14日 5時00分,事件
生保の団体年金保険 配当含めた利回り 引き上げの動きも,https://www3.nhk.or.jp//news/html/20240514/k10014448171000.html,5月14日 4時13分,金融
タンチョウのヒナ誕生 愛らしい姿見せる 北海道 釧路,https://www3.nhk.or.jp//news/html/20240514/k10014448091000.html,5月14日 4時04分,北海道
円相場 NY市場 一時1ドル＝156円台まで値下がり,https://www3.nhk.or.jp//news/html/20240514/k10014448321000.html,5月14日 4時02分,株価・為替
自宅で亡くなる1人暮らしの高齢者“約6万8000人に上る可能性”,https://www3.nhk.or.jp//news/html/20240513/k10014448181000.html,5月13日 22時02分,医療・健康
あおぞら銀行 大和証券グループ本社が業務提携で筆頭株主へ,https://www3.nhk.or.jp//news/html/20240513/k10014447761000.html,5月13日 21時37分,金融
大相撲夏場所2日目 大関 琴櫻 祖父のしこ名襲名後初白星,https://www3.nhk.or.jp//news/html/20240513/k10014448051000.html,5月13日 21時33分,大相撲
熊本 阿蘇 遊覧ヘリ不時着 3人大けが 機体後部から異音か,https://www3.nhk.or.jp//news/html/20240513/k10014447731000.html,5月13日 21時12分,熊本県
廃部の日大アメフト部 後継組織 5月中旬にも本格的練習開始へ,https://www3.nhk.or.jp//news/html/20240513/k10014448141000.html,5月13日 21時10分,
広島 スタジアム棒落下事故 つり下げワイヤーのうち1本切れる,https://www3.nhk.or.jp//news/html/20240513/k10014448161000.html,5月13日 20時59分,広島県
第3号被保険者制度 “対象者減らしていくべき” 厚労省審議会,https://www3.nhk.or.jp//news/html/20240513/k10014448151000.html,5月13日 20時54分,年金
ボランティアが長時間移動せず活動できる宿泊拠点 輪島に新設,https://www3.nhk.or.jp//news/html/20240513/k10014448111000.html,5月13日 20時48分,令和6年能登半島地震
輪島塗 道具を失うなどした人たちを対象 国の補助制度の説明会,https://www3.nhk.or.jp//news/html/20240513/k10014448041000.html,5月13日 20時47分,令和6年能登半島地震
政府 2040年に向け新たな国家戦略の取りまとめへ,https://www3.nhk.or.jp//news/html/20240513/k10014448101000.html,5月13日 20時42分,脱炭素社会への動き
ロシア 国防相交代へ ウクライナでの長期戦などに備えてか,https://www3.nhk.or.jp//news/html/20240513/k10014447991000.html,5月13日 20時31分,ロシア
福島第一原発2号機 配管内の堆積物の除去作業を完了 東京電力,https://www3.nhk.or.jp//news/html/20240513/k10014448081000.html,5月13日 20時28分,福島第一原発
イスラエル軍 ラファへの攻撃続く 米から今後の地上作戦に懸念,https://www3.nhk.or.jp//news/html/20240513/k10014448071000.html,5月13日 20時21分,イスラエル・パレスチナ
