title,link,time,category
オートロックのマンションで「置き配」の実証実験 日本郵便,https://www3.nhk.or.jp//news/html/20210804/k10013180541000.html,8月4日 16時10分,新型コロナウイルス
山形 吉村知事 “県内ではこれまでどおり入院での療養基本に”,https://www3.nhk.or.jp//news/html/20210804/k10013180601000.html,8月4日 16時09分,新型コロナウイルス
石川県 新型コロナ 新たに118人感染確認 県内計5444人に,https://www3.nhk.or.jp//news/html/20210804/k10013180661000.html,8月4日 16時07分,新型コロナ 国内感染者数
岩手県 新型コロナ 新たに19人感染確認 県内計2065人に,https://www3.nhk.or.jp//news/html/20210804/k10013180611000.html,8月4日 16時06分,新型コロナ 国内感染者数
群馬県 新型コロナ 新たに204人感染確認 2日連続最多更新,https://www3.nhk.or.jp//news/html/20210804/k10013180641000.html,8月4日 16時06分,新型コロナ 国内感染者数
【動画】オリンピック 選手たちに音楽でエールを,https://www3.nhk.or.jp//news/html/20210804/k10013180521000.html,8月4日 16時04分,オリンピック・パラリンピック 話題
沖縄県 新型コロナ 新たに602人感染確認 大幅増加で過去最多,https://www3.nhk.or.jp//news/html/20210804/k10013180311000.html,8月4日 16時04分,新型コロナウイルス
“自宅療養を基本” 政府の方針をめぐり国会で議論,https://www3.nhk.or.jp//news/html/20210804/k10013180581000.html,8月4日 16時03分,新型コロナウイルス
富山県 新型コロナ 新たに31人感染確認 県内計2371人に,https://www3.nhk.or.jp//news/html/20210804/k10013180571000.html,8月4日 15時58分,新型コロナ 国内感染者数
五輪 スケートボード 四十住さくらが金 開心那が銀 女子パーク,https://www3.nhk.or.jp//news/html/20210804/k10013180091000.html,8月4日 15時58分,スケートボード
“起立性調節障害の子どもに効果的な治療を” 大学が費用募る,https://www3.nhk.or.jp//news/html/20210804/k10013180451000.html,8月4日 15時52分,医療
オリンピック セーリング男子470級 岡田・外薗ぺアは7位入賞,https://www3.nhk.or.jp//news/html/20210804/k10013180481000.html,8月4日 15時49分,セーリング
兵庫県 新型コロナ 1人死亡 422人感染確認 2日連続400人超,https://www3.nhk.or.jp//news/html/20210804/k10013180561000.html,8月4日 15時47分,新型コロナ 国内感染者数
“自宅療養を基本 病床確保する必要 理解を” 田村厚労相,https://www3.nhk.or.jp//news/html/20210804/k10013180001000.html,8月4日 15時46分,新型コロナウイルス
オリンピック陸上 男子110mハードル 泉谷・金井 決勝進めず,https://www3.nhk.or.jp//news/html/20210804/k10013179891000.html,8月4日 15時46分,陸上
新横綱 照ノ富士 日本国籍を取得 モンゴル出身横綱で3人目,https://www3.nhk.or.jp//news/html/20210804/k10013179761000.html,8月4日 15時44分,大相撲
岡山県 新型コロナ 新たに131人感染確認 100人超は5月22日以来,https://www3.nhk.or.jp//news/html/20210804/k10013180551000.html,8月4日 15時43分,新型コロナ 国内感染者数
山梨で39.7度 各地で猛烈な暑さ 熱中症に厳重警戒,https://www3.nhk.or.jp//news/html/20210804/k10013180511000.html,8月4日 15時42分,熱中症
東京オリンピック 13日目【随時更新】4日の試合結果や動き,https://www3.nhk.or.jp//news/html/20210804/k10013179511000.html,8月4日 15時41分,オリンピック・パラリンピック
亡命希望 ベラルーシ選手めぐり 監督などに聞き取り開始 IOC,https://www3.nhk.or.jp//news/html/20210804/k10013180411000.html,8月4日 15時40分,オリンピック・パラリンピック　競技・選手
