title,link,time,category
レスリング女子57キロ級 櫻井つぐみ 準決勝進出 パリ五輪,https://www3.nhk.or.jp//news/html/20240808/k10014542771000.html,8月8日 21時24分,#レスリング
【速報中】各地の対応は 南海トラフ地震臨時情報,https://www3.nhk.or.jp//news/html/20240808/k10014542951000.html,8月8日 21時24分,南海トラフ地震臨時情報
群馬 みなかみ町 親子死傷事件で長男 指名手配 殺人未遂の疑い,https://www3.nhk.or.jp//news/html/20240808/k10014543041000.html,8月8日 21時23分,事件
駐車場で男性死亡 大雨で冠水し逃げ遅れたか 埼玉 坂戸,https://www3.nhk.or.jp//news/html/20240808/k10014543021000.html,8月8日 21時22分,埼玉県
陸上男子400メートルリレー 日本が決勝進出 パリオリンピック,https://www3.nhk.or.jp//news/html/20240808/k10014542861000.html,8月8日 21時21分,#陸上競技
みずほ銀行 9日は通常どおり営業へ,https://www3.nhk.or.jp//news/html/20240808/k10014543071000.html,8月8日 21時20分,地震
【速報中】南海トラフ地震臨時情報「巨大地震注意」気象庁発表,https://www3.nhk.or.jp//news/html/20240808/k10014542271000.html,8月8日 21時17分,南海トラフ地震臨時情報
東海道新幹線など一部で遅れ 南海トラフ地震臨時情報の発表で,https://www3.nhk.or.jp//news/html/20240808/k10014543031000.html,8月8日 21時13分,地震
セーリング混合470級 岡田奎樹・吉岡美帆ペアが銀メダル 五輪,https://www3.nhk.or.jp//news/html/20240808/k10014542871000.html,8月8日 21時11分,#セーリング
高校野球 京都国際 札幌日大高に勝利 4回までに7得点 2回戦へ,https://www3.nhk.or.jp//news/html/20240808/k10014542981000.html,8月8日 21時10分,#夏の全国高校野球
山形 秋田 生活再建へ支援継続が課題 被害は きょうの現場は,https://www3.nhk.or.jp//news/html/20240808/k10014541251000.html,8月8日 21時07分,山形県
【一問一答】長崎市長 平和祈念式典にイスラエル不招待を説明,https://www3.nhk.or.jp//news/html/20240808/k10014541441000.html,8月8日 21時06分,長崎県
スポーツクライミング 女子 森秋彩が決勝進出 パリ五輪,https://www3.nhk.or.jp//news/html/20240808/k10014542921000.html,8月8日 21時06分,#スポーツクライミング
大阪地検特捜部の検事 取り調べめぐり刑事裁判へ 大阪高裁,https://www3.nhk.or.jp//news/html/20240808/k10014542111000.html,8月8日 21時05分,大阪府
【被害】宮崎 鹿児島で9人けが（消防庁）各地で住宅被害も,https://www3.nhk.or.jp//news/html/20240808/k10014542241000.html,8月8日 21時03分,地震
パリオリンピック【速報中】8/8～8/9 タイムライン,https://www3.nhk.or.jp//news/html/20240808/k10014542141000.html,8月8日 20時47分,#パリオリンピック
自民総裁選 石破氏“党員票割合増やさないと地方の反発招く”,https://www3.nhk.or.jp//news/html/20240808/k10014542931000.html,8月8日 20時41分,自民党総裁選
処理水放出1年を前に 齋藤経産相が福島県を訪れ安全性アピール,https://www3.nhk.or.jp//news/html/20240808/k10014542901000.html,8月8日 20時39分,福島第一原発 処理水
レスリング男子フリー86キロ級 石黒隼士は準々決勝で敗れる,https://www3.nhk.or.jp//news/html/20240808/k10014542851000.html,8月8日 20時33分,#レスリング
気象庁 日南市など揺れ大きかった地域 警報などの基準引き下げ,https://www3.nhk.or.jp//news/html/20240808/k10014543011000.html,8月8日 20時32分,地震
