title,link,time,category
【速報中】台湾総統選挙 民進党・頼清徳氏リード 台湾メディア,https://www3.nhk.or.jp//news/html/20240113/k10014319761000.html,1月13日 19時30分,台湾
【交通影響 13日】道路・鉄道・航空,https://www3.nhk.or.jp//news/html/20240113/k10014319491000.html,1月13日 19時29分,令和6年能登半島地震
石川 能登町 避難所で90代女性が食事をのどに詰まらせ死亡,https://www3.nhk.or.jp//news/html/20240113/k10014319711000.html,1月13日 19時18分,令和6年能登半島地震
石川 能登町 避難所の86歳男性 体調悪化させ搬送 災害関連死か,https://www3.nhk.or.jp//news/html/20240113/k10014319921000.html,1月13日 19時15分,令和6年能登半島地震
能登半島地震 国の重要文化財「上時国家住宅」にも被害 輪島,https://www3.nhk.or.jp//news/html/20240113/k10014319971000.html,1月13日 19時13分,令和6年能登半島地震
【放送同時提供】NHK金沢発 ライフライン情報 10:05－10:55,https://www3.nhk.or.jp//news/html/20240105/k10014309981000.html,1月13日 19時12分,令和6年能登半島地震
都道府県対抗 全国女子駅伝の開会式 新春の京都でたすきつなぐ,https://www3.nhk.or.jp//news/html/20240113/k10014319821000.html,1月13日 18時58分,ロードレース（駅伝）
被災地や北～東日本 14日夜から雪を伴った強い風吹く見込み,https://www3.nhk.or.jp//news/html/20240113/k10014319891000.html,1月13日 18時51分,気象
ラグビー全国大学選手権 帝京大3連覇 34対15で明治大に勝利,https://www3.nhk.or.jp//news/html/20240113/k10014319901000.html,1月13日 18時43分,ラグビー
防衛省から大型フェリー派遣 被災者14日から利用へ 石川 七尾,https://www3.nhk.or.jp//news/html/20240113/k10014319881000.html,1月13日 18時42分,令和6年能登半島地震
奈良 下北山村 国道で起きた土砂崩れ 死亡は75歳男性と確認,https://www3.nhk.or.jp//news/html/20240113/k10014319841000.html,1月13日 18時30分,事故
東京都心で「初雪」平年より10日遅い観測,https://www3.nhk.or.jp//news/html/20240113/k10014319871000.html,1月13日 18時15分,気象
【被害状況 13日】石川県で220人死亡 安否不明者26人(午後2時),https://www3.nhk.or.jp//news/html/20240113/k10014319551000.html,1月13日 18時07分,令和6年能登半島地震
政治資金問題 “党全体で議論 信頼回復につながる結論を”首相,https://www3.nhk.or.jp//news/html/20240113/k10014319851000.html,1月13日 18時06分,政治資金
ラグビーリーグワン 第5節 ワイルドナイツが大勝 開幕5連勝に,https://www3.nhk.or.jp//news/html/20240113/k10014319861000.html,1月13日 18時05分,ラグビー リーグワン
孤立状態 少なくとも793人「1時間歩き食料調達」石川【13日】,https://www3.nhk.or.jp//news/html/20240113/k10014319741000.html,1月13日 17時55分,令和6年能登半島地震
石川 志賀町 ほぼ全域で断水 各地から職員派遣受け復旧作業,https://www3.nhk.or.jp//news/html/20240113/k10014319801000.html,1月13日 17時33分,令和6年能登半島地震
広島 江田島で林野火災 けが人なし,https://www3.nhk.or.jp//news/html/20240113/k10014319811000.html,1月13日 17時31分,広島県
巨人 新人合同自主トレ 西舘勇陽 “100％力出すため取り組む”,https://www3.nhk.or.jp//news/html/20240113/k10014319721000.html,1月13日 17時27分,プロ野球
千葉 公共工事の入札めぐる贈収賄事件 逮捕の所長 容疑認める,https://www3.nhk.or.jp//news/html/20240113/k10014319781000.html,1月13日 17時00分,事件
