title,link,time,category
「まん延防止措置」適用地域追加 医療提供体制の確保が課題,https://www3.nhk.or.jp//news/html/20220126/k10013450051000.html,1月26日 5時09分,新型コロナウイルス
航空会社の旅客需要 回復遅れ 感染拡大前の4割に落ち込む,https://www3.nhk.or.jp//news/html/20220126/k10013450081000.html,1月26日 4時47分,新型コロナウイルス
沖縄 コロナ感染今後の見込み 新規感染減も 高齢者 入院患者増,https://www3.nhk.or.jp//news/html/20220126/k10013449951000.html,1月26日 4時40分,新型コロナウイルス
“思春期から更年期 心と体の健康を”東京都 相談や支援へ,https://www3.nhk.or.jp//news/html/20220126/k10013449861000.html,1月26日 4時35分,教育
日本国際賞 コロナワクチン開発に貢献のカリコ博士らが受賞,https://www3.nhk.or.jp//news/html/20220126/k10013449911000.html,1月26日 4時25分,新型コロナウイルス
テニス 錦織圭 股関節の手術を発表 半年後の復帰目指す,https://www3.nhk.or.jp//news/html/20220126/k10013449991000.html,1月26日 0時35分,テニス
グアンタナモ収容者制作の美術作品を展示 一部で抗議の声も,https://www3.nhk.or.jp//news/html/20220125/k10013450001000.html,1月25日 23時39分,
ENEOS 和歌山製油所を閉鎖へ 脱炭素化でガソリン需要落ち込み,https://www3.nhk.or.jp//news/html/20220125/k10013449961000.html,1月25日 23時11分,脱炭素社会への動き
韓国 北京五輪開会式に国会議長と閣僚出席へ 米中双方へ配慮,https://www3.nhk.or.jp//news/html/20220125/k10013449941000.html,1月25日 23時06分,北京 冬季オリンピック・パラリンピック
北京五輪 スキークロスカントリー代表内定 石田正子ら４人会見,https://www3.nhk.or.jp//news/html/20220125/k10013449931000.html,1月25日 23時03分,スキー（クロスカントリー）
【国内感染】新型コロナ 初の6万人超 過去最多 (25日22時半),https://www3.nhk.or.jp//news/html/20220125/k10013449741000.html,1月25日 22時59分,新型コロナ 国内感染者数
電車内喫煙注意で傷害事件 被害者の高校生にはぜんそくの持病,https://www3.nhk.or.jp//news/html/20220125/k10013449901000.html,1月25日 21時22分,事件
立民憲法調査会 中川会長「予算委中は審査会開催に応じず」,https://www3.nhk.or.jp//news/html/20220125/k10013449871000.html,1月25日 21時09分,憲法
「まん延防止」18道府県追加 沖縄 山口 広島は延長 政府決定,https://www3.nhk.or.jp//news/html/20220125/k10013449331000.html,1月25日 21時06分,新型コロナウイルス
統計データ書き換え データ復元し統計結果改定へ 有識者会議,https://www3.nhk.or.jp//news/html/20220125/k10013449891000.html,1月25日 20時58分,
「まん延防止措置」追加の各地 飲食店や観光地などの反応は,https://www3.nhk.or.jp//news/html/20220125/k10013448801000.html,1月25日 20時56分,新型コロナウイルス
まん延防止等重点措置 適用地域追加決定を前に国会で各党 質疑,https://www3.nhk.or.jp//news/html/20220125/k10013449851000.html,1月25日 20時46分,新型コロナウイルス
鹿児島県 新型コロナ 2人死亡 新たに526人感染確認 過去最多,https://www3.nhk.or.jp//news/html/20220125/k10013449321000.html,1月25日 20時41分,新型コロナ 国内感染者数
工事で埋め戻した道路にくぼみ 原付バイクの女性が転倒し重体,https://www3.nhk.or.jp//news/html/20220125/k10013449841000.html,1月25日 20時25分,事故
米国防総省 ウクライナ周辺防衛 8500人規模部隊に警戒強化指示,https://www3.nhk.or.jp//news/html/20220125/k10013448441000.html,1月25日 20時12分,米ロ関係
