title,link,time,category
日本シリーズ 第6戦【速報中】阪神 ノイジーのソロで先制,https://www3.nhk.or.jp//news/html/20231104/k10014247151000.html,11月4日 19時08分,日本シリーズ
イスラエル軍 ハマス拠点破壊進める ガザ地区 医療施設に被害,https://www3.nhk.or.jp//news/html/20231104/k10014247291000.html,11月4日 19時00分,イスラエル・パレスチナ
日本シリーズ第6戦 阪神の日本一決まるか 関西各地の動き,https://www3.nhk.or.jp//news/html/20231104/k10014247311000.html,11月4日 18時45分,日本シリーズ
都内のイスラエル大使館周辺で文化人らが停戦を求め抗議活動,https://www3.nhk.or.jp//news/html/20231104/k10014247231000.html,11月4日 18時32分,東京都
ロシア軍 大統領選も念頭にウクライナ東部へ大規模攻撃準備か,https://www3.nhk.or.jp//news/html/20231104/k10014247181000.html,11月4日 18時24分,ウクライナ情勢
岸田首相 フィリピンの日程終え 次の訪問国マレーシアへ出発,https://www3.nhk.or.jp//news/html/20231104/k10014247241000.html,11月4日 18時23分,フィリピン
Jリーグカップ アビスパ福岡 初優勝 クラブ史上初タイトル,https://www3.nhk.or.jp//news/html/20231104/k10014247121000.html,11月4日 18時18分,サッカーJリーグ
ネパール西部の地震 “少なくとも128人死亡 多数のけが人も”,https://www3.nhk.or.jp//news/html/20231104/k10014246951000.html,11月4日 18時11分,地震
駅弁メーカー吉田屋 保健所が改善確認し営業禁止処分を解除,https://www3.nhk.or.jp//news/html/20231104/k10014247221000.html,11月4日 18時10分,青森県
岸田首相 南シナ海でパトロール行う沿岸警備隊の活動を視察,https://www3.nhk.or.jp//news/html/20231104/k10014247201000.html,11月4日 18時08分,フィリピン
硫黄島沖合に新たな島形成 “噴火続けば島拡大も” 専門家,https://www3.nhk.or.jp//news/html/20231104/k10014247211000.html,11月4日 18時06分,東京都
番組に似せた岸田首相の偽動画拡散 日本テレビが注意呼びかけ,https://www3.nhk.or.jp//news/html/20231104/k10014247171000.html,11月4日 17時55分,フェイク対策
女子ゴルフ 日米共催ツアー 第3R 畑岡奈紗と桑木志帆 首位守る,https://www3.nhk.or.jp//news/html/20231104/k10014247191000.html,11月4日 17時48分,ゴルフ（女子）
“ゼレンスキー大統領 欧米に裏切られたと感じている” 米雑誌,https://www3.nhk.or.jp//news/html/20231104/k10014247161000.html,11月4日 17時23分,ウクライナ情勢
【随時更新】米国務長官働きかけも 戦闘一時停止は実現せず,https://www3.nhk.or.jp//news/html/20231104/k10014246891000.html,11月4日 16時56分,イスラエル・パレスチナ
食堂兼ねた住宅全焼 “落雷の音のあと焦げ臭いにおい” 秋田,https://www3.nhk.or.jp//news/html/20231104/k10014247141000.html,11月4日 16時14分,気象
日中韓環境相会合 気候変動などの分野で共同声明を採択,https://www3.nhk.or.jp//news/html/20231104/k10014247111000.html,11月4日 15時49分,環境
声援は○○級！？甲子園の盛り上がりを測ってみた！,https://www3.nhk.or.jp//news/html/20231104/k10014247051000.html,11月4日 15時32分,日本シリーズ
スマホ撮影中に橋から約40ｍ転落か 女性死亡 静岡 東伊豆町,https://www3.nhk.or.jp//news/html/20231104/k10014247131000.html,11月4日 15時31分,静岡県
テニス 全日本 女子シングルス 加治遥 ストレート勝ちで初優勝,https://www3.nhk.or.jp//news/html/20231104/k10014247101000.html,11月4日 15時28分,テニス
