title,link,time,category
プーチン大統領「ウクライナは取り返しのつかない打撃受ける」,https://www3.nhk.or.jp//news/html/20240117/k10014324731000.html,1月17日 18時33分,プーチン大統領
大学入学共通テスト 追試験対象者は1600人余 被災した19人も,https://www3.nhk.or.jp//news/html/20240117/k10014324631000.html,1月17日 18時31分,共通テスト
柿沢前法務副大臣を起訴 東京地検特捜部 公選法違反の買収の罪,https://www3.nhk.or.jp//news/html/20240117/k10014324161000.html,1月17日 18時28分,事件
「物価上がった」95％ 「1年後上がる」79％ 日銀 生活意識調査,https://www3.nhk.or.jp//news/html/20240117/k10014324591000.html,1月17日 18時27分,物価高騰
中国 去年のGDP伸び率 ＋5.2％ 目標達成も景気回復力強さ欠く,https://www3.nhk.or.jp//news/html/20240117/k10014324021000.html,1月17日 18時26分,中国
被災地の2次避難や集団避難 分かれる判断 離ればなれの家族も,https://www3.nhk.or.jp//news/html/20240117/k10014324121000.html,1月17日 18時24分,令和6年能登半島地震
日経平均株価の上昇傾向 “企業業績への期待やNISAが背景か”,https://www3.nhk.or.jp//news/html/20240117/k10014324701000.html,1月17日 18時19分,株価・為替
生成AIルール作りに向け業界団体設立 国に政策提言や人材育成,https://www3.nhk.or.jp//news/html/20240117/k10014324641000.html,1月17日 18時17分,生成AI・人工知能
福岡空港で旅客機が誘導路外れる 1週間前も同じ場所でトラブル,https://www3.nhk.or.jp//news/html/20240117/k10014324571000.html,1月17日 18時15分,航空
円相場 1ドル＝147円台後半まで値下がり 円売りドル買い強まる,https://www3.nhk.or.jp//news/html/20240117/k10014324681000.html,1月17日 18時13分,株価・為替
【能登半島地震 交通影響】鉄道・航空・道路（17日16時）,https://www3.nhk.or.jp//news/html/20240117/k10014323951000.html,1月17日 18時13分,令和6年能登半島地震
阪神・淡路大震災から29年 東日本大震災の被災地などで追悼,https://www3.nhk.or.jp//news/html/20240117/k10014324151000.html,1月17日 18時06分,阪神・淡路大震災
能登半島地震被災地 17日夜遅くから雨のところも 土砂災害注意,https://www3.nhk.or.jp//news/html/20240117/k10014323891000.html,1月17日 18時05分,令和6年能登半島地震
日経平均株価 一時600円以上値上がり 3万6200円台に,https://www3.nhk.or.jp//news/html/20240117/k10014324001000.html,1月17日 17時57分,きょうの株価
孤立状態 少なくとも7地区56人 解消後も要支援が多数【17日】,https://www3.nhk.or.jp//news/html/20240117/k10014324531000.html,1月17日 17時56分,令和6年能登半島地震
新潟 上越 一部海岸に約2メートルの津波の痕跡 能登半島地震,https://www3.nhk.or.jp//news/html/20240117/k10014324581000.html,1月17日 17時53分,令和6年能登半島地震
【更新中】阪神・淡路大震災29年 能登半島地震の時間に黙とう,https://www3.nhk.or.jp//news/html/20240116/k10014322971000.html,1月17日 17時51分,阪神・淡路大震災
小3息子放置の疑いで逮捕の母親 交際相手の家に滞在していたか,https://www3.nhk.or.jp//news/html/20240117/k10014324611000.html,1月17日 17時48分,事件
【被害状況 17日】石川県で232人死亡 重軽傷者1045人(14時),https://www3.nhk.or.jp//news/html/20240117/k10014323981000.html,1月17日 17時45分,令和6年能登半島地震
ガザ地区に支援物資 引き換えにイスラエル人質に医薬品で合意,https://www3.nhk.or.jp//news/html/20240117/k10014324551000.html,1月17日 17時44分,イスラエル・パレスチナ
