title,link,time,category
高レベル放射性廃棄物液体のガラス固化再開 茨城 東海村の施設,https://www3.nhk.or.jp//news/html/20210817/k10013208721000.html,8月17日 20時34分,各地の原発
夏の甲子園 宮城 東北学院が出場辞退 選手の感染や濃厚接触で,https://www3.nhk.or.jp//news/html/20210817/k10013208751000.html,8月17日 20時29分,高校野球
“50代以下のワクチン接種 着実に推進を” 自民・公明幹事長ら,https://www3.nhk.or.jp//news/html/20210817/k10013207751000.html,8月17日 20時27分,新型コロナ ワクチン（日本国内）
デパ地下の売り場に入場整理 要請へ 基本的対処方針変更 政府,https://www3.nhk.or.jp//news/html/20210817/k10013207181000.html,8月17日 20時23分,新型コロナ 経済影響
緊急安全確保 熊本 天草 本渡町広瀬大矢崎地区付近の41人に,https://www3.nhk.or.jp//news/html/20210817/k10013208771000.html,8月17日 20時21分,大雨（8月）
あすにかけ西・東日本中心に 災害の危険性 急激に高まるおそれ,https://www3.nhk.or.jp//news/html/20210817/k10013206921000.html,8月17日 20時19分,大雨（8月）
「最後の“宣言”に…」 関東の追加対象地域からの報告,https://www3.nhk.or.jp//news/html/20210817/k10013207531000.html,8月17日 20時16分,新型コロナ 経済影響
自宅療養中の夫が救急搬送されて気付いたこと,https://www3.nhk.or.jp//news/html/20210817/k10013207421000.html,8月17日 20時00分,新型コロナウイルス
タリバン幹部 「女性は政府組織参加すべき」不安払拭の思惑か,https://www3.nhk.or.jp//news/html/20210817/k10013208701000.html,8月17日 19時54分,アフガニスタン
「緊急事態宣言」「重点措置」 対象拡大と期限延長を決定 政府,https://www3.nhk.or.jp//news/html/20210817/k10013208501000.html,8月17日 19時31分,新型コロナウイルス
西村経済再生相 「宣言」対象地域追加と期限延長を国会に報告,https://www3.nhk.or.jp//news/html/20210817/k10013208141000.html,8月17日 19時28分,新型コロナウイルス
ジャニーズ事務所 藤島メリー名誉会長死去 タレント多く育てる,https://www3.nhk.or.jp//news/html/20210817/k10013208731000.html,8月17日 19時25分,おくやみ
東京パラ 聖火リレー 静岡県内でスタート 一部除き競技場内で,https://www3.nhk.or.jp//news/html/20210817/k10013208711000.html,8月17日 19時23分,聖火リレー パラリンピック
送迎バス 熱中症で園児死亡 母親「今はただ戻ってきてほしい」,https://www3.nhk.or.jp//news/html/20210817/k10013208621000.html,8月17日 19時19分,事件
NHK杯全国中学校放送コンテスト 2年ぶり 4部門の最優秀賞決定,https://www3.nhk.or.jp//news/html/20210817/k10013208351000.html,8月17日 19時19分,
パラ開幕前に選手やコーチなど88％ ワクチン接種終える見通し,https://www3.nhk.or.jp//news/html/20210817/k10013208661000.html,8月17日 19時10分,オリンピック・パラリンピック
【国内】新型コロナ 47人死亡 1万9955人感染確認 (17日18:30),https://www3.nhk.or.jp//news/html/20210817/k10013208671000.html,8月17日 19時05分,新型コロナ 国内感染者数
“搬送困難” 過去最多に 半数以上が新型コロナ感染の疑い,https://www3.nhk.or.jp//news/html/20210817/k10013208581000.html,8月17日 19時05分,新型コロナウイルス
突風で神社の拝殿倒れる 住宅にも被害 けが人の情報なし 岐阜,https://www3.nhk.or.jp//news/html/20210817/k10013208591000.html,8月17日 19時02分,大雨（8月）
佐賀 武雄市 ボランティアは県内在住でワクチン接種済みの人に,https://www3.nhk.or.jp//news/html/20210817/k10013208631000.html,8月17日 19時00分,大雨（8月）
