title,link,time,category
「輪島朝市」3月に金沢で「出張輪島朝市」として営業再開へ,https://www3.nhk.or.jp//news/html/20240206/k10014349371000.html,2月6日 18時00分,令和6年能登半島地震
東京都 福祉施設に提供のマスク 法解釈誤り2900万円余支払い,https://www3.nhk.or.jp//news/html/20240206/k10014349441000.html,2月6日 17時59分,新型コロナウイルス
北朝鮮 群馬県の朝鮮人労働者の追悼碑撤去を非難,https://www3.nhk.or.jp//news/html/20240206/k10014349361000.html,2月6日 17時56分,群馬県
沖縄 「辺野古崎」周辺で国が新たな護岸造成に向けた工事着手,https://www3.nhk.or.jp//news/html/20240206/k10014349391000.html,2月6日 17時54分,基地問題
トルコ・シリア大地震から1年で追悼式 復興の遅れなどに非難も,https://www3.nhk.or.jp//news/html/20240206/k10014349421000.html,2月6日 17時53分,トルコ・シリア大地震
大相撲 石川出身の遠藤らが被災した地元に 馳知事を表敬訪問,https://www3.nhk.or.jp//news/html/20240206/k10014349021000.html,2月6日 17時38分,令和6年能登半島地震
【被害状況 6日】石川県内の住宅被害 5万5千棟超,https://www3.nhk.or.jp//news/html/20240206/k10014348751000.html,2月6日 17時35分,令和6年能登半島地震
石川県 災害廃棄物 約240万トン 2026年3月末までの処理目指す,https://www3.nhk.or.jp//news/html/20240206/k10014348941000.html,2月6日 17時32分,令和6年能登半島地震
【解説】軍事力強化進める韓国 朝鮮半島情勢の行方は,https://www3.nhk.or.jp//news/html/20240206/k10014349321000.html,2月6日 17時30分,韓国
共産 田村委員長“次の衆院選 比例代表650万票の獲得目指す”,https://www3.nhk.or.jp//news/html/20240206/k10014349411000.html,2月6日 17時26分,政治資金
日銀 植田総裁 ETFの買い入れ方針 見直しの議論進める考え,https://www3.nhk.or.jp//news/html/20240206/k10014349401000.html,2月6日 17時22分,日本銀行（日銀）
政府 災害廃棄物の処理費用 国の負担率引き上げ検討,https://www3.nhk.or.jp//news/html/20240206/k10014349341000.html,2月6日 17時18分,令和6年能登半島地震
大雪 列車内で一夜明かした乗客 “座席なく通路に座る人も”,https://www3.nhk.or.jp//news/html/20240206/k10014349261000.html,2月6日 17時17分,鉄道
胎児にブタの腎臓移植 国内初の臨床研究計画 年内の申請目指す,https://www3.nhk.or.jp//news/html/20240206/k10014349131000.html,2月6日 17時15分,医療・健康
石川 珠洲市仁江町の土砂災害現場 男性見つかり死亡確認,https://www3.nhk.or.jp//news/html/20240206/k10014349181000.html,2月6日 17時12分,令和6年能登半島地震
中国 「春節」前に花市にぎわう,https://www3.nhk.or.jp//news/html/20240206/k10014349331000.html,2月6日 17時08分,中国
天皇誕生日の一般参賀 実施へ 宮内庁,https://www3.nhk.or.jp//news/html/20240206/k10014349351000.html,2月6日 16時57分,皇室
2024年春闘 大企業100社に聞く 賃上げは？ デフレ脱却は？,https://www3.nhk.or.jp//news/html/20240206/k10014348821000.html,2月6日 16時55分,春闘
JFEホールディングス 新社長に北野嘉久氏就任 人事発表,https://www3.nhk.or.jp//news/html/20240206/k10014349291000.html,2月6日 16時53分,脱炭素社会への動き
男子ゴルフ 米ツアー 最終ラウンド中止 松山英樹は71位,https://www3.nhk.or.jp//news/html/20240206/k10014349111000.html,2月6日 16時50分,ゴルフ（男子）
