title,link,time,category
男子110mハードル 村竹ラシッドは5位 パリ五輪,https://www3.nhk.or.jp//news/html/20240809/k10014543391000.html,8月9日 6時04分,#陸上競技
レスリング 藤波朱理が金メダル 女子53キロ級 パリ五輪,https://www3.nhk.or.jp//news/html/20240809/k10014543211000.html,8月9日 5時55分,#レスリング
各地の対応 避難 行政 原発は 南海トラフ地震臨時情報,https://www3.nhk.or.jp//news/html/20240808/k10014542951000.html,8月9日 5時55分,南海トラフ地震臨時情報
パリオリンピック【結果】8/8～8/9 タイムライン,https://www3.nhk.or.jp//news/html/20240808/k10014542141000.html,8月9日 5時49分,#パリオリンピック
卓球女子団体 日本 2大会連続で決勝進出 パリ五輪,https://www3.nhk.or.jp//news/html/20240809/k10014543451000.html,8月9日 5時45分,#卓球
パリオリンピック日程 8/9～10（競技・放送・配信予定）,https://www3.nhk.or.jp//news/html/20240809/k10014543271000.html,8月9日 5時43分,#パリオリンピック
ハマス最高幹部殺害 イラン側は報復行う姿勢 緊張続く,https://www3.nhk.or.jp//news/html/20240809/k10014543141000.html,8月9日 5時37分,イラン
自転車 男子オムニアム 窪木一茂が6位 パリオリンピック,https://www3.nhk.or.jp//news/html/20240809/k10014543441000.html,8月9日 5時35分,#自転車競技
陸上女子400mH マクラフリン レブロン 世界新で金メダル 五輪,https://www3.nhk.or.jp//news/html/20240809/k10014543421000.html,8月9日 5時32分,#陸上競技
東海道新幹線など一部で遅れ 南海トラフ地震臨時情報の発表で,https://www3.nhk.or.jp//news/html/20240808/k10014543031000.html,8月9日 5時29分,南海トラフ地震臨時情報
自転車男子スプリント 太田 小原 ともに準々決勝敗退 パリ五輪,https://www3.nhk.or.jp//news/html/20240809/k10014543381000.html,8月9日 5時22分,#自転車競技
バングラデシュ暫定政権発足 ユヌス氏 治安の安定化最優先,https://www3.nhk.or.jp//news/html/20240809/k10014543261000.html,8月9日 5時17分,
【被害】宮崎 鹿児島で9人けが 住宅被害も 最大震度6弱,https://www3.nhk.or.jp//news/html/20240808/k10014542241000.html,8月9日 5時14分,南海トラフ地震臨時情報
自転車女子ケイリン 太田 9位 佐藤 準々決勝敗退 パリ五輪,https://www3.nhk.or.jp//news/html/20240809/k10014543321000.html,8月9日 5時13分,#自転車競技
高島屋やローソン カスハラ対策強化 場合により来店拒否も,https://www3.nhk.or.jp//news/html/20240809/k10014543051000.html,8月9日 5時09分,小売業
レスリング女子57キロ級 櫻井つぐみ 決勝進出 パリ五輪,https://www3.nhk.or.jp//news/html/20240808/k10014542771000.html,8月9日 5時05分,#レスリング
GDP 4～6月の実質伸び率はプラスに転じる見方多い 民間予測,https://www3.nhk.or.jp//news/html/20240809/k10014543081000.html,8月9日 5時03分,GDP
長崎 原爆投下から79年 “最後の被爆地に”願い発信する一日に,https://www3.nhk.or.jp//news/html/20240809/k10014543181000.html,8月9日 4時44分,長崎県
陸上男子200m テボゴがボツワナ史上初の金メダル パリ五輪,https://www3.nhk.or.jp//news/html/20240809/k10014543401000.html,8月9日 4時35分,#陸上競技
【随時更新】イスラエル パレスチナ 中東情勢（8月9日）,https://www3.nhk.or.jp//news/html/20240809/k10014543411000.html,8月9日 4時21分,イスラエル・パレスチナ
