title,link,time,category
アーチェリー長谷川選手 違反行為でパラ代表資格取り消し,https://www3.nhk.or.jp//news/html/20210822/k10013216831000.html,8月22日 13時47分,パラアーチェリー
パイレーツの筒香 大リーグ初の2試合連続ホームラン,https://www3.nhk.or.jp//news/html/20210822/k10013216771000.html,8月22日 13時44分,大リーグ
新潟県 新型コロナ 新たに85人感染確認 県内計5853人に,https://www3.nhk.or.jp//news/html/20210822/k10013216821000.html,8月22日 13時37分,新型コロナ 国内感染者数
香川県 新型コロナ 新たに88人感染確認 県内計3583人に,https://www3.nhk.or.jp//news/html/20210822/k10013216801000.html,8月22日 13時24分,新型コロナ 国内感染者数
夏の全国高校野球 第2試合 神戸国際が高川学園に4対3で勝利,https://www3.nhk.or.jp//news/html/20210822/k10013216791000.html,8月22日 13時20分,高校野球
徳島県 新型コロナ 新たに55人感染確認 県内計2223人に,https://www3.nhk.or.jp//news/html/20210822/k10013216781000.html,8月22日 13時15分,新型コロナ 国内感染者数
福島県 新型コロナ 新たに94人感染確認 県内累計7978人に,https://www3.nhk.or.jp//news/html/20210822/k10013216761000.html,8月22日 13時06分,新型コロナ 国内感染者数
パラリンピック来日選手など 30人感染確認 1日の発表で最多,https://www3.nhk.or.jp//news/html/20210822/k10013216641000.html,8月22日 12時59分,オリンピック・パラリンピック　大会運営
熱海の土石流 犠牲者24人に 行方不明4人の捜索続く,https://www3.nhk.or.jp//news/html/20210822/k10013216741000.html,8月22日 12時47分,気象
NYの復活願うコンサート ワクチン接種証明など提示して参加,https://www3.nhk.or.jp//news/html/20210822/k10013216751000.html,8月22日 12時43分,新型コロナウイルス
夏の全国高校野球 第1試合 明徳義塾が明桜に8対2で勝利,https://www3.nhk.or.jp//news/html/20210822/k10013216631000.html,8月22日 12時42分,高校野球
「緊急事態宣言」拡大後初の日曜日 神戸市の繁華街の客まばら,https://www3.nhk.or.jp//news/html/20210822/k10013216731000.html,8月22日 12時27分,新型コロナウイルス
H2Aロケット 種子島に搬入 日本版GPS衛星後継機載せ打ち上げへ,https://www3.nhk.or.jp//news/html/20210822/k10013216711000.html,8月22日 12時19分,
土石流被害 熱海伊豆山地区で窃盗などの被害 防犯カメラ設置へ,https://www3.nhk.or.jp//news/html/20210822/k10013216661000.html,8月22日 12時13分,気象
東京 吉祥寺で建物火災 2人を病院に搬送 男性1人死亡 夫婦か,https://www3.nhk.or.jp//news/html/20210822/k10013216651000.html,8月22日 12時08分,
山形県 新型コロナ 新たに45人感染確認 県内累計2867人に,https://www3.nhk.or.jp//news/html/20210822/k10013216671000.html,8月22日 12時04分,新型コロナ 国内感染者数
台風12号 昼すぎにかけ先島諸島に最接近へ 暴風や高波に警戒を,https://www3.nhk.or.jp//news/html/20210822/k10013216561000.html,8月22日 12時03分,台風
宮城・福島で震度4 津波の心配なし,https://www3.nhk.or.jp//news/html/20210822/k10013216681000.html,8月22日 11時56分,
西村経済再生相「人出減らず対策強化を検討」NHK日曜討論,https://www3.nhk.or.jp//news/html/20210822/k10013216721000.html,8月22日 11時55分,新型コロナウイルス
横浜市長選挙投票進む 午前11時の投票率 前回比3ポイント余↑,https://www3.nhk.or.jp//news/html/20210822/k10013216691000.html,8月22日 11時49分,選挙
