title,link,time,category
香港 映画の検閲強化する条例改正案を発表 懸念の声も,https://www3.nhk.or.jp//news/html/20210825/k10013221391000.html,8月25日 4時33分,香港 抗議活動
緊急事態宣言8道県追加 重点措置4県適用 きょう決定へ,https://www3.nhk.or.jp//news/html/20210825/k10013221341000.html,8月25日 4時27分,新型コロナウイルス
パラリンピック開会式 中止を求めるデモも,https://www3.nhk.or.jp//news/html/20210825/k10013221501000.html,8月25日 4時22分,オリンピック・パラリンピック
パラリンピック開幕 国立競技場の周辺は多くの人集まる,https://www3.nhk.or.jp//news/html/20210825/k10013221531000.html,8月25日 4時20分,オリンピック・パラリンピック
パラリンピック 感染拡大の中の開幕で競技者には複雑な思いも,https://www3.nhk.or.jp//news/html/20210825/k10013221521000.html,8月25日 4時17分,オリンピック・パラリンピック
東京 白金高輪駅 男性が液体かけられ顔などにやけど 硫酸か,https://www3.nhk.or.jp//news/html/20210824/k10013221451000.html,8月25日 0時43分,事件
《詳細》東京パラリンピック開会式 大会は9/5までの13日間,https://www3.nhk.or.jp//news/html/20210824/k10013221141000.html,8月25日 0時41分,オリンピック・パラリンピック
東京都 新型コロナ 9人死亡 4220人感染確認 2日連続前週下回る,https://www3.nhk.or.jp//news/html/20210824/k10013220481000.html,8月24日 23時42分,新型コロナ 国内感染者数
東京パラリンピックが開幕 24日の動き,https://www3.nhk.or.jp//news/html/20210824/k10013219871000.html,8月24日 23時19分,オリンピック・パラリンピック
プロ野球結果 首位阪神が快勝 青柳はリーグ単独トップの10勝目,https://www3.nhk.or.jp//news/html/20210824/k10013221441000.html,8月24日 22時50分,プロ野球
洪水などの予報 研究機関や民間事業者にも許可を 気象庁検討会,https://www3.nhk.or.jp//news/html/20210824/k10013221261000.html,8月24日 22時27分,気象
アフガンの邦人など退避へ 自衛隊機2機が物資積み基地を離陸,https://www3.nhk.or.jp//news/html/20210824/k10013220281000.html,8月24日 21時46分,アフガニスタン
アフガンからの退避 政府専用機を追加派遣で最終調整,https://www3.nhk.or.jp//news/html/20210824/k10013221431000.html,8月24日 21時38分,アフガニスタン
競泳 リオ五輪 金メダルの萩野公介 現役引退へ,https://www3.nhk.or.jp//news/html/20210824/k10013221421000.html,8月24日 21時32分,競泳
「医療の危機」 医療機関が赤い色で強い危機感を表明 京都,https://www3.nhk.or.jp//news/html/20210824/k10013221321000.html,8月24日 21時28分,新型コロナウイルス
夏の全国高校野球 石見智翠館が日大山形にサヨナラ勝ち,https://www3.nhk.or.jp//news/html/20210824/k10013221301000.html,8月24日 21時04分,高校野球
新型コロナ 29都道府県の5指標7項目(23日）,https://www3.nhk.or.jp//news/html/20210824/k10013221251000.html,8月24日 20時58分,新型コロナウイルス
政府 アフガンからの退避輸送 米軍撤退までの期間に限る方針,https://www3.nhk.or.jp//news/html/20210824/k10013221201000.html,8月24日 20時52分,アフガニスタン
念願の正社員、でも「安かった」,https://www3.nhk.or.jp//news/html/20210824/k10013219431000.html,8月24日 20時49分,
新たな沖縄振興策 必要な法案提出のため準備,https://www3.nhk.or.jp//news/html/20210824/k10013221231000.html,8月24日 20時46分,
