title,link,time,category
長野 松本城ですす払い しめ縄も飾りつけ 新年へ準備整える,https://www3.nhk.or.jp//news/html/20231228/k10014302481000.html,12月28日 15時06分,長野県
中国共産党が規則改正“習主席の方針から逸脱は処分対象”追加,https://www3.nhk.or.jp//news/html/20231228/k10014302431000.html,12月28日 14時59分,中国
NBA サンズ 渡邊雄太 終盤に出場し無得点 チームは連敗止める,https://www3.nhk.or.jp//news/html/20231228/k10014302501000.html,12月28日 14時44分,バスケットボール
女子学生に性的暴行の疑い 中学校教諭を逮捕 容疑を否認 埼玉,https://www3.nhk.or.jp//news/html/20231228/k10014302491000.html,12月28日 14時42分,事件
自民 大野泰正参院議員関係先 捜索開始 政治資金問題 東京地検,https://www3.nhk.or.jp//news/html/20231228/k10014302161000.html,12月28日 14時31分,政治資金
親子はねられ死亡の事故 自動車整備会社の店舗と本社を捜索,https://www3.nhk.or.jp//news/html/20231228/k10014302461000.html,12月28日 14時28分,東京都
柿沢前法務副大臣逮捕 江東区長選めぐる買収など疑い 東京地検,https://www3.nhk.or.jp//news/html/20231228/k10014302151000.html,12月28日 14時23分,事件
名古屋 女性刺殺事件 “自暴自棄になりやった” 趣旨の供述,https://www3.nhk.or.jp//news/html/20231228/k10014302361000.html,12月28日 14時20分,事件
【詳しく】山本由伸 ドジャース入団会見 12年契約で合意,https://www3.nhk.or.jp//news/html/20231228/k10014301171000.html,12月28日 14時07分,山本由伸
「徴用」めぐる問題 韓国最高裁 先週に続き 賠償命じる判決,https://www3.nhk.or.jp//news/html/20231228/k10014302381000.html,12月28日 13時50分,徴用問題
辺野古沖 地盤改良工事 国が代執行 地方自治法基づく初の事態,https://www3.nhk.or.jp//news/html/20231228/k10014302171000.html,12月28日 13時48分,基地問題
引き取り手ない遺体 2年以上火葬せず 名古屋市 職員の処分検討,https://www3.nhk.or.jp//news/html/20231228/k10014302411000.html,12月28日 13時36分,愛知県
立民 岡田幹事長 次回衆院選で政権交代目指す考え強調,https://www3.nhk.or.jp//news/html/20231228/k10014302391000.html,12月28日 13時12分,国会
自然動物園のサルたち「サルだんご」で寒さしのぐ 香川 小豆島,https://www3.nhk.or.jp//news/html/20231228/k10014302371000.html,12月28日 12時52分,香川県
奈良 下北山村 土砂崩れ現場 人の体とみられるもの見つかる,https://www3.nhk.or.jp//news/html/20231228/k10014302351000.html,12月28日 12時49分,奈良県
京葉線ダイヤ改正 JR東日本が千葉市長に説明も市長再考求める,https://www3.nhk.or.jp//news/html/20231228/k10014302341000.html,12月28日 12時28分,鉄道
“年末年始を海外で” 出国ラッシュ始まる 関西空港は混雑,https://www3.nhk.or.jp//news/html/20231228/k10014302321000.html,12月28日 12時24分,航空
【随時更新】イスラエル軍 ガザ地区中部 南部で軍事作戦拡大,https://www3.nhk.or.jp//news/html/20231228/k10014301981000.html,12月28日 12時17分,イスラエル・パレスチナ
イスラエル軍 ガザ南部で軍事作戦拡大 犠牲者増歯止めかからず,https://www3.nhk.or.jp//news/html/20231228/k10014302311000.html,12月28日 12時03分,イスラエル・パレスチナ
「H3」ロケット2号機 来年2月15日に打ち上げを発表 JAXA,https://www3.nhk.or.jp//news/html/20231228/k10014302301000.html,12月28日 12時00分,宇宙
