title,link,time,category
サンマ漁 大型船が初水揚げ 去年上回るも例年より低い水準に,https://www3.nhk.or.jp//news/html/20210827/k10013226481000.html,8月27日 19時11分,
自民と台湾与党の議員が会談 中国けん制へ安保の共通政策を,https://www3.nhk.or.jp//news/html/20210827/k10013227001000.html,8月27日 19時10分,
【国内感染】新型コロナ 57人死亡 2万4200人感染（27日18:50）,https://www3.nhk.or.jp//news/html/20210827/k10013227761000.html,8月27日 19時10分,新型コロナ 国内感染者数
東京パラリンピック【随時更新】大会4日目 27日の結果や動き,https://www3.nhk.or.jp//news/html/20210827/k10013225271000.html,8月27日 19時08分,オリンピック・パラリンピック
オリンピック派遣の香川県警の警察官 宣言期間に飲酒伴う会食,https://www3.nhk.or.jp//news/html/20210827/k10013227551000.html,8月27日 19時07分,オリンピック・パラリンピック　大会運営
パラリンピック 競泳 初出場の窪田幸太 日本新で5位,https://www3.nhk.or.jp//news/html/20210827/k10013227811000.html,8月27日 19時06分,オリンピック・パラリンピック　競技・選手
富士急ハイランド 利用客骨折 県設置の相談窓口に複数の届け出,https://www3.nhk.or.jp//news/html/20210827/k10013227451000.html,8月27日 19時05分,事故
新型コロナ 重症者2000人に 15日連続で過去最多(27日）,https://www3.nhk.or.jp//news/html/20210827/k10013226401000.html,8月27日 19時01分,新型コロナウイルス
【随時更新】アフガニスタン 混乱の中の国外退避の行方,https://www3.nhk.or.jp//news/html/20210825/k10013222081000.html,8月27日 19時00分,自衛隊
選手村で自動運転車と接触 パラ柔道の北薗選手けが,https://www3.nhk.or.jp//news/html/20210827/k10013227351000.html,8月27日 18時58分,パラ柔道
円相場 小幅な値動き FRB議長講演前 積極的取り引き控えられる,https://www3.nhk.or.jp//news/html/20210827/k10013227621000.html,8月27日 18時57分,株価・為替
各地で猛暑日 あす朝にかけ熱帯夜の予想 熱中症に警戒を,https://www3.nhk.or.jp//news/html/20210827/k10013227471000.html,8月27日 18時57分,熱中症
築地市場跡地に「酸素ステーション」9月下旬までに開設予定,https://www3.nhk.or.jp//news/html/20210827/k10013227371000.html,8月27日 18時56分,新型コロナウイルス
「ユニ・チャーム」全国で“出社禁止“ 感染拡大で,https://www3.nhk.or.jp//news/html/20210827/k10013227411000.html,8月27日 18時51分,新型コロナウイルス
小田急線切りつけ 別の乗客への殺人未遂などの疑い 男を再逮捕,https://www3.nhk.or.jp//news/html/20210827/k10013227491000.html,8月27日 18時48分,事件
パラリンピック車いすテニス 暑さで6時間遅れて屋外の試合開始,https://www3.nhk.or.jp//news/html/20210827/k10013227791000.html,8月27日 18時45分,車いすテニス
来年度後半の連続テレビ小説は「舞いあがれ！」,https://www3.nhk.or.jp//news/html/20210827/k10013227301000.html,8月27日 18時44分,エンタメ
鳥取 三朝温泉の「河原風呂」大雨被害の復旧終え再開,https://www3.nhk.or.jp//news/html/20210827/k10013227431000.html,8月27日 18時38分,大雨（2021年7月）
パラリンピック IPC会長が復興のモニュメント訪問,https://www3.nhk.or.jp//news/html/20210827/k10013227571000.html,8月27日 18時37分,オリンピック・パラリンピック
パラリンピック 柔道 瀬戸勇次郎が銅メダル 男子66キロ級,https://www3.nhk.or.jp//news/html/20210827/k10013226801000.html,8月27日 18時35分,パラ柔道
