title,link,time,category
東京都 3回目のワクチン接種 19日に開始 年末年始も実施へ,https://www3.nhk.or.jp//news/html/20211217/k10013391441000.html,12月17日 0時00分,新型コロナウイルス
ソフト 渥美 今シーズンで現役引退表明 東京五輪金獲得に貢献,https://www3.nhk.or.jp//news/html/20211216/k10013391611000.html,12月16日 23時54分,ソフトボール
東京都 全入国者の施設待機を緊急要望 オミクロン株感染受け,https://www3.nhk.or.jp//news/html/20211216/k10013391591000.html,12月16日 23時05分,新型コロナウイルス
新型コロナ オミクロン株感染 同じ空間にいた人は幅広く検査を,https://www3.nhk.or.jp//news/html/20211216/k10013391501000.html,12月16日 23時02分,新型コロナウイルス
ビーチサッカー日本代表6選手 待機中に練習参加で出場停止処分,https://www3.nhk.or.jp//news/html/20211216/k10013391571000.html,12月16日 22時57分,サッカー
関西空港の検疫所職員 新型コロナ オミクロン株に感染確認,https://www3.nhk.or.jp//news/html/20211216/k10013391381000.html,12月16日 22時00分,新型コロナ 国内感染者数
カーリング男子 日本は北京五輪出場枠獲得ならず 世界最終予選,https://www3.nhk.or.jp//news/html/20211216/k10013391421000.html,12月16日 21時55分,カーリング
イギリス中央銀行 3年4か月ぶり利上げ決定 インフレ加速に対応,https://www3.nhk.or.jp//news/html/20211216/k10013391431000.html,12月16日 21時47分,新型コロナ 経済影響
連合 衆院選総括 “立民が共産などと共通政策結び支援できず”,https://www3.nhk.or.jp//news/html/20211216/k10013391411000.html,12月16日 21時44分,2021衆院選
巨人残留のエース菅野 推定2億円ダウンの年俸6億円で契約更改,https://www3.nhk.or.jp//news/html/20211216/k10013391371000.html,12月16日 21時23分,プロ野球
サッカー男子 パリ五輪目指す日本代表 新監督に大岩剛氏就任,https://www3.nhk.or.jp//news/html/20211216/k10013391391000.html,12月16日 21時12分,サッカー
豪の小学校 大型遊具 強風で舞い上がり子どもが落下 4人死亡,https://www3.nhk.or.jp//news/html/20211216/k10013391351000.html,12月16日 21時05分,事故
調布の道路陥没問題 外環道の地下トンネル内を報道陣に公開,https://www3.nhk.or.jp//news/html/20211216/k10013391161000.html,12月16日 21時00分,
“オミクロン株” ワクチン供給は？ 3回目接種で効果は？,https://www3.nhk.or.jp//news/html/20211216/k10013390401000.html,12月16日 20時53分,新型コロナ ワクチン（日本国内）
神奈川県 新型コロナ 36人感染確認 1人死亡,https://www3.nhk.or.jp//news/html/20211216/k10013391141000.html,12月16日 20時53分,新型コロナ 国内感染者数
オミクロン株 自宅待機中の20代女性1人感染確認 東京都が発表,https://www3.nhk.or.jp//news/html/20211216/k10013390841000.html,12月16日 20時47分,新型コロナウイルス
深刻化する半導体不足解消を 自動車と半導体の業界が対策会議,https://www3.nhk.or.jp//news/html/20211216/k10013391361000.html,12月16日 20時43分,電気自動車
もう書類はいらない！？官僚たちのDX,https://www3.nhk.or.jp//news/html/20211216/k10013390381000.html,12月16日 20時42分,IT・ネット
モデルナワクチン “3回目”承認 ファイザーとの交互接種も,https://www3.nhk.or.jp//news/html/20211216/k10013390451000.html,12月16日 20時30分,新型コロナ ワクチン（日本国内）
パラスキー選手4人 北京パラ前哨戦の世界選手権に出場せず,https://www3.nhk.or.jp//news/html/20211216/k10013391281000.html,12月16日 20時08分,北京 冬季オリンピック・パラリンピック
