title,link,time,category
北京オリンピック 日本メダル13個に 冬最多ピョンチャンと並ぶ,https://www3.nhk.or.jp//news/html/20220215/k10013485581000.html,2月15日 19時37分,北京 冬季オリンピック・パラリンピック
ウクライナ情勢 ロシア国防省 演習終えた部隊 撤収開始と発表,https://www3.nhk.or.jp//news/html/20220215/k10013485771000.html,2月15日 19時35分,ロシア
フィギュア【速報】女子シングルSP 坂本・樋口・河辺が出場,https://www3.nhk.or.jp//news/html/20220215/k10013484761000.html,2月15日 19時35分,フィギュアスケート
ノルディック複合個人LH【速報】後半クロカン10km,https://www3.nhk.or.jp//news/html/20220215/k10013484731000.html,2月15日 19時35分,スキーノルディック複合
オリンピック【随時更新】大会12日目 15日の競技結果・動き,https://www3.nhk.or.jp//news/html/20220215/k10013484371000.html,2月15日 19時33分,北京 冬季オリンピック・パラリンピック
スピードスケート 女子団体パシュート 日本は銀メダル,https://www3.nhk.or.jp//news/html/20220215/k10013484831000.html,2月15日 19時31分,スピードスケート
岸田首相とウクライナ大統領 電話会談,https://www3.nhk.or.jp//news/html/20220215/k10013485801000.html,2月15日 19時29分,ロシア
日大 田中英壽前理事長 脱税事件の初公判 起訴内容認める,https://www3.nhk.or.jp//news/html/20220215/k10013484841000.html,2月15日 19時27分,事件
【国内感染】新型コロナ236人死亡 8万4221人感染（18:20現在）,https://www3.nhk.or.jp//news/html/20220215/k10013485761000.html,2月15日 19時21分,新型コロナ 国内感染者数
大阪 集合住宅で男女意識不明 男性は女性の娘と面識ある高校生,https://www3.nhk.or.jp//news/html/20220215/k10013484641000.html,2月15日 19時18分,事件
トンガ沖 海底火山噴火から1か月 水産業への影響 長期化が懸念,https://www3.nhk.or.jp//news/html/20220215/k10013485541000.html,2月15日 19時13分,
日本海側 あすから18日にかけこの冬一番の大雪の可能性,https://www3.nhk.or.jp//news/html/20220215/k10013485531000.html,2月15日 19時09分,
NTT労組 春闘で2％賃上げ要求へ “人財への投資” 求める,https://www3.nhk.or.jp//news/html/20220215/k10013485691000.html,2月15日 19時08分,春闘
新型コロナ 国内感染者数400万人超に この12日間で100万人増,https://www3.nhk.or.jp//news/html/20220215/k10013484611000.html,2月15日 19時06分,新型コロナ 国内感染者数
感染急拡大で事業継続が課題に 商社が独自の対応マニュアル,https://www3.nhk.or.jp//news/html/20220215/k10013485641000.html,2月15日 19時05分,新型コロナウイルス
大阪市のヘイトスピーチ規制条例は「合憲」最高裁が初めて判断,https://www3.nhk.or.jp//news/html/20220215/k10013485591000.html,2月15日 19時01分,
自民・公明 原則停止の留学生受け入れ求める決議文 政府に提出,https://www3.nhk.or.jp//news/html/20220215/k10013485621000.html,2月15日 18時57分,外国人材
カーリング女子【詳細】日本 イギリスに敗れ初の連敗 4勝3敗に,https://www3.nhk.or.jp//news/html/20220215/k10013484971000.html,2月15日 18時54分,カーリング
カーリング女子日本代表「もぐもぐタイム」生かしメダルへ！,https://www3.nhk.or.jp//news/html/20220215/k10013484571000.html,2月15日 18時54分,北京 冬季オリンピック・パラリンピック
アサヒビール工場 2か所を閉鎖へ ビール離れや新型コロナ影響,https://www3.nhk.or.jp//news/html/20220215/k10013485661000.html,2月15日 18時52分,新型コロナ 経済影響
