title,link,time,category
新型コロナ 5類後の医療体制 インフルエンザと同規模目指す,https://www3.nhk.or.jp//news/html/20230222/k10013987451000.html,2月22日 5時27分,新型コロナウイルス
2月22日は猫の日 猫のマイクロチップ装着は犬の4割程度,https://www3.nhk.or.jp//news/html/20230222/k10013987381000.html,2月22日 5時21分,
米軍基地周辺で検出の「PFOS」など 測定方法の開発急ぐ 環境省,https://www3.nhk.or.jp//news/html/20230222/k10013987371000.html,2月22日 5時20分,環境
プーチン大統領演説 核軍縮条約を停止 核戦力誇示で米けん制,https://www3.nhk.or.jp//news/html/20230222/k10013987541000.html,2月22日 5時15分,ロシア
【随時更新】ロシア ウクライナに軍事侵攻（22日の動き）,https://www3.nhk.or.jp//news/html/20230222/k10013961881000.html,2月22日 4時57分,ウクライナ情勢
林外相 ウクライナ侵攻1年に合わせ開催の国連会合に出発へ,https://www3.nhk.or.jp//news/html/20230222/k10013987431000.html,2月22日 4時31分,ウクライナ情勢
日本製鉄 カナダ石炭会社に約1100億円出資 高品質の石炭確保へ,https://www3.nhk.or.jp//news/html/20230222/k10013987531000.html,2月22日 4時28分,環境
賃金デジタル払いへ 厚生労働省が専門の部署設置の方針,https://www3.nhk.or.jp//news/html/20230222/k10013987391000.html,2月22日 4時18分,IT・ネット
新年度予算案 衆議院採決日程で与野党の調整続く,https://www3.nhk.or.jp//news/html/20230222/k10013987441000.html,2月22日 4時15分,来年度予算案
日中防衛当局協議 ”気球の領空侵犯”生じないよう申し入れ,https://www3.nhk.or.jp//news/html/20230222/k10013987481000.html,2月22日 4時13分,中国
九州新幹線の車両1両を輸送用に 鹿児島産初ガツオなど福岡へ,https://www3.nhk.or.jp//news/html/20230222/k10013987311000.html,2月22日 4時10分,鹿児島県
スノーボード世界選手権 女子パラレル回転 三木つばきは敗退,https://www3.nhk.or.jp//news/html/20230222/k10013987501000.html,2月22日 0時54分,スノーボード
2歳の男児死亡で母親逮捕 児童相談所「重く受け止め検証する」,https://www3.nhk.or.jp//news/html/20230222/k10013987491000.html,2月22日 0時51分,児童虐待
NATO事務総長「侵略者はロシア」ウクライナ支援強化の考え示す,https://www3.nhk.or.jp//news/html/20230222/k10013987511000.html,2月22日 0時14分,ウクライナ情勢
【詳細】ロシア ウクライナに軍事侵攻（21日の動き）,https://www3.nhk.or.jp//news/html/20230221/k10013961871000.html,2月21日 23時35分,ウクライナ情勢
東京 板橋 事業所に4人組の男押し入る 現金約900万円奪い逃走,https://www3.nhk.or.jp//news/html/20230221/k10013987161000.html,2月21日 23時26分,事件
プーチン大統領が侵攻継続姿勢を強調 侵攻後初の年次教書演説,https://www3.nhk.or.jp//news/html/20230221/k10013987151000.html,2月21日 21時29分,ロシア
トルコ・シリア大地震 M6.3の地震発生 被災者の不安広がる,https://www3.nhk.or.jp//news/html/20230221/k10013986471000.html,2月21日 20時52分,トルコ・シリア大地震
パンダ3頭に感謝を伝えるセレモニー あす中国へ返還 和歌山,https://www3.nhk.or.jp//news/html/20230221/k10013987201000.html,2月21日 20時50分,和歌山県
トルコ・シリア大地震 思い出の品探す人も【21日の動き】,https://www3.nhk.or.jp//news/html/20230221/k10013986441000.html,2月21日 20時49分,トルコ・シリア大地震
