title,link,time,category
九州北部と四国が梅雨入り 九州で雨強まる 沖縄は梅雨明け,https://www3.nhk.or.jp//news/html/20250608/k10014829061000.html,6月8日 12時04分,気象
成田空港会社 2024年度の決算 売り上げが過去最高に,https://www3.nhk.or.jp//news/html/20250608/k10014829101000.html,6月8日 11時54分,航空
女子ゴルフ 米ツアー第2R 西郷真央と古江彩佳が2位に浮上,https://www3.nhk.or.jp//news/html/20250608/k10014829091000.html,6月8日 11時38分,#ゴルフ（女子）
米首都で性的マイノリティーの人たちがパレード“権利尊重を”,https://www3.nhk.or.jp//news/html/20250608/k10014829071000.html,6月8日 11時25分,アメリカ
宮崎 えびの パラグライダー着陸失敗 意識不明の61歳男性 死亡,https://www3.nhk.or.jp//news/html/20250608/k10014829051000.html,6月8日 10時48分,宮崎県
米ロサンゼルスで住民と移民当局が衝突 大規模摘発に反発,https://www3.nhk.or.jp//news/html/20250608/k10014829031000.html,6月8日 10時11分,アメリカ
ドジャース 山本6回無失点 大谷1安打 チームはサヨナラ負け,https://www3.nhk.or.jp//news/html/20250608/k10014828991000.html,6月8日 10時09分,#山本由伸
岸田前首相 “コメ価格高騰の要因 検証が重要” 認識を示す,https://www3.nhk.or.jp//news/html/20250608/k10014829041000.html,6月8日 10時06分,農業
サッカー日本代表 W杯最終予選の最終戦へ調整開始 大阪 堺,https://www3.nhk.or.jp//news/html/20250607/k10014828871000.html,6月8日 9時03分,#サッカー日本代表
カブス 鈴木誠也 1試合2本のホームラン 今季打点55でリーグ2位,https://www3.nhk.or.jp//news/html/20250608/k10014829011000.html,6月8日 8時42分,#鈴木誠也
九州で10日にかけて雷を伴い非常に激しい雨が降るおそれ,https://www3.nhk.or.jp//news/html/20250608/k10014828981000.html,6月8日 8時29分,気象
新潟 南魚沼 パラグライダー大会参加の女性が死亡 川で倒れる,https://www3.nhk.or.jp//news/html/20250608/k10014829021000.html,6月8日 7時20分,新潟県
JR中央線快速 運転再開 東京駅～高尾駅間の全線で,https://www3.nhk.or.jp//news/html/20250608/k10014829001000.html,6月8日 7時16分,鉄道
テニス 全仏OP 女子シングルスはガウフが逆転で初優勝,https://www3.nhk.or.jp//news/html/20250608/k10014828971000.html,6月8日 7時10分,#テニス
LGBTQなど性的マイノリティーの中高生9割が“学校で困難経験”,https://www3.nhk.or.jp//news/html/20250608/k10014828831000.html,6月8日 6時48分,LGBTQ
イスラエル 軍事作戦に反対の大規模集会 停戦で人質の解放を,https://www3.nhk.or.jp//news/html/20250608/k10014828961000.html,6月8日 6時29分,イスラエル・パレスチナ
佳子さま サンパウロ近郊の高齢者施設で日系人と交流,https://www3.nhk.or.jp//news/html/20250608/k10014828951000.html,6月8日 6時04分,皇室
中国 レアアース EU企業向け輸出の承認手続き 迅速化へ,https://www3.nhk.or.jp//news/html/20250608/k10014828911000.html,6月8日 5時31分,中国
米中貿易協議に何副首相が出席 どこまで進展するかが焦点に,https://www3.nhk.or.jp//news/html/20250608/k10014828941000.html,6月8日 5時28分,アメリカ
ロシアとウクライナ 遺体返還めぐり非難応酬 交換時期は不透明,https://www3.nhk.or.jp//news/html/20250608/k10014828931000.html,6月8日 4時57分,ウクライナ情勢
