title,link,time,category
イラン“大使館にイスラエルが攻撃” 大統領 報復措置取る考え,https://www3.nhk.or.jp//news/html/20240402/k10014409861000.html,4月2日 19時07分,イスラエル
静岡 川勝知事 辞職の意向表明 不適切発言の批判受けた会見で,https://www3.nhk.or.jp//news/html/20240402/k10014410721000.html,4月2日 19時04分,静岡県
輪島市 能登半島地震後 約4分の1の防災行政無線が使えず,https://www3.nhk.or.jp//news/html/20240402/k10014410691000.html,4月2日 19時03分,令和6年能登半島地震
岸田首相 自民党執行部と会談 関係議員の処分協議 調整続ける,https://www3.nhk.or.jp//news/html/20240402/k10014410771000.html,4月2日 19時01分,政治資金
石川 全国自治体から応援の職員約360人 被災した市町で対応へ,https://www3.nhk.or.jp//news/html/20240402/k10014410681000.html,4月2日 18時59分,令和6年能登半島地震
米カリフォルニア州 ファストフード店の最低賃金3000円に,https://www3.nhk.or.jp//news/html/20240402/k10014410631000.html,4月2日 18時26分,アメリカ
被災した元教員の手書きの新聞 約3か月ぶりに復活 石川 穴水町,https://www3.nhk.or.jp//news/html/20240402/k10014410641000.html,4月2日 18時20分,令和6年能登半島地震
紅麹問題 小林製薬“ナイシヘルプ”改めて分析へ 学会調査受け,https://www3.nhk.or.jp//news/html/20240402/k10014410651000.html,4月2日 18時15分,医療・健康
円相場 小幅に値下がり,https://www3.nhk.or.jp//news/html/20240402/k10014410661000.html,4月2日 18時14分,株価・為替
能登半島地震 石川県 新たに1人の死亡確認 245人に（4月2日）,https://www3.nhk.or.jp//news/html/20240402/k10014410501000.html,4月2日 18時03分,令和6年能登半島地震
少子化対策強化へ 子ども・子育て支援法など改正案が審議入り,https://www3.nhk.or.jp//news/html/20240402/k10014410611000.html,4月2日 18時00分,少子化
トヨタ 研究開発拠点完成で記念式典 本社一体で競争力高める,https://www3.nhk.or.jp//news/html/20240402/k10014410541000.html,4月2日 17時51分,自動車
千葉 市川 市指定の有形文化財に落書き 建造物損壊事件で捜査,https://www3.nhk.or.jp//news/html/20240402/k10014410621000.html,4月2日 17時48分,事件
三重の高校生 輪島の避難所で炊き出し 自分たちが育てた食材で,https://www3.nhk.or.jp//news/html/20240402/k10014410561000.html,4月2日 17時45分,令和6年能登半島地震
日本郵便 配達できない被災地の郵便物 手続きを呼びかけ 石川,https://www3.nhk.or.jp//news/html/20240402/k10014410551000.html,4月2日 17時44分,令和6年能登半島地震
海自基地でドローン使用し撮影か SNSに動画 防衛省が調査,https://www3.nhk.or.jp//news/html/20240402/k10014410491000.html,4月2日 17時41分,防衛省・自衛隊
“県職員は牛の世話する人と違う”静岡県知事発言に苦情相次ぐ,https://www3.nhk.or.jp//news/html/20240402/k10014410601000.html,4月2日 17時39分,静岡県
2月の農林水産物と食品の輸出額 去年同月比1.6％減,https://www3.nhk.or.jp//news/html/20240402/k10014410581000.html,4月2日 17時35分,水産業
誤情報に惑わされない「情報的健康」実現へアイデアコンテスト,https://www3.nhk.or.jp//news/html/20240402/k10014410521000.html,4月2日 17時34分,IT・ネット
宇宙機器メーカー 本社を東京から群馬 富岡市に移転,https://www3.nhk.or.jp//news/html/20240402/k10014410481000.html,4月2日 17時32分,群馬県
