title,link,time,category
カーリング日本選手権 男子 コンサドーレが優勝 3年ぶり4回目,https://www3.nhk.or.jp//news/html/20240204/k10014347031000.html,2月4日 19時28分,カーリング
将棋 「棋王戦」第1局 「持将棋」で引き分け,https://www3.nhk.or.jp//news/html/20240204/k10014347231000.html,2月4日 19時24分,将棋
石川 輪島 孤立状態から避難した後 初めて区長が地元集落に,https://www3.nhk.or.jp//news/html/20240204/k10014347181000.html,2月4日 19時23分,令和6年能登半島地震
イスラエル 人質解放を求め抗議集会 政権の退陣を迫る声も,https://www3.nhk.or.jp//news/html/20240204/k10014347251000.html,2月4日 19時21分,イスラエル・パレスチナ
立民”企業・団体献金の禁止検討を” 自民は慎重姿勢 日曜討論,https://www3.nhk.or.jp//news/html/20240204/k10014346951000.html,2月4日 19時05分,政治資金
前橋市長選挙 野党側新人の小川氏が当選確実 与党推す現職抑え,https://www3.nhk.or.jp//news/html/20240204/k10014343691000.html,2月4日 19時01分,選挙
関東甲信5日から大雪「不要不急の外出控えて」国交省と気象庁,https://www3.nhk.or.jp//news/html/20240204/k10014346561000.html,2月4日 19時00分,気象
地震 2次避難者は5000人超 石川県 避難者に次の居場所を調整へ,https://www3.nhk.or.jp//news/html/20240204/k10014347171000.html,2月4日 18時59分,令和6年能登半島地震
【随時更新】イスラエル各地 人質解放求め抗議集会 （2月4日）,https://www3.nhk.or.jp//news/html/20240204/k10014346741000.html,2月4日 18時45分,イスラエル・パレスチナ
米 民主党 サウスカロライナ州予備選挙 バイデン大統領が勝利,https://www3.nhk.or.jp//news/html/20240204/k10014347021000.html,2月4日 18時41分,アメリカ大統領選
厚労省 生活保護受給世帯の子が高卒就職時に一時金支給へ,https://www3.nhk.or.jp//news/html/20240204/k10014347201000.html,2月4日 18時40分,厚生労働省
石川 輪島 5日から市内巡回する無料臨時バスの運行開始,https://www3.nhk.or.jp//news/html/20240204/k10014347191000.html,2月4日 18時38分,令和6年能登半島地震
【被害状況】石川 能登地方の一部地域で停電続く（2月4日）,https://www3.nhk.or.jp//news/html/20240204/k10014346771000.html,2月4日 18時24分,令和6年能登半島地震
トルコ・シリア大地震から1年 今も70万人近くが仮設住宅で生活,https://www3.nhk.or.jp//news/html/20240204/k10014347061000.html,2月4日 18時19分,トルコ・シリア大地震
立民 党大会 泉代表が次の衆院選で政権交代を目指す決意強調,https://www3.nhk.or.jp//news/html/20240204/k10014347151000.html,2月4日 17時51分,衆議院
チリで大規模な山火事相次ぐ これまでに51人死亡,https://www3.nhk.or.jp//news/html/20240204/k10014347161000.html,2月4日 17時41分,気象
東日本大震災で津波被害の被災地でマラソン大会 千葉 旭,https://www3.nhk.or.jp//news/html/20240204/k10014347081000.html,2月4日 16時59分,東日本大震災
石川 能登町 被災農家がネット販売「復興しいたけ」数日で完売,https://www3.nhk.or.jp//news/html/20240204/k10014347131000.html,2月4日 16時50分,令和6年能登半島地震
能登半島地震 安否不明者12人の氏名 石川県が公表（2月4日）,https://www3.nhk.or.jp//news/html/20240103/k10014308261000.html,2月4日 16時45分,令和6年能登半島地震
NBA レイカーズ八村塁  先発出場で7得点 チームは2連勝,https://www3.nhk.or.jp//news/html/20240204/k10014347041000.html,2月4日 16時33分,八村塁
