title,link,time,category
女子ゴルフ 米ツアー マッチプレー 古江彩佳 決勝で敗れる,https://www3.nhk.or.jp//news/html/20220530/k10013649271000.html,5月30日 12時09分,ゴルフ
【随時更新】ロシア ウクライナに軍事侵攻（30日の動き）,https://www3.nhk.or.jp//news/html/20220530/k10013617791000.html,5月30日 12時08分,ウクライナ情勢
AIに都市を動かせるのか？企業連合で挑む未来都市プロジェクト,https://www3.nhk.or.jp//news/html/20220530/k10013622841000.html,5月30日 12時05分,IT・ネット
株価 500円以上値上がり NYダウの下落歯止めに安心感,https://www3.nhk.or.jp//news/html/20220530/k10013649201000.html,5月30日 12時02分,株価・為替
大谷翔平 2打席連続ホームラン 大リーグ通算4回目のふた桁達成,https://www3.nhk.or.jp//news/html/20220530/k10013649161000.html,5月30日 11時54分,大リーグ
米バイデン大統領夫妻 男が銃乱射した小学校訪問 犠牲者を追悼,https://www3.nhk.or.jp//news/html/20220530/k10013649241000.html,5月30日 11時39分,銃乱射
ゼレンスキー大統領 欧米から軍事支援受け徹底抗戦の決意強調,https://www3.nhk.or.jp//news/html/20220530/k10013649231000.html,5月30日 11時35分,ウクライナ情勢
参院予算委 補正予算案 あす採決で与野党合意,https://www3.nhk.or.jp//news/html/20220530/k10013649211000.html,5月30日 10時25分,
ブラジル北東部で大雨 79人死亡,https://www3.nhk.or.jp//news/html/20220530/k10013649191000.html,5月30日 10時02分,
自動車レース「インディ500」 佐藤琢磨は3回目の優勝ならず,https://www3.nhk.or.jp//news/html/20220530/k10013649181000.html,5月30日 9時29分,
エルサレムでイスラエル極右支持者らが行進 衝突でけが人も,https://www3.nhk.or.jp//news/html/20220530/k10013649171000.html,5月30日 9時09分,イスラエル・パレスチナ
狙われる先端技術 “スパイ活動”の手口 警察庁は取り組み強化,https://www3.nhk.or.jp//news/html/20220530/k10013649151000.html,5月30日 8時30分,経済安全保障
上海 企業活動の再開認める方針 多くの地域で外出制限続く中で,https://www3.nhk.or.jp//news/html/20220530/k10013649031000.html,5月30日 7時04分,新型コロナウイルス
暗闇に舞うヒメボタル 3週間ほどの幻想的な光景 高知 いの町,https://www3.nhk.or.jp//news/html/20220530/k10013648871000.html,5月30日 6時57分,
空調機器メーカー オフィス向けサービス拡大 行動制限の緩和で,https://www3.nhk.or.jp//news/html/20220530/k10013648991000.html,5月30日 6時38分,新型コロナ 経済影響
“1.5度”の気温上昇「今後5年間に起きる可能性 50％近く」,https://www3.nhk.or.jp//news/html/20220530/k10013649011000.html,5月30日 6時32分,気象
特産のテングサをPR ところてんを観光客に 静岡 西伊豆町,https://www3.nhk.or.jp//news/html/20220530/k10013648861000.html,5月30日 5時56分,
自慢の愛車が勢ぞろい オートバイ愛好家が3年ぶりに交流 大津,https://www3.nhk.or.jp//news/html/20220530/k10013648881000.html,5月30日 5時47分,新型コロナウイルス
立民 物価高騰対策強化に向け街頭などで対話活動展開へ,https://www3.nhk.or.jp//news/html/20220530/k10013648961000.html,5月30日 5時45分,
きょうから参院予算委員会 補正予算案めぐり与野党論戦へ,https://www3.nhk.or.jp//news/html/20220530/k10013648951000.html,5月30日 5時42分,原油価格
