title,link,time,category
プーチン大統領71歳に 大統領選に立候補の場合 83歳まで続投も,https://www3.nhk.or.jp//news/html/20231007/k10014218121000.html,10月7日 4時30分,プーチン大統領
ノーベル平和賞 イランのモハンマディさん受賞 政権側は反発,https://www3.nhk.or.jp//news/html/20231007/k10014218091000.html,10月7日 4時14分,ノーベル賞2023
伊勢えび漁が解禁 一部漁港で今シーズン初めての水揚げ 三重,https://www3.nhk.or.jp//news/html/20231007/k10014218151000.html,10月7日 4時06分,三重県
ラグビーＷ杯 日本 アルゼンチン戦メンバー発表 SHは齋藤直人,https://www3.nhk.or.jp//news/html/20231006/k10014218231000.html,10月6日 23時35分,ラグビーW杯 2023
米 9月雇用統計 農業分野以外の就業者 市場予想を大きく上回る,https://www3.nhk.or.jp//news/html/20231006/k10014218111000.html,10月6日 23時23分,雇用統計
熊本の強豪 大津高サッカー部 いじめ問題受け 当面活動を自粛,https://www3.nhk.or.jp//news/html/20231006/k10014218221000.html,10月6日 23時18分,サッカー
“精神科病院での身体拘束 上限制定を” 看護師ら厚労省に要望,https://www3.nhk.or.jp//news/html/20231006/k10014218281000.html,10月6日 23時14分,厚生労働省
公明 山口代表 “新たな経済対策 速やかな実施可能給付 妥当”,https://www3.nhk.or.jp//news/html/20231006/k10014218271000.html,10月6日 22時55分,物価高騰
ジャニーズ事務所会見 司会者 “NGリスト手元にあった”,https://www3.nhk.or.jp//news/html/20231006/k10014218251000.html,10月6日 22時48分,ジャニー喜多川氏 性加害問題
大阪・関西万博の会場建設費 見直しで500億円増の最大2350億円,https://www3.nhk.or.jp//news/html/20231006/k10014218241000.html,10月6日 22時45分,大阪・関西万博
パ・リーグ3位のロッテ大勝 CS進出争う3チームは残り2試合,https://www3.nhk.or.jp//news/html/20231006/k10014218261000.html,10月6日 22時42分,プロ野球
パリ五輪代表内定 ボクシング 岡澤 原田 アジア大会から帰国,https://www3.nhk.or.jp//news/html/20231006/k10014218161000.html,10月6日 22時36分,ボクシング
ノーベル平和賞 イランの人権活動家 ナルゲス・モハンマディ氏,https://www3.nhk.or.jp//news/html/20231006/k10014217681000.html,10月6日 22時30分,ノーベル賞2023
バレーボール男子 五輪予選 4勝で出場権得られるグループ2位に,https://www3.nhk.or.jp//news/html/20231006/k10014218171000.html,10月6日 22時26分,バレーボール
Japan Weeks 最終日 岸田首相と海外の機関投資家 意見交換会,https://www3.nhk.or.jp//news/html/20231006/k10014218071000.html,10月6日 22時23分,金融
検察事務官 児童ポルノ禁止法違反などの罪で略式起訴 さいたま,https://www3.nhk.or.jp//news/html/20231006/k10014218051000.html,10月6日 22時20分,埼玉県
自民 政府保有NTT株式売却の場合 外資規制のあり方ヒアリング,https://www3.nhk.or.jp//news/html/20231006/k10014218181000.html,10月6日 22時14分,通信
巨人 阿部慎之助新監督が就任会見 原前監督と同じ背番号「83」,https://www3.nhk.or.jp//news/html/20231006/k10014218021000.html,10月6日 22時12分,プロ野球
ラグビーW杯 アルゼンチン戦を前に 基本の「キ」【10月6日版】,https://www3.nhk.or.jp//news/html/20231006/k10014216861000.html,10月6日 22時10分,ラグビーW杯 2023
三木証券に一部業務停止命令 リスク判断能力ない人に株式販売,https://www3.nhk.or.jp//news/html/20231006/k10014218011000.html,10月6日 22時04分,金融
