title,link,time,category
ゼレンスキー大統領「平和サミット」を“平和構築プロセスに”,https://www3.nhk.or.jp//news/html/20240615/k10014482131000.html,6月15日 23時25分,ウクライナ情勢
バレーボール女子 パリ五輪へ 古賀紗理那「戦術面より高めて」,https://www3.nhk.or.jp//news/html/20240615/k10014482321000.html,6月15日 23時08分,バレーボール
サッカーJ1 第18節 FC町田ゼルビアが逆転勝ち 2試合ぶりの勝利,https://www3.nhk.or.jp//news/html/20240615/k10014482311000.html,6月15日 22時57分,サッカーJリーグ
岸田首相 スイス到着 ウクライナ支援の連携を呼びかけへ,https://www3.nhk.or.jp//news/html/20240615/k10014482081000.html,6月15日 22時37分,ウクライナ情勢
トランプ前大統領 78歳の誕生日迎える 81歳バイデン氏と論戦へ,https://www3.nhk.or.jp//news/html/20240615/k10014481881000.html,6月15日 22時35分,アメリカ大統領選
パキスタン 山岳地帯で1人の遺体収容 不明の日本人か確認急ぐ,https://www3.nhk.or.jp//news/html/20240615/k10014482291000.html,6月15日 21時52分,パキスタン
東京 熱中症の疑いで18人搬送 70代の1人は重症 対策の徹底を,https://www3.nhk.or.jp//news/html/20240615/k10014482101000.html,6月15日 21時51分,気象
岸田首相 今国会での衆院解散や役員人事「今は考えていない」,https://www3.nhk.or.jp//news/html/20240615/k10014482281000.html,6月15日 21時40分,国会
岐阜 中津川 男子大学生が川で溺れ意識不明の重体,https://www3.nhk.or.jp//news/html/20240615/k10014482261000.html,6月15日 20時34分,岐阜県
捜査段階の精神鑑定 面接せず鑑定書作成 裁判所「信用性低い」,https://www3.nhk.or.jp//news/html/20240615/k10014481991000.html,6月15日 19時42分,事件
全日本大学野球選手権 決勝は青山学院大と早稲田大の対戦に,https://www3.nhk.or.jp//news/html/20240615/k10014482231000.html,6月15日 19時27分,野球
WFP“ガザ南部で壊滅的な飢餓に陥るおそれ” 即時停戦訴え,https://www3.nhk.or.jp//news/html/20240615/k10014482141000.html,6月15日 19時08分,イスラエル・パレスチナ
ラグビー日本代表 イングランド戦へ宮崎合宿 ファンが熱い声援,https://www3.nhk.or.jp//news/html/20240615/k10014482061000.html,6月15日 19時02分,ラグビー日本代表
【随時更新】イスラエル・パレスチナ 中東情勢（6月15日）,https://www3.nhk.or.jp//news/html/20240615/k10014481711000.html,6月15日 18時59分,イスラエル・パレスチナ
『画像をばらまくぞ』SNSで横行 性的画像の拡散・脅迫,https://www3.nhk.or.jp//news/html/20240615/k10014481191000.html,6月15日 18時58分,デジタルでだまされない
茨城 山あい住宅に2人組押し入り90歳女性縛り逃走 強盗で捜査,https://www3.nhk.or.jp//news/html/20240615/k10014482121000.html,6月15日 18時52分,事件
中国 北京で旅行の博覧会 日本の自治体などが各地の魅力をPR,https://www3.nhk.or.jp//news/html/20240615/k10014482091000.html,6月15日 18時15分,中国
新潟 長野 福井で猛暑日に あすは湿度も高く 熱中症に十分注意,https://www3.nhk.or.jp//news/html/20240615/k10014482111000.html,6月15日 18時05分,気象
サッカー日本代表 遠藤航 能登半島地震被災地の中高生と交流,https://www3.nhk.or.jp//news/html/20240615/k10014482041000.html,6月15日 17時56分,令和6年能登半島地震
諏訪湖の台船に特設リング プロレスのイベント開催 長野 岡谷,https://www3.nhk.or.jp//news/html/20240615/k10014482071000.html,6月15日 17時52分,長野県
