title,link,time,category
石川 珠洲の小中学校で卒業式 学校に避難の住民たちも門出祝う,https://www3.nhk.or.jp//news/html/20240312/k10014387631000.html,3月12日 17時12分,令和6年能登半島地震
春闘 機械や金属産業の中小企業労組 高水準回答のケースも,https://www3.nhk.or.jp//news/html/20240312/k10014387981000.html,3月12日 17時08分,春闘
自民 “中小企業の賃上げ原資確保へ 環境整備を” 首相に要請,https://www3.nhk.or.jp//news/html/20240312/k10014387961000.html,3月12日 17時04分,春闘
「不謹慎で迷惑」能登半島地震で相次いだ偽救助要請 実態は?,https://www3.nhk.or.jp//news/html/20240312/k10014383261000.html,3月12日 17時03分,デジタルでだまされない
「北陸応援割」石川でも予約受け付け始まる,https://www3.nhk.or.jp//news/html/20240312/k10014387971000.html,3月12日 16時57分,令和6年能登半島地震
「工藤会」トップに無期懲役 1審の死刑判決取り消し 福岡高裁,https://www3.nhk.or.jp//news/html/20240312/k10014387471000.html,3月12日 16時54分,事件
サーフィン 稲葉玲王 五輪へ意気込み「出場するからには金を」,https://www3.nhk.or.jp//news/html/20240312/k10014387941000.html,3月12日 16時53分,サーフィン
変わる駅の時刻表,https://www3.nhk.or.jp//news/html/20240312/k10014387481000.html,3月12日 16時52分,鉄道
参院政倫審14日開催で合意 世耕前参院幹事長ら3人出席意向,https://www3.nhk.or.jp//news/html/20240312/k10014387641000.html,3月12日 16時48分,政治資金
投資詐欺事件 国際手配の元副社長 逮捕へ 今夜にも日本に移送,https://www3.nhk.or.jp//news/html/20240312/k10014387931000.html,3月12日 16時41分,事件
コストコ 下請け法違反で勧告 値引き分納入業者が負担 公取委,https://www3.nhk.or.jp//news/html/20240312/k10014387911000.html,3月12日 16時30分,小売業
上下水道被害 自治体向け助言など中間取りまとめへ 国の委員会,https://www3.nhk.or.jp//news/html/20240312/k10014387891000.html,3月12日 16時28分,令和6年能登半島地震
宇宙飛行士 古川聡さん 今夜帰還へ【ライブ予定 17:30ごろ～】,https://www3.nhk.or.jp//news/html/20240312/k10014387771000.html,3月12日 16時28分,宇宙
兵庫 小野 工事中に土砂崩れ 作業員2人巻き込まれ1人死亡,https://www3.nhk.or.jp//news/html/20240312/k10014387751000.html,3月12日 16時27分,兵庫県
柔道女子 日本代表の合宿公開 阿部詩“パリで金だけを目標に”,https://www3.nhk.or.jp//news/html/20240312/k10014387901000.html,3月12日 16時26分,柔道
【随時更新】ラマダン初日も攻撃 国連「銃置き人命救助を」,https://www3.nhk.or.jp//news/html/20240312/k10014387351000.html,3月12日 16時20分,イスラエル・パレスチナ
被災地の小中学生 心のケア面談にのべ600人余 不調訴える声も,https://www3.nhk.or.jp//news/html/20240312/k10014387801000.html,3月12日 16時12分,令和6年能登半島地震
大型トラックが自転車巻き込み1人死亡 女子高校生か 福岡 八女,https://www3.nhk.or.jp//news/html/20240312/k10014387921000.html,3月12日 16時09分,福岡県
強風の影響 羽田空港発着する空の便に欠航相次ぐ（14時現在）,https://www3.nhk.or.jp//news/html/20240312/k10014387881000.html,3月12日 15時53分,航空
53年前から営業の喫茶店が営業再開 常連客ら訪れる 石川 輪島,https://www3.nhk.or.jp//news/html/20240312/k10014387871000.html,3月12日 15時42分,令和6年能登半島地震
