title,link,time,category
西武HD プリンスホテルなど30施設売却へ 外資系に1500億円程度,https://www3.nhk.or.jp//news/html/20220206/k10013469231000.html,2月6日 5時16分,
15分時短のパート公務員 自治体の4割に 総務省が見直し求める,https://www3.nhk.or.jp//news/html/20220206/k10013469071000.html,2月6日 4時56分,
北京オリンピック 2月6日（日）の予定,https://www3.nhk.or.jp//news/html/20220206/k10013458661000.html,2月6日 4時52分,北京 冬季オリンピック・パラリンピック
スキージャンプ 高梨沙羅 メダル届かず 要因は「飛型点」,https://www3.nhk.or.jp//news/html/20220206/k10013469271000.html,2月6日 4時49分,スキージャンプ
ローザンヌ国際バレエコンクール 田中月乃さんが2位入賞,https://www3.nhk.or.jp//news/html/20220206/k10013469281000.html,2月6日 4時24分,
北京オリンピック 堀島行真選手の銅メダルに日本の技術,https://www3.nhk.or.jp//news/html/20220206/k10013466831000.html,2月6日 1時27分,北京 冬季オリンピック・パラリンピック
「うまい棒」値上げが示すコモディティ高騰【経済記者コラム】,https://www3.nhk.or.jp//news/html/20220204/k10013464261000.html,2月6日 0時51分,コラム 株・円相場
オリンピック【まとめ】5日の競技結果・動き,https://www3.nhk.or.jp//news/html/20220205/k10013468011000.html,2月6日 0時28分,北京 冬季オリンピック・パラリンピック
オリンピック 大会2日目 堀島行真が銅 今大会日本勢初メダル,https://www3.nhk.or.jp//news/html/20220206/k10013469251000.html,2月6日 0時09分,北京 冬季オリンピック・パラリンピック
カーリングで「米中対決」 両国の政治対立よそに交流の一幕も,https://www3.nhk.or.jp//news/html/20220206/k10013469241000.html,2月6日 0時04分,カーリング
日本海側中心に平地でも大雪のおそれ 落雪や雪崩にも注意を,https://www3.nhk.or.jp//news/html/20220205/k10013468851000.html,2月5日 23時39分,気象
アイスホッケー女子【試合詳細】日本が2連勝 6得点は五輪最多,https://www3.nhk.or.jp//news/html/20220205/k10013468251000.html,2月5日 23時34分,北京 冬季オリンピック・パラリンピック
オリンピック男子モーグル 堀島行真が銅 今大会日本勢初メダル,https://www3.nhk.or.jp//news/html/20220205/k10013468091000.html,2月5日 23時23分,スキー（フリースタイル）
スケート ショートトラック 菊池 吉永が準々決勝進出,https://www3.nhk.or.jp//news/html/20220205/k10013469221000.html,2月5日 23時04分,スケート ショートトラック
スキージャンプ【詳細】高梨沙羅は4位 100mの大ジャンプも…,https://www3.nhk.or.jp//news/html/20220205/k10013469041000.html,2月5日 22時51分,スキージャンプ
スケート ショートトラック混合リレー 日本は準決勝進出ならず,https://www3.nhk.or.jp//news/html/20220205/k10013469211000.html,2月5日 22時45分,スケート ショートトラック
東京都 新型コロナ 2万1122人感染確認 過去2番目の多さ,https://www3.nhk.or.jp//news/html/20220205/k10013468381000.html,2月5日 22時35分,新型コロナ 国内感染者数
スキー男子モーグル 堀島が決勝進出 原 杉本は決勝進出ならず,https://www3.nhk.or.jp//news/html/20220205/k10013469191000.html,2月5日 22時23分,スキー（フリースタイル）
スケートショートトラック 吉永が準々決勝進出 宮田は予選敗退,https://www3.nhk.or.jp//news/html/20220205/k10013469201000.html,2月5日 22時04分,スケート ショートトラック
北京五輪歓迎レセプション 習主席「国際社会はもっと団結を」,https://www3.nhk.or.jp//news/html/20220205/k10013469171000.html,2月5日 21時56分,中国
