title,link,time,category
佐賀 武雄 浸水被害の家具など 災害廃棄物の受け入れ開始,https://www3.nhk.or.jp//news/html/20210816/k10013205531000.html,8月16日 14時07分,大雨（8月）
九州で非常に激しい雨 西～東日本 災害危険 急に高まるおそれ,https://www3.nhk.or.jp//news/html/20210816/k10013205441000.html,8月16日 14時04分,大雨（8月）
全国高校野球 第2試合 専大松戸がセンバツ準優勝の明豊に勝利,https://www3.nhk.or.jp//news/html/20210816/k10013205541000.html,8月16日 13時55分,高校野球
香川県 新型コロナ 1人死亡 新たに57人感染確認,https://www3.nhk.or.jp//news/html/20210816/k10013205581000.html,8月16日 13時34分,新型コロナ 国内感染者数
高知県 新型コロナ 新たに20人感染確認 県内計2335人,https://www3.nhk.or.jp//news/html/20210816/k10013205571000.html,8月16日 13時27分,新型コロナ 国内感染者数
徳島県 新型コロナ 新たに19人感染確認 県内計1961人,https://www3.nhk.or.jp//news/html/20210816/k10013205561000.html,8月16日 13時25分,新型コロナ 国内感染者数
全国高校野球 第1試合 長崎商業が69年ぶり甲子園で勝利,https://www3.nhk.or.jp//news/html/20210816/k10013205231000.html,8月16日 13時07分,高校野球
大雨被害 6人死亡 4人行方不明 6人けが （16日11:30時点）,https://www3.nhk.or.jp//news/html/20210816/k10013205451000.html,8月16日 13時06分,大雨（8月）
パラ関連で海外から来日したメディア関係者など新たに7人感染,https://www3.nhk.or.jp//news/html/20210816/k10013205501000.html,8月16日 13時04分,新型コロナウイルス
岡山県「まん延防止等重点措置」適用を 政府に要請 感染急拡大,https://www3.nhk.or.jp//news/html/20210816/k10013205521000.html,8月16日 12時59分,新型コロナウイルス
東京都内 高齢者の感染 人数再び増加 重症患者も倍以上に,https://www3.nhk.or.jp//news/html/20210816/k10013205491000.html,8月16日 12時54分,新型コロナウイルス
東京都内 自宅療養者2万人超続く 療養場所調整中は過去最多に,https://www3.nhk.or.jp//news/html/20210816/k10013205481000.html,8月16日 12時34分,新型コロナウイルス
再び大雨予想 気象庁 厳重警戒呼びかけ「明るいうちに避難を」,https://www3.nhk.or.jp//news/html/20210816/k10013205511000.html,8月16日 12時31分,大雨（8月）
長崎 雲仙市 行方不明2人の捜索続く 土砂崩れ発生から3日経過,https://www3.nhk.or.jp//news/html/20210816/k10013205431000.html,8月16日 12時25分,大雨（8月）
大雨 奈良井宿に大量の土砂や水が流入 撤去追われる 長野 塩尻,https://www3.nhk.or.jp//news/html/20210816/k10013205461000.html,8月16日 12時23分,大雨（8月）
福井県 新型コロナ 新たに17人感染確認 県内計2031人,https://www3.nhk.or.jp//news/html/20210816/k10013205471000.html,8月16日 12時17分,新型コロナ 国内感染者数
広島 あすからの大雨に備えて避難所生活続ける人も,https://www3.nhk.or.jp//news/html/20210816/k10013205401000.html,8月16日 12時15分,大雨（8月）
株価 500円以上の値下がり 感染拡大と中国経済減速懸念が影響,https://www3.nhk.or.jp//news/html/20210816/k10013205201000.html,8月16日 12時11分,株価・為替
米韓合同軍事演習きょうから 規模縮小も北朝鮮は強く反発,https://www3.nhk.or.jp//news/html/20210816/k10013204771000.html,8月16日 12時10分,北朝鮮情勢
清掃事務所で16人感染 不燃ゴミの収集取りやめ 東京 台東区,https://www3.nhk.or.jp//news/html/20210816/k10013205391000.html,8月16日 12時08分,新型コロナウイルス
