title,link,time,category
トランプ次期大統領の就任式 厳しい寒さ予想で40年ぶり屋内に,https://www3.nhk.or.jp//news/html/20250118/k10014696721000.html,1月18日 14時05分,トランプ次期大統領
佐々木朗希 ドジャースと契約合意 “契約金は約10億円”,https://www3.nhk.or.jp//news/html/20250118/k10014696741000.html,1月18日 13時40分,#佐々木朗希
韓国ユン大統領 裁判所の逮捕状審査出席へ “捜査不当”主張か,https://www3.nhk.or.jp//news/html/20250118/k10014696851000.html,1月18日 13時10分,ユン・ソンニョル（尹錫悦）大統領
広島 江田島 海自射撃場の山林火災 丸一日以上たつも延焼続く,https://www3.nhk.or.jp//news/html/20250118/k10014696731000.html,1月18日 12時41分,広島県
アメリカ財務省 債務不履行回避で21日から資金繰りの特別措置,https://www3.nhk.or.jp//news/html/20250118/k10014696881000.html,1月18日 12時30分,アメリカ
スキマバイトやスポットワーク 困りごとや疑問 無料電話相談会,https://www3.nhk.or.jp//news/html/20250118/k10014696871000.html,1月18日 12時08分,働き方改革
大学入学共通テスト 1日目始まる 出題教科や科目が再編,https://www3.nhk.or.jp//news/html/20250118/k10014696801000.html,1月18日 11時45分,教育
群馬 伊勢崎 住宅で強盗 男3人が押し入り現金など奪い逃走,https://www3.nhk.or.jp//news/html/20250118/k10014696861000.html,1月18日 11時39分,群馬県
千葉 柏 夫婦殺害 容疑者の車から刃物押収 殺人事件にも関与か,https://www3.nhk.or.jp//news/html/20250118/k10014696821000.html,1月18日 11時31分,千葉県
大相撲初場所 平幕 狼雅 きょうから再休場 右太もものけがで,https://www3.nhk.or.jp//news/html/20250118/k10014696791000.html,1月18日 11時19分,#大相撲
立民 政府の新年度予算案 新たな作業部会設け内容検証へ,https://www3.nhk.or.jp//news/html/20250118/k10014696841000.html,1月18日 11時16分,来年度（新年度）予算
大阪 天王寺区 タワーマンションの1室で火事 70代の夫婦死亡,https://www3.nhk.or.jp//news/html/20250118/k10014696811000.html,1月18日 10時58分,大阪府
ガザ地区停戦合意 イスラエル政府が正式に承認と発表,https://www3.nhk.or.jp//news/html/20250118/k10014696751000.html,1月18日 10時54分,イスラエル
国の調査 「悪い方向」向かう分野 物価・景気が上位 防災は増,https://www3.nhk.or.jp//news/html/20250118/k10014696781000.html,1月18日 10時22分,
住宅火災で火元の住宅に住む女性1人と連絡取れず 千葉 習志野,https://www3.nhk.or.jp//news/html/20250118/k10014696761000.html,1月18日 10時00分,千葉県
LA山火事 ドジャースなど12のスポーツチームが支援 吉田麻也も,https://www3.nhk.or.jp//news/html/20250118/k10014696771000.html,1月18日 9時58分,アメリカ
ガザ地区停戦合意 ハマス幹部 “合意順守”人質解放の考え強調,https://www3.nhk.or.jp//news/html/20250118/k10014696591000.html,1月18日 8時17分,イスラエル・パレスチナ
ロシアとイラン 経済や安保分野の協力を盛り込んだ条約に署名,https://www3.nhk.or.jp//news/html/20250118/k10014696561000.html,1月18日 7時05分,ロシア
川や湖などの生物 24％が絶滅危機 日本固有の淡水魚の約40％も,https://www3.nhk.or.jp//news/html/20250118/k10014696621000.html,1月18日 7時04分,環境
TikTok側の訴え 米連邦最高裁が退ける アプリ利用が実質禁止に,https://www3.nhk.or.jp//news/html/20250118/k10014696671000.html,1月18日 7時01分,アメリカ
