title,link,time,category
衆院長崎4区と参院徳島高知選挙区の2補選 投票進む,https://www3.nhk.or.jp//news/html/20231022/k10014233321000.html,10月22日 11時54分,選挙
【随時更新】双方の死者5700人超 物資搬入も“足りず”,https://www3.nhk.or.jp//news/html/20231022/k10014233161000.html,10月22日 11時49分,イスラエル・パレスチナ
栃木 女子高校生遺体遺棄事件 女子高校生のひざなどに複数の傷,https://www3.nhk.or.jp//news/html/20231022/k10014233301000.html,10月22日 11時41分,事件
イスラエル元高官 “政府 侵攻開始の時期を冷静に見極め”,https://www3.nhk.or.jp//news/html/20231022/k10014233311000.html,10月22日 11時39分,イスラエル・パレスチナ
フィギュアGPシリーズ 女子シングル前半SP 18歳の千葉が5位に,https://www3.nhk.or.jp//news/html/20231022/k10014233281000.html,10月22日 11時10分,フィギュアスケート
スノーボードビッグエア W杯開幕戦 男子は日本勢が表彰台独占,https://www3.nhk.or.jp//news/html/20231022/k10014233261000.html,10月22日 10時56分,スノーボード
ラグビーW杯 南アフリカ 決勝進出 イングランドに逆転勝ち,https://www3.nhk.or.jp//news/html/20231022/k10014232521000.html,10月22日 10時47分,ラグビーW杯 2023
イスラエルとハマス　それぞれの軍事力は？,https://www3.nhk.or.jp//news/html/20231022/k10014233271000.html,10月22日 10時41分,イスラエル・パレスチナ
欧州サッカー フライブルク堂安 今季初ゴール 浅野 久保ら活躍,https://www3.nhk.or.jp//news/html/20231022/k10014233251000.html,10月22日 10時39分,サッカー（ヨーロッパ）
軽乗用車と普通乗用車が衝突 70代の夫婦2人死亡 秋田 由利本荘,https://www3.nhk.or.jp//news/html/20231022/k10014233231000.html,10月22日 8時59分,事故
衆院長崎4区と参院徳島高知選挙区の2補選 投票始まる,https://www3.nhk.or.jp//news/html/20231022/k10014233111000.html,10月22日 7時22分,選挙
栃木 車から遺体 発見のスーツケースは空 容疑者が用意か,https://www3.nhk.or.jp//news/html/20231022/k10014233181000.html,10月22日 7時10分,事件
【随時更新】ロシア ウクライナに軍事侵攻（22日の動き）,https://www3.nhk.or.jp//news/html/20231022/k10014214401000.html,10月22日 6時58分,ウクライナ情勢
ODA「無償資金協力」フィジーの3事業が適切に実施されず,https://www3.nhk.or.jp//news/html/20231022/k10014233121000.html,10月22日 6時31分,外務省
ウクライナ軍 南部ドニプロ川東岸地域で大規模な作戦を展開か,https://www3.nhk.or.jp//news/html/20231022/k10014233221000.html,10月22日 6時19分,ロシア
アルゼンチン大統領選 右派の経済学者が支持伸ばす 接戦予想,https://www3.nhk.or.jp//news/html/20231022/k10014231531000.html,10月22日 5時55分,アルゼンチン
“伝説的サッカー選手” ボビー・チャールトンさん死去 86歳,https://www3.nhk.or.jp//news/html/20231022/k10014233241000.html,10月22日 5時42分,訃報
350万年前の地層から見つかった化石のチョウ 新種と判明 群馬,https://www3.nhk.or.jp//news/html/20231022/k10014233131000.html,10月22日 4時53分,群馬県
アルツハイマー病 リスク高める遺伝子のメカニズムを解明,https://www3.nhk.or.jp//news/html/20231022/k10014232971000.html,10月22日 4時40分,医療・健康
上川外相“人道状況悪化食い止めが重要”各国の協力を呼びかけ,https://www3.nhk.or.jp//news/html/20231021/k10014233101000.html,10月22日 3時15分,イスラエル・パレスチナ
