title,link,time,category
名護市長選 現職の渡具知氏と新人の岸本氏が競り合う 出口調査,https://www3.nhk.or.jp//news/html/20220123/k10013445601000.html,1月23日 20時01分,選挙
ブレイキン全日本選手権 男子 半井が連覇 女子 福島が初優勝,https://www3.nhk.or.jp//news/html/20220123/k10013446251000.html,1月23日 19時30分,ブレイキン
競泳 大橋悠依 200m個人メドレーで優勝,https://www3.nhk.or.jp//news/html/20220123/k10013446291000.html,1月23日 19時29分,競泳
アメリカの新駐日大使 ラーム・エマニュエル氏が日本着任,https://www3.nhk.or.jp//news/html/20220123/k10013446321000.html,1月23日 19時28分,米 バイデン大統領
大相撲初場所 関脇 御嶽海が3回目の優勝 大関昇進が確実に,https://www3.nhk.or.jp//news/html/20220123/k10013445761000.html,1月23日 19時28分,大相撲
吉田に続き冨安も W杯最終予選 けがで不参加 日本代表,https://www3.nhk.or.jp//news/html/20220123/k10013446311000.html,1月23日 19時16分,サッカーＷ杯（男子）
東京都 新型コロナ 新たに9468人の感染確認 1週間前の2倍超,https://www3.nhk.or.jp//news/html/20220123/k10013445971000.html,1月23日 19時15分,新型コロナ 国内感染者数
ワクチン接種証明 提示義務化などに抗議 各国でデモ相次ぐ,https://www3.nhk.or.jp//news/html/20220123/k10013446001000.html,1月23日 19時06分,新型コロナ ワクチン（世界）
大相撲初場所 御嶽海に技能賞 殊勲賞に阿炎 敢闘賞に琴ノ若,https://www3.nhk.or.jp//news/html/20220123/k10013446241000.html,1月23日 19時05分,大相撲
大相撲初場所 千秋楽 関脇 御嶽海が13勝2敗で3回目の優勝,https://www3.nhk.or.jp//news/html/20220123/k10013446301000.html,1月23日 19時04分,大相撲
沖縄 名護市長選 投票は午後8時まで 投票率22.54％（午後6時）,https://www3.nhk.or.jp//news/html/20220123/k10013446271000.html,1月23日 19時00分,選挙
石川県 「まん延防止等重点措置」適用要請 県内全域対象の方針,https://www3.nhk.or.jp//news/html/20220123/k10013446281000.html,1月23日 18時58分,新型コロナウイルス
福岡県 新型コロナ 新たに2646人感染確認 5日連続で2000人超,https://www3.nhk.or.jp//news/html/20220123/k10013446261000.html,1月23日 18時49分,新型コロナ 国内感染者数
【国内感染】新型コロナ 2日連続で5万人超える(23日18:20),https://www3.nhk.or.jp//news/html/20220123/k10013446051000.html,1月23日 18時47分,新型コロナ 国内感染者数
立民 西村幹事長が新型コロナウイルスに感染,https://www3.nhk.or.jp//news/html/20220123/k10013446231000.html,1月23日 18時29分,新型コロナウイルス
衛星が噴火後の波の変動捉える トンガの海底火山噴火,https://www3.nhk.or.jp//news/html/20220123/k10013445941000.html,1月23日 18時27分,
将棋「王将戦」藤井聡太四冠が2勝目 渡辺明三冠に連勝,https://www3.nhk.or.jp//news/html/20220123/k10013446151000.html,1月23日 18時23分,藤井四冠
埼玉県 新型コロナ 新たに2525人感染確認 5日連続で2000人超,https://www3.nhk.or.jp//news/html/20220123/k10013446221000.html,1月23日 18時20分,新型コロナ 国内感染者数
「ビオトープ」の取り組み競うコンクール 秋篠宮さまも出席,https://www3.nhk.or.jp//news/html/20220123/k10013446031000.html,1月23日 18時17分,皇室
噴火被害のトンガ 各国の支援本格化 コロナ対策との両立課題,https://www3.nhk.or.jp//news/html/20220123/k10013445991000.html,1月23日 18時16分,
