title,link,time,category
【随時更新】ロシア ウクライナに軍事侵攻（9月13日の動き）,https://www3.nhk.or.jp//news/html/20240913/k10014554821000.html,9月13日 6時23分,ウクライナ情勢
トランプ氏「次のテレビ討論会応じない」 ハリス氏は反論,https://www3.nhk.or.jp//news/html/20240913/k10014580711000.html,9月13日 6時17分,アメリカ大統領選
立民代表選 候補者4人が討論参加 党勢拡大など主張展開,https://www3.nhk.or.jp//news/html/20240913/k10014580421000.html,9月13日 6時16分,立憲民主党代表選
五輪・パラの旗が2028年開催地ロサンゼルスの市役所に到着,https://www3.nhk.or.jp//news/html/20240913/k10014580721000.html,9月13日 5時58分,#オリンピック・パラリンピック
自民総裁選 過去最多の9人が立候補 立会演説会で決意述べる,https://www3.nhk.or.jp//news/html/20240913/k10014580411000.html,9月13日 5時57分,自民党総裁選
日米豪印クアッド首脳会合 21日にバイデン大統領の地元で開催,https://www3.nhk.or.jp//news/html/20240913/k10014580701000.html,9月13日 5時56分,アメリカ
大分 別府 ひき逃げ事件の容疑者「重要指名手配」継続を決定,https://www3.nhk.or.jp//news/html/20240913/k10014580581000.html,9月13日 5時02分,事件
ゼレンスキー大統領 越境攻撃に対するロシアの反撃開始認める,https://www3.nhk.or.jp//news/html/20240913/k10014580691000.html,9月13日 4時54分,ウクライナ情勢
ガザ地区 ポリオワクチン1回目の接種率「目標にほぼ到達」WHO,https://www3.nhk.or.jp//news/html/20240913/k10014580671000.html,9月13日 4時48分,イスラエル・パレスチナ
大相撲秋場所6日目の見どころ 勝ちっぱなし大の里 正代と対戦,https://www3.nhk.or.jp//news/html/20240913/k10014580601000.html,9月13日 2時57分,#大相撲
プーチン大統領 BRICS首脳会議に中国 インド イラン首脳招待へ,https://www3.nhk.or.jp//news/html/20240913/k10014580661000.html,9月13日 2時42分,ロシア
“ロシア軍の哨戒機2機 日本列島1周するように飛行” 防衛省,https://www3.nhk.or.jp//news/html/20240913/k10014580531000.html,9月13日 2時36分,防衛省
トランプ氏「ペット食べている」発言にハイチ政府が深い懸念,https://www3.nhk.or.jp//news/html/20240913/k10014580651000.html,9月13日 2時14分,アメリカ大統領選
欧州中央銀行 0.25％追加利下げ 金利引き下げは2会合ぶり,https://www3.nhk.or.jp//news/html/20240912/k10014580591000.html,9月13日 0時45分,金融
オリパラなど経験アスリート 教員採用しやすい取り組み 文科省,https://www3.nhk.or.jp//news/html/20240913/k10014580441000.html,9月13日 0時27分,#オリンピック・パラリンピック
米実業家ら 民間人初の「船外活動」高度700キロ付近の宇宙空間,https://www3.nhk.or.jp//news/html/20240912/k10014580571000.html,9月13日 0時11分,宇宙
自民総裁選 候補者が始動 必勝祈願や出陣式 告示日の動き,https://www3.nhk.or.jp//news/html/20240912/k10014579961000.html,9月13日 0時04分,自民党総裁選
【プロ野球結果】セ首位巨人が3連勝 広島とのゲーム差を4に,https://www3.nhk.or.jp//news/html/20240912/k10014580641000.html,9月12日 23時22分,#プロ野球
太陽光発電業者の実質的経営者を逮捕 1億円余脱税か 大阪地検,https://www3.nhk.or.jp//news/html/20240912/k10014580631000.html,9月12日 22時47分,事件
西武 今季85敗 前身の西鉄など含め1950年創設以来球団ワースト,https://www3.nhk.or.jp//news/html/20240912/k10014580611000.html,9月12日 22時38分,#プロ野球
