title,link,time,category
北朝鮮 最高人民会議開催へ キム総書記 米韓との関係言及か,https://www3.nhk.or.jp//news/html/20220206/k10013469101000.html,2月6日 6時25分,北朝鮮情勢
「存在感示すため論戦力の向上を」立民 若手議員に講習会,https://www3.nhk.or.jp//news/html/20220206/k10013469081000.html,2月6日 6時14分,
日本海側を中心に平地でも大雪のおそれ 落雪や雪崩にも注意,https://www3.nhk.or.jp//news/html/20220206/k10013469091000.html,2月6日 6時09分,気象
トルコ大統領が新型コロナ感染 ウクライナ情勢にも影響か,https://www3.nhk.or.jp//news/html/20220206/k10013469261000.html,2月6日 5時51分,ロシア
英 エリザベス女王きょう即位70年 国民の支持は世代間で違いも,https://www3.nhk.or.jp//news/html/20220206/k10013469121000.html,2月6日 5時35分,イギリス
西武HD プリンスホテルなど30施設売却へ 外資系に1500億円程度,https://www3.nhk.or.jp//news/html/20220206/k10013469231000.html,2月6日 5時16分,
15分時短のパート公務員 自治体の4割に 総務省が見直し求める,https://www3.nhk.or.jp//news/html/20220206/k10013469071000.html,2月6日 4時56分,
北京オリンピック 2月6日（日）の予定,https://www3.nhk.or.jp//news/html/20220206/k10013458661000.html,2月6日 4時52分,北京 冬季オリンピック・パラリンピック
スキージャンプ 高梨沙羅 メダル届かず 要因は「飛型点」,https://www3.nhk.or.jp//news/html/20220206/k10013469271000.html,2月6日 4時49分,スキージャンプ
ローザンヌ国際バレエコンクール 田中月乃さんが2位入賞,https://www3.nhk.or.jp//news/html/20220206/k10013469281000.html,2月6日 4時24分,
北京オリンピック 堀島行真選手の銅メダルに日本の技術,https://www3.nhk.or.jp//news/html/20220206/k10013466831000.html,2月6日 1時27分,北京 冬季オリンピック・パラリンピック
「うまい棒」値上げが示すコモディティ高騰【経済記者コラム】,https://www3.nhk.or.jp//news/html/20220204/k10013464261000.html,2月6日 0時51分,コラム 株・円相場
オリンピック【まとめ】5日の競技結果・動き,https://www3.nhk.or.jp//news/html/20220205/k10013468011000.html,2月6日 0時28分,北京 冬季オリンピック・パラリンピック
オリンピック 大会2日目 堀島行真が銅 今大会日本勢初メダル,https://www3.nhk.or.jp//news/html/20220206/k10013469251000.html,2月6日 0時09分,北京 冬季オリンピック・パラリンピック
カーリングで「米中対決」 両国の政治対立よそに交流の一幕も,https://www3.nhk.or.jp//news/html/20220206/k10013469241000.html,2月6日 0時04分,カーリング
日本海側中心に平地でも大雪のおそれ 落雪や雪崩にも注意を,https://www3.nhk.or.jp//news/html/20220205/k10013468851000.html,2月5日 23時39分,気象
アイスホッケー女子【試合詳細】日本が2連勝 6得点は五輪最多,https://www3.nhk.or.jp//news/html/20220205/k10013468251000.html,2月5日 23時34分,北京 冬季オリンピック・パラリンピック
オリンピック男子モーグル 堀島行真が銅 今大会日本勢初メダル,https://www3.nhk.or.jp//news/html/20220205/k10013468091000.html,2月5日 23時23分,スキー（フリースタイル）
スケート ショートトラック 菊池 吉永が準々決勝進出,https://www3.nhk.or.jp//news/html/20220205/k10013469221000.html,2月5日 23時04分,スケート ショートトラック
スキージャンプ【詳細】高梨沙羅は4位 100mの大ジャンプも…,https://www3.nhk.or.jp//news/html/20220205/k10013469041000.html,2月5日 22時51分,スキージャンプ
