title,link,time,category
バドミントン 混合ダブルス “ワタガシ”ペア 準決勝進出 五輪,https://www3.nhk.or.jp//news/html/20240801/k10014532191000.html,8月1日 7時08分,#バドミントン
パリオリンピック メダルランキング【7月31日】,https://www3.nhk.or.jp//news/html/20240801/k10014532181000.html,8月1日 7時05分,#パリオリンピック
競泳 鈴木聡美 女子200m平泳ぎで決勝進出 パリ五輪,https://www3.nhk.or.jp//news/html/20240731/k10014531411000.html,8月1日 6時58分,#競泳
競泳 男子200m平泳ぎ 花車優 渡辺一平 メダル届かず パリ五輪,https://www3.nhk.or.jp//news/html/20240801/k10014532141000.html,8月1日 6時55分,#競泳
競泳 男子200m背泳ぎ 竹原秀一 決勝進出ならず パリ五輪,https://www3.nhk.or.jp//news/html/20240731/k10014531531000.html,8月1日 6時49分,#競泳
【随時更新】イスラエル・パレスチナ 中東情勢（8月1日）,https://www3.nhk.or.jp//news/html/20240801/k10014532131000.html,8月1日 6時46分,イスラエル・パレスチナ
ハマス最高幹部殺害 イラン最高指導者 報復行う考え示す,https://www3.nhk.or.jp//news/html/20240801/k10014531761000.html,8月1日 6時45分,イスラエル・パレスチナ
【詳細】米FRB 政策金利据え置き “9月会合で利下げの可能性”,https://www3.nhk.or.jp//news/html/20240801/k10014531631000.html,8月1日 6時42分,金融
近畿 東海などで38度以上の危険な暑さ予想 熱中症に警戒,https://www3.nhk.or.jp//news/html/20240801/k10014531701000.html,8月1日 6時40分,気象
パリオリンピック予定 8/1～2（競技・放送・配信予定）,https://www3.nhk.or.jp//news/html/20240801/k10014532101000.html,8月1日 6時38分,#パリオリンピック
卓球 女子シングルス 早田ひな 準々決勝に進出 パリ五輪,https://www3.nhk.or.jp//news/html/20240731/k10014531691000.html,8月1日 6時27分,#卓球
サッカー女子 なでしこ 2大会連続の準々決勝進出 パリ五輪,https://www3.nhk.or.jp//news/html/20240801/k10014532081000.html,8月1日 6時24分,#サッカー
卓球 男子シングルス 張本智和が準々決勝へ パリオリンピック,https://www3.nhk.or.jp//news/html/20240731/k10014531621000.html,8月1日 6時14分,#卓球
日銀 利上げ進め経済の好循環 実現できるのか 難しいかじ取り,https://www3.nhk.or.jp//news/html/20240801/k10014531651000.html,8月1日 5時58分,日本銀行（日銀）
体操 男子個人総合 岡慎之助が金メダル パリ五輪【詳しく】,https://www3.nhk.or.jp//news/html/20240731/k10014531891000.html,8月1日 5時56分,#体操
柔道 女子70キロ級 新添左季 敗者復活戦で敗れ7位 パリ五輪,https://www3.nhk.or.jp//news/html/20240731/k10014531431000.html,8月1日 5時47分,#柔道
円相場(NY) 一時149円台後半まで値上がり FRB会見を受け,https://www3.nhk.or.jp//news/html/20240801/k10014532171000.html,8月1日 5時45分,株価・為替
パリオリンピック【結果】7/31～8/1タイムライン,https://www3.nhk.or.jp//news/html/20240731/k10014531251000.html,8月1日 5時43分,#パリオリンピック
柔道 村尾三四郎が銀メダル 男子90キロ級 パリ五輪,https://www3.nhk.or.jp//news/html/20240801/k10014532021000.html,8月1日 5時41分,#柔道
“アメリカ製F16戦闘機 ウクライナに初めて到着” 米メディア,https://www3.nhk.or.jp//news/html/20240801/k10014532161000.html,8月1日 5時37分,ウクライナ情勢
