title,link,time,category
陸上女子1500m準決勝 田中希実 2組の11着 決勝進めず パリ五輪,https://www3.nhk.or.jp//news/html/20240809/k10014543371000.html,8月9日 4時06分,#陸上競技
男女混合が20種目に ジェンダー平等へと向かうパリ五輪,https://www3.nhk.or.jp//news/html/20240809/k10014543291000.html,8月9日 4時02分,#パリオリンピック
「南海トラフ地震臨時情報」を受け企業も対応進める,https://www3.nhk.or.jp//news/html/20240809/k10014543121000.html,8月9日 3時48分,南海トラフ地震臨時情報
「巨大地震注意」政府 発生に備え態勢構築に万全期す,https://www3.nhk.or.jp//news/html/20240809/k10014543101000.html,8月9日 3時42分,南海トラフ地震臨時情報
パリオリンピック【速報中】8/8～8/9 タイムライン,https://www3.nhk.or.jp//news/html/20240808/k10014542141000.html,8月9日 3時39分,#パリオリンピック
「南海トラフ地震臨時情報」（巨大地震注意）とは？解説動画も,https://www3.nhk.or.jp//news/html/20240808/k10014542291000.html,8月9日 3時34分,南海トラフ地震臨時情報
レスリング女子57キロ級 櫻井つぐみ 決勝進出 パリ五輪,https://www3.nhk.or.jp//news/html/20240808/k10014542771000.html,8月9日 3時08分,#レスリング
自転車女子ケイリン 太田 9位 佐藤 準々決勝敗退 パリ五輪,https://www3.nhk.or.jp//news/html/20240809/k10014543321000.html,8月9日 2時34分,#自転車競技
ゴルフ女子 山下美夢有が6位タイ 笹生優花は47位 パリ五輪,https://www3.nhk.or.jp//news/html/20240809/k10014543351000.html,8月9日 2時27分,#ゴルフ
レスリング男子フリー86キロ級 石黒隼士は準々決勝で敗れる,https://www3.nhk.or.jp//news/html/20240808/k10014542851000.html,8月9日 2時11分,#レスリング
レスリング男子フリー57キロ級 樋口黎 決勝へ パリ五輪,https://www3.nhk.or.jp//news/html/20240808/k10014542731000.html,8月9日 2時05分,#レスリング
第一生命から出向の社員 7万2000人分の契約情報を漏えい,https://www3.nhk.or.jp//news/html/20240809/k10014543341000.html,8月9日 2時00分,東京都
開催国フランス すでに史上最多のメダル数に パリオリンピック,https://www3.nhk.or.jp//news/html/20240809/k10014543331000.html,8月9日 1時55分,#パリオリンピック
近代五種 競技開始 男子は佐藤が6位 女子は内田が30位につける,https://www3.nhk.or.jp//news/html/20240809/k10014543311000.html,8月9日 1時14分,#近代五種
高校野球 夏の甲子園 大会3日目の見どころ,https://www3.nhk.or.jp//news/html/20240809/k10014542011000.html,8月9日 0時57分,#夏の全国高校野球
NY株式市場 ダウ平均株価一時500ドル超の大幅値上がり,https://www3.nhk.or.jp//news/html/20240809/k10014543301000.html,8月9日 0時51分,株価・為替
【速報中】各地の対応は 南海トラフ地震臨時情報,https://www3.nhk.or.jp//news/html/20240808/k10014542951000.html,8月9日 0時37分,南海トラフ地震臨時情報
東海道新幹線など一部で遅れ 南海トラフ地震臨時情報の発表で,https://www3.nhk.or.jp//news/html/20240808/k10014543031000.html,8月9日 0時21分,南海トラフ地震臨時情報
スポーツクライミング女子 準決勝敗退の野中生萌“成長の3年”,https://www3.nhk.or.jp//news/html/20240809/k10014543161000.html,8月9日 0時12分,#スポーツクライミング
【プロ野球結果】首位ソフトバンクがロッテに快勝 M34に減らす,https://www3.nhk.or.jp//news/html/20240808/k10014543281000.html,8月8日 23時54分,#プロ野球
