title,link,time,category
最も聴かれ、歌われた曲 YOASOBI「アイドル」2年連続で1位,https://www3.nhk.or.jp//news/html/20250516/k10014807331000.html,5月16日 14時34分,音楽
新ローマ教皇の就任祝うミサに出席へ 自民 麻生氏が羽田を出発,https://www3.nhk.or.jp//news/html/20250516/k10014807351000.html,5月16日 14時29分,ローマ教皇
日韓 一部空港に双方の国民専用レーン設置へ 国交正常化60年で,https://www3.nhk.or.jp//news/html/20250516/k10014807561000.html,5月16日 14時26分,日韓関係
適正な価格転嫁を促す改正下請け法 参議院本会議で可決・成立,https://www3.nhk.or.jp//news/html/20250516/k10014807581000.html,5月16日 14時21分,参議院
長崎 対馬 韓国から13年ぶりに返還された仏像の特別公開始まる,https://www3.nhk.or.jp//news/html/20250516/k10014807541000.html,5月16日 14時18分,長崎県
埼玉 八潮 道路陥没 トラックの運転席部分 引き上げられる,https://www3.nhk.or.jp//news/html/20250516/k10014807401000.html,5月16日 14時16分,事故
元衆院議員長男の会社に利益 全国の空港ビル会社に報告要請へ,https://www3.nhk.or.jp//news/html/20250516/k10014807551000.html,5月16日 13時43分,航空
韓国 大統領選の世論調査 最大野党のイ候補支持が51％,https://www3.nhk.or.jp//news/html/20250516/k10014807511000.html,5月16日 13時38分,韓国
長崎 松浦 列車と軽トラック衝突 運転手の77歳男性が死亡,https://www3.nhk.or.jp//news/html/20250516/k10014807391000.html,5月16日 13時35分,鉄道
自民 太田参院議員 資金提供持ちかけたと報じた内容を否定,https://www3.nhk.or.jp//news/html/20250516/k10014807521000.html,5月16日 13時15分,選挙
「能動的サイバー防御」導入の法律 参院本会議で可決・成立,https://www3.nhk.or.jp//news/html/20250516/k10014807531000.html,5月16日 13時12分,サイバー攻撃
刑事手続きデジタル化の改正法 参院本会議で可決・成立,https://www3.nhk.or.jp//news/html/20250516/k10014807491000.html,5月16日 13時09分,
「モペット」で信号無視 歩行者にけがさせたか 45歳容疑者逮捕,https://www3.nhk.or.jp//news/html/20250516/k10014807501000.html,5月16日 13時06分,東京都
大分 由布院駅 腐食木材が落下し客に当たる JR九州が陳謝,https://www3.nhk.or.jp//news/html/20250516/k10014807471000.html,5月16日 12時54分,大分県
ドジャース 大谷翔平 2打席連続ホームラン 今季初,https://www3.nhk.or.jp//news/html/20250516/k10014807481000.html,5月16日 12時52分,#大谷翔平
ミュゼプラチナムの元従業員ら 破産手続き開始を申し立て,https://www3.nhk.or.jp//news/html/20250516/k10014807461000.html,5月16日 12時35分,東京都
日本人戦没者の遺骨 ペリリュー島で今年度の収集作業始まる,https://www3.nhk.or.jp//news/html/20250516/k10014807441000.html,5月16日 12時26分,戦後80年
自衛隊練習機墜落 エンジンとみられるものなど 水中で見つかる,https://www3.nhk.or.jp//news/html/20250516/k10014807151000.html,5月16日 12時22分,愛知県
クリニック医師が男から暴行受けけが 男は逃走 横浜 港北区,https://www3.nhk.or.jp//news/html/20250516/k10014807431000.html,5月16日 12時22分,神奈川県
1-3月のGDP 年率換算でマイナス0.7％ マイナスは4期ぶり,https://www3.nhk.or.jp//news/html/20250516/k10014807271000.html,5月16日 12時21分,GDP
