title,link,time,category
イスラエル“米の提案受け入れるまでガザ支援物資搬入は停止”,https://www3.nhk.or.jp//news/html/20250303/k10014738001000.html,3月3日 5時31分,イスラエル・パレスチナ
新年度予算案の修正案 衆議院での審議は大詰め迎える,https://www3.nhk.or.jp//news/html/20250303/k10014737971000.html,3月3日 5時30分,国会
きょうから核兵器禁止条約第3回締約国会議 被爆者がスピーチへ,https://www3.nhk.or.jp//news/html/20250303/k10014737931000.html,3月3日 5時21分,核兵器禁止条約
岩手 大船渡 山林火災 鎮圧めど立たず 発生から5日も延焼続く,https://www3.nhk.or.jp//news/html/20250303/k10014737921000.html,3月3日 5時02分,岩手県
ノルディック世界選手権ジャンプ男子ノーマルヒル 小林陵侑7位,https://www3.nhk.or.jp//news/html/20250303/k10014738031000.html,3月3日 4時45分,スキージャンプ
ノルディックスキー世界選手権 複合で葛西姉妹が6位と7位,https://www3.nhk.or.jp//news/html/20250303/k10014737991000.html,3月3日 2時22分,スキーノルディック複合
スノーボードW杯パラレル 三木つばきが日本選手初の総合優勝,https://www3.nhk.or.jp//news/html/20250303/k10014737951000.html,3月3日 0時02分,スノーボード
スピードスケートW杯最終戦 女子団体パシュート 日本は2位,https://www3.nhk.or.jp//news/html/20250302/k10014737941000.html,3月2日 23時37分,スピードスケート
将棋「棋王戦」藤井聡太七冠 3連勝で五番勝負制し防衛 3連覇に,https://www3.nhk.or.jp//news/html/20250302/k10014737601000.html,3月2日 23時08分,将棋
山口 下関 住宅全焼 1人遺体で見つかる 高齢夫婦と連絡とれず,https://www3.nhk.or.jp//news/html/20250302/k10014737911000.html,3月2日 21時35分,山口県
きょうから再び冬の寒さに 東京23区などでも積雪のおそれ,https://www3.nhk.or.jp//news/html/20250302/k10014737791000.html,3月2日 21時03分,気象
大崎事件 弁護団 5回目再審請求へ 最高裁の再審認めない決定で,https://www3.nhk.or.jp//news/html/20250302/k10014737881000.html,3月2日 20時56分,事件
東京 葛飾区 サル目撃情報20件以上に “近寄らないよう注意”,https://www3.nhk.or.jp//news/html/20250302/k10014737901000.html,3月2日 20時47分,東京都
ゼレンスキー大統領 欧州各国の首脳らとの会合に参加へ,https://www3.nhk.or.jp//news/html/20250302/k10014737331000.html,3月2日 20時35分,ゼレンスキー大統領
スポーツクライミング リードJC 男子は安楽 女子は森が優勝,https://www3.nhk.or.jp//news/html/20250302/k10014737871000.html,3月2日 20時03分,#スポーツクライミング
【プロ野球】オープン戦 3試合の結果まとめ,https://www3.nhk.or.jp//news/html/20250302/k10014737831000.html,3月2日 19時47分,#プロ野球
岩手 八幡平 JR花輪線 安全確認で運転見合わせも順次運転再開,https://www3.nhk.or.jp//news/html/20250302/k10014737661000.html,3月2日 19時40分,鉄道
中日 高橋宏斗 自身初の開幕投手 昨季は最優秀防御率を獲得,https://www3.nhk.or.jp//news/html/20250302/k10014737841000.html,3月2日 19時29分,#プロ野球
岩手 大船渡の山林火災 発生から4日も延焼続く焼失約1800haに,https://www3.nhk.or.jp//news/html/20250302/k10014737371000.html,3月2日 19時28分,岩手県
ウクライナ系米国人支援継続訴え 米国内には“支援疲れ”も,https://www3.nhk.or.jp//news/html/20250302/k10014737581000.html,3月2日 19時27分,トランプ大統領
