title,link,time,category
石川県能登地方で震度5強の地震 津波の心配なし M5.3,https://www3.nhk.or.jp//news/html/20240106/k10014311511000.html,1月6日 6時59分,令和6年能登半島地震
ウクライナ軍 南部クリミアへ2日連続の無人機やミサイル攻撃,https://www3.nhk.or.jp//news/html/20240106/k10014311471000.html,1月6日 6時34分,ウクライナ情勢
台湾総統選まで1週間 投票日前最後の週末 大都市で3候補集会へ,https://www3.nhk.or.jp//news/html/20240106/k10014311181000.html,1月6日 6時33分,台湾
ウクライナなどがロシア非難“北朝鮮供与の弾道ミサイル発射”,https://www3.nhk.or.jp//news/html/20240106/k10014311451000.html,1月6日 6時32分,ウクライナ情勢
外相 安全保障など北欧諸国との連携強化に向け外交方針発表へ,https://www3.nhk.or.jp//news/html/20240106/k10014311151000.html,1月6日 6時30分,外務省
台湾立法委員選候補者の身柄拘束 中国から資金援助受けた疑い,https://www3.nhk.or.jp//news/html/20240106/k10014311191000.html,1月6日 6時28分,台湾
能登半島地震被災地で雨 地盤緩み少しの雨で災害おそれ 注意を,https://www3.nhk.or.jp//news/html/20240106/k10014311261000.html,1月6日 6時24分,令和6年能登半島地震
【6日随時更新】ガザ地区地上作戦と空爆続く レバノンへ攻撃も,https://www3.nhk.or.jp//news/html/20240106/k10014311421000.html,1月6日 6時23分,イスラエル・パレスチナ
羽田の管制業務“機体位置確認モニターの常時監視担当”新設へ,https://www3.nhk.or.jp//news/html/20240106/k10014311441000.html,1月6日 6時15分,羽田空港事故
政府 早ければ来週中にも能登半島地震を「激甚災害」指定へ,https://www3.nhk.or.jp//news/html/20240106/k10014311141000.html,1月6日 5時52分,令和6年能登半島地震
イスラエル軍“ガザで100以上標的攻撃” 隣国レバノンへ攻撃も,https://www3.nhk.or.jp//news/html/20240105/k10014310971000.html,1月6日 5時45分,イスラエル・パレスチナ
【6日 被災者支援の情報まとめ】年金保険料免除など対応始まる,https://www3.nhk.or.jp//news/html/20240105/k10014310041000.html,1月6日 5時42分,令和6年能登半島地震
【ライフライン 6日】断水や停電続く 石川県で3万人余が避難,https://www3.nhk.or.jp//news/html/20240106/k10014311481000.html,1月6日 5時25分,令和6年能登半島地震
【ライフライン 5日】断水や停電続く 石川県で3万人余が避難,https://www3.nhk.or.jp//news/html/20240105/k10014309691000.html,1月6日 3時21分,令和6年能登半島地震
【被害状況 5日】石川県で94人死亡 このうち輪島市で55人死亡,https://www3.nhk.or.jp//news/html/20240105/k10014309671000.html,1月6日 3時16分,令和6年能登半島地震
石川 志賀町で震度4の地震 津波の心配なし M4.6,https://www3.nhk.or.jp//news/html/20240106/k10014311461000.html,1月6日 2時15分,令和6年能登半島地震
伊藤忠商事 ビッグモーター再建時期“予定の3月末より早める”,https://www3.nhk.or.jp//news/html/20240106/k10014311301000.html,1月6日 1時49分,自動車
12月の米雇用統計 就業者数が市場予想上回る 失業率は横ばい,https://www3.nhk.or.jp//news/html/20240105/k10014311371000.html,1月6日 1時39分,雇用統計
能登半島地震 被災地支援に予備費47億4000万円支出へ,https://www3.nhk.or.jp//news/html/20240105/k10014310141000.html,1月6日 1時29分,令和6年能登半島地震
兼六園や金沢城公園も影響 文科省 学校や文化財の被害状況発表,https://www3.nhk.or.jp//news/html/20240106/k10014311111000.html,1月6日 1時02分,令和6年能登半島地震
