title,link,time,category
ローマ教皇 インドネシアで異なる宗教指導者たちと対話,https://www3.nhk.or.jp//news/html/20240906/k10014573641000.html,9月6日 4時59分,インドネシア
パリパラ ゴールボール男子 日本が金 この種目で初のメダル,https://www3.nhk.or.jp//news/html/20240906/k10014573911000.html,9月6日 4時56分,#ゴールボール
立民代表選 再選目指す泉代表 きょう立候補表明へ,https://www3.nhk.or.jp//news/html/20240906/k10014573901000.html,9月6日 4時50分,立憲民主党代表選
パリパラリンピック【速報中】9/5～9/6タイムライン,https://www3.nhk.or.jp//news/html/20240905/k10014573621000.html,9月6日 4時50分,#パリパラリンピック
千葉 船橋 男性の遺体が遺棄された事件 容疑者の車 都内で押収,https://www3.nhk.or.jp//news/html/20240906/k10014573871000.html,9月6日 4時48分,千葉県
兵庫県議会 百条委 きょう斎藤知事への2回目の証人尋問,https://www3.nhk.or.jp//news/html/20240906/k10014573141000.html,9月6日 4時44分,兵庫県
ローマの観光名所「トレビの泉」 有料化し予約制検討,https://www3.nhk.or.jp//news/html/20240906/k10014573881000.html,9月6日 4時42分,イタリア
自民総裁選 小泉氏きょう立候補表明へ 候補者最多が確実に,https://www3.nhk.or.jp//news/html/20240906/k10014573591000.html,9月6日 4時38分,自民党総裁選
独のイスラエル総領事館近くで銃撃戦 警察が男を射殺 テロか,https://www3.nhk.or.jp//news/html/20240906/k10014573941000.html,9月6日 4時36分,ドイツ
岸田首相きょう訪韓 ユン大統領と首脳会談へ 協力拡大を確認か,https://www3.nhk.or.jp//news/html/20240906/k10014573571000.html,9月6日 4時03分,ユン・ソンニョル（尹錫悦）大統領
パリパラ 小田凱人が決勝進出 車いすテニス 男子シングルス,https://www3.nhk.or.jp//news/html/20240906/k10014573931000.html,9月6日 3時40分,#車いすテニス
【プロ野球結果】巨人が広島に代わって首位に 戸郷が10勝目,https://www3.nhk.or.jp//news/html/20240906/k10014573861000.html,9月6日 2時28分,#プロ野球
パラリンピック 卓球 和田なつきが金メダル 女子シングルス,https://www3.nhk.or.jp//news/html/20240906/k10014573851000.html,9月6日 2時14分,#パラ卓球
パリパラリンピック メダル獲得 バドミントン選手ら喜び語る,https://www3.nhk.or.jp//news/html/20240906/k10014573891000.html,9月6日 2時05分,#パラバドミントン
セブン＆アイ 買収提案 “現時点で受け入れ不可”意見まとめる,https://www3.nhk.or.jp//news/html/20240905/k10014573021000.html,9月6日 1時31分,小売業
【詳細】イスラエル パレスチナ 中東情勢（9月5日）,https://www3.nhk.or.jp//news/html/20240905/k10014572481000.html,9月6日 1時26分,イスラエル・パレスチナ
パリパラ 車いすテニス女子ダブルス 上地 田中ペア 金メダル,https://www3.nhk.or.jp//news/html/20240905/k10014573781000.html,9月6日 0時58分,#車いすテニス
パリパラ 車いすラグビー 日本代表が帰国 喜びを改めて語る,https://www3.nhk.or.jp//news/html/20240905/k10014573521000.html,9月6日 0時54分,#車いすラグビー
自民総裁選へ 河野氏“規制改革 デジタル化 被選挙権18歳に”,https://www3.nhk.or.jp//news/html/20240905/k10014573431000.html,9月6日 0時25分,自民党総裁選
パラリンピック 柔道 半谷静香が銀メダル 女子48キロ級,https://www3.nhk.or.jp//news/html/20240905/k10014573811000.html,9月6日 0時20分,#パラ柔道
