title,link,time,category
「DDoS攻撃」年末以降 国内の航空会社など46の組織が標的に,https://www3.nhk.or.jp//news/html/20250112/k10014691191000.html,1月12日 5時12分,サイバー攻撃
都道府県対抗の全国女子駅伝 午後0時半スタート 京都,https://www3.nhk.or.jp//news/html/20250112/k10014691151000.html,1月12日 5時07分,#ロードレース（駅伝）
米トランプ次期大統領の中東特使 ネタニヤフ首相と会談,https://www3.nhk.or.jp//news/html/20250112/k10014691311000.html,1月12日 5時04分,イスラエル・パレスチナ
栃木県内で住宅火災相次ぎ2人死亡 宇都宮と日光,https://www3.nhk.or.jp//news/html/20250112/k10014691301000.html,1月12日 5時02分,栃木県
ロサンゼルス近郊の山火事 特別チームで行方不明者捜索本格化,https://www3.nhk.or.jp//news/html/20250112/k10014691321000.html,1月12日 5時01分,アメリカ
ウクライナ治安当局 北朝鮮兵士捕虜2人の取り調べ内容を初公表,https://www3.nhk.or.jp//news/html/20250111/k10014691251000.html,1月12日 4時36分,ゼレンスキー大統領
渋谷の商業施設から男性が落下し死亡 通行人が巻き込まれ搬送,https://www3.nhk.or.jp//news/html/20250112/k10014691271000.html,1月12日 2時00分,東京都
山梨 南アルプス 工場で機械が誤って落下 作業員の男性1人死亡,https://www3.nhk.or.jp//news/html/20250112/k10014691281000.html,1月12日 0時26分,山梨県
辰巳（たつみ）天井？どうなることしの金融市場【経済コラム】,https://www3.nhk.or.jp//news/html/20250110/k10014688101000.html,1月11日 23時58分,マーケットコラム
【詳細】ロシア ウクライナに軍事侵攻（1月11日の動き）,https://www3.nhk.or.jp//news/html/20250111/k10014685771000.html,1月11日 23時30分,ウクライナ情勢
イギリス財務相が訪中 副首相と会談 貿易や投資の拡大に合意,https://www3.nhk.or.jp//news/html/20250111/k10014691241000.html,1月11日 22時52分,イギリス
九州平地で積雪のおそれ 関東南部も雨や雪 最新予報確認を,https://www3.nhk.or.jp//news/html/20250111/k10014690411000.html,1月11日 22時38分,気象
バルト海の海底ケーブル損傷 海底からいかりを回収 関連を調査,https://www3.nhk.or.jp//news/html/20250111/k10014691211000.html,1月11日 22時16分,フィンランド
東京都「無痛分べん」費用を最大10万円助成へ 都道府県では初,https://www3.nhk.or.jp//news/html/20250111/k10014691221000.html,1月11日 20時44分,東京都
伊東沖縄・北方相 普天間基地返還後の跡地利用 計画策定を支援,https://www3.nhk.or.jp//news/html/20250111/k10014691181000.html,1月11日 20時32分,沖縄県
共産 田村委員長 参院選1人区一本化「各党の対応見極め必要」,https://www3.nhk.or.jp//news/html/20250111/k10014691161000.html,1月11日 20時23分,参議院選挙
トランプ氏 大統領への就任間近 アメリカを巡る動きは？,https://www3.nhk.or.jp//news/html/20250111/k10014690931000.html,1月11日 19時51分,トランプ次期大統領
トランプ次期大統領の特使がカタール訪問 ガザ停戦で意見交換,https://www3.nhk.or.jp//news/html/20250111/k10014691141000.html,1月11日 19時43分,イスラエル・パレスチナ
石川 輪島 能登半島地震で延期「二十歳の集い」 1年遅れで開催,https://www3.nhk.or.jp//news/html/20250111/k10014691111000.html,1月11日 19時11分,石川県
立民 野田代表 介護職員の賃金上乗せ法案 通常国会提出の考え,https://www3.nhk.or.jp//news/html/20250111/k10014691121000.html,1月11日 19時06分,国会
