title,link,time,category
ヨルダン川西岸で連日抗議デモ 治安部隊との衝突で100人超死亡,https://www3.nhk.or.jp//news/html/20231026/k10014237851000.html,10月26日 6時08分,イスラエル・パレスチナ
国連安保理 アメリカとロシアの決議案 いずれも否決される事態,https://www3.nhk.or.jp//news/html/20231026/k10014237861000.html,10月26日 6時06分,イスラエル
岸田首相 所得減税など検討指示へ 議論本格化,https://www3.nhk.or.jp//news/html/20231026/k10014237471000.html,10月26日 6時03分,税制改正
イスラエル首相が演説 地上侵攻「いつ始めるかなど言えない」,https://www3.nhk.or.jp//news/html/20231026/k10014237501000.html,10月26日 5時59分,イスラエル・パレスチナ
国民健康保険 年間保険料の上限額2万円引き上げて89万円の方針,https://www3.nhk.or.jp//news/html/20231026/k10014237781000.html,10月26日 5時53分,厚生労働省
きょうプロ野球ドラフト会議 高校生左腕や大学生好投手に注目,https://www3.nhk.or.jp//news/html/20231026/k10014237451000.html,10月26日 5時49分,ドラフト会議
成田空港内の事業所で働く人 6年前から約7000人減少,https://www3.nhk.or.jp//news/html/20231026/k10014237581000.html,10月26日 5時48分,新型コロナウイルス
上川外相 イスラエル ヨルダン訪問を検討 現地情勢見極め判断,https://www3.nhk.or.jp//news/html/20231026/k10014237791000.html,10月26日 5時32分,イスラエル・パレスチナ
大阪 岸和田 金属板下敷きの死傷事故 責任者ら3人を書類送検へ,https://www3.nhk.or.jp//news/html/20231026/k10014237561000.html,10月26日 5時29分,事故
山田文部科学政務官 女性問題で辞表提出 野党は任命責任追及へ,https://www3.nhk.or.jp//news/html/20231026/k10014237801000.html,10月26日 5時22分,
米下院 議長不在22日ぶりに解消 共和党4人目の候補 議長に選出,https://www3.nhk.or.jp//news/html/20231026/k10014237511000.html,10月26日 5時20分,アメリカ
性同一性障害 性別変更の手術要件 最高裁違憲判断 今後議論は,https://www3.nhk.or.jp//news/html/20231026/k10014237701000.html,10月26日 4時59分,憲法
中国 習主席 米カリフォルニア州知事と北京で会談,https://www3.nhk.or.jp//news/html/20231026/k10014237631000.html,10月26日 4時58分,米中対立
PFAS 有害性指摘の物質 東京都が地点追加し地下水調査へ,https://www3.nhk.or.jp//news/html/20231026/k10014237601000.html,10月26日 4時56分,東京都
グローバル・サウスなど連携強化へ 1400億円の支援策 経産省,https://www3.nhk.or.jp//news/html/20231026/k10014237481000.html,10月26日 4時26分,経済産業省
ES肝細胞移植 今年度中にも国への承認申請目指す 治験で効果,https://www3.nhk.or.jp//news/html/20231026/k10014237271000.html,10月26日 4時25分,医療・健康
きのこ採りに出かけた27歳～88歳の3人が行方不明 長野 伊那,https://www3.nhk.or.jp//news/html/20231026/k10014237841000.html,10月26日 0時47分,長野県
【25日随時更新】ガザ地区の死者の多くが子ども,https://www3.nhk.or.jp//news/html/20231025/k10014236281000.html,10月25日 23時42分,イスラエル・パレスチナ
公職選挙法違反の前川前衆院議員 来月に判決 有罪確定の見通し,https://www3.nhk.or.jp//news/html/20231025/k10014237821000.html,10月25日 23時39分,選挙
福島第一原発 汚染水処理設備で作業員5人に誤って廃液かかる,https://www3.nhk.or.jp//news/html/20231025/k10014237651000.html,10月25日 23時03分,福島第一原発
