title,link,time,category
【珠洲市 9日】分かってきたこと まだ分からないこと,https://www3.nhk.or.jp//news/html/20240109/k10014314501000.html,1月9日 18時32分,令和6年能登半島地震
立民 岡田幹事長 “自民は派閥の廃止も含めて議論すべき”,https://www3.nhk.or.jp//news/html/20240109/k10014315091000.html,1月9日 18時31分,政治資金
「大学入学共通テスト 追試験会場は金沢大に」盛山文科相,https://www3.nhk.or.jp//news/html/20240109/k10014314701000.html,1月9日 18時29分,令和6年能登半島地震
【輪島市 9日】分かってきたこと まだ分からないこと,https://www3.nhk.or.jp//news/html/20240109/k10014314461000.html,1月9日 18時29分,令和6年能登半島地震
能登半島地震で被害の地域産業 実態把握と支援策検討へ 経産省,https://www3.nhk.or.jp//news/html/20240109/k10014315171000.html,1月9日 18時25分,令和6年能登半島地震
【被害状況 9日】石川県で202人死亡 安否不明102人（14時）,https://www3.nhk.or.jp//news/html/20240109/k10014314061000.html,1月9日 18時25分,令和6年能登半島地震
八代亜紀さん死去 73歳 「舟唄」や「雨の慕情」などのヒット曲,https://www3.nhk.or.jp//news/html/20240109/k10014315201000.html,1月9日 18時23分,訃報
新潟県で震度5弱の地震（17:59）,https://www3.nhk.or.jp//news/html/20240109/k10014315161000.html,1月9日 18時19分,令和6年能登半島地震
被災地の福祉施設 “暖房使えず職員も疲弊 全国で受け入れを”,https://www3.nhk.or.jp//news/html/20240109/k10014315001000.html,1月9日 18時18分,令和6年能登半島地震
中国 “衛星を発射”と発表 台湾では「防空警報」,https://www3.nhk.or.jp//news/html/20240109/k10014315081000.html,1月9日 18時14分,核・ミサイル
能登半島 あすにかけ大気不安定 雨強まる 土砂災害など注意,https://www3.nhk.or.jp//news/html/20240109/k10014314271000.html,1月9日 18時13分,令和6年能登半島地震
【ライフライン 9日】断水・停電続く 給水・入浴支援情報,https://www3.nhk.or.jp//news/html/20240109/k10014314101000.html,1月9日 18時11分,令和6年能登半島地震
ヤマト運輸 約2万5000人との契約終了 配達員らが抗議活動,https://www3.nhk.or.jp//news/html/20240109/k10014314761000.html,1月9日 18時10分,
【放送同時提供】NHK金沢発 ライフライン情報 18:20～予定,https://www3.nhk.or.jp//news/html/20240105/k10014309981000.html,1月9日 18時09分,令和6年能登半島地震
ソニーとホンダ マイクロソフトと生成AIシステム開発 車載へ,https://www3.nhk.or.jp//news/html/20240109/k10014314941000.html,1月9日 18時00分,EV（電気自動車）
旧田中角栄元首相邸が全焼 1階の仏壇付近から出火か,https://www3.nhk.or.jp//news/html/20240109/k10014315111000.html,1月9日 17時54分,東京都
東京都 インフルと新型コロナの感染者数増加,https://www3.nhk.or.jp//news/html/20240109/k10014315011000.html,1月9日 17時52分,東京都
【9日随時更新】ガザ地区保健当局 “過去24時間で249人死亡”,https://www3.nhk.or.jp//news/html/20240109/k10014314121000.html,1月9日 17時47分,イスラエル・パレスチナ
能登半島地震 政府 予備費47億円余支出を決定 物資支援強化で,https://www3.nhk.or.jp//news/html/20240109/k10014314431000.html,1月9日 17時43分,来年度（新年度）予算
地震で車中泊続ける人に エコノミークラス症候群に近い症状も,https://www3.nhk.or.jp//news/html/20240109/k10014314981000.html,1月9日 17時39分,令和6年能登半島地震
