title,link,time,category
巨人 坂本勇人が通算1000打点達成 史上49人目,https://www3.nhk.or.jp//news/html/20230924/k10014205511000.html,9月24日 19時28分,プロ野球
万博会場の建設費増“まず大阪府と市で対応検討を”立民幹事長,https://www3.nhk.or.jp//news/html/20230924/k10014205491000.html,9月24日 18時59分,大阪・関西万博
大相撲秋場所 大関 貴景勝4回目の優勝 熱海富士との決定戦制す,https://www3.nhk.or.jp//news/html/20230924/k10014205441000.html,9月24日 18時43分,大相撲
処理水放出1か月 中国の日本産水産物の輸入停止 影響広がる,https://www3.nhk.or.jp//news/html/20230924/k10014204801000.html,9月24日 18時36分,福島第一原発 処理水
核廃絶国際デー前に平和などテーマにオンラインでシンポジウム,https://www3.nhk.or.jp//news/html/20230924/k10014205461000.html,9月24日 18時29分,核兵器関連
女子ゴルフ国内ツアー 岩井明愛が2週連続の「完全優勝」,https://www3.nhk.or.jp//news/html/20230924/k10014205481000.html,9月24日 18時28分,ゴルフ（女子）
大相撲秋場所 一山本が2回目の十両優勝 大奄美に勝ち2敗守る,https://www3.nhk.or.jp//news/html/20230924/k10014205451000.html,9月24日 18時27分,大相撲
男子ゴルフ国内ツアー 大槻智春が逆転優勝 ツアー通算3勝目,https://www3.nhk.or.jp//news/html/20230924/k10014205471000.html,9月24日 18時03分,ゴルフ（男子）
旧新潟交通電車線「かぼちゃ電車」乗車体験できる催し 新潟,https://www3.nhk.or.jp//news/html/20230924/k10014205331000.html,9月24日 18時01分,鉄道
防衛相が石垣島の駐屯地訪問 中国念頭に任務万全期すよう指示,https://www3.nhk.or.jp//news/html/20230924/k10014205391000.html,9月24日 17時59分,防衛省・自衛隊
千葉 柏 同居女性への傷害容疑で22歳の容疑者逮捕 女性は死亡,https://www3.nhk.or.jp//news/html/20230924/k10014205431000.html,9月24日 17時55分,事件
大相撲秋場所 幕下は日翔志が優勝 7人による優勝決定戦制する,https://www3.nhk.or.jp//news/html/20230924/k10014205371000.html,9月24日 17時26分,大相撲
大リーグ レイズ創設25周年記念 岩村明憲さんの銅像が球場に,https://www3.nhk.or.jp//news/html/20230924/k10014205411000.html,9月24日 17時22分,大リーグ
「世界ゴリラの日」上野動物園で絶滅の危機を知らせる催し,https://www3.nhk.or.jp//news/html/20230924/k10014205401000.html,9月24日 17時02分,環境
“金利のある世界”に？どうなる住宅ローン金利,https://www3.nhk.or.jp//news/html/20230924/k10014205221000.html,9月24日 16時46分,金融
ロッテ 佐々木朗希 発熱で1軍登録抹消 きょう先発登板予定,https://www3.nhk.or.jp//news/html/20230924/k10014205321000.html,9月24日 16時38分,プロ野球
大相撲秋場所 序二段は安大翔が決定戦制し優勝 宮城県出身18歳,https://www3.nhk.or.jp//news/html/20230924/k10014205311000.html,9月24日 16時28分,大相撲
御嶽山噴火から27日で9年 岐阜 下呂市で犠牲者を悼む慰霊式,https://www3.nhk.or.jp//news/html/20230924/k10014205301000.html,9月24日 16時17分,岐阜県
ふるさと納税仲介サイト 国内の水産物が返礼品の寄付大幅増,https://www3.nhk.or.jp//news/html/20230924/k10014205291000.html,9月24日 16時08分,ふるさと納税
尖閣沖 中国海警局の船2隻が領海出る 25時間余にわたり侵入,https://www3.nhk.or.jp//news/html/20230924/k10014205271000.html,9月24日 16時07分,尖閣
