title,link,time,category
京都府 新型コロナ 2人死亡 新たに2216人の感染確認 過去最多,https://www3.nhk.or.jp//news/html/20220126/k10013451561000.html,1月26日 18時09分,新型コロナ 国内感染者数
山梨県 新型コロナ 新たに375人の感染確認 2日連続で過去最多,https://www3.nhk.or.jp//news/html/20220126/k10013451571000.html,1月26日 18時08分,新型コロナ 国内感染者数
福島県 新型コロナ 新たに341人の感染確認 過去最多,https://www3.nhk.or.jp//news/html/20220126/k10013450381000.html,1月26日 18時07分,新型コロナ 国内感染者数
ウクライナ駐日大使 外交努力による事態打開の必要性訴える,https://www3.nhk.or.jp//news/html/20220126/k10013451501000.html,1月26日 18時04分,ロシア
部活動 地域移行の課題議論 スポーツ庁有識者会議が5月提言へ,https://www3.nhk.or.jp//news/html/20220126/k10013451491000.html,1月26日 18時04分,教育
茨城県 新型コロナ 1人死亡 新たに861人感染確認 過去最多,https://www3.nhk.or.jp//news/html/20220126/k10013451531000.html,1月26日 18時03分,新型コロナ 国内感染者数
東京都 新型コロナ 5人死亡 1万4086人感染 2日連続で過去最多,https://www3.nhk.or.jp//news/html/20220126/k10013451181000.html,1月26日 18時00分,新型コロナ 国内感染者数
タイ首相がサウジ訪問 33年前の盗難事件で悪化した関係修復へ,https://www3.nhk.or.jp//news/html/20220126/k10013451461000.html,1月26日 17時59分,
原発事故で避難指示 福島県川俣町の元町長 古川道郎さん死去,https://www3.nhk.or.jp//news/html/20220126/k10013451481000.html,1月26日 17時55分,おくやみ
宮城県 新型コロナ 新たに496人の感染確認 2日連続で過去最多,https://www3.nhk.or.jp//news/html/20220126/k10013451451000.html,1月26日 17時51分,新型コロナ 国内感染者数
秋田県 新型コロナ 新たに242人の感染確認 過去2番目,https://www3.nhk.or.jp//news/html/20220126/k10013451471000.html,1月26日 17時44分,新型コロナ 国内感染者数
妊婦の感染も増える 都立病院 受け入れ困難になるおそれも,https://www3.nhk.or.jp//news/html/20220126/k10013451351000.html,1月26日 17時43分,新型コロナウイルス
静岡県 新型コロナ 新たに1461人の感染確認 過去最多,https://www3.nhk.or.jp//news/html/20220126/k10013451431000.html,1月26日 17時42分,新型コロナ 国内感染者数
山口県 新型コロナ 新たに415人の感染確認 過去最多,https://www3.nhk.or.jp//news/html/20220126/k10013451331000.html,1月26日 17時41分,新型コロナ 国内感染者数
和歌山県 新型コロナ 新たに347人の感染確認 過去最多,https://www3.nhk.or.jp//news/html/20220126/k10013451441000.html,1月26日 17時40分,新型コロナ 国内感染者数
「濃厚接触」基準相談急増 保健所ひっ迫で企業が判断する例も,https://www3.nhk.or.jp//news/html/20220126/k10013451321000.html,1月26日 17時39分,新型コロナウイルス
長崎 米軍佐世保基地 新型コロナ 新たに基地関係者36人感染,https://www3.nhk.or.jp//news/html/20220126/k10013451381000.html,1月26日 17時38分,新型コロナウイルス
西武 育成選手の長谷川信哉 新型コロナ感染確認 感染者は8人に,https://www3.nhk.or.jp//news/html/20220126/k10013451251000.html,1月26日 17時38分,新型コロナウイルス
神奈川県 新型コロナ 4794人の感染確認 3日連続4000人超,https://www3.nhk.or.jp//news/html/20220126/k10013451391000.html,1月26日 17時37分,新型コロナ 国内感染者数
滋賀県 新型コロナ 1人死亡 新たに703人の感染確認 過去最多,https://www3.nhk.or.jp//news/html/20220126/k10013451211000.html,1月26日 17時36分,新型コロナ 国内感染者数
