title,link,time,category
2歳女児 「パワーウインドー」に首挟まれ死亡 東京 練馬,https://www3.nhk.or.jp//news/html/20240521/k10014455931000.html,5月21日 18時11分,東京都
定額減税 給与明細に所得税の減税額を明記 企業に義務づけ,https://www3.nhk.or.jp//news/html/20240521/k10014455891000.html,5月21日 18時11分,税制改正
警察官がクマに襲われたこと受け秋田県や自治体などが緊急会議,https://www3.nhk.or.jp//news/html/20240521/k10014456411000.html,5月21日 18時09分,クマ被害
ペーパーカンパニーで資金洗浄繰り返したか会社役員ら12人逮捕,https://www3.nhk.or.jp//news/html/20240521/k10014456381000.html,5月21日 18時04分,事件
横山ゆかりちゃん不明事件 情報提供者に謝礼増額へ 群馬 太田,https://www3.nhk.or.jp//news/html/20240521/k10014456391000.html,5月21日 18時01分,事件
ヒグマに襲われたか 北海道 別海町の牧場 子牛8頭が被害,https://www3.nhk.or.jp//news/html/20240521/k10014456401000.html,5月21日 17時58分,クマ被害
東京 千代田区の道路冠水 東京メトロの地下工事との関連調べる,https://www3.nhk.or.jp//news/html/20240521/k10014455741000.html,5月21日 17時58分,東京都
石川 穴水町 仮設住宅を医師ら訪問 病気予防で体動かす助言,https://www3.nhk.or.jp//news/html/20240521/k10014456271000.html,5月21日 17時46分,令和6年能登半島地震
警視庁の52歳巡査部長を逮捕 置き忘れのスマホ窃盗か 千葉県警,https://www3.nhk.or.jp//news/html/20240521/k10014456331000.html,5月21日 17時44分,千葉県
パラバドミントン女子 腕に障害があるクラス 亀山楓が代表内定,https://www3.nhk.or.jp//news/html/20240521/k10014456281000.html,5月21日 17時40分,パラバドミントン
“長期金利上昇 財政強じん化を” 財務相の諮問機関が提言,https://www3.nhk.or.jp//news/html/20240521/k10014455921000.html,5月21日 17時35分,金融
首都圏 4月の新築マンション平均価格 2か月連続下落も高水準,https://www3.nhk.or.jp//news/html/20240521/k10014456321000.html,5月21日 17時33分,不動産
神戸「マンホール吹き飛ばされた」と通報 水噴き出し水浸しに,https://www3.nhk.or.jp//news/html/20240521/k10014456311000.html,5月21日 17時31分,兵庫県
コンビニ越しに富士山撮影 迷惑行為あと絶たず黒い幕設置 山梨,https://www3.nhk.or.jp//news/html/20240521/k10014455991000.html,5月21日 17時30分,山梨県
衆議院政倫審 幹事懇談会 関係議員44人の出席意向ないこと報告,https://www3.nhk.or.jp//news/html/20240521/k10014456361000.html,5月21日 17時30分,政治資金
ALSのうち遺伝子に変異ある患者対象の新薬 承認申請,https://www3.nhk.or.jp//news/html/20240521/k10014456351000.html,5月21日 17時26分,医療・健康
政治資金規正法改正 法案あす衆院特別委で審議入り 与野党合意,https://www3.nhk.or.jp//news/html/20240521/k10014455911000.html,5月21日 17時24分,政治資金
春闘で大手企業の賃上げ5％台「非常に心強い」経団連 十倉会長,https://www3.nhk.or.jp//news/html/20240521/k10014456371000.html,5月21日 17時23分,春闘
出入国管理法などの改正案 衆議院本会議で可決 参議院へ,https://www3.nhk.or.jp//news/html/20240521/k10014456301000.html,5月21日 17時21分,技能実習生
池上彰さんかたりうその投資話 1000万円余詐欺疑い 容疑者逮捕,https://www3.nhk.or.jp//news/html/20240521/k10014455981000.html,5月21日 17時21分,事件
