title,link,time,category
能登半島地震 被災者の仮設住宅 輪島市で320戸追加で着工へ,https://www3.nhk.or.jp//news/html/20240125/k10014334711000.html,1月25日 19時58分,令和6年能登半島地震
ソフトバンク 珠洲市で携帯の音声通話とデータ通信 応急復旧,https://www3.nhk.or.jp//news/html/20240125/k10014334731000.html,1月25日 19時56分,令和6年能登半島地震
京アニ放火殺人事件 青葉真司被告に死刑判決 京都地裁,https://www3.nhk.or.jp//news/html/20240125/k10014333101000.html,1月25日 19時50分,アニメ会社放火
富山県 1200棟余被害の射水市に被災者生活再建支援法を適用へ,https://www3.nhk.or.jp//news/html/20240125/k10014334671000.html,1月25日 19時43分,令和6年能登半島地震
大阪・関西万博の費用検証など 政府の有識者委が初会合,https://www3.nhk.or.jp//news/html/20240125/k10014334661000.html,1月25日 19時42分,大阪・関西万博
【被害状況 25日】石川県で236人死亡,https://www3.nhk.or.jp//news/html/20240125/k10014333671000.html,1月25日 19時37分,令和6年能登半島地震
石川 輪島 り災証明書発行の被害状況調査 態勢大幅拡充で実施,https://www3.nhk.or.jp//news/html/20240125/k10014334651000.html,1月25日 19時35分,令和6年能登半島地震
【放送同時提供】NHK金沢発ライフライン・地域情報,https://www3.nhk.or.jp//news/html/20240105/k10014309981000.html,1月25日 19時29分,令和6年能登半島地震
全焼した永井豪記念館 館内の原画やフィギュアは燃えず 輪島,https://www3.nhk.or.jp//news/html/20240125/k10014334771000.html,1月25日 19時23分,令和6年能登半島地震
金融庁 損保ジャパンと親会社に業務改善命令 保険金不正請求で,https://www3.nhk.or.jp//news/html/20240125/k10014334471000.html,1月25日 19時23分,金融庁
自民 小渕選挙対策委員長が茂木派退会意向「政治姿勢示す」,https://www3.nhk.or.jp//news/html/20240125/k10014334741000.html,1月25日 19時17分,政治資金
円相場 対ドル 小幅に値上がり,https://www3.nhk.or.jp//news/html/20240125/k10014334691000.html,1月25日 19時14分,株価・為替
【25日随時更新】ガザ地区 住民避難の国連施設が攻撃受ける,https://www3.nhk.or.jp//news/html/20240125/k10014333661000.html,1月25日 19時12分,イスラエル・パレスチナ
トランスジェンダーとスポーツ 大会参加の現在地,https://www3.nhk.or.jp//news/html/20240125/k10014331431000.html,1月25日 19時00分,ジェンダー
日本海側中心に大雪 西日本や北陸など積雪平年の3倍超 注意を,https://www3.nhk.or.jp//news/html/20240125/k10014333891000.html,1月25日 18時58分,気象
月面探査機 JAXA 世界初の「ピンポイント着陸」に成功と発表,https://www3.nhk.or.jp//news/html/20240125/k10014333951000.html,1月25日 18時56分,月面着陸
能登半島地震の復旧・復興に向けた政府の支援策まとまる,https://www3.nhk.or.jp//news/html/20240125/k10014334581000.html,1月25日 18時55分,令和6年能登半島地震
水なく「モーモーモー」200頭飼育の牛舎は【被災地の声 25日】,https://www3.nhk.or.jp//news/html/20240125/k10014334071000.html,1月25日 18時52分,令和6年能登半島地震
【随時更新】ロシア ウクライナに軍事侵攻（1月25日の動き）,https://www3.nhk.or.jp//news/html/20240125/k10014300021000.html,1月25日 18時50分,ウクライナ情勢
デパート 去年の免税品売り上げ コロナ禍前を超え過去最高に,https://www3.nhk.or.jp//news/html/20240125/k10014334611000.html,1月25日 18時45分,小売業
