title,link,time,category
参議院選挙 あす投票日 各党が最後の訴え,https://www3.nhk.or.jp//news/html/20250719/k10014868301000.html,7月19日 19時43分,参議院選挙
参議院選挙 期日前投票 18日まで約2145万人 すでに過去最多,https://www3.nhk.or.jp//news/html/20250719/k10014868421000.html,7月19日 19時23分,参議院選挙
大相撲名古屋場所7日目 横綱 大の里 金峰山に勝って6勝目,https://www3.nhk.or.jp//news/html/20250719/k10014868381000.html,7月19日 19時18分,#大相撲
小原日登美さん死去 ロンドン五輪レスリング48キロ級金メダル,https://www3.nhk.or.jp//news/html/20250719/k10014868391000.html,7月19日 19時16分,訃報
“イスラエルとシリアが停戦に合意” トルコ駐在の米大使 発表,https://www3.nhk.or.jp//news/html/20250719/k10014868401000.html,7月19日 18時49分,イスラエル
東北北部で梅雨明け この先1週間程度 猛暑日予想 熱中症対策を,https://www3.nhk.or.jp//news/html/20250719/k10014868141000.html,7月19日 18時30分,気象
トカラ列島近海 活発な地震活動続く 震度1以上の揺れ2100回超,https://www3.nhk.or.jp//news/html/20250719/k10014867911000.html,7月19日 18時26分,地震
米財務長官 万博へ 関税措置発動1日に迫り ギリギリの交渉続く,https://www3.nhk.or.jp//news/html/20250719/k10014868371000.html,7月19日 18時22分,関税
北海道 駆除のヒグマ “12日と4年前に死亡の2人襲った”と断定,https://www3.nhk.or.jp//news/html/20250719/k10014868201000.html,7月19日 18時15分,クマ被害
二ホンウナギ EU「ワシントン条約の対象に」 水産庁「反対を」,https://www3.nhk.or.jp//news/html/20250719/k10014868311000.html,7月19日 17時59分,水産業
バスケ女子Wリーグが能登半島地震復興支援 子どもたちと交流,https://www3.nhk.or.jp//news/html/20250719/k10014868361000.html,7月19日 17時09分,令和6年能登半島地震
水泳 世界選手権 梶本一花が金 オープンウォータースイミング,https://www3.nhk.or.jp//news/html/20250719/k10014868331000.html,7月19日 16時20分,#競泳
奥能登地域で唯一の海水浴場で海開き 石川 能登町,https://www3.nhk.or.jp//news/html/20250719/k10014868351000.html,7月19日 16時14分,令和6年能登半島地震
大相撲名古屋場所 英乃海 あすから再出場へ 3年半ぶり幕内復帰,https://www3.nhk.or.jp//news/html/20250719/k10014868321000.html,7月19日 15時02分,#大相撲
DeNA ビシエド獲得を発表 昨シーズンまで中日でプレー,https://www3.nhk.or.jp//news/html/20250719/k10014868281000.html,7月19日 14時21分,#プロ野球
ドジャース 大谷翔平 無安打も1盗塁 後半戦の最初の登板は21日,https://www3.nhk.or.jp//news/html/20250719/k10014868221000.html,7月19日 14時19分,#大谷翔平
破傷風のワクチン 出荷停止 “けがの際 入念に洗浄を” 学会,https://www3.nhk.or.jp//news/html/20250719/k10014868271000.html,7月19日 14時00分,医療・健康
徳島道の衝突事故 死亡の2人 バス乗客とトラック運転手と確認,https://www3.nhk.or.jp//news/html/20250719/k10014868261000.html,7月19日 13時49分,事故
北九州 皿倉山 けが人相次いだ滑り台 子どもに限定し利用再開,https://www3.nhk.or.jp//news/html/20250719/k10014868251000.html,7月19日 12時54分,事故
トランプ氏 “富豪に手紙はフェイク” 有力紙親会社など提訴,https://www3.nhk.or.jp//news/html/20250719/k10014868241000.html,7月19日 12時36分,トランプ大統領
