title,link,time,category
トヨタ自動車 国内の完成車工場 稼働時間上限を30分程度短縮,https://www3.nhk.or.jp//news/html/20240202/k10014344821000.html,2月2日 15時26分,自動車
石川 輪島の海女を支援 三重 志摩の海女が寄付を呼びかけ,https://www3.nhk.or.jp//news/html/20240202/k10014344851000.html,2月2日 15時14分,令和6年能登半島地震
ボランティアの心構え“単独行動せず涙止まらないならやめる”,https://www3.nhk.or.jp//news/html/20240202/k10014344451000.html,2月2日 15時13分,令和6年能登半島地震
液状化被害 富山 高岡の2地区で復旧・復興に向けた協議会設立,https://www3.nhk.or.jp//news/html/20240202/k10014344761000.html,2月2日 15時12分,令和6年能登半島地震
JR芸備線  路線の存続など議論する再構築協議会 3月26日開催へ,https://www3.nhk.or.jp//news/html/20240202/k10014344531000.html,2月2日 15時09分,鉄道
津波警報で海沿いから避難 半数以上が“車を使った” 富山県,https://www3.nhk.or.jp//news/html/20240202/k10014344801000.html,2月2日 15時08分,令和6年能登半島地震
石川 珠洲 専門業者が壊れた屋根の応急処置,https://www3.nhk.or.jp//news/html/20240202/k10014344811000.html,2月2日 14時50分,令和6年能登半島地震
“北朝鮮 2日午前 黄海に向け巡航ミサイル数発発射” 韓国軍,https://www3.nhk.or.jp//news/html/20240202/k10014344721000.html,2月2日 14時47分,北朝鮮情勢
【随時更新】イスラエル ガザ地区への攻勢強める姿勢  (2日),https://www3.nhk.or.jp//news/html/20240202/k10014344151000.html,2月2日 14時43分,イスラエル・パレスチナ
NBA レイカーズ八村塁 6試合連続のふた桁となる15得点,https://www3.nhk.or.jp//news/html/20240202/k10014344711000.html,2月2日 14時39分,八村塁
“かたい豆 5歳以下は食べないで”節分前に呼びかけ 消費者庁,https://www3.nhk.or.jp//news/html/20240202/k10014344791000.html,2月2日 14時38分,医療・健康
2月3日は節分「恵方巻き」にも注意が必要,https://www3.nhk.or.jp//news/html/20240202/k10014341821000.html,2月2日 14時35分,医療・健康
顧客情報漏えい事件 元派遣社員が100回以上ダウンロードしたか,https://www3.nhk.or.jp//news/html/20240202/k10014344731000.html,2月2日 14時24分,事件
富山 高岡「準半壊」認定の住宅も解体費用補助 独自の支援へ,https://www3.nhk.or.jp//news/html/20240202/k10014344751000.html,2月2日 14時20分,令和6年能登半島地震
断水続く石川 珠洲 湧き水を生活用水に 水道管の設置作業進む,https://www3.nhk.or.jp//news/html/20240202/k10014344501000.html,2月2日 14時17分,令和6年能登半島地震
石川 珠洲のタクシー会社 全面的に営業再開 燃料確保にめど,https://www3.nhk.or.jp//news/html/20240202/k10014344661000.html,2月2日 13時55分,令和6年能登半島地震
NHK金沢発ライフライン・地域情報,https://www3.nhk.or.jp//news/html/20240105/k10014309981000.html,2月2日 13時49分,令和6年能登半島地震
「d払い」一時全国で利用できない状態も 午後1時すぎに復旧,https://www3.nhk.or.jp//news/html/20240202/k10014344691000.html,2月2日 13時42分,通信
国内スタートアップ企業などの生成AI開発を後押しへ 経産省,https://www3.nhk.or.jp//news/html/20240202/k10014344681000.html,2月2日 13時24分,生成AI・人工知能
石川 輪島のスーパー 地域の生活守ろうと元日から休まず営業,https://www3.nhk.or.jp//news/html/20240202/k10014344671000.html,2月2日 13時18分,令和6年能登半島地震
