title,link,time,category
台風22号 フィリピンで被害広がる 死者169人 行方不明50人,https://www3.nhk.or.jp//news/html/20211220/k10013395181000.html,12月20日 4時34分,台風
アフガニスタン支援 イスラム諸国 食糧調達の基金設立へ,https://www3.nhk.or.jp//news/html/20211220/k10013395131000.html,12月20日 4時28分,アフガニスタン
スキージャンプ男子 W杯 個人第9戦 小林が逆転優勝で3勝目,https://www3.nhk.or.jp//news/html/20211220/k10013395211000.html,12月20日 4時21分,スキージャンプ
スキー ノルディック複合W杯 個人第8戦 渡部暁斗は18位,https://www3.nhk.or.jp//news/html/20211220/k10013395191000.html,12月20日 4時18分,スキーノルディック複合
バドミントン世界選手権 保木 小林ペアが金 男子ダブルスで初,https://www3.nhk.or.jp//news/html/20211219/k10013395171000.html,12月19日 23時25分,バドミントン
アイスホッケー全日本選手権 ひがし北海道クレインズが2連覇,https://www3.nhk.or.jp//news/html/20211219/k10013395161000.html,12月19日 22時08分,
レスリング 五輪4連覇 伊調馨がコーチ就任 パリ五輪向け強化,https://www3.nhk.or.jp//news/html/20211219/k10013395141000.html,12月19日 21時45分,レスリング
サッカー天皇杯 浦和が3季ぶり優勝 槙野が終了間際に決勝点,https://www3.nhk.or.jp//news/html/20211219/k10013394471000.html,12月19日 21時02分,サッカー
インドネシア ジャワ島の火山噴火 再び大規模火砕流のおそれ,https://www3.nhk.or.jp//news/html/20211219/k10013395041000.html,12月19日 20時59分,
バドミントン世界選手権 山口茜が初の金 女子シングルス,https://www3.nhk.or.jp//news/html/20211219/k10013395091000.html,12月19日 20時58分,バドミントン
沖縄 海兵隊基地で新たに31人感染確認 米軍から県に連絡,https://www3.nhk.or.jp//news/html/20211219/k10013395051000.html,12月19日 20時45分,新型コロナウイルス
パラオ ペリリュー島の戦いを伝える催し 茨城 常陸大宮,https://www3.nhk.or.jp//news/html/20211219/k10013395001000.html,12月19日 20時41分,
中国自動車メーカー 乗用車輸入販売店がオープン 大阪,https://www3.nhk.or.jp//news/html/20211219/k10013395021000.html,12月19日 20時39分,中国
レスリング 全日本選手権 女子53キロ級 藤波朱理が2連覇,https://www3.nhk.or.jp//news/html/20211219/k10013395031000.html,12月19日 20時34分,レスリング
新競技パルクール 初の日本選手権 障害物越えスピードなど競う,https://www3.nhk.or.jp//news/html/20211219/k10013394981000.html,12月19日 20時32分,
大阪 ビル放火事件 新たに身元確認の8人の方々（警察公表）,https://www3.nhk.or.jp//news/html/20211219/k10013395061000.html,12月19日 20時21分,大阪 ビル放火事件
自民幹事長 文書交通費“寄付など各党が主張する内容実行を”,https://www3.nhk.or.jp//news/html/20211219/k10013394991000.html,12月19日 19時58分,政治資金
診療報酬本体0.43％引き上げで最終調整 医師の人件費など 政府,https://www3.nhk.or.jp//news/html/20211219/k10013395011000.html,12月19日 19時54分,医療
遠藤周作の記録が残されていなかった短編小説 見つかる,https://www3.nhk.or.jp//news/html/20211219/k10013394911000.html,12月19日 19時32分,
大阪 ビル放火 容疑者とみられる人物 現場近くの防犯カメラに,https://www3.nhk.or.jp//news/html/20211219/k10013394941000.html,12月19日 19時31分,大阪 ビル放火事件
