title,link,time,category
柔道 永瀬貴規 男子81キロ級 合わせ技一本勝ち決勝へ パリ五輪,https://www3.nhk.or.jp//news/html/20240730/k10014530531000.html,7月30日 23時58分,#柔道
バドミントン 女子ダブルス シダマツペア 予選通過 パリ五輪,https://www3.nhk.or.jp//news/html/20240730/k10014530541000.html,7月30日 23時46分,#バドミントン
日銀 追加の利上げ検討へ 0.25％程度に引き上げる案など議論か,https://www3.nhk.or.jp//news/html/20240730/k10014530221000.html,7月30日 23時43分,日本銀行（日銀）
パリオリンピック【速報中】7/30～31タイムライン,https://www3.nhk.or.jp//news/html/20240730/k10014529931000.html,7月30日 22時59分,#パリオリンピック
80代夫婦と娘が殺害された事件 指名手配の孫を鳥取市内で確保,https://www3.nhk.or.jp//news/html/20240730/k10014530471000.html,7月30日 22時52分,事件
競泳 男子200mバタフライ 本多灯 予選敗退 パリ五輪,https://www3.nhk.or.jp//news/html/20240730/k10014530441000.html,7月30日 22時42分,#競泳
競泳 渡辺と花車 男子200m平泳ぎ ともに準決勝進出 パリ五輪,https://www3.nhk.or.jp//news/html/20240730/k10014530411000.html,7月30日 22時34分,#競泳
青森 八戸 南郷の2地区 避難指示を解除,https://www3.nhk.or.jp//news/html/20240730/k10014530481000.html,7月30日 22時34分,青森県
自民 広瀬めぐみ参議院議員が離党 事務所などの捜索受け,https://www3.nhk.or.jp//news/html/20240730/k10014530461000.html,7月30日 22時28分,
競泳 男子800mリレー 日本 予選8位で決勝進出 パリ五輪,https://www3.nhk.or.jp//news/html/20240730/k10014530431000.html,7月30日 22時19分,#パリオリンピック
駐中国大使が山東省トップと会談 経済関係の強化で一致,https://www3.nhk.or.jp//news/html/20240730/k10014530361000.html,7月30日 22時11分,中国
九州～東北 猛暑日200地点超 31日も猛烈な暑さに 熱中症警戒を,https://www3.nhk.or.jp//news/html/20240730/k10014529591000.html,7月30日 21時28分,気象
競泳 寺門弦輝 男子200mバタフライ 準決勝進出 パリ五輪,https://www3.nhk.or.jp//news/html/20240730/k10014530151000.html,7月30日 21時21分,#競泳
パリ五輪 トライアスロン1日延期 セーヌ川の水質基準満たさず,https://www3.nhk.or.jp//news/html/20240730/k10014529581000.html,7月30日 21時21分,#パリオリンピック
能登半島地震の災害関連死 21人を答申 認定されれば100人超に,https://www3.nhk.or.jp//news/html/20240730/k10014530391000.html,7月30日 21時19分,令和6年能登半島地震
柔道 永瀬貴規 男子81キロ級 準決勝進出 パリオリンピック,https://www3.nhk.or.jp//news/html/20240730/k10014530021000.html,7月30日 21時16分,#柔道
サッカーJ1 松木玖生 イングランドのサウサンプトンに移籍決定,https://www3.nhk.or.jp//news/html/20240730/k10014530401000.html,7月30日 21時09分,#サッカー
福岡 糸島 屋外プールからはだしで移動 生徒21人足の裏やけど,https://www3.nhk.or.jp//news/html/20240730/k10014530381000.html,7月30日 21時02分,福岡県
単独インタビューで語ったことは？,https://www3.nhk.or.jp//news/html/20240730/k10014528511000.html,7月30日 21時01分,ウクライナ情勢
卓球 戸上隼輔 男子シングルス 逆転で3回戦進出 パリ五輪,https://www3.nhk.or.jp//news/html/20240730/k10014530371000.html,7月30日 20時37分,#卓球
