title,link,time,category
立民 岡田氏 国民との合流に意欲「大きなかたまり目指したい」,https://www3.nhk.or.jp//news/html/20240211/k10014355191000.html,2月11日 16時32分,国会
【DeNA キャンプ】平良が実戦形式に登板「シンカー磨きたい」,https://www3.nhk.or.jp//news/html/20240211/k10014355091000.html,2月11日 16時28分,プロ野球
伯耆稲荷神社で初午大祭 空に矢を放ち豊作祈願 鳥取 琴浦町,https://www3.nhk.or.jp//news/html/20240211/k10014355181000.html,2月11日 16時24分,鳥取県
石川 能登町 コンテナに洗濯機を備え付けたランドリー設置,https://www3.nhk.or.jp//news/html/20240211/k10014355151000.html,2月11日 16時18分,令和6年能登半島地震
公明 山口代表 富山県視察 “財政支援に万全期し復興を加速”,https://www3.nhk.or.jp//news/html/20240211/k10014355161000.html,2月11日 16時16分,令和6年能登半島地震
ミャンマー軍 徴兵制実施を発表 兵員不足を補うねらいか,https://www3.nhk.or.jp//news/html/20240211/k10014355011000.html,2月11日 16時09分,ミャンマー
石川 七尾 被災した一本杉通りで「復興マルシェ」開催,https://www3.nhk.or.jp//news/html/20240211/k10014355121000.html,2月11日 16時07分,令和6年能登半島地震
スノボW杯ハーフパイプ 小野光希と平野流佳 2季連続種目別優勝,https://www3.nhk.or.jp//news/html/20240211/k10014355101000.html,2月11日 16時01分,スノーボード
さいたま アパート全焼 2人の遺体見つかる 1人暮らしの住人か,https://www3.nhk.or.jp//news/html/20240211/k10014355131000.html,2月11日 15時52分,埼玉県
わんこそば全日本大会 4年ぶりコロナ禍前と同じ形で開催 岩手,https://www3.nhk.or.jp//news/html/20240211/k10014355141000.html,2月11日 15時50分,岩手県
NBA グリズリーズ移籍の渡邊「絶対にやれる。本当に楽しみ」,https://www3.nhk.or.jp//news/html/20240211/k10014355071000.html,2月11日 15時46分,バスケットボール
「空飛ぶクルマ」実用化に向けヘリコプターで実験 東京,https://www3.nhk.or.jp//news/html/20240211/k10014355111000.html,2月11日 15時44分,自動車
ひな人形の衣装着た子どもたちを乗せた山車 地域を巡る 福岡,https://www3.nhk.or.jp//news/html/20240211/k10014355081000.html,2月11日 15時34分,福岡県
氷見の寒ぶり楽しめるイベント 地震で3週間延期し開催,https://www3.nhk.or.jp//news/html/20240211/k10014355061000.html,2月11日 15時11分,令和6年能登半島地震
“新一万円札”の渋沢栄一 誕生日記念のまんじゅう配布 埼玉,https://www3.nhk.or.jp//news/html/20240211/k10014355031000.html,2月11日 14時58分,埼玉県
びわ湖ほとりの公園 1万2000本の菜の花が見頃 滋賀 守山,https://www3.nhk.or.jp//news/html/20240211/k10014355041000.html,2月11日 14時57分,滋賀県
野球と日系人の歴史を考える講演会 大統領令署名の日を前に,https://www3.nhk.or.jp//news/html/20240211/k10014355051000.html,2月11日 14時56分,大リーグ
UNRWA事務局長「深刻に受け止め対応」ハマス攻撃関与の疑い,https://www3.nhk.or.jp//news/html/20240211/k10014354801000.html,2月11日 14時03分,イスラエル・パレスチナ
「さっぽろ雪まつり」最終日 大勢の観光客でにぎわう,https://www3.nhk.or.jp//news/html/20240211/k10014354991000.html,2月11日 13時35分,北海道
YS11型機など展示 官民連携の航空博物館オープン 茨城 筑西,https://www3.nhk.or.jp//news/html/20240211/k10014354981000.html,2月11日 13時06分,茨城県
