title,link,time,category
岩屋外相 カリブ共同体の外相らと会合へ 環境などの課題議論,https://www3.nhk.or.jp//news/html/20241210/k10014664121000.html,12月10日 20時11分,外務省
日本生命 欧米などで保険事業の企業 買収で調整 約1兆2000億円,https://www3.nhk.or.jp//news/html/20241210/k10014664021000.html,12月10日 20時08分,医療・健康
千葉 四街道 強盗傷害事件 実行役を再逮捕 別の住宅に侵入疑い,https://www3.nhk.or.jp//news/html/20241210/k10014664141000.html,12月10日 20時04分,事件
北朝鮮の拉致事件現場 3市の小学校結びオンライン授業,https://www3.nhk.or.jp//news/html/20241210/k10014664041000.html,12月10日 19時55分,拉致
ゼレンスキー大統領 “NATO加盟までの間 外国軍駐留案も検討”,https://www3.nhk.or.jp//news/html/20241210/k10014664131000.html,12月10日 19時52分,ゼレンスキー大統領
仙台放送元アナウンサー“立民 柳沢剛氏からパワハラ”と訴え,https://www3.nhk.or.jp//news/html/20241210/k10014664071000.html,12月10日 19時44分,衆議院
中学校の部活動 地域で担う取り組み 平日も推進 有識者会議,https://www3.nhk.or.jp//news/html/20241210/k10014664081000.html,12月10日 19時42分,教育
北海道 函館 郷土料理の飯寿司の出荷盛ん 正月に向け,https://www3.nhk.or.jp//news/html/20241210/k10014663921000.html,12月10日 19時41分,北海道
中国 習主席“貿易戦争に勝者なし” トランプ次期大統領けん制,https://www3.nhk.or.jp//news/html/20241210/k10014664061000.html,12月10日 19時39分,習近平主席
さいたま 国道でトラック追突 道路上の作業員2人が重体,https://www3.nhk.or.jp//news/html/20241210/k10014663941000.html,12月10日 19時34分,事故
“106万円の壁”撤廃に 厚生年金新たに200万人加入対象見込み,https://www3.nhk.or.jp//news/html/20241210/k10014663411000.html,12月10日 19時34分,年金
キム前国防相の逮捕状 今夜遅くにも裁判所が判断示す見通し,https://www3.nhk.or.jp//news/html/20241210/k10014663161000.html,12月10日 19時29分,韓国
“高校生平和大使” ノルウェー首都の高校で原爆の悲惨さ訴え,https://www3.nhk.or.jp//news/html/20241210/k10014663591000.html,12月10日 19時07分,ノーベル賞2024
茨城 ひたちなか 住宅で74歳男性死亡 侵入疑いで68歳知人逮捕,https://www3.nhk.or.jp//news/html/20241210/k10014663931000.html,12月10日 19時06分,事件
石破首相「企業・団体献金禁止 表現の自由保障の憲法に抵触」,https://www3.nhk.or.jp//news/html/20241210/k10014664031000.html,12月10日 19時06分,政治資金
あなたは解ける？「国際成人力調査」日本“世界トップレベル”,https://www3.nhk.or.jp//news/html/20241210/k10014663511000.html,12月10日 19時02分,教育
米軍 オスプレイの飛行一部停止 陸自も一時的に飛行見合わせ,https://www3.nhk.or.jp//news/html/20241210/k10014663291000.html,12月10日 19時00分,オスプレイ
【ライブ配信予定】ノーベル平和賞 今夜9時から授賞式,https://www3.nhk.or.jp//news/html/20241209/k10014662521000.html,12月10日 18時59分,ノーベル賞2024
“106万の壁”撤廃 現場の受け止めは「週20時間以上」の壁も…,https://www3.nhk.or.jp//news/html/20241210/k10014663731000.html,12月10日 18時53分,年金
円相場 値下がり 米長期金利上昇受け日米の金利差拡大との見方,https://www3.nhk.or.jp//news/html/20241210/k10014664051000.html,12月10日 18時45分,株価・為替
