title,link,time,category
長嶋茂雄さん 文化勲章受章の記念セレモニー開催,https://www3.nhk.or.jp//news/html/20211208/k10013380821000.html,12月8日 22時39分,プロ野球
巨人 プロ野球女子チーム創設 野球競技人口の拡大目指す,https://www3.nhk.or.jp//news/html/20211208/k10013380921000.html,12月8日 22時38分,プロ野球
オミクロン株 国内4人目感染確認 ナイジェリア滞在歴ある男性,https://www3.nhk.or.jp//news/html/20211208/k10013380611000.html,12月8日 22時37分,新型コロナウイルス
財務省 大手町のオフィスビル売却へ 売却額は過去最高額か,https://www3.nhk.or.jp//news/html/20211208/k10013380931000.html,12月8日 22時35分,
プロ野球 巨人 新人選手17人の入団発表 翁田の背番号は「15」,https://www3.nhk.or.jp//news/html/20211208/k10013380911000.html,12月8日 22時27分,プロ野球
ヤクルト 山田哲人 現状維持で来シーズンの契約更改,https://www3.nhk.or.jp//news/html/20211208/k10013380891000.html,12月8日 22時20分,プロ野球
オミクロン株へのワクチンの効果「3回目で向上」ファイザー,https://www3.nhk.or.jp//news/html/20211208/k10013380951000.html,12月8日 21時59分,新型コロナウイルス
ドイツ新首相に社会民主党 ショルツ氏就任 メルケル首相退任,https://www3.nhk.or.jp//news/html/20211208/k10013380501000.html,12月8日 21時43分,ドイツ
オミクロン株「感染拡大懸念」で検査強化を 厚労省専門家会合,https://www3.nhk.or.jp//news/html/20211208/k10013380901000.html,12月8日 21時39分,新型コロナウイルス
拉致被害者の蓮池薫さん 高校生に講演「拉致問題に関心を」,https://www3.nhk.or.jp//news/html/20211208/k10013380641000.html,12月8日 21時26分,拉致
真珠湾攻撃80年 暗号電文送った旧施設で平和願う 北海道 稚内,https://www3.nhk.or.jp//news/html/20211208/k10013380831000.html,12月8日 21時25分,
韓国 新型コロナ 一日の感染者7000人超 過去最多 規制一部強化,https://www3.nhk.or.jp//news/html/20211208/k10013379571000.html,12月8日 21時20分,新型コロナウイルス
バドミントン桃田賢斗 世界選手権は欠場へ 腰痛のため,https://www3.nhk.or.jp//news/html/20211208/k10013380851000.html,12月8日 21時02分,バドミントン
緊急地震速報に遅れも 海底の地震津波観測網にトラブル,https://www3.nhk.or.jp//news/html/20211208/k10013380871000.html,12月8日 21時00分,
自民 竹島上陸で韓国への制裁措置検討する作業チームの初会合,https://www3.nhk.or.jp//news/html/20211208/k10013380841000.html,12月8日 20時48分,日韓関係
真珠湾攻撃80年 パイロットの遺族など集まり慰霊祭 静岡,https://www3.nhk.or.jp//news/html/20211208/k10013380811000.html,12月8日 20時47分,
福島第一 廃炉作業の技術者 外国人の新規入国停止で入国できず,https://www3.nhk.or.jp//news/html/20211208/k10013380491000.html,12月8日 20時46分,福島第一原発
真珠湾攻撃から80年 各地で平和への思い 新たに,https://www3.nhk.or.jp//news/html/20211208/k10013379961000.html,12月8日 20時43分,
東京 府中で住宅火災 40代と70代の女性2人死亡 身元確認進める,https://www3.nhk.or.jp//news/html/20211208/k10013380431000.html,12月8日 20時35分,
日銀副総裁 経済の先行き“オミクロン株で不確実性さらに”,https://www3.nhk.or.jp//news/html/20211208/k10013380241000.html,12月8日 20時25分,新型コロナ 経済影響
