title,link,time,category
パリ五輪 日本 金メダル・メダル総数ともに海外大会の最多更新,https://www3.nhk.or.jp//news/html/20240811/k10014545621000.html,8月11日 6時31分,#パリオリンピック
台風5号 あす東北に上陸のおそれ 雨や風が強まる前に備えを,https://www3.nhk.or.jp//news/html/20240811/k10014545681000.html,8月11日 6時31分,台風
陸上男子 走り高跳び 赤松諒一は5位 パリオリンピック,https://www3.nhk.or.jp//news/html/20240811/k10014545921000.html,8月11日 6時30分,#陸上競技
ロシア ウクライナ侵攻開始から900日 激しい攻防続く,https://www3.nhk.or.jp//news/html/20240811/k10014545641000.html,8月11日 6時29分,ウクライナ情勢
【随時更新】イスラエル パレスチナ 中東情勢（8月11日）,https://www3.nhk.or.jp//news/html/20240811/k10014545901000.html,8月11日 6時26分,イスラエル・パレスチナ
ブレイキン男子 「Shigekix」半井重幸 3位決定戦で敗れ4位,https://www3.nhk.or.jp//news/html/20240811/k10014545861000.html,8月11日 6時24分,#ブレイキン
パリオリンピック日程 8/11～12（競技・放送・配信予定）,https://www3.nhk.or.jp//news/html/20240811/k10014545831000.html,8月11日 6時16分,#パリオリンピック
南海トラフ地震臨時情報 巨大地震に注意 引き続き備え確認を,https://www3.nhk.or.jp//news/html/20240811/k10014545691000.html,8月11日 6時12分,南海トラフ地震臨時情報
フィリピンと中国 南シナ海の上空で「妨害」と非難の応酬に,https://www3.nhk.or.jp//news/html/20240811/k10014545851000.html,8月11日 6時08分,フィリピン
レスリング 元木咲良 金メダル 女子62キロ級 パリオリンピック,https://www3.nhk.or.jp//news/html/20240811/k10014546001000.html,8月11日 6時08分,#レスリング
北口榛花が金メダル 陸上女子やり投げ パリ五輪【詳しく】,https://www3.nhk.or.jp//news/html/20240811/k10014545871000.html,8月11日 6時00分,#陸上競技
ガザ地区学校空爆で多数の死傷者 イスラエルへ非難相次ぐ,https://www3.nhk.or.jp//news/html/20240811/k10014545931000.html,8月11日 5時49分,イスラエル・パレスチナ
アーティスティックS  デュエット 日本は8位 パリ五輪,https://www3.nhk.or.jp//news/html/20240811/k10014545971000.html,8月11日 5時47分,#アーティスティックスイミング
陸上男子1600mリレー 日本 アジア新で6位 パリオリンピック,https://www3.nhk.or.jp//news/html/20240811/k10014545951000.html,8月11日 5時23分,#陸上競技
パリオリンピック【結果】8/10～11タイムライン,https://www3.nhk.or.jp//news/html/20240810/k10014545451000.html,8月11日 5時06分,#パリオリンピック
レスリング 高谷大地が銀メダル 男子フリー74キロ級 パリ五輪,https://www3.nhk.or.jp//news/html/20240811/k10014545881000.html,8月11日 4時41分,#レスリング
近代五種 佐藤大宗 銀メダル 近代五種で初のメダル パリ五輪,https://www3.nhk.or.jp//news/html/20240811/k10014545891000.html,8月11日 3時45分,#近代五種
サッカー女子 アメリカが3大会ぶり金メダル パリオリンピック,https://www3.nhk.or.jp//news/html/20240811/k10014545911000.html,8月11日 3時26分,#サッカー
レスリング女子76キロ級 鏡優翔が決勝進出 パリ五輪,https://www3.nhk.or.jp//news/html/20240810/k10014545661000.html,8月11日 3時20分,#レスリング
レスリング男子フリー65キロ級 清岡幸大郎が決勝進出 パリ五輪,https://www3.nhk.or.jp//news/html/20240810/k10014545651000.html,8月11日 2時55分,#レスリング
