title,link,time,category
プーチン大統領 北朝鮮の外相と会談 北朝鮮訪問も調整か,https://www3.nhk.or.jp//news/html/20240117/k10014323901000.html,1月17日 9時16分,プーチン大統領
米軍“フーシ派を攻撃 ミサイル破壊”と発表 緊張の高まり懸念,https://www3.nhk.or.jp//news/html/20240117/k10014323921000.html,1月17日 9時15分,イスラエル・パレスチナ
【随時更新】阪神・淡路大震災から29年 午前5時46分に黙とう,https://www3.nhk.or.jp//news/html/20240116/k10014322971000.html,1月17日 9時09分,阪神・淡路大震災
【17日随時更新】イスラエル防衛費2兆円増額 「戦争予算だ」,https://www3.nhk.or.jp//news/html/20240117/k10014323961000.html,1月17日 9時03分,イスラエル・パレスチナ
中国 胡錦涛前国家主席の息子を民政省次官に任命と発表,https://www3.nhk.or.jp//news/html/20240117/k10014323801000.html,1月17日 9時01分,中国
【被害状況 17日】石川県内 約7800戸が停電（午前5時時点）,https://www3.nhk.or.jp//news/html/20240117/k10014323981000.html,1月17日 8時44分,令和6年能登半島地震
英郵便局システム欠陥「えん罪に関わったこと謝罪」富士通幹部,https://www3.nhk.or.jp//news/html/20240117/k10014323811000.html,1月17日 8時43分,イギリス
阪神・淡路大震災からきょうで29年 教訓などをどう生かすか,https://www3.nhk.or.jp//news/html/20240117/k10014323261000.html,1月17日 8時24分,阪神・淡路大震災
三重 伊勢で真珠の入札会 前年を大きく上回る高値で取り引き,https://www3.nhk.or.jp//news/html/20240117/k10014323111000.html,1月17日 8時02分,三重県
【能登半島地震 交通影響】鉄道・航空・道路（17日5時時点）,https://www3.nhk.or.jp//news/html/20240117/k10014323951000.html,1月17日 7時41分,令和6年能登半島地震
円相場（NY）1ドル＝147円台まで値下がり 米長期金利上昇で,https://www3.nhk.or.jp//news/html/20240117/k10014323851000.html,1月17日 7時25分,株価・為替
ゼレンスキー大統領 ダボス会議で演説 欧米側に支援継続を訴え,https://www3.nhk.or.jp//news/html/20240117/k10014323871000.html,1月17日 7時11分,ゼレンスキー大統領
能登半島地震の被災地 厳しい冷え込み続く 低体温症に注意を,https://www3.nhk.or.jp//news/html/20240117/k10014323891000.html,1月17日 6時56分,令和6年能登半島地震
日本の去年のGDP ドイツに抜かれ世界4位になる見通しに,https://www3.nhk.or.jp//news/html/20240117/k10014323601000.html,1月17日 6時56分,GDP
政府 巨大IT企業を規制する新たな法律を制定する方向で検討,https://www3.nhk.or.jp//news/html/20240117/k10014323591000.html,1月17日 6時54分,IT・ネット
「排出量取引」市場 参加企業が設定の削減目標を公表 経産省,https://www3.nhk.or.jp//news/html/20240117/k10014323541000.html,1月17日 6時44分,脱炭素社会への動き
“私人逮捕”動画投稿 自称ユーチューバーら逮捕 恐喝未遂疑い,https://www3.nhk.or.jp//news/html/20240117/k10014323881000.html,1月17日 6時43分,事件
能登半島地震 SNSで偽情報 政府 有識者チーム設置し対策検討へ,https://www3.nhk.or.jp//news/html/20240117/k10014323831000.html,1月17日 6時08分,令和6年能登半島地震
障害者向け施設 食材費過大徴収 運営会社に検証・報告を勧告,https://www3.nhk.or.jp//news/html/20240117/k10014323781000.html,1月17日 5時41分,厚生労働省
柿沢前副大臣を公職選挙法違反の罪で起訴へ 東京地検特捜部,https://www3.nhk.or.jp//news/html/20240117/k10014323761000.html,1月17日 5時30分,事件
