title,link,time,category
岡山5歳女児虐待 児童相談所など20回以上自宅訪問も事件防げず,https://www3.nhk.or.jp//news/html/20220211/k10013478781000.html,2月11日 6時32分,事件
ウクライナ情勢 英・NATO “外交努力も 軍事侵攻に備えも”,https://www3.nhk.or.jp//news/html/20220211/k10013478881000.html,2月11日 6時31分,ロシア
幼い姉妹3人が死亡 母親を殺人未遂の疑いで逮捕 愛知 一宮,https://www3.nhk.or.jp//news/html/20220211/k10013479021000.html,2月11日 6時17分,事件
【大雪】交通への影響,https://www3.nhk.or.jp//news/html/20220211/k10013479031000.html,2月11日 6時06分,
茨城 千葉など雪続く 気温低く路面凍結のおそれ 転倒など注意,https://www3.nhk.or.jp//news/html/20220211/k10013478861000.html,2月11日 6時00分,気象
仏 ワクチン抗議デモ 車列組んでパリへ 警察はデモ禁止し警告,https://www3.nhk.or.jp//news/html/20220211/k10013478911000.html,2月11日 5時49分,新型コロナウイルス
林外相 きょう日米豪印外相会合出席 幅広い分野で連携確認へ,https://www3.nhk.or.jp//news/html/20220211/k10013478821000.html,2月11日 5時30分,
旭川女子中学生凍死事件 「学校は早く調査を」遺族がコメント,https://www3.nhk.or.jp//news/html/20220211/k10013478791000.html,2月11日 5時05分,事件
“新型コロナに打ち克ち 未来を拓こう” 岸田首相がメッセージ,https://www3.nhk.or.jp//news/html/20220211/k10013478831000.html,2月11日 5時00分,新型コロナウイルス
糖尿病治療に関わるすい臓の細胞 増殖に成功 マウスで症状改善,https://www3.nhk.or.jp//news/html/20220211/k10013478851000.html,2月11日 4時42分,医療
米 1月の消費者物価指数 前年同月比7.5％↑ 約40年ぶり高水準,https://www3.nhk.or.jp//news/html/20220211/k10013478921000.html,2月11日 4時39分,
北京オリンピック 2月11日（金）の予定,https://www3.nhk.or.jp//news/html/20220211/k10013459041000.html,2月11日 4時37分,北京 冬季オリンピック・パラリンピック
関東甲信 大雪のピークすぎる 路面凍結による転倒など十分注意,https://www3.nhk.or.jp//news/html/20220210/k10013477301000.html,2月11日 1時19分,気象
ファイザーの新型コロナ飲み薬を承認 国内で2種類目 厚労相,https://www3.nhk.or.jp//news/html/20220210/k10013478741000.html,2月11日 0時48分,新型コロナウイルス
ジャンプ 高梨沙羅 “測り方が違った” 失格受け連盟に回答,https://www3.nhk.or.jp//news/html/20220211/k10013479001000.html,2月11日 0時36分,スキージャンプ
オリンピック 大会7日目 日本は銀1個 銅2個を新たに獲得,https://www3.nhk.or.jp//news/html/20220211/k10013478961000.html,2月11日 0時02分,北京 冬季オリンピック・パラリンピック
オリンピック【まとめ】大会7日目 10日の競技結果・動き,https://www3.nhk.or.jp//news/html/20220210/k10013476921000.html,2月10日 23時52分,北京 冬季オリンピック・パラリンピック
スピードスケート 10日までの全種目で五輪記録更新,https://www3.nhk.or.jp//news/html/20220210/k10013478991000.html,2月10日 23時27分,スピードスケート
関東甲信 静岡県で大雪 東京都心でも積雪 交通への影響は,https://www3.nhk.or.jp//news/html/20220210/k10013477001000.html,2月10日 22時59分,気象
スノーボード女子ハーフパイプ 冨田せなに銅メダル授与,https://www3.nhk.or.jp//news/html/20220210/k10013478951000.html,2月10日 22時54分,スノーボード
