title,link,time,category
障害者向け施設運営会社“不正請求や虐待も確認を”厚労省通知,https://www3.nhk.or.jp//news/html/20231025/k10014236211000.html,10月25日 7時21分,
日本ラグビーの歩みを紹介する展覧会 フランスで開催,https://www3.nhk.or.jp//news/html/20231025/k10014236341000.html,10月25日 7時10分,ラグビー
米議会下院 共和党が新たな議長候補決定も直後に撤退 混乱続く,https://www3.nhk.or.jp//news/html/20231025/k10014236311000.html,10月25日 7時02分,アメリカ
「火山調査研究推進本部」の役割議論 対策強化で来年4月に設置,https://www3.nhk.or.jp//news/html/20231025/k10014236221000.html,10月25日 6時54分,
【25日随時更新】ガザ地区で亡くなった子どもが2000人以上に,https://www3.nhk.or.jp//news/html/20231025/k10014236281000.html,10月25日 6時44分,イスラエル・パレスチナ
アメリカ経済なぜ堅調？ 専門家に聞く GDPは5期連続プラスか,https://www3.nhk.or.jp//news/html/20231025/k10014236131000.html,10月25日 6時42分,アメリカ
今夜遅くにかけて西～北日本で大気不安定 落雷や竜巻に注意,https://www3.nhk.or.jp//news/html/20231025/k10014236121000.html,10月25日 6時25分,気象
JR山手線 横須賀線 東海道線 いずれも運転再開,https://www3.nhk.or.jp//news/html/20231025/k10014236361000.html,10月25日 6時23分,
米GM 業績見通しを撤回 全米自動車労組ストライキの影響で,https://www3.nhk.or.jp//news/html/20231025/k10014236301000.html,10月25日 6時21分,アメリカ
“戸籍上の性別変更に手術は必要か” きょう最高裁が判断,https://www3.nhk.or.jp//news/html/20231025/k10014236101000.html,10月25日 6時12分,憲法
国連安保理 イスラエルとパレスチナが非難の応酬,https://www3.nhk.or.jp//news/html/20231025/k10014236291000.html,10月25日 5時52分,イスラエル・パレスチナ
ラグビーワールドカップ 27年大会は出場チーム数が24に拡大,https://www3.nhk.or.jp//news/html/20231025/k10014236241000.html,10月25日 5時44分,ラグビー
犯罪被害者や遺族の心情を加害者に伝える 新制度開始で研修会,https://www3.nhk.or.jp//news/html/20231025/k10014236201000.html,10月25日 5時40分,
きょうから参議院でも代表質問 所得税減税の是非など論戦,https://www3.nhk.or.jp//news/html/20231025/k10014236071000.html,10月25日 5時36分,国会
高速道路の通勤割引 毎日24時間に拡大 来年4月から試験導入へ,https://www3.nhk.or.jp//news/html/20231025/k10014236081000.html,10月25日 5時33分,
ガザ NICUの赤ちゃん“48時間の命” 悪化する子どもたちの環境,https://www3.nhk.or.jp//news/html/20231024/k10014236181000.html,10月25日 5時14分,イスラエル・パレスチナ
冬の訪れを前に 松の木に恒例の「こも巻き」山形 鶴岡,https://www3.nhk.or.jp//news/html/20231025/k10014236161000.html,10月25日 4時48分,山形県
東山魁夷の代表作にも 御射鹿池周辺のカラマツが黄金色に 長野,https://www3.nhk.or.jp//news/html/20231025/k10014236151000.html,10月25日 4時47分,長野県
全米自動車労組ストライキ GM主力工場にも拡大 4万5000人超に,https://www3.nhk.or.jp//news/html/20231025/k10014236251000.html,10月25日 2時13分,アメリカ
東京 江東区長 有料広告で投票呼びかけか 区長室など捜索,https://www3.nhk.or.jp//news/html/20231024/k10014235711000.html,10月25日 1時22分,選挙
