title,link,time,category
ローイング 森卓也がパリパラリンピックの出場権獲得,https://www3.nhk.or.jp//news/html/20240422/k10014429691000.html,4月22日 17時32分,ボート
グーグルの再発防止計画 公取委が認定 LINEヤフー広告不当制限,https://www3.nhk.or.jp//news/html/20240422/k10014429651000.html,4月22日 17時31分,IT・ネット
水球男子 パリ五輪代表に稲場悠介や鈴木透生など13人が内定,https://www3.nhk.or.jp//news/html/20240422/k10014429711000.html,4月22日 17時28分,水球
VポイントとTポイントが統合 ポイント経済圏はどう変わる？,https://www3.nhk.or.jp//news/html/20240422/k10014429281000.html,4月22日 17時24分,ニュース深掘り
愛媛 大洲 被災の老舗酒蔵 屋根にブルーシートで急場しのぐ,https://www3.nhk.or.jp//news/html/20240422/k10014429701000.html,4月22日 17時24分,地震
栃木 遺体遺棄事件 被害者 前夜に容疑者とは別の男と移動か,https://www3.nhk.or.jp//news/html/20240422/k10014429681000.html,4月22日 17時21分,事件
愛媛 宇和島 特産のみかん畑でも石垣崩れる被害 震度5強観測,https://www3.nhk.or.jp//news/html/20240422/k10014429661000.html,4月22日 17時19分,地震
衆院予算委 首相 “政策活動費 党としても共通ルール判断”,https://www3.nhk.or.jp//news/html/20240422/k10014429391000.html,4月22日 17時18分,政治資金
埼玉 白岡 大量のがれき 道路塞ぎ通行止め 不法投棄か,https://www3.nhk.or.jp//news/html/20240422/k10014429421000.html,4月22日 17時04分,事件
介護施設送迎車2人死亡事故 75歳被告に実刑判決 さいたま地裁,https://www3.nhk.or.jp//news/html/20240422/k10014429641000.html,4月22日 16時54分,高齢ドライバー事故
羽田空港に着陸の旅客機 別の滑走路に向かい着陸やり直し,https://www3.nhk.or.jp//news/html/20240422/k10014429671000.html,4月22日 16時52分,航空
「カスハラ」防ぐ条例制定へ 具体的例示案が都の部会で了承,https://www3.nhk.or.jp//news/html/20240422/k10014429051000.html,4月22日 16時45分,東京都
日本航空石川 東京 青梅の大学校舎を借りて授業再開へ,https://www3.nhk.or.jp//news/html/20240422/k10014429601000.html,4月22日 16時44分,令和6年能登半島地震
「紅麹」問題 診察した医師「患者はいずれも尿細管に異常か」,https://www3.nhk.or.jp//news/html/20240422/k10014429631000.html,4月22日 16時40分,医療・健康
埼玉 越谷 消防職員がAVに出演し約25万円の報酬 懲戒処分に,https://www3.nhk.or.jp//news/html/20240422/k10014429591000.html,4月22日 16時37分,埼玉県
木原防衛相 5月に交代の米司令官と会談“引き続き日米連携を”,https://www3.nhk.or.jp//news/html/20240422/k10014429581000.html,4月22日 16時31分,防衛省・自衛隊
石川 七尾の和倉温泉 建物周辺の護岸 市に対し早期修復を要望,https://www3.nhk.or.jp//news/html/20240422/k10014429541000.html,4月22日 16時24分,令和6年能登半島地震
中国 太平洋地域などの海軍トップら集まる会議で米などけん制,https://www3.nhk.or.jp//news/html/20240422/k10014429561000.html,4月22日 16時23分,中国
全国の原発避難計画 調べてみえた地域差とは,https://www3.nhk.or.jp//news/html/20240422/k10014419091000.html,4月22日 16時19分,各地の原発
韓国 ユン大統領 最側近の秘書室長にチョン前国会副議長を任命,https://www3.nhk.or.jp//news/html/20240422/k10014429491000.html,4月22日 16時08分,ユン・ソンニョル（尹錫悦）大統領
