title,link,time,category
プラスチックめぐる国際条約 合意見送り 各国の隔たり埋まらず,https://www3.nhk.or.jp//news/html/20241202/k10014655511000.html,12月2日 3時13分,環境
競泳ジャパンオープン 高校3年生 成田 平井が優勝 若手が活躍,https://www3.nhk.or.jp//news/html/20241201/k10014655451000.html,12月1日 22時53分,#競泳
プラスチックめぐる国際条約 議長が合意見送りを提案 協議続く,https://www3.nhk.or.jp//news/html/20241201/k10014655071000.html,12月1日 22時47分,環境
西武 新入団選手発表 ドラフト1位 齋藤“日本一のショートに”,https://www3.nhk.or.jp//news/html/20241201/k10014655431000.html,12月1日 22時42分,#プロ野球
スノーボードW杯 ビッグエア 第2戦 男子は荻原大翔が優勝,https://www3.nhk.or.jp//news/html/20241201/k10014655481000.html,12月1日 22時33分,スノーボード
大阪 貝塚 男性を車で連れ去り監禁か 26歳の容疑者ら3人逮捕,https://www3.nhk.or.jp//news/html/20241201/k10014655461000.html,12月1日 21時54分,大阪府
維新 大阪府の吉村洋文知事 新代表に選出,https://www3.nhk.or.jp//news/html/20241201/k10014655101000.html,12月1日 21時11分,選挙
来年 日本初開催のデフリンピック 陸上の会場で日本選手権開催,https://www3.nhk.or.jp//news/html/20241201/k10014655371000.html,12月1日 20時56分,東京都
しんきゅう院など施術所 マイナ保険証導入に戸惑いの声も 長野,https://www3.nhk.or.jp//news/html/20241201/k10014655291000.html,12月1日 20時54分,マイナンバー
ロシア軍の攻撃で6人死亡 ゼレンスキー大統領は強く非難,https://www3.nhk.or.jp//news/html/20241201/k10014655391000.html,12月1日 20時53分,ウクライナ情勢
ハマス 人質男性の映像公開 停戦交渉へイスラエルなどに圧力か,https://www3.nhk.or.jp//news/html/20241201/k10014655411000.html,12月1日 20時36分,イスラエル・パレスチナ
秋田 スーパーのクマ バックヤードで確認 わな設置で捕獲へ,https://www3.nhk.or.jp//news/html/20241201/k10014655381000.html,12月1日 20時25分,秋田県
アマチュア相撲 池田俊が優勝 2年連続「アマチュア横綱」に,https://www3.nhk.or.jp//news/html/20241201/k10014655401000.html,12月1日 19時59分,東京都
【随時更新】ロシア ウクライナに軍事侵攻（12月1日の動き）,https://www3.nhk.or.jp//news/html/20241201/k10014644451000.html,12月1日 19時56分,ウクライナ情勢
猪口参院議員自宅の火事 応接室から火か 事件性なし,https://www3.nhk.or.jp//news/html/20241201/k10014655011000.html,12月1日 19時40分,東京都
シリア 反政府勢力が中部でも攻勢強める 人道状況の悪化も懸念,https://www3.nhk.or.jp//news/html/20241201/k10014654821000.html,12月1日 19時05分,シリア
ラグビー 100回目の「早明戦」 早稲田大が接戦制し6年ぶり優勝,https://www3.nhk.or.jp//news/html/20241201/k10014655281000.html,12月1日 18時45分,#ラグビー
秋田 スーパーのクマ 売り場確認も見当たらず バックヤードか,https://www3.nhk.or.jp//news/html/20241201/k10014654811000.html,12月1日 18時28分,クマ被害
サッカーJ1への昇格かけたプレーオフ 岡山と仙台が勝ち決勝へ,https://www3.nhk.or.jp//news/html/20241201/k10014655271000.html,12月1日 18時13分,#サッカーJリーグ
アメフト全日本大学選手権 立命館大が9年ぶりの決勝進出へ,https://www3.nhk.or.jp//news/html/20241201/k10014655261000.html,12月1日 18時08分,京都府
