title,link,time,category
オミクロン株 “ワクチン後も感染しやすい” 西浦教授ら分析,https://www3.nhk.or.jp//news/html/20211209/k10013381041000.html,12月9日 6時11分,新型コロナウイルス
新型コロナ 自宅療養死の遺族会が初会合 悲しみなど語り合う,https://www3.nhk.or.jp//news/html/20211209/k10013381091000.html,12月9日 6時09分,新型コロナウイルス
“メタボ健診”で体重や血糖値減少に一定の効果 厚労省検証,https://www3.nhk.or.jp//news/html/20211209/k10013380741000.html,12月9日 6時00分,
ノーベル物理学賞の真鍋淑郎さん 記念講演で地球温暖化に警鐘,https://www3.nhk.or.jp//news/html/20211209/k10013381021000.html,12月9日 5時58分,脱炭素社会への動き
台湾の出先機関開設のリトアニア 中国から圧力か EUがけん制,https://www3.nhk.or.jp//news/html/20211209/k10013380771000.html,12月9日 5時45分,ＥＵ
旧日本軍作成の煙幕実験映像発見 空襲から重要拠点守る目的,https://www3.nhk.or.jp//news/html/20211209/k10013380861000.html,12月9日 5時36分,
国保有の東京メトロ株売却へ議論開始 売却収入は復興財源に,https://www3.nhk.or.jp//news/html/20211209/k10013380701000.html,12月9日 5時34分,東日本大震災
前澤友作さん搭乗の宇宙船 ISSにドッキング 約12日間滞在開始,https://www3.nhk.or.jp//news/html/20211209/k10013381131000.html,12月9日 5時32分,
ドイツでショルツ新政権発足 メルケル氏は退任,https://www3.nhk.or.jp//news/html/20211209/k10013381121000.html,12月9日 5時20分,ドイツ
オミクロン株へのワクチンの効果「3回目で向上」ファイザー,https://www3.nhk.or.jp//news/html/20211208/k10013380951000.html,12月9日 5時04分,新型コロナウイルス
10万円給付 自治体が全額現金給付も選択できるよう調整 政府,https://www3.nhk.or.jp//news/html/20211209/k10013380671000.html,12月9日 5時00分,新型コロナウイルス
イギリスとカナダも北京五輪「外交的ボイコット」 人権に懸念,https://www3.nhk.or.jp//news/html/20211209/k10013381111000.html,12月9日 5時00分,中国
18歳以下への10万円給付 大阪 箕面市は全額を現金給付 決定,https://www3.nhk.or.jp//news/html/20211209/k10013380801000.html,12月9日 4時44分,新型コロナウイルス
韓国大統領選挙まで3か月 与野党の動きが本格化 対日姿勢は？,https://www3.nhk.or.jp//news/html/20211209/k10013380751000.html,12月9日 4時41分,韓国大統領選挙
来年の通常国会 1月17日召集案を軸に調整 参院選は7月10日か,https://www3.nhk.or.jp//news/html/20211209/k10013380681000.html,12月9日 4時10分,参院選
在日米軍 駐留経費の日本側負担 1年当たり2100億円規模で調整,https://www3.nhk.or.jp//news/html/20211209/k10013380691000.html,12月9日 4時05分,基地問題
東京五輪・パラ開催経費 “額はまだ詰めの作業中” 組織委,https://www3.nhk.or.jp//news/html/20211209/k10013380991000.html,12月9日 4時02分,東京オリンピック・パラリンピック
衆院憲法審査会 9日開催予定 与党側会合に維新 国民も参加へ,https://www3.nhk.or.jp//news/html/20211209/k10013381051000.html,12月9日 4時01分,憲法
カーリング 混合ダブルスは世界最終予選敗退 五輪出場ならず,https://www3.nhk.or.jp//news/html/20211209/k10013381071000.html,12月9日 1時24分,カーリング
ことしの検索大賞に「大谷翔平」 この1年で検索数が最も上昇,https://www3.nhk.or.jp//news/html/20211209/k10013380941000.html,12月9日 0時05分,
