title,link,time,category
香川県 新型コロナ 新たに191人感染確認 過去最多,https://www3.nhk.or.jp//news/html/20220125/k10013448941000.html,1月25日 13時45分,新型コロナ 国内感染者数
ウマヅラハギの生態調査始まる 背びれに電子標識 富山湾,https://www3.nhk.or.jp//news/html/20220125/k10013448771000.html,1月25日 13時43分,環境
徳島県 新型コロナ 新たに92人感染確認 過去最多,https://www3.nhk.or.jp//news/html/20220125/k10013448931000.html,1月25日 13時37分,新型コロナ 国内感染者数
財務省 全国の景気判断1年3か月ぶり引き上げ 沖縄のみ引き下げ,https://www3.nhk.or.jp//news/html/20220125/k10013448661000.html,1月25日 13時33分,新型コロナ 経済影響
ご当地アイドル ライブ中のビル放火 懲役11年の判決 徳島地裁,https://www3.nhk.or.jp//news/html/20220125/k10013448851000.html,1月25日 13時32分,事件
大阪 感染者急増で宿泊療養施設を増設 看護師の確保も急ピッチ,https://www3.nhk.or.jp//news/html/20220125/k10013448901000.html,1月25日 13時28分,新型コロナウイルス
株価 一時600円以上値下がり 約5か月ぶりに2万7000円下回る,https://www3.nhk.or.jp//news/html/20220125/k10013448921000.html,1月25日 13時24分,株価・為替
新年度予算案 関係資料に3省で計4つの新たなミスで首相陳謝,https://www3.nhk.or.jp//news/html/20220125/k10013448691000.html,1月25日 13時19分,
堀内ワクチン相 “接種の有無で差別的取り扱いは不適切“”,https://www3.nhk.or.jp//news/html/20220125/k10013448881000.html,1月25日 13時14分,新型コロナウイルス
100社アンケート ことしの賃上げ 企業側の慎重姿勢浮き彫りに,https://www3.nhk.or.jp//news/html/20220125/k10013447991000.html,1月25日 13時11分,春闘
ワクチン3回目接種券 前倒し発送など 自治体は対応に追われる,https://www3.nhk.or.jp//news/html/20220125/k10013448861000.html,1月25日 12時59分,新型コロナ ワクチン（日本国内）
「まん延防止」 新たに18道府県追加 政府分科会が了承,https://www3.nhk.or.jp//news/html/20220125/k10013448631000.html,1月25日 12時46分,新型コロナウイルス
20代女性の遺体遺棄か 栃木県内のアパートから“車で運んだ”,https://www3.nhk.or.jp//news/html/20220125/k10013448811000.html,1月25日 12時44分,事件
山口 米軍岩国基地 新型コロナ 基地関係者30人の感染確認,https://www3.nhk.or.jp//news/html/20220125/k10013448831000.html,1月25日 12時43分,新型コロナ 国内感染者数
国交省 統計データ書き換え 首相“検討委で過去統計復元急ぐ”,https://www3.nhk.or.jp//news/html/20220125/k10013448781000.html,1月25日 12時39分,
メガソーラー計画 “環境に負荷 抜本的な見直し必要” 環境相,https://www3.nhk.or.jp//news/html/20220125/k10013448731000.html,1月25日 12時28分,環境
車にはねられ2人死亡の事故“ペットが気になりよそ見”　川崎,https://www3.nhk.or.jp//news/html/20220125/k10013448751000.html,1月25日 12時25分,事故
関東南部中心に雪 東京23区も積雪か 交通影響や凍結など注意,https://www3.nhk.or.jp//news/html/20220125/k10013448741000.html,1月25日 12時19分,気象
福島県 新型コロナ 新たに207人感染確認,https://www3.nhk.or.jp//news/html/20220125/k10013448791000.html,1月25日 12時18分,新型コロナ 国内感染者数
無免許運転繰り返した罪 木下元都議 初公判で起訴内容認める,https://www3.nhk.or.jp//news/html/20220125/k10013448761000.html,1月25日 12時15分,
