title,link,time,category
【動画】青森 むつ市の大雨被害 上空からの映像,https://www3.nhk.or.jp//news/html/20210811/k10013194241000.html,8月11日 12時35分,気象
ムン政権に対する不適切発言の駐韓前総括公使 帰国の途に,https://www3.nhk.or.jp//news/html/20210811/k10013194191000.html,8月11日 12時32分,日韓関係
ドイツ流通大手「メトロ」日本撤退へ 従業員の雇用契約を解消,https://www3.nhk.or.jp//news/html/20210811/k10013194151000.html,8月11日 12時21分,
米大統領 アフガニスタン駐留米軍 今月末までに撤退に変更なし,https://www3.nhk.or.jp//news/html/20210811/k10013194131000.html,8月11日 12時16分,米 バイデン大統領
大雨で道路が寸断 孤立状態地区の支援本格化へ 青森 下北半島,https://www3.nhk.or.jp//news/html/20210811/k10013194141000.html,8月11日 12時08分,台風
13日にかけ西日本で非常に激しい雨のおそれ 災害に警戒を,https://www3.nhk.or.jp//news/html/20210811/k10013193881000.html,8月11日 12時04分,気象
都医師会 自宅療養者の健康観察 かかりつけ医に協力求める事に,https://www3.nhk.or.jp//news/html/20210811/k10013194171000.html,8月11日 12時02分,新型コロナウイルス
核兵器禁止条約 締約国会議 来年3月に延期 新型コロナ影響で,https://www3.nhk.or.jp//news/html/20210811/k10013194041000.html,8月11日 11時36分,核兵器禁止条約
佐賀 江北町 高齢者等避難の情報 4地区の計1547世帯,https://www3.nhk.or.jp//news/html/20210811/k10013194111000.html,8月11日 11時32分,気象
山形県 新型コロナ 新たに43人感染確認 県内累計2436人に,https://www3.nhk.or.jp//news/html/20210811/k10013194101000.html,8月11日 11時31分,新型コロナ 国内感染者数
秋葉国家安全保障局長 米国防長官と会談 日米同盟を一層強化,https://www3.nhk.or.jp//news/html/20210811/k10013194051000.html,8月11日 11時29分,南シナ海問題
福島県 新型コロナ 新たに91人感染確認 県内延べ6710人,https://www3.nhk.or.jp//news/html/20210811/k10013194091000.html,8月11日 11時26分,新型コロナ 国内感染者数
夏の全国高校野球 大会2日目 第1試合 智弁学園10ー3倉敷商,https://www3.nhk.or.jp//news/html/20210811/k10013193981000.html,8月11日 11時16分,高校野球
島根県 新型コロナ 新たに12人感染確認 県内計839人に,https://www3.nhk.or.jp//news/html/20210811/k10013194071000.html,8月11日 11時14分,新型コロナ 国内感染者数
東日本大震災から10年5か月 気仙沼の慰霊碑で祈り,https://www3.nhk.or.jp//news/html/20210811/k10013193991000.html,8月11日 11時03分,東日本大震災
鳥取県 新型コロナ 新たに23人感染確認 県内累計1034人に,https://www3.nhk.or.jp//news/html/20210811/k10013194011000.html,8月11日 10時52分,新型コロナ 国内感染者数
北朝鮮 キム総書記の側近 米韓合同軍事演習をけん制,https://www3.nhk.or.jp//news/html/20210811/k10013193971000.html,8月11日 10時50分,北朝鮮情勢
エンジェルス 大谷翔平 4試合ぶり先発出場もノーヒット,https://www3.nhk.or.jp//news/html/20210811/k10013194001000.html,8月11日 10時48分,大リーグ
青森 七戸町 避難指示すべて解除,https://www3.nhk.or.jp//news/html/20210811/k10013193961000.html,8月11日 8時57分,気象
東京オリンピック アメリカでの視聴者数は過去最少,https://www3.nhk.or.jp//news/html/20210811/k10013193951000.html,8月11日 8時42分,オリンピック・パラリンピック
