title,link,time,category
石川県医師会会長 輪島の臨時診療所を視察 医療機関の状況確認,https://www3.nhk.or.jp//news/html/20240221/k10014366031000.html,2月21日 13時11分,令和6年能登半島地震
【石川 交通影響】鉄道 航空 バス 道路（2月21日）,https://www3.nhk.or.jp//news/html/20240221/k10014365891000.html,2月21日 13時08分,令和6年能登半島地震
イチローさん マリナーズのキャンプに参加 献身的にサポート,https://www3.nhk.or.jp//news/html/20240221/k10014366071000.html,2月21日 13時00分,野球
筒香「結果出さないといけない立場」大リーグ昇格に向けて決意,https://www3.nhk.or.jp//news/html/20240221/k10014366081000.html,2月21日 12時58分,大リーグ
ヌートバー フェンス越えの打球 車の窓ガラス割るアクシデント,https://www3.nhk.or.jp//news/html/20240221/k10014366091000.html,2月21日 12時56分,ラーズ・ヌートバー
山本由伸の開幕シリーズ先発起用は“妥当” ドジャース監督,https://www3.nhk.or.jp//news/html/20240221/k10014366021000.html,2月21日 12時53分,山本由伸
屋久島沖オスプレイ墜落事故  機体調査進めている 米軍発表,https://www3.nhk.or.jp//news/html/20240221/k10014365791000.html,2月21日 12時50分,オスプレイ
【随時更新2月21日】アメリカ拒否権行使 ガザ停戦決議案は否決,https://www3.nhk.or.jp//news/html/20240221/k10014365751000.html,2月21日 12時48分,イスラエル・パレスチナ
日経平均株価 一時200円以上値下がり 3万8000円台前半で推移,https://www3.nhk.or.jp//news/html/20240221/k10014365861000.html,2月21日 12時47分,きょうの株価
G7交通相 紅海周辺での船舶攻撃 フーシ派強く非難する閣僚宣言,https://www3.nhk.or.jp//news/html/20240221/k10014366051000.html,2月21日 12時36分,イスラエル・パレスチナ
【石川 給水 入浴支援情報】輪島・珠洲などで実施（21日予定）,https://www3.nhk.or.jp//news/html/20240221/k10014365711000.html,2月21日 12時32分,令和6年能登半島地震
【随時更新】ロシア ウクライナに軍事侵攻（2月21日の動き）,https://www3.nhk.or.jp//news/html/20240221/k10014365761000.html,2月21日 12時30分,ウクライナ情勢
大正時代の洋館「春木屋洋品店」損傷激しく再建断念 石川 七尾,https://www3.nhk.or.jp//news/html/20240221/k10014365971000.html,2月21日 12時28分,令和6年能登半島地震
自民 派閥政治資金問題 松野氏 西村氏ら5人 政倫審出席の意向,https://www3.nhk.or.jp//news/html/20240221/k10014365851000.html,2月21日 12時26分,政治資金
成年後見制度の見直し 有識者らの研究会が報告書案まとめる,https://www3.nhk.or.jp//news/html/20240221/k10014365981000.html,2月21日 12時20分,
福島第一原発 汚染水トラブル 経産相が東京電力社長に指導,https://www3.nhk.or.jp//news/html/20240221/k10014365991000.html,2月21日 12時13分,福島第一原発
浜名湖 高校生遺体事件 全身にあざ 暴行受けた際にできたか,https://www3.nhk.or.jp//news/html/20240221/k10014366001000.html,2月21日 11時55分,事件
性的暴行疑いで逮捕の監督“映画出るなら裸に”女性に伝えたか,https://www3.nhk.or.jp//news/html/20240221/k10014365961000.html,2月21日 11時54分,事件
野党4党の参院国対委員長が会談 参院でも政倫審開催を要求へ,https://www3.nhk.or.jp//news/html/20240221/k10014365941000.html,2月21日 11時43分,政治資金
地震の被害免れた輪島塗の作品 若手職人が東京で展示即売会,https://www3.nhk.or.jp//news/html/20240221/k10014365921000.html,2月21日 11時27分,令和6年能登半島地震
