title,link,time,category
フィリピンと中国 南シナ海の上空で「妨害」と非難の応酬に,https://www3.nhk.or.jp//news/html/20240811/k10014545851000.html,8月11日 6時08分,フィリピン
レスリング 元木咲良 金メダル 女子62キロ級 パリオリンピック,https://www3.nhk.or.jp//news/html/20240811/k10014546001000.html,8月11日 6時08分,#レスリング
北口榛花が金メダル 陸上女子やり投げ パリ五輪【詳しく】,https://www3.nhk.or.jp//news/html/20240811/k10014545871000.html,8月11日 6時00分,#陸上競技
ガザ地区学校空爆で多数の死傷者 イスラエルへ非難相次ぐ,https://www3.nhk.or.jp//news/html/20240811/k10014545931000.html,8月11日 5時49分,イスラエル・パレスチナ
アーティスティックS  デュエット 日本は8位 パリ五輪,https://www3.nhk.or.jp//news/html/20240811/k10014545971000.html,8月11日 5時47分,#アーティスティックスイミング
パリオリンピック 日本の金メダル17個 海外の大会の最多を更新,https://www3.nhk.or.jp//news/html/20240811/k10014545621000.html,8月11日 5時39分,#パリオリンピック
陸上男子1600mリレー 日本 アジア新で6位 パリオリンピック,https://www3.nhk.or.jp//news/html/20240811/k10014545951000.html,8月11日 5時23分,#陸上競技
陸上男子 走り高跳び 赤松諒一は5位 パリオリンピック,https://www3.nhk.or.jp//news/html/20240811/k10014545921000.html,8月11日 5時19分,#陸上競技
パリオリンピック【結果】8/10～11タイムライン,https://www3.nhk.or.jp//news/html/20240810/k10014545451000.html,8月11日 5時06分,#パリオリンピック
ブレイキン男子 「Shigekix」半井重幸 3位決定戦で敗れ4位,https://www3.nhk.or.jp//news/html/20240811/k10014545861000.html,8月11日 5時05分,#ブレイキン
レスリング 高谷大地が銀メダル 男子フリー74キロ級 パリ五輪,https://www3.nhk.or.jp//news/html/20240811/k10014545881000.html,8月11日 4時41分,#レスリング
近代五種 佐藤大宗 銀メダル 近代五種で初のメダル パリ五輪,https://www3.nhk.or.jp//news/html/20240811/k10014545891000.html,8月11日 3時45分,#近代五種
サッカー女子 アメリカが3大会ぶり金メダル パリオリンピック,https://www3.nhk.or.jp//news/html/20240811/k10014545911000.html,8月11日 3時26分,#サッカー
レスリング女子76キロ級 鏡優翔が決勝進出 パリ五輪,https://www3.nhk.or.jp//news/html/20240810/k10014545661000.html,8月11日 3時20分,#レスリング
レスリング男子フリー65キロ級 清岡幸大郎が決勝進出 パリ五輪,https://www3.nhk.or.jp//news/html/20240810/k10014545651000.html,8月11日 2時55分,#レスリング
男子高飛び込み 玉井陸斗 銀メダル 飛び込みで五輪初のメダル,https://www3.nhk.or.jp//news/html/20240810/k10014545811000.html,8月11日 2時42分,#飛び込み
ゴルフ女子 山下美夢有は4位 メダルならず パリ五輪【詳しく】,https://www3.nhk.or.jp//news/html/20240810/k10014545431000.html,8月11日 2時14分,#ゴルフ（女子）
卓球 女子団体 日本が銀 4大会連続のメダル 五輪【詳しく】,https://www3.nhk.or.jp//news/html/20240810/k10014545711000.html,8月11日 1時56分,#卓球
近代五種 内田美咲は決勝進出ならず パリオリンピック,https://www3.nhk.or.jp//news/html/20240811/k10014545841000.html,8月11日 1時55分,#近代五種
スポーツクライミング女子 森秋彩は4位 パリオリンピック,https://www3.nhk.or.jp//news/html/20240810/k10014545611000.html,8月11日 1時53分,#スポーツクライミング
