title,link,time,category
共産党 不破哲三氏 党の指導機関 中央委員から外れる見通し,https://www3.nhk.or.jp//news/html/20240117/k10014324501000.html,1月17日 17時35分,
エステ店装い複数マンションで性的サービスか 従業員13人逮捕,https://www3.nhk.or.jp//news/html/20240117/k10014324461000.html,1月17日 17時29分,事件
ヤクルト 村上宗隆 自主トレ公開「三冠王をもう一度取りたい」,https://www3.nhk.or.jp//news/html/20240117/k10014324541000.html,1月17日 17時28分,プロ野球
【被害状況 17日】石川県で232人死亡 重軽傷者1045人(14時),https://www3.nhk.or.jp//news/html/20240117/k10014323981000.html,1月17日 17時24分,令和6年能登半島地震
柿沢前法務副大臣を起訴 東京地検特捜部 公選法違反の買収の罪,https://www3.nhk.or.jp//news/html/20240117/k10014324161000.html,1月17日 17時18分,事件
幼稚園の送迎バスにクレーン車追突 バスの園児ら10人軽いけが,https://www3.nhk.or.jp//news/html/20240117/k10014324371000.html,1月17日 17時15分,事故
被災地の2次避難や集団避難 分かれる判断 離ればなれの家族も,https://www3.nhk.or.jp//news/html/20240117/k10014324121000.html,1月17日 17時12分,令和6年能登半島地震
去年の訪日外国人旅行者 2500万人余 新型コロナ前の8割近くに,https://www3.nhk.or.jp//news/html/20240117/k10014324491000.html,1月17日 17時11分,新型コロナ 経済影響
【更新中】阪神・淡路大震災29年 能登半島地震の時間に黙とう,https://www3.nhk.or.jp//news/html/20240116/k10014322971000.html,1月17日 17時08分,阪神・淡路大震災
阪神・淡路大震災から29年 今の被災地支援に教訓どう生かすか,https://www3.nhk.or.jp//news/html/20240117/k10014323261000.html,1月17日 17時04分,阪神・淡路大震災
同性パートナーに遺族給付は？最高裁弁論へ 2審判決見直しか,https://www3.nhk.or.jp//news/html/20240117/k10014324481000.html,1月17日 17時02分,ジェンダー
「資産を分配する」と呼びかけ カードなど送らせたか 2人逮捕,https://www3.nhk.or.jp//news/html/20240117/k10014324381000.html,1月17日 16時56分,IT・ネット
日本とマーシャル諸島の生徒が交流会「ビキニ事件」から70年,https://www3.nhk.or.jp//news/html/20240117/k10014324331000.html,1月17日 16時50分,神奈川県
七尾の高齢者施設 地震でエレベーター故障 体力低下など懸念,https://www3.nhk.or.jp//news/html/20240117/k10014324351000.html,1月17日 16時35分,令和6年能登半島地震
石川県 能登半島地震の死者名を新たに公表 遺族同意の16人,https://www3.nhk.or.jp//news/html/20240117/k10014324451000.html,1月17日 16時34分,令和6年能登半島地震
遺伝子組み換え熱帯魚を違法販売か 熱帯魚店経営者ら逮捕 東京,https://www3.nhk.or.jp//news/html/20240117/k10014324131000.html,1月17日 16時32分,事件
ダイハツ 認証取得の不正問題 2車種についてリコールを検討,https://www3.nhk.or.jp//news/html/20240117/k10014324411000.html,1月17日 16時29分,自動車
コシノジュンコさんデザイン御朱印帳 熊野古道 世界遺産20年で,https://www3.nhk.or.jp//news/html/20240117/k10014324421000.html,1月17日 16時20分,和歌山県
韓国 刃物で襲われた最大野党のイ・ジェミョン代表 退院し復帰,https://www3.nhk.or.jp//news/html/20240117/k10014324341000.html,1月17日 16時02分,韓国
中国の人口 推計14億967万人 2年連続の減少で減少幅は拡大,https://www3.nhk.or.jp//news/html/20240117/k10014324081000.html,1月17日 16時01分,中国
