title,link,time,category
アメリカ 12月の小売業売上高 5か月ぶりの減少,https://www3.nhk.or.jp//news/html/20220115/k10013431821000.html,1月15日 10時59分,
東大 共通テスト受験生ら3人切られる 意識あり 少年を逮捕,https://www3.nhk.or.jp//news/html/20220115/k10013431921000.html,1月15日 10時56分,事件
仏映画界の巨匠 ジャンジャック・ベネックス監督死去 75歳,https://www3.nhk.or.jp//news/html/20220115/k10013431851000.html,1月15日 10時54分,訃報
トルコとアルメニア 国交正常化に向け協議始める,https://www3.nhk.or.jp//news/html/20220115/k10013431861000.html,1月15日 10時21分,
「アラブの春」から11年 チュニジアで市民抗議デモ,https://www3.nhk.or.jp//news/html/20220115/k10013431841000.html,1月15日 10時18分,
北朝鮮 14日のミサイル発射は「鉄道機動ミサイル連隊」の訓練,https://www3.nhk.or.jp//news/html/20220115/k10013431871000.html,1月15日 9時21分,北朝鮮 ミサイル
スキーフリースタイルモーグルW杯 日本勢が男女で優勝,https://www3.nhk.or.jp//news/html/20220115/k10013431901000.html,1月15日 9時02分,スキー（フリースタイル）
「ゴジラ」の音楽など手がけた伊福部昭の資料 東京音大に寄贈,https://www3.nhk.or.jp//news/html/20220115/k10013431471000.html,1月15日 8時53分,
大阪の倉庫火災 倉庫で勤務の19歳少年を放火の疑いで逮捕,https://www3.nhk.or.jp//news/html/20220115/k10013431831000.html,1月15日 8時15分,事件
京都市消防局制作の火災避難マニュアル動画 再生回数が大幅増,https://www3.nhk.or.jp//news/html/20220115/k10013431561000.html,1月15日 8時00分,大阪 ビル放火事件
パラスノースポーツ世界選手権 スノーボード 小栗と大岩根 4位,https://www3.nhk.or.jp//news/html/20220115/k10013431771000.html,1月15日 7時56分,パラスキー
NY原油先物価格 約2か月ぶり1バレル84ドル台まで値上がり,https://www3.nhk.or.jp//news/html/20220115/k10013431881000.html,1月15日 7時37分,原油価格
香港政府 夜間の外食禁止などの規制 2月3日まで延長を発表,https://www3.nhk.or.jp//news/html/20220115/k10013431591000.html,1月15日 7時26分,新型コロナウイルス
山形新幹線 山形県内の大雪影響で上り3本 駅や線路上で動けず,https://www3.nhk.or.jp//news/html/20220114/k10013431741000.html,1月15日 7時20分,気象
統計データ書き換え問題 国土交通省 再発防止策の検討急ぐ,https://www3.nhk.or.jp//news/html/20220115/k10013431521000.html,1月15日 6時55分,
失業手当の受給期間 新たに起業した場合 最大4年間に延長へ,https://www3.nhk.or.jp//news/html/20220115/k10013431531000.html,1月15日 6時38分,
感染者の待機期間などの扱い 引き続き見直し検討へ 厚生労働省,https://www3.nhk.or.jp//news/html/20220115/k10013431641000.html,1月15日 6時29分,新型コロナウイルス
新型コロナ感染急拡大のインド“死者の7割 ワクチン接種せず”,https://www3.nhk.or.jp//news/html/20220115/k10013431571000.html,1月15日 6時22分,新型コロナ ワクチン（世界）
軽井沢スキーツアーバス事故から6年 現場近くで安全誓い追悼,https://www3.nhk.or.jp//news/html/20220115/k10013431481000.html,1月15日 6時19分,事故
急激な感染拡大の沖縄 医師「不足人員補える次元超えている」,https://www3.nhk.or.jp//news/html/20220115/k10013431791000.html,1月15日 6時14分,新型コロナウイルス
