title,link,time,category
日大 田中前理事長 脱税の罪 来月15日に東京地裁で初公判,https://www3.nhk.or.jp//news/html/20220118/k10013436461000.html,1月18日 13時45分,事件
徳島 雑居ビル放火事件 被告が起訴内容認める 徳島地裁,https://www3.nhk.or.jp//news/html/20220118/k10013436421000.html,1月18日 13時41分,事件
米軍 岩国基地 新型コロナ 新たに8人感染確認,https://www3.nhk.or.jp//news/html/20220118/k10013436501000.html,1月18日 13時37分,新型コロナ 国内感染者数
岸田首相「まん延防止等重点措置 速やかに判断したい」,https://www3.nhk.or.jp//news/html/20220118/k10013436481000.html,1月18日 13時25分,新型コロナウイルス
長崎県 中村知事 「まん延防止等重点措置」政府に適用を要請,https://www3.nhk.or.jp//news/html/20220118/k10013436261000.html,1月18日 13時23分,新型コロナウイルス
熊本県 「まん延防止等重点措置」適用を政府に要請,https://www3.nhk.or.jp//news/html/20220118/k10013436211000.html,1月18日 13時22分,新型コロナウイルス
FIFA年間最優秀選手 男子はレバンドフスキ 女子はプテリャス,https://www3.nhk.or.jp//news/html/20220118/k10013436441000.html,1月18日 13時20分,サッカー
「まん延防止措置」要請は1都9県 松野官房長官,https://www3.nhk.or.jp//news/html/20220118/k10013436311000.html,1月18日 13時18分,新型コロナウイルス
統計データ書き換え 斉藤国交相 みずから含め関係者処分の考え,https://www3.nhk.or.jp//news/html/20220118/k10013436431000.html,1月18日 13時17分,
みずほの経営陣刷新 鈴木金融相「課題の抜本的な改善を」,https://www3.nhk.or.jp//news/html/20220118/k10013436391000.html,1月18日 13時09分,
国交省統計データ書き換え 総務相「意思疎通が不十分だった」,https://www3.nhk.or.jp//news/html/20220118/k10013436231000.html,1月18日 13時04分,
尾身会長“オミクロン株 特徴にふさわしい効果的な対策を”,https://www3.nhk.or.jp//news/html/20220118/k10013436451000.html,1月18日 12時59分,新型コロナウイルス
立民 給付受けられないひとり親世帯に10万円を支給 法案を提出,https://www3.nhk.or.jp//news/html/20220118/k10013436371000.html,1月18日 12時54分,
都内の公立小勤務 パキスタン人講師を逮捕 女性に暴行疑い,https://www3.nhk.or.jp//news/html/20220118/k10013436401000.html,1月18日 12時48分,事件
日銀 大規模金融緩和策を維持 新年度物価見通しプラス1.1％に,https://www3.nhk.or.jp//news/html/20220118/k10013436071000.html,1月18日 12時45分,
都内の自宅療養者1万人超に 第5波以来 感染急拡大で一気に増加,https://www3.nhk.or.jp//news/html/20220118/k10013436381000.html,1月18日 12時42分,新型コロナ 国内感染者数
【動画】受験の成功祈って“合格”リンゴをプレゼント 青森,https://www3.nhk.or.jp//news/html/20220118/k10013436351000.html,1月18日 12時40分,
東京 世田谷区 薬局などで抗原検査キットの無料配布へ,https://www3.nhk.or.jp//news/html/20220118/k10013436251000.html,1月18日 12時35分,新型コロナウイルス
新潟県「まん延防止等重点措置」適用するよう政府に要請を決定,https://www3.nhk.or.jp//news/html/20220118/k10013436361000.html,1月18日 12時33分,新型コロナウイルス
ふるさと納税 返礼品の基準 確認徹底を自治体に通知 総務相,https://www3.nhk.or.jp//news/html/20220118/k10013436331000.html,1月18日 12時29分,
