title,link,time,category
ロシアの民間軍事会社 北朝鮮からロケット弾やミサイル調達か,https://www3.nhk.or.jp//news/html/20221223/k10013932951000.html,12月23日 19時08分,ロシア
クリスマスにも「物価高」値上げラッシュ 年明けも7000品目超,https://www3.nhk.or.jp//news/html/20221223/k10013932121000.html,12月23日 19時03分,物価高騰
サッカー日本代表 来年3月にワールドカップ後初の強化試合,https://www3.nhk.or.jp//news/html/20221223/k10013932561000.html,12月23日 19時02分,サッカー
先月就任した松本総務相の資産公開,https://www3.nhk.or.jp//news/html/20221223/k10013933201000.html,12月23日 19時00分,
関東運輸局の給与事務職員 自分の給与勝手に水増し 懲戒免職,https://www3.nhk.or.jp//news/html/20221223/k10013933121000.html,12月23日 18時58分,神奈川県
コロナ第8波 都内の大学病院 病床ひっ迫 救急受け入れ困難も,https://www3.nhk.or.jp//news/html/20221223/k10013933101000.html,12月23日 18時57分,新型コロナウイルス
年末年始にコロナ無料検査拠点 全国の主要駅など126か所設置へ,https://www3.nhk.or.jp//news/html/20221223/k10013933011000.html,12月23日 18時54分,新型コロナウイルス
沖縄 機関砲の実弾誤射 巡視船の当時の船長ら3人懲戒処分 海保,https://www3.nhk.or.jp//news/html/20221223/k10013933081000.html,12月23日 18時53分,沖縄県
TikTok運営会社の社員 取材担当記者のデータに不正アクセス,https://www3.nhk.or.jp//news/html/20221223/k10013933091000.html,12月23日 18時52分,IT・ネット
【随時更新】大雪 各地の状況 停電 事故 通行止め 物流に乱れ,https://www3.nhk.or.jp//news/html/20221223/k10013932011000.html,12月23日 18時50分,気象
税制改正大綱を閣議決定 防衛力の必要財源に増税実施盛り込む,https://www3.nhk.or.jp//news/html/20221223/k10013932971000.html,12月23日 18時50分,税制改正
日本海側などで雪が強まる 山形で“顕著な大雪” 厳重警戒を,https://www3.nhk.or.jp//news/html/20221223/k10013931861000.html,12月23日 18時47分,気象
新型コロナ 中国に滞在の日本人1人が死亡 官房長官明らかに,https://www3.nhk.or.jp//news/html/20221223/k10013932351000.html,12月23日 18時46分,新型コロナウイルス
従来の保険証 3割負担の患者の場合 窓口負担6円上乗せ,https://www3.nhk.or.jp//news/html/20221223/k10013932841000.html,12月23日 18時46分,マイナンバー
神奈川 茅ヶ崎 男性刺殺事件 逮捕の容疑者 レンタカーで逃走か,https://www3.nhk.or.jp//news/html/20221223/k10013933061000.html,12月23日 18時41分,事件
来年度の国家公務員の定員 全体で約860人増へ,https://www3.nhk.or.jp//news/html/20221223/k10013933131000.html,12月23日 18時41分,
旧優生保護法弁護団「国は全国調査すべき」江差町のホーム問題,https://www3.nhk.or.jp//news/html/20221223/k10013933021000.html,12月23日 18時40分,北海道
北朝鮮から弾道ミサイルの可能性のあるもの EEZ外に落下か,https://www3.nhk.or.jp//news/html/20221223/k10013932791000.html,12月23日 18時33分,北朝鮮 ミサイル
トラックなどの運転手 拘束時間上限 2年後から大幅引き下げ,https://www3.nhk.or.jp//news/html/20221223/k10013932901000.html,12月23日 18時31分,働き方改革
“あすから1週間 電力の安定供給を確保” 経済産業省,https://www3.nhk.or.jp//news/html/20221223/k10013932991000.html,12月23日 18時29分,
