title,link,time,category
鹿児島 川内原発 運転差し止め訴訟 きょう判決 13年前に提訴,https://www3.nhk.or.jp//news/html/20250221/k10014728581000.html,2月21日 6時05分,各地の原発
原爆投下80年 被爆の記憶継承へ 全国から体験記募集 厚労省,https://www3.nhk.or.jp//news/html/20250221/k10014728461000.html,2月21日 6時04分,原爆
ゼレンスキー大統領と米特使 共同会見中止 首脳間の関係影響か,https://www3.nhk.or.jp//news/html/20250221/k10014728811000.html,2月21日 5時50分,ウクライナ情勢
ガザ地区停戦 人質4人の遺体が返還 恒久的な停戦協議は進まず,https://www3.nhk.or.jp//news/html/20250221/k10014728661000.html,2月21日 5時49分,
トランプ大統領が離脱示唆 巨大IT企業課税 国際協調の行方は,https://www3.nhk.or.jp//news/html/20250221/k10014728631000.html,2月21日 5時48分,トランプ大統領
自民公明維新 教育無償化は方向性確認 社会保険料で詰めの調整,https://www3.nhk.or.jp//news/html/20250221/k10014728601000.html,2月21日 5時46分,来年度（新年度）予算
小学生が育てたサケの稚魚を学校近くの川に放流 宮城 大崎,https://www3.nhk.or.jp//news/html/20250221/k10014728301000.html,2月21日 5時02分,宮城県
北海道 知内町 特産カキの水揚げが本格化,https://www3.nhk.or.jp//news/html/20250221/k10014728331000.html,2月21日 5時00分,北海道
熊本市電の人気車両 22日で運転終了 最後の3日間は特別運行,https://www3.nhk.or.jp//news/html/20250221/k10014728321000.html,2月21日 5時00分,鉄道
在日ウクライナ商工会議所 設立式典 国の復興に企業の連携強化,https://www3.nhk.or.jp//news/html/20250221/k10014728821000.html,2月21日 4時30分,ウクライナ情勢
ミャンマーで保護 日本人高校生 中国系の男の指示で詐欺加担か,https://www3.nhk.or.jp//news/html/20250221/k10014728831000.html,2月21日 4時20分,ミャンマー
G20外相会合 “日本のウクライナ支援継続を強調” 岩屋外相,https://www3.nhk.or.jp//news/html/20250221/k10014728671000.html,2月21日 4時17分,G20
IAEA事務局長 処理水モニタリング調査「これまでより頻繁に」,https://www3.nhk.or.jp//news/html/20250221/k10014728781000.html,2月21日 2時37分,福島第一原発 処理水
NYダウ 一時650ドル超下落 個人消費の先行きへの懸念,https://www3.nhk.or.jp//news/html/20250221/k10014728791000.html,2月21日 2時27分,金融
バスケ男子日本代表 アジアカップ予選 中国に大差で敗れる,https://www3.nhk.or.jp//news/html/20250221/k10014728771000.html,2月21日 0時17分,#バスケットボール
福島第一原発で試験的に採取 核燃料デブリ 茨城の施設で初公開,https://www3.nhk.or.jp//news/html/20250221/k10014728641000.html,2月21日 0時09分,福島第一原発
岩手 大船渡 山林火災消し止められず 62世帯157人に避難指示,https://www3.nhk.or.jp//news/html/20250220/k10014727951000.html,2月20日 23時43分,岩手県
韓国 ユン大統領の弾劾裁判 25日結審へ 3月中旬にも決定か,https://www3.nhk.or.jp//news/html/20250220/k10014728731000.html,2月20日 23時36分,ユン・ソンニョル（尹錫悦）大統領
フィギュア 四大陸選手権 男子シングルSP 友野一希が3位,https://www3.nhk.or.jp//news/html/20250220/k10014728761000.html,2月20日 23時07分,#フィギュアスケート
G20外相会合開幕 岩屋外相 ウクライナ支援継続の考え強調へ,https://www3.nhk.or.jp//news/html/20250220/k10014728721000.html,2月20日 22時21分,G20
