title,link,time,category
天皇皇后両陛下 イギリスに到着 エリザベス女王の国葬参列で,https://www3.nhk.or.jp//news/html/20220918/k10013823161000.html,9月18日 3時14分,皇室
台風14号 鹿児島県に暴風 波浪 高潮の特別警報 最大級の警戒を,https://www3.nhk.or.jp//news/html/20220917/k10013823261000.html,9月18日 2時56分,台風
カブス 鈴木誠也 一時的な産休制度使いチーム離脱,https://www3.nhk.or.jp//news/html/20220918/k10013823341000.html,9月18日 2時54分,大リーグ
【随時更新】ロシア ウクライナに軍事侵攻（18日の動き）,https://www3.nhk.or.jp//news/html/20220918/k10013777211000.html,9月18日 1時06分,ウクライナ情勢
台風14号 緊急安全確保が約7800世帯 避難指示が96万世帯余,https://www3.nhk.or.jp//news/html/20220917/k10013823081000.html,9月18日 0時40分,台風
高潮にも厳重な警戒を 九州の主な港の満潮時間,https://www3.nhk.or.jp//news/html/20220918/k10013823331000.html,9月18日 0時34分,台風
台風14号 九州新幹線で計画運休も 交通への影響は,https://www3.nhk.or.jp//news/html/20220917/k10013822141000.html,9月18日 0時32分,台風
円安さらに進むか 鍵を握るのはスイス？【経済コラム】,https://www3.nhk.or.jp//news/html/20220916/k10013820321000.html,9月18日 0時19分,コラム 株・円相場
テニス デビスカップ 日本敗れ ファイナルズ予選出場権逃す,https://www3.nhk.or.jp//news/html/20220918/k10013823231000.html,9月18日 0時12分,テニス
競泳ジャパンパラ大会 世界選手権金メダルの小野智華子が優勝,https://www3.nhk.or.jp//news/html/20220917/k10013822981000.html,9月17日 23時52分,競泳
鹿児島県に台風の特別警報「暴風吹き始め前の避難重要」気象庁,https://www3.nhk.or.jp//news/html/20220917/k10013823281000.html,9月17日 23時51分,台風
プロ野球 マジックナンバー ソフトバンク9のまま ヤクルト8に,https://www3.nhk.or.jp//news/html/20220917/k10013823291000.html,9月17日 23時49分,プロ野球
緊急安全確保 命を守る行動を 鹿児島県西之表市 全域に,https://www3.nhk.or.jp//news/html/20220917/k10013823311000.html,9月17日 23時42分,台風
J1第30節 2位川崎は柏と引き分け 首位と勝ち点差4に,https://www3.nhk.or.jp//news/html/20220917/k10013823271000.html,9月17日 23時39分,サッカー
大相撲 秋場所7日目 横綱 照ノ富士 連敗を2で止める,https://www3.nhk.or.jp//news/html/20220917/k10013823111000.html,9月17日 22時21分,大相撲
御嶽山噴火から8年を前にシェルターを初めて使った避難訓練,https://www3.nhk.or.jp//news/html/20220917/k10013823241000.html,9月17日 22時20分,
【災害担当デスク解説】鹿児島県に特別警報 最大級の警戒を,https://www3.nhk.or.jp//news/html/20220917/k10013823251000.html,9月17日 22時17分,台風
日朝首脳会談から20年 解決見通せず拉致被害者家族に危機感,https://www3.nhk.or.jp//news/html/20220917/k10013823041000.html,9月17日 21時50分,拉致
台風14号 鹿児島県に暴風 波浪 高潮の特別警報,https://www3.nhk.or.jp//news/html/20220917/k10013823211000.html,9月17日 21時43分,台風
全日空機 警告表示で緊急降下 酸素マスクも乗客に体調不良なし,https://www3.nhk.or.jp//news/html/20220917/k10013823221000.html,9月17日 21時38分,
