title,link,time,category
国民民主 党大会 玉木代表 政治資金“岸田政権に厳しく対応”,https://www3.nhk.or.jp//news/html/20240212/k10014355841000.html,2月12日 16時00分,政治資金
サッカー セルティック古橋亨梧と前田大然 ともにゴールで勝利,https://www3.nhk.or.jp//news/html/20240212/k10014355741000.html,2月12日 15時57分,サッカー（ヨーロッパ）
ブレイキン全日本選手権 Shigekix 4連覇へ“いい踊り届ける”,https://www3.nhk.or.jp//news/html/20240212/k10014355831000.html,2月12日 15時55分,ブレイキン
スーパーボウル チーフスが連覇 延長の末 49ersに競り勝つ,https://www3.nhk.or.jp//news/html/20240212/k10014355801000.html,2月12日 15時54分,アメリカ
能登半島地震で漁の再開見通せず 50年の漁師生活から引退決意,https://www3.nhk.or.jp//news/html/20240212/k10014355781000.html,2月12日 15時51分,令和6年能登半島地震
能登半島地震6週間 石川 輪島 被災した人も支援物資仕分け配付,https://www3.nhk.or.jp//news/html/20240212/k10014355661000.html,2月12日 15時49分,令和6年能登半島地震
東京 府中 信金職員殺害事件 まもなく19年 情報提供呼びかけ,https://www3.nhk.or.jp//news/html/20240212/k10014355811000.html,2月12日 15時34分,事件
被災した人たちに足湯 リラックスして会話を 石川 七尾,https://www3.nhk.or.jp//news/html/20240212/k10014355821000.html,2月12日 15時33分,令和6年能登半島地震
【随時更新】イスラエル ラファで地上作戦行う姿勢強調,https://www3.nhk.or.jp//news/html/20240212/k10014355511000.html,2月12日 15時23分,イスラエル・パレスチナ
見つかった結婚指輪「また一緒にならんかいえ」【被災地の声】,https://www3.nhk.or.jp//news/html/20240212/k10014355701000.html,2月12日 15時02分,令和6年能登半島地震
リオのカーニバル トップチームのパレード始まる 熱気最高潮に,https://www3.nhk.or.jp//news/html/20240212/k10014355791000.html,2月12日 14時26分,ブラジル
男子ゴルフ ヨーロッパツアー 星野陸也がツアー初優勝,https://www3.nhk.or.jp//news/html/20240212/k10014355751000.html,2月12日 14時21分,ゴルフ（男子）
大谷翔平 キャンプ3日目 山本由伸の投球練習を首脳陣と見守る,https://www3.nhk.or.jp//news/html/20240212/k10014355421000.html,2月12日 13時54分,大谷翔平
立民 泉代表 政治資金問題の自民アンケート“客観性ない”,https://www3.nhk.or.jp//news/html/20240212/k10014355771000.html,2月12日 13時51分,政治資金
日本医師会会長が石川県訪問  医療支援を長期的に行う考え示す,https://www3.nhk.or.jp//news/html/20240212/k10014355731000.html,2月12日 13時36分,令和6年能登半島地震
東京 あきる野 住宅に2人組押し入り 男性の頭殴って現金奪う,https://www3.nhk.or.jp//news/html/20240212/k10014355761000.html,2月12日 13時27分,事件
大リーグ パドレス ダルビッシュと松井裕樹がキャンプスタート,https://www3.nhk.or.jp//news/html/20240212/k10014355691000.html,2月12日 13時17分,大リーグ
輪島 被災建物の公費解体の個別相談始まる 問い合わせ約500件,https://www3.nhk.or.jp//news/html/20240212/k10014355681000.html,2月12日 13時06分,令和6年能登半島地震
イスラエル ラファでの地上作戦行う姿勢強調 各国が懸念示す,https://www3.nhk.or.jp//news/html/20240212/k10014355711000.html,2月12日 12時50分,イスラエル・パレスチナ
【石川 給水 入浴支援情報】輪島・珠洲などで実施（12日予定）,https://www3.nhk.or.jp//news/html/20240211/k10014354871000.html,2月12日 12時44分,令和6年能登半島地震
