title,link,time,category
男子ゴルフ 米ツアー最終ラウンド 松山英樹は30位,https://www3.nhk.or.jp//news/html/20240115/k10014321301000.html,1月15日 13時27分,ゴルフ（男子）
日経平均株価 33年ぶり3万6000円台に バブル期以来最高値更新,https://www3.nhk.or.jp//news/html/20240115/k10014321271000.html,1月15日 13時26分,きょうの株価
能登半島地震で土砂崩れ 国道8号 復旧見通し立たず 新潟 上越,https://www3.nhk.or.jp//news/html/20240115/k10014321351000.html,1月15日 13時24分,令和6年能登半島地震
石川 馳知事“被害全容把握できず 被災者ニーズ速やかに対応”,https://www3.nhk.or.jp//news/html/20240115/k10014321371000.html,1月15日 13時23分,令和6年能登半島地震
ヌートバー「大谷翔平や山本由伸との対戦待ちきれない」,https://www3.nhk.or.jp//news/html/20240115/k10014321381000.html,1月15日 13時20分,ラーズ・ヌートバー
米大統領選 共和党候補者選び初戦 アイオワ州 各候補支持訴え,https://www3.nhk.or.jp//news/html/20240115/k10014321151000.html,1月15日 13時13分,アメリカ大統領選
茨城 阿見町 コンビニ ドラッグストアで従業員刺される 男逮捕,https://www3.nhk.or.jp//news/html/20240115/k10014321341000.html,1月15日 13時12分,事件
「大谷選手のグローブのおかげで元気に」富山の被災小学校にも,https://www3.nhk.or.jp//news/html/20240115/k10014321321000.html,1月15日 13時04分,令和6年能登半島地震
富山 氷見 農業用水路が被害 農作業できないおそれ 調査始まる,https://www3.nhk.or.jp//news/html/20240115/k10014321361000.html,1月15日 13時02分,令和6年能登半島地震
【被害状況 15日】石川県で221人死亡 安否不明者22人(9時),https://www3.nhk.or.jp//news/html/20240115/k10014320841000.html,1月15日 13時00分,令和6年能登半島地震
長野 軽井沢町 スキーバス事故から8年 慰霊碑に遺族ら献花,https://www3.nhk.or.jp//news/html/20240115/k10014321251000.html,1月15日 12時59分,事故
【ライフライン 15日】石川県内の給水予定 いつ どこで,https://www3.nhk.or.jp//news/html/20240115/k10014320831000.html,1月15日 12時49分,令和6年能登半島地震
北朝鮮の弾道ミサイル“中距離と推定 詳細は分析中” 官房長官,https://www3.nhk.or.jp//news/html/20240115/k10014321261000.html,1月15日 12時47分,北朝鮮 ミサイル
石川 中能登町 小中学校で6日遅れ始業式 被災の恐怖で欠席も…,https://www3.nhk.or.jp//news/html/20240115/k10014321241000.html,1月15日 12時36分,令和6年能登半島地震
イスラエルとハマス戦闘100日 人質の映像公開 終結見通せず,https://www3.nhk.or.jp//news/html/20240115/k10014321181000.html,1月15日 12時32分,イスラエル・パレスチナ
【交通影響 15日】道路・鉄道・航空（11時）,https://www3.nhk.or.jp//news/html/20240115/k10014320821000.html,1月15日 12時19分,令和6年能登半島地震
フェンシングW杯 フルーレ団体 男子2位女子4位 五輪出場内定,https://www3.nhk.or.jp//news/html/20240115/k10014321171000.html,1月15日 12時16分,フェンシング
14日の北朝鮮ミサイル発射 日米韓の高官が電話協議 強く非難,https://www3.nhk.or.jp//news/html/20240115/k10014321141000.html,1月15日 12時14分,北朝鮮 ミサイル
天皇陛下 地震の犠牲者を悼む 警視庁創設150年の式典で,https://www3.nhk.or.jp//news/html/20240115/k10014321211000.html,1月15日 12時10分,皇室
地震から2週間 被災地あすにかけ雪 捜索見合わせるところも,https://www3.nhk.or.jp//news/html/20240115/k10014321201000.html,1月15日 11時58分,令和6年能登半島地震
