title,link,time,category
LA山火事 大谷翔平が一時避難と明かす 2週間程度で自宅に戻る,https://www3.nhk.or.jp//news/html/20250202/k10014710061000.html,2月2日 7時03分,アメリカ
ウクライナ ロシア軍のミサイルや無人機の攻撃相次ぎ 10人死亡,https://www3.nhk.or.jp//news/html/20250202/k10014710011000.html,2月2日 6時44分,ウクライナ情勢
トランプ大統領 ソマリアでISの拠点を空爆 メンバー殺害と発表,https://www3.nhk.or.jp//news/html/20250202/k10014710071000.html,2月2日 6時37分,トランプ大統領
午前中を中心に関東甲信の平地で積雪見込みのところも,https://www3.nhk.or.jp//news/html/20250202/k10014710051000.html,2月2日 6時30分,気象
LA近郊の山火事鎮圧 2日から入域規制を解除方針 復旧本格化へ,https://www3.nhk.or.jp//news/html/20250202/k10014710041000.html,2月2日 6時16分,アメリカ
ハマスが3人解放 イスラエルは180人余釈放 停戦合意履行に注視,https://www3.nhk.or.jp//news/html/20250202/k10014709991000.html,2月2日 5時42分,イスラエル・パレスチナ
米 小型ジェット機墜落 搭乗6人全員と地上で巻き込まれ1人死亡,https://www3.nhk.or.jp//news/html/20250202/k10014710031000.html,2月2日 5時23分,アメリカ
コンゴ民主共和国 反政府武装勢力と政府軍戦闘で700人以上死亡,https://www3.nhk.or.jp//news/html/20250202/k10014710021000.html,2月2日 5時20分,アフリカ
埼玉 八潮 道路陥没 がれき撤去は一時中断 捜索開始に時間も,https://www3.nhk.or.jp//news/html/20250202/k10014710001000.html,2月2日 5時11分,事故
農林水産物と食品の輸出額が初の1兆5000億円超 日本食の人気で,https://www3.nhk.or.jp//news/html/20250202/k10014709941000.html,2月2日 4時58分,農業
きょう節分 かたい豆“5歳以下には食べさせないで” 消費者庁,https://www3.nhk.or.jp//news/html/20250202/k10014709861000.html,2月2日 4時56分,子育て
鹿児島 徳之島 保育士殺害 殺人容疑で18歳の高校生を逮捕,https://www3.nhk.or.jp//news/html/20250201/k10014709971000.html,2月2日 3時41分,事件
スキージャンプ女子W杯 個人第14戦 高梨沙羅が7位に,https://www3.nhk.or.jp//news/html/20250202/k10014709981000.html,2月2日 0時27分,スキージャンプ
最近、方言使ってますか,https://www3.nhk.or.jp//news/html/20250201/k10014706811000.html,2月2日 0時25分,生成AI・人工知能
突破する？しない？日本経済の「壁」【経済コラム】,https://www3.nhk.or.jp//news/html/20250131/k10014707751000.html,2月2日 0時20分,マーケットコラム
関税こだわるトランプ大統領とかつての“タリフマン＝関税男”,https://www3.nhk.or.jp//news/html/20250201/k10014709881000.html,2月1日 23時27分,トランプ大統領
埼玉 八潮 道路陥没 スロープ工事完了 捜索開始にはまだ時間,https://www3.nhk.or.jp//news/html/20250201/k10014709501000.html,2月1日 22時26分,事故
【解説】2日午前を中心に関東甲信で雪予想 交通影響に十分注意,https://www3.nhk.or.jp//news/html/20250201/k10014709621000.html,2月1日 22時20分,気象
神奈川 登山の女性 クマに襲われけが 山形ではクマが公園内か,https://www3.nhk.or.jp//news/html/20250201/k10014709911000.html,2月1日 21時37分,クマ被害
日本被団協 都内でノーベル平和賞報告会 今後の活動方針を確認,https://www3.nhk.or.jp//news/html/20250201/k10014709951000.html,2月1日 21時12分,ノーベル賞2024
