,title,link,time,category
0,フィリピン大統領 国際的な仲裁裁判の判断価値認めず,https://www3.nhk.or.jp//news/html/20210727/k10013161971000.html,7月27日 4時24分,南シナ海問題
1,台風8号 きょう東北や関東甲信に接近 上陸のおそれ 大雨に警戒,https://www3.nhk.or.jp//news/html/20210726/k10013161501000.html,7月27日 4時12分,台風
2,「確定拠出年金」の利回り 初めて「確定給付年金」を上回る,https://www3.nhk.or.jp//news/html/20210727/k10013161791000.html,7月27日 4時05分,年金
3,東京オリンピック 大会4日目 日本は金メダル8個でトップに,https://www3.nhk.or.jp//news/html/20210727/k10013162121000.html,7月27日 4時01分,オリンピック・パラリンピック
4,香港の日系企業 半数以上 香港国家安全維持法に懸念 JETRO調査,https://www3.nhk.or.jp//news/html/20210727/k10013161751000.html,7月27日 1時23分,中国
5,北京パラリンピック スキー日本代表に村岡桃佳など12人内定,https://www3.nhk.or.jp//news/html/20210727/k10013162051000.html,7月27日 1時10分,北京 冬季五輪・パラ
6,オリンピック 水谷・伊藤ぺア 卓球で初の金メダル,https://www3.nhk.or.jp//news/html/20210726/k10013162001000.html,7月27日 0時50分,卓球
7,オリンピック フィリピン初の「金」逃すも 笑顔絶やさず,https://www3.nhk.or.jp//news/html/20210726/k10013161891000.html,7月27日 0時39分,スケートボード
8,オリンピック バスケットボール男子 日本初戦 スペインに敗戦,https://www3.nhk.or.jp//news/html/20210726/k10013162041000.html,7月27日 0時07分,バスケットボール
9,オリンピック ハンドボール男子 日本 スウェーデンに敗れ2連敗,https://www3.nhk.or.jp//news/html/20210726/k10013162061000.html,7月27日 0時05分,ハンドボール
10,オリンピック 射撃 世界ランク1位不在の戦い,https://www3.nhk.or.jp//news/html/20210727/k10013161911000.html,7月27日 0時03分,射撃
11,オリンピック アーチェリー男子団体で銅 ピタリとはまった作戦,https://www3.nhk.or.jp//news/html/20210726/k10013161901000.html,7月26日 23時53分,アーチェリー
12,スケートボード 少年少女に人気 メダリストの活躍に刺激,https://www3.nhk.or.jp//news/html/20210726/k10013161211000.html,7月26日 23時45分,スケートボード
13,オリンピック バレーボール男子 日本 カナダに逆転勝ちで2連勝,https://www3.nhk.or.jp//news/html/20210726/k10013161991000.html,7月26日 23時42分,バレーボール
14,東京都 新型コロナ 新たに1429人感染確認 月曜日では過去最多,https://www3.nhk.or.jp//news/html/20210726/k10013160781000.html,7月26日 23時36分,新型コロナ 国内感染者数
15,新型コロナ 高齢者で少なくともワクチン1回接種は84％余,https://www3.nhk.or.jp//news/html/20210726/k10013161841000.html,7月26日 23時32分,新型コロナ ワクチン（日本国内）
16,東京オリンピック 大会4日目 7月26日の試合結果や動き,https://www3.nhk.or.jp//news/html/20210726/k10013160051000.html,7月26日 23時30分,オリンピック・パラリンピック
17,出場辞退の東海大相模高校野球部 新型コロナ感染者31人に,https://www3.nhk.or.jp//news/html/20210726/k10013161691000.html,7月26日 23時28分,新型コロナ 国内感染者数
18,オリンピック ホッケー女子 日本 ニュージーランドに敗れ2連敗,https://www3.nhk.or.jp//news/html/20210726/k10013162021000.html,7月26日 23時26分,ホッケー
19,治安悪化のアフガン 民間人死傷者 最悪の水準に 国連が警鐘,https://www3.nhk.or.jp//news/html/20210726/k10013162031000.html,7月26日 23時23分,
