title,link,time,category
近代五種男子準決勝 佐藤大宗 B組1位 決勝進出決める パリ五輪,https://www3.nhk.or.jp//news/html/20240810/k10014544971000.html,8月10日 3時36分,#近代五種
パリオリンピック【速報中】8/9～8/10 タイムライン,https://www3.nhk.or.jp//news/html/20240809/k10014543911000.html,8月10日 3時33分,#パリオリンピック
南海トラフ地震臨時情報 引き続き注意を 気象庁,https://www3.nhk.or.jp//news/html/20240810/k10014544901000.html,8月10日 3時30分,南海トラフ地震臨時情報
ブラジル サンパウロ州内陸部 62人乗り旅客機が墜落,https://www3.nhk.or.jp//news/html/20240810/k10014544981000.html,8月10日 3時26分,航空
体重超過で失格 レスリング女子 インド選手 銀メダル求め提訴,https://www3.nhk.or.jp//news/html/20240810/k10014544961000.html,8月10日 3時21分,#レスリング
レスリング女子62キロ級 元木咲良 決勝進出 パリ五輪,https://www3.nhk.or.jp//news/html/20240809/k10014544331000.html,8月10日 3時20分,#レスリング
レスリング 樋口黎が金メダル 男子フリー57キロ級 パリ五輪,https://www3.nhk.or.jp//news/html/20240810/k10014544091000.html,8月10日 3時16分,#レスリング
レスリング男子フリー74キロ級 高谷大地が決勝進出 パリ五輪,https://www3.nhk.or.jp//news/html/20240809/k10014544281000.html,8月10日 2時23分,#レスリング
ブレイキン女子 湯浅亜実 福島あゆみ 準々決勝進出 パリ五輪,https://www3.nhk.or.jp//news/html/20240810/k10014544841000.html,8月10日 2時04分,#ブレイキン
なでしこジャパンGK 山下杏也加 マンチェスターシティーに移籍,https://www3.nhk.or.jp//news/html/20240810/k10014544871000.html,8月10日 1時51分,#なでしこジャパン
河野デジタル相 麻生副総裁に自民党総裁選立候補の意欲伝える,https://www3.nhk.or.jp//news/html/20240810/k10014544791000.html,8月10日 1時49分,自民党総裁選
ゴルフ女子 第3R 山下美夢有 首位と2打差3位に浮上 パリ五輪,https://www3.nhk.or.jp//news/html/20240810/k10014544891000.html,8月10日 1時45分,#ゴルフ（女子）
【詳細】ロシア ウクライナに軍事侵攻（8月9日の動き）,https://www3.nhk.or.jp//news/html/20240809/k10014529921000.html,8月10日 1時36分,ウクライナ情勢
立憲民主党代表選 枝野前代表 立候補の意向「わたしの使命」,https://www3.nhk.or.jp//news/html/20240809/k10014544051000.html,8月10日 1時11分,立憲民主党代表選
東名高速道路 神奈川～静岡の通行止め すべて解除,https://www3.nhk.or.jp//news/html/20240809/k10014544681000.html,8月10日 1時04分,神奈川県
【交通影響】神奈川県西部で震度5弱,https://www3.nhk.or.jp//news/html/20240809/k10014544371000.html,8月10日 1時01分,地震
【地震情報】神奈川で震度5弱 専門家“南海トラフと関係ない”,https://www3.nhk.or.jp//news/html/20240809/k10014544361000.html,8月10日 0時28分,地震
神奈川震度5弱 東海道新幹線10万人影響 きょうも遅れや運休か,https://www3.nhk.or.jp//news/html/20240810/k10014544801000.html,8月10日 0時19分,鉄道
旧優生保護法シンポジウム 手術受けた被害者 全面的解決を訴え,https://www3.nhk.or.jp//news/html/20240810/k10014544781000.html,8月10日 0時04分,医療・健康
震度5弱 神奈川 小田急本厚木駅前 帰宅困難者 滞在場所を開放,https://www3.nhk.or.jp//news/html/20240809/k10014544541000.html,8月9日 23時52分,地震
