title,link,time,category
松江 遊漁船が岩場に衝突 乗っていた釣り客5人けが,https://www3.nhk.or.jp//news/html/20240728/k10014526931000.html,7月28日 6時09分,事故
パリ五輪 エスタンゲ会長「特別な開会式 世界に示したかった」,https://www3.nhk.or.jp//news/html/20240728/k10014526871000.html,7月28日 6時08分,#パリオリンピック
ASEAN外相会議 ミャンマー情勢 戦闘停止への具体策打ち出せず,https://www3.nhk.or.jp//news/html/20240728/k10014526691000.html,7月28日 6時06分,ASEAN
バドミントン 女子ダブルス シダマツペア 白星発進 パリ五輪,https://www3.nhk.or.jp//news/html/20240728/k10014526901000.html,7月28日 6時05分,#バドミントン
サッカー男子 日本 マリに勝利 決勝トーナメント進出 パリ五輪,https://www3.nhk.or.jp//news/html/20240728/k10014526911000.html,7月28日 6時04分,#サッカー
競泳 池江璃花子 女子100mバタフライ 決勝進出ならず パリ五輪,https://www3.nhk.or.jp//news/html/20240728/k10014526861000.html,7月28日 5時52分,#競泳
体操 男子団体 決勝進出 パリオリンピック,https://www3.nhk.or.jp//news/html/20240728/k10014526751000.html,7月28日 5時48分,#体操
上川外相“北朝鮮 ロシアとの軍事協力などに懸念”ARF閣僚会合,https://www3.nhk.or.jp//news/html/20240728/k10014526581000.html,7月28日 5時33分,ASEAN
柔道 永山竜樹 銅メダル 男子60キロ級 パリオリンピック,https://www3.nhk.or.jp//news/html/20240727/k10014526501000.html,7月28日 5時27分,#柔道
競泳 平井瑞希が決勝進出 女子100ｍバタフライ パリ五輪,https://www3.nhk.or.jp//news/html/20240728/k10014526841000.html,7月28日 5時22分,#競泳
バドミントン女子シングルス 山口茜 初戦勝ち パリ五輪,https://www3.nhk.or.jp//news/html/20240728/k10014526831000.html,7月28日 5時19分,#バドミントン
夏季五輪 日本 メダル総数500個達成 パリオリンピック,https://www3.nhk.or.jp//news/html/20240728/k10014526821000.html,7月28日 5時06分,#パリオリンピック
柔道 角田夏実 金メダル 女子48キロ級 パリ五輪で日本勢初,https://www3.nhk.or.jp//news/html/20240727/k10014526341000.html,7月28日 4時11分,#柔道
カヌー 羽根田卓也と矢澤亜季 それぞれ準決勝進出 パリ五輪,https://www3.nhk.or.jp//news/html/20240728/k10014526811000.html,7月28日 3時52分,#カヌー
卓球 混合ダブルス 張本・早田ペア 1回戦で敗退 パリ五輪,https://www3.nhk.or.jp//news/html/20240728/k10014526741000.html,7月28日 3時43分,#卓球
体操 パリオリンピック【日程・日本代表・NHK放送予定】,https://www3.nhk.or.jp//news/html/20240728/k10014526791000.html,7月28日 3時35分,#体操
総合馬術 日本 団体5位に 大岩は個人8位につける パリ五輪,https://www3.nhk.or.jp//news/html/20240728/k10014526801000.html,7月28日 3時18分,#馬術
7人制ラグビー男子 日本は12位 全敗で今大会終える パリ五輪,https://www3.nhk.or.jp//news/html/20240728/k10014526711000.html,7月28日 2時46分,#7人制ラグビー
バスケットボール男子 日本 初戦でドイツに敗れる パリ五輪,https://www3.nhk.or.jp//news/html/20240727/k10014526601000.html,7月28日 2時17分,#バスケットボール
パリオリンピック【速報】7/27～28タイムライン 角田夏実が金,https://www3.nhk.or.jp//news/html/20240727/k10014526231000.html,7月28日 2時11分,#パリオリンピック
