title,link,time,category
女子高校生死亡 車に約9キロ引きずられたか 茨城 ひたちなか,https://www3.nhk.or.jp//news/html/20240210/k10014354471000.html,2月10日 18時09分,茨城県
【随時更新】イスラエル ハマス 隔たり大 米はCIA長官派遣へ,https://www3.nhk.or.jp//news/html/20240210/k10014354231000.html,2月10日 18時08分,イスラエル・パレスチナ
西日本 10日夜遅くから大気 非常に不安定に 落雷など注意,https://www3.nhk.or.jp//news/html/20240210/k10014354681000.html,2月10日 18時06分,気象
公明 山口代表“自民 規制法改正の具体案を”連座制導入も強調,https://www3.nhk.or.jp//news/html/20240210/k10014354631000.html,2月10日 18時00分,政治資金
能登町 民間病院再建へ クラウドファンディングで支援呼びかけ,https://www3.nhk.or.jp//news/html/20240210/k10014354601000.html,2月10日 17時54分,令和6年能登半島地震
輪島市で災害ボランティアの活動始まる 石川,https://www3.nhk.or.jp//news/html/20240210/k10014354431000.html,2月10日 17時45分,令和6年能登半島地震
“安全で災害のない年に”厄よけ願う「御願神事」石川 加賀,https://www3.nhk.or.jp//news/html/20240210/k10014354621000.html,2月10日 17時38分,令和6年能登半島地震
“身近な山でも登山届を”埼玉県警の山岳救助隊が呼びかけ,https://www3.nhk.or.jp//news/html/20240210/k10014354611000.html,2月10日 17時35分,埼玉県
千葉 焼けた乗用車の遺体 後部で横の状態で ベトナム国籍か,https://www3.nhk.or.jp//news/html/20240210/k10014354641000.html,2月10日 17時30分,千葉県
松村防災相 石川 七尾の浄水場を視察 復旧工事の進ちょく確認,https://www3.nhk.or.jp//news/html/20240210/k10014354591000.html,2月10日 17時29分,令和6年能登半島地震
“安倍派や二階派議員は政倫審で説明が必要” 立民 岡田幹事長,https://www3.nhk.or.jp//news/html/20240210/k10014354571000.html,2月10日 17時12分,政治資金
福島の消防隊員が珠洲でボランティア きっかけは東日本大震災,https://www3.nhk.or.jp//news/html/20240210/k10014354581000.html,2月10日 17時10分,令和6年能登半島地震
小澤征爾さん死去 88歳「世界のオザワ」の訃報に国内外で追悼,https://www3.nhk.or.jp//news/html/20240209/k10014354011000.html,2月10日 16時59分,訃報
NBA 八村塁 ペリカンズ戦で21得点の活躍 チームも快勝,https://www3.nhk.or.jp//news/html/20240210/k10014354561000.html,2月10日 16時46分,八村塁
ベニズワイガニ 被災後初の水揚げ 富山 射水,https://www3.nhk.or.jp//news/html/20240210/k10014354541000.html,2月10日 16時40分,令和6年能登半島地震
米ムーディーズ イスラエル国債 1段階格下げ ガザ軍事作戦で,https://www3.nhk.or.jp//news/html/20240210/k10014354521000.html,2月10日 16時20分,イスラエル
沖縄 首里城地下の旧日本軍司令部壕周辺で教員らが野外学習,https://www3.nhk.or.jp//news/html/20240210/k10014354531000.html,2月10日 16時19分,沖縄県
中国の旧正月「春節」祝う祭りや行事 観光地訪れる人たちも,https://www3.nhk.or.jp//news/html/20240210/k10014354481000.html,2月10日 16時10分,中国 春節
珠洲 地盤の隆起 全長約4キロ高さ2メートル余の「崖」出来る,https://www3.nhk.or.jp//news/html/20240210/k10014354511000.html,2月10日 15時40分,令和6年能登半島地震
海底隆起で出航できず 苦悩強いられる漁業者 石川 珠洲,https://www3.nhk.or.jp//news/html/20240210/k10014354491000.html,2月10日 15時35分,令和6年能登半島地震
