title,link,time,category
【被害状況 21日】石川県内で死亡確認 232人 安否不明者 22人,https://www3.nhk.or.jp//news/html/20240121/k10014328951000.html,1月21日 21時16分,令和6年能登半島地震
【石川県内 給水・入浴支援情報 21日】輪島市など9市町で実施,https://www3.nhk.or.jp//news/html/20240121/k10014328881000.html,1月21日 21時15分,令和6年能登半島地震
冬のユース五輪 スキージャンプ混合団体 日本は9位,https://www3.nhk.or.jp//news/html/20240121/k10014329211000.html,1月21日 20時52分,スキージャンプ
ロシアのビジネスジェット機 アフガニスタン上空で消息絶つ,https://www3.nhk.or.jp//news/html/20240121/k10014329451000.html,1月21日 20時51分,アフガニスタン
石川県 “孤立状態 実質的に解消”も「要支援集落」残る,https://www3.nhk.or.jp//news/html/20240121/k10014329201000.html,1月21日 20時49分,令和6年能登半島地震
初代ミッキーマウス 登場アニメ著作権切れで米で2次創作可能に,https://www3.nhk.or.jp//news/html/20240121/k10014329321000.html,1月21日 20時48分,アニメ
【放送同時提供】NHK金沢発 ライフライン・地域情報,https://www3.nhk.or.jp//news/html/20240105/k10014309981000.html,1月21日 19時43分,令和6年能登半島地震
ガザ地区の死者 2万5000人超に イスラエル軍の軍事作戦開始後,https://www3.nhk.or.jp//news/html/20240121/k10014329251000.html,1月21日 19時36分,イスラエル・パレスチナ
大相撲初場所8日目 大関 霧島 翔猿に敗れ2敗目,https://www3.nhk.or.jp//news/html/20240121/k10014329341000.html,1月21日 19時33分,大相撲
立民 泉代表“自民の裏金体質許さず” 議員の証人喚問求める,https://www3.nhk.or.jp//news/html/20240121/k10014329331000.html,1月21日 19時22分,政治資金
石川県 馳知事 県内6市町の水道の復旧時期 見通し明らかに,https://www3.nhk.or.jp//news/html/20240121/k10014329281000.html,1月21日 19時17分,令和6年能登半島地震
地震被害の珠洲市と能登町 中学生約140人 金沢市に集団避難,https://www3.nhk.or.jp//news/html/20240121/k10014328991000.html,1月21日 19時17分,令和6年能登半島地震
関東の沿岸部で雨風強まる 土砂災害や強風などに十分注意,https://www3.nhk.or.jp//news/html/20240121/k10014328861000.html,1月21日 19時16分,気象
ボッチャ 廣瀬隆喜 杉村英孝 遠藤裕美 パリパラリンピック内定,https://www3.nhk.or.jp//news/html/20240121/k10014329311000.html,1月21日 19時15分,ボッチャ
テニス 全豪オープン混合ダブルス 柴原瑛菜のペアが2回戦進出,https://www3.nhk.or.jp//news/html/20240121/k10014329171000.html,1月21日 19時09分,テニス
ガザ地区 死者2万5000人超に 国際NGO「1万人以上が子ども」,https://www3.nhk.or.jp//news/html/20240121/k10014328841000.html,1月21日 19時04分,イスラエル・パレスチナ
面識ない女性にわいせつ行為の疑い 39歳医師を逮捕,https://www3.nhk.or.jp//news/html/20240121/k10014329261000.html,1月21日 18時55分,事件
石川 珠洲市長 “仮設住宅は希望者全員の入居数を確保したい”,https://www3.nhk.or.jp//news/html/20240121/k10014329271000.html,1月21日 18時43分,令和6年能登半島地震
【能登半島地震 交通影響 21日】鉄道・航空・道路（16:00）,https://www3.nhk.or.jp//news/html/20240121/k10014328891000.html,1月21日 18時39分,令和6年能登半島地震
京都市長選挙告示 現職引退で16年ぶり新人どうしの争い,https://www3.nhk.or.jp//news/html/20240121/k10014329011000.html,1月21日 18時34分,京都府
