title,link,time,category
サッカーW杯 アジア最終予選 日本 初戦で中国に7対0の大勝,https://www3.nhk.or.jp//news/html/20240905/k10014573761000.html,9月5日 22時14分,#サッカーW杯2026
【随時更新】ロシア ウクライナに軍事侵攻（9月5日の動き）,https://www3.nhk.or.jp//news/html/20240905/k10014554741000.html,9月5日 22時12分,ウクライナ情勢
【随時更新】イスラエル パレスチナ 中東情勢（9月5日）,https://www3.nhk.or.jp//news/html/20240905/k10014572481000.html,9月5日 22時09分,イスラエル・パレスチナ
パリパラ 車いすフェンシング 男子フルーレ団体 準々決勝敗退,https://www3.nhk.or.jp//news/html/20240905/k10014573751000.html,9月5日 22時08分,#車いすフェンシング
パラリンピック 卓球 和田なつきが決勝進出 女子シングルス,https://www3.nhk.or.jp//news/html/20240905/k10014573351000.html,9月5日 22時04分,#パラ卓球
首都直下地震 被害想定見直しで国の会合 中長期的影響も検討へ,https://www3.nhk.or.jp//news/html/20240905/k10014573741000.html,9月5日 22時03分,地震
パラリンピック 卓球 古川佳奈美が銅メダル 女子シングルス,https://www3.nhk.or.jp//news/html/20240905/k10014573381000.html,9月5日 22時01分,#パラ卓球
山梨 富士スバルラインで自動運転EVバス運行の実証実験へ,https://www3.nhk.or.jp//news/html/20240905/k10014573721000.html,9月5日 22時00分,山梨県
パリパラ 車いすラグビー 悲願の金メダル 日本代表が帰国会見,https://www3.nhk.or.jp//news/html/20240905/k10014573521000.html,9月5日 21時52分,#車いすラグビー
パリパラリンピック【速報中】9/5～9/6タイムライン,https://www3.nhk.or.jp//news/html/20240905/k10014573621000.html,9月5日 21時31分,#パリパラリンピック
パリパラリンピック ブラインドサッカー男子 日本は8位,https://www3.nhk.or.jp//news/html/20240905/k10014573671000.html,9月5日 21時25分,#ブラインドサッカー
ロシア軍が無人機78機で攻撃 キーウでは約9時間 防空警報発令,https://www3.nhk.or.jp//news/html/20240905/k10014573701000.html,9月5日 21時22分,ウクライナ情勢
ガザ南部でもポリオワクチン接種始まる 着実な戦闘休止焦点に,https://www3.nhk.or.jp//news/html/20240905/k10014573711000.html,9月5日 21時21分,イスラエル・パレスチナ
ロシアの国立研究機関が独自調査で処理水「懸念なし」報告書,https://www3.nhk.or.jp//news/html/20240905/k10014573291000.html,9月5日 21時05分,福島第一原発 処理水
朝鮮半島出身の労働者など犠牲「浮島丸」関連名簿を韓国に提供,https://www3.nhk.or.jp//news/html/20240905/k10014573551000.html,9月5日 21時02分,韓国
パリパラ 柔道 半谷静香 決勝へ 女子48キロ級 メダル獲得確定,https://www3.nhk.or.jp//news/html/20240905/k10014573681000.html,9月5日 20時45分,#パラ柔道
千葉 柏 女性が切りつけられ大けが 34歳の女の容疑者を逮捕,https://www3.nhk.or.jp//news/html/20240905/k10014572791000.html,9月5日 20時42分,事件
沖縄 性的暴行疑いの米兵 書類送検 県警 県に初めて概要伝える,https://www3.nhk.or.jp//news/html/20240905/k10014573311000.html,9月5日 20時35分,沖縄県
パリパラ ボッチャ混合団体 日本が銅 団体種目3大会連続メダル,https://www3.nhk.or.jp//news/html/20240905/k10014573531000.html,9月5日 20時25分,#ボッチャ
ゴルフ 日本女子プロ選手権 第1ラウンド 竹田麗央が単独首位,https://www3.nhk.or.jp//news/html/20240905/k10014573561000.html,9月5日 20時22分,#ゴルフ（女子）
