title,link,time,category
“空気入れ不要” “見える化” タイヤへ新技術導入が活発に,https://www3.nhk.or.jp//news/html/20230228/k10013992881000.html,2月28日 8時01分,環境
【随時更新】ロシア ウクライナに軍事侵攻（28日の動き）,https://www3.nhk.or.jp//news/html/20230228/k10013972491000.html,2月28日 7時58分,ウクライナ情勢
ベラルーシ大統領きょう中国訪問 ロシア支援めぐる発言が焦点,https://www3.nhk.or.jp//news/html/20230228/k10013992991000.html,2月28日 7時54分,ウクライナ情勢
ウクライナの避難学生 日本語学校と学費支払いでトラブルに,https://www3.nhk.or.jp//news/html/20230228/k10013992971000.html,2月28日 7時52分,群馬県
“反転攻勢 クリミア情勢焦点か” 米の元駐ウクライナ大使,https://www3.nhk.or.jp//news/html/20230228/k10013993001000.html,2月28日 7時34分,ウクライナ情勢
“耐震基準いかに守るかが教訓” トルコ大地震 現地調査報告会,https://www3.nhk.or.jp//news/html/20230228/k10013992951000.html,2月28日 7時28分,トルコ・シリア大地震
トルコ・シリア大地震 トルコの物理的被害額4兆6500億円余か,https://www3.nhk.or.jp//news/html/20230228/k10013992981000.html,2月28日 7時22分,トルコ・シリア大地震
子ども政策めぐり 若い世代約1万人から意見聞く方針 少子化相,https://www3.nhk.or.jp//news/html/20230228/k10013993051000.html,2月28日 7時20分,
オミクロン株対応ワクチン 5歳～11歳も対象 3月上旬から接種へ,https://www3.nhk.or.jp//news/html/20230228/k10013992941000.html,2月28日 7時14分,新型コロナ ワクチン（日本国内）
子宮頸がんなどを防ぐ「9価HPVワクチン」2回接種を了承 厚労省,https://www3.nhk.or.jp//news/html/20230228/k10013993121000.html,2月28日 7時12分,
メタバース上の知的財産保護 法律改正案 今国会提出へ 経産省,https://www3.nhk.or.jp//news/html/20230228/k10013992871000.html,2月28日 7時10分,IT・ネット
五輪談合事件 電通グループなど6社 きょう刑事告発へ 公取委,https://www3.nhk.or.jp//news/html/20230228/k10013992901000.html,2月28日 7時07分,事件
東京 新宿区や東久留米で住宅火災相次ぎ 合わせて2人死亡,https://www3.nhk.or.jp//news/html/20230228/k10013993151000.html,2月28日 7時06分,
新年度予算案 きょう衆議院通過で年度内成立へ,https://www3.nhk.or.jp//news/html/20230228/k10013992851000.html,2月28日 6時55分,来年度予算案
豪雪地帯 3mの積雪掘りタイム競う「地面出し競争」山形 大蔵村,https://www3.nhk.or.jp//news/html/20230228/k10013993061000.html,2月28日 6時49分,山形県
岸田首相ウクライナ訪問に国会事前報告不要の声も,https://www3.nhk.or.jp//news/html/20230228/k10013992861000.html,2月28日 6時47分,
スギ花粉飛散シーズン到来 東京など12都府県 過去10年で最多か,https://www3.nhk.or.jp//news/html/20230227/k10013992791000.html,2月28日 6時35分,気象
フィリピンから送還の容疑者4人 別の特殊詐欺で再逮捕へ,https://www3.nhk.or.jp//news/html/20230228/k10013992911000.html,2月28日 6時30分,事件
【動画】電車で職場で けさのニュースをスマホでチェック！,https://www3.nhk.or.jp//news/html/20230228/k10013993141000.html,2月28日 6時20分,
きょう各地で4月並みの暖かさに 雪崩や落雪などに注意,https://www3.nhk.or.jp//news/html/20230228/k10013992921000.html,2月28日 6時05分,気象
