title,link,time,category
米バイデン政権 イスラエル ウクライナ支援の予算を議会に要請,https://www3.nhk.or.jp//news/html/20231021/k10014232601000.html,10月21日 5時25分,イスラエル・パレスチナ
ハマス「米国籍の母親と娘を解放」SNSで発表,https://www3.nhk.or.jp//news/html/20231021/k10014232641000.html,10月21日 5時22分,イスラエル・パレスチナ
栃木 車から遺体で発見女性 別の場所で死亡 車に乗せられたか,https://www3.nhk.or.jp//news/html/20231021/k10014232591000.html,10月21日 5時07分,事件
米 下院議長不在続く 共和党が候補を選び直しへ,https://www3.nhk.or.jp//news/html/20231021/k10014232671000.html,10月21日 5時05分,アメリカ
男子テニス 望月慎太郎が準決勝へ ジャパンオープン,https://www3.nhk.or.jp//news/html/20231021/k10014232611000.html,10月21日 4時25分,テニス
市川猿之助被告に懲役3年求刑 両親の自殺手助けした罪,https://www3.nhk.or.jp//news/html/20231020/k10014231451000.html,10月21日 3時10分,歌舞伎
レバノン南部「退避勧告」に引き上げ 外務省,https://www3.nhk.or.jp//news/html/20231021/k10014232631000.html,10月21日 1時13分,イスラエル・パレスチナ
【20日詳細】西岸などで衝突拡大懸念 ガザの人道状況 日々悪化,https://www3.nhk.or.jp//news/html/20231020/k10014230991000.html,10月21日 0時17分,イスラエル・パレスチナ
プロ野球 阪神が9年ぶり日本シリーズへ CSファイナル 広島破る,https://www3.nhk.or.jp//news/html/20231020/k10014232511000.html,10月21日 0時13分,プロ野球
パ・リーグCS オリックスが勝利 3勝1敗 日本シリーズ進出王手,https://www3.nhk.or.jp//news/html/20231020/k10014232531000.html,10月20日 23時16分,プロ野球CS
栃木 車から遺体 千葉の女子高校生か 首絞めて殺害された疑い,https://www3.nhk.or.jp//news/html/20231020/k10014232171000.html,10月20日 22時44分,事件
“料金振り込まれず”ブッキング・ドットコムを宿泊施設側提訴,https://www3.nhk.or.jp//news/html/20231020/k10014231951000.html,10月20日 22時40分,観光
ガザ地区で人道支援遅れる ヨルダン川西岸では衝突拡大懸念,https://www3.nhk.or.jp//news/html/20231020/k10014232481000.html,10月20日 22時38分,イスラエル・パレスチナ
米バイデン大統領 「イスラエル ウクライナ支援は重要」と演説,https://www3.nhk.or.jp//news/html/20231020/k10014231401000.html,10月20日 22時35分,バイデン大統領
尼崎 帰宅した女児に暴行 けがなし 刃物を持っていた男は逃走,https://www3.nhk.or.jp//news/html/20231020/k10014232541000.html,10月20日 22時32分,事件
サッカーJ1 第30節 3位の浦和レッズが柏レイソルに快勝,https://www3.nhk.or.jp//news/html/20231020/k10014232571000.html,10月20日 22時16分,サッカーJリーグ
上川外相 エジプトへ出発 ガザの人道状況改善に向け国際会議,https://www3.nhk.or.jp//news/html/20231020/k10014232561000.html,10月20日 22時02分,イスラエル・パレスチナ
第212臨時国会 天皇陛下をお迎えして開会式,https://www3.nhk.or.jp//news/html/20231020/k10014231961000.html,10月20日 21時49分,国会
日大アメフト部 11人が大麻使用の疑い 8月の学内会議で報告,https://www3.nhk.or.jp//news/html/20231020/k10014232201000.html,10月20日 21時42分,事件
所得税減税の検討指示 岸田首相 与党に,https://www3.nhk.or.jp//news/html/20231020/k10014232311000.html,10月20日 21時39分,税制改正
