title,link,time,category
自民 茂木幹事長 派閥の中堅・若手衆院議員10人余と会合,https://www3.nhk.or.jp//news/html/20240127/k10014336351000.html,1月27日 0時46分,衆議院
国内初の民間ロケット発射場 3月9日打ち上げへ 和歌山 串本町,https://www3.nhk.or.jp//news/html/20240127/k10014336531000.html,1月27日 0時40分,宇宙
アマゾン 会社側団体交渉拒否で労組が都労働委に救済申し立て,https://www3.nhk.or.jp//news/html/20240127/k10014336811000.html,1月27日 0時36分,東京都
北陸新幹線 3月開業予定の鉄道施設 安全確認で営業許可 国交省,https://www3.nhk.or.jp//news/html/20240127/k10014336321000.html,1月27日 0時22分,鉄道
新潟 上越 能登半島地震で高さ最大5.8mの津波到達か 気象庁,https://www3.nhk.or.jp//news/html/20240127/k10014336401000.html,1月27日 0時07分,令和6年能登半島地震
七尾で救急救命士目指す生徒たち 金沢で特別授業受ける,https://www3.nhk.or.jp//news/html/20240126/k10014336521000.html,1月26日 23時55分,令和6年能登半島地震
パリオリンピック 開幕まで半年 日本選手たちの意気込み,https://www3.nhk.or.jp//news/html/20240126/k10014336071000.html,1月26日 23時52分,パリ五輪
愛媛 今治 住宅で女性死亡 男性けが 容疑者逃走か,https://www3.nhk.or.jp//news/html/20240126/k10014336671000.html,1月26日 23時48分,事件
富山 高岡 県内で唯一残されていた指定避難所が閉所,https://www3.nhk.or.jp//news/html/20240126/k10014335791000.html,1月26日 23時39分,令和6年能登半島地震
石川県知事 輪島と珠洲を視察 “インフラ整備など支援進める”,https://www3.nhk.or.jp//news/html/20240126/k10014336561000.html,1月26日 23時28分,令和6年能登半島地震
齋藤経産相 被災4県に 中小企業や伝統産業への支援策を説明,https://www3.nhk.or.jp//news/html/20240126/k10014336601000.html,1月26日 22時40分,令和6年能登半島地震
石川 輪島 歯科医師たちが避難所巡回し歯磨きや入れ歯の掃除,https://www3.nhk.or.jp//news/html/20240126/k10014336421000.html,1月26日 22時37分,令和6年能登半島地震
社会人野球のトヨタ自動車 エース佐竹功年 この夏で現役引退へ,https://www3.nhk.or.jp//news/html/20240126/k10014336841000.html,1月26日 22時35分,野球
【随時更新】ロシア ウクライナに軍事侵攻（1月26日の動き）,https://www3.nhk.or.jp//news/html/20240126/k10014335261000.html,1月26日 22時34分,ウクライナ情勢
JR山手線 新大久保駅の転落事故23年 ホームで黙とうささげ追悼,https://www3.nhk.or.jp//news/html/20240126/k10014336631000.html,1月26日 22時22分,東京都
国際司法裁 イスラエルに暫定措置命じるも作戦即時停止命じず,https://www3.nhk.or.jp//news/html/20240126/k10014336851000.html,1月26日 22時20分,イスラエル・パレスチナ
楽天グループ 約8000億円の社債償還 時期分散化へ,https://www3.nhk.or.jp//news/html/20240126/k10014336191000.html,1月26日 22時17分,通信
旧優生保護法で不妊手術強制 大阪の夫婦の2審 国に賠償命じる,https://www3.nhk.or.jp//news/html/20240126/k10014336301000.html,1月26日 22時16分,大阪府
【被害状況 26日】石川県で236人死亡,https://www3.nhk.or.jp//news/html/20240126/k10014335321000.html,1月26日 22時08分,令和6年能登半島地震
桐島聡容疑者か 身柄確保 70年代の連続企業爆破事件で指名手配,https://www3.nhk.or.jp//news/html/20240126/k10014336161000.html,1月26日 21時57分,事件
