title,link,time,category
香川 高松 造船所で作業用の足場崩れる 転落した作業員3人死亡,https://www3.nhk.or.jp//news/html/20241026/k10014620021000.html,10月26日 21時48分,事故
ウクライナ “ロシア軍の通信傍受 前線の兵士からは不満も”,https://www3.nhk.or.jp//news/html/20241026/k10014620041000.html,10月26日 21時24分,ウクライナ情勢
ジョージア議会選挙 ロシア融和姿勢の与党 政権維持するか焦点,https://www3.nhk.or.jp//news/html/20241026/k10014620001000.html,10月26日 21時19分,ジョージア
将棋「竜王戦」第3局 藤井聡太七冠 佐々木勇気八段に勝ち2勝目,https://www3.nhk.or.jp//news/html/20241026/k10014620071000.html,10月26日 21時04分,藤井七冠
女子ゴルフ 米ツアー3R 西郷真央スコア伸ばすも首位と7打差に,https://www3.nhk.or.jp//news/html/20241026/k10014620081000.html,10月26日 20時54分,#ゴルフ（女子）
スピードスケート 高木美帆 女子3000メートルも制し 2冠,https://www3.nhk.or.jp//news/html/20241026/k10014619971000.html,10月26日 20時21分,スピードスケート
衆議院選挙 あす投票日 各党の党首が最後の訴え,https://www3.nhk.or.jp//news/html/20241026/k10014619841000.html,10月26日 19時28分,衆議院選挙
ラグビー日本代表 ニュージーランドとのテストマッチに完敗,https://www3.nhk.or.jp//news/html/20241026/k10014620011000.html,10月26日 19時01分,#ラグビー日本代表
イスラエルがイラン国内を攻撃 今後のイランの出方が焦点に,https://www3.nhk.or.jp//news/html/20241026/k10014619901000.html,10月26日 18時55分,イスラエル・パレスチナ
宮崎 延岡の土砂崩れで死亡の女性 56歳住人と確認,https://www3.nhk.or.jp//news/html/20241026/k10014619651000.html,10月26日 18時54分,宮崎県
北海道 江別 公園に倒れた男性 死亡確認 事件に巻き込まれたか,https://www3.nhk.or.jp//news/html/20241026/k10014619991000.html,10月26日 18時53分,事件
男子ゴルフ 米ツアー第3R 清水大成が12位 日本勢最上位,https://www3.nhk.or.jp//news/html/20241026/k10014619981000.html,10月26日 18時05分,#ゴルフ（男子）
ワールドシリーズ第1戦 ドジャース 延長10回サヨナラ勝ち,https://www3.nhk.or.jp//news/html/20241026/k10014619551000.html,10月26日 18時03分,#大谷翔平
なでしこジャパン 韓国に快勝 パリ五輪後最初の強化試合で,https://www3.nhk.or.jp//news/html/20241026/k10014619951000.html,10月26日 17時54分,#なでしこジャパン
東京 池袋 ハロウィーン前に コスプレでパレード,https://www3.nhk.or.jp//news/html/20241026/k10014619961000.html,10月26日 17時49分,東京都
米政府 台湾に地対空ミサイルなど約3000億円の武器 売却へ,https://www3.nhk.or.jp//news/html/20241026/k10014619921000.html,10月26日 17時44分,アメリカ
山梨 鳴沢村 期日前投票所で1人に用紙2枚交付し投票させるミス,https://www3.nhk.or.jp//news/html/20241026/k10014619911000.html,10月26日 17時41分,衆議院選挙
マレーシア 日本人観光客死傷事故 バス運転手の事情聴取へ,https://www3.nhk.or.jp//news/html/20241026/k10014619931000.html,10月26日 17時40分,マレーシア
NBA グリズリーズ 河村勇輝 日本選手4人目のデビュー果たす,https://www3.nhk.or.jp//news/html/20241026/k10014619791000.html,10月26日 17時29分,#バスケットボール
ワールドシリーズあす第2戦 ドジャースは山本由伸が先発予定,https://www3.nhk.or.jp//news/html/20241026/k10014619691000.html,10月26日 17時02分,#山本由伸
