title,link,time,category
台湾 TSMC 5四半期連続で増収増益 AI向け半導体の販売好調,https://www3.nhk.or.jp//news/html/20250417/k10014782231000.html,4月17日 20時23分,台湾
立民 国民 連合 基本政策で合意 連合は参院選での協力促す考え,https://www3.nhk.or.jp//news/html/20250417/k10014782251000.html,4月17日 20時19分,参議院選挙
岸田前首相 能登半島地震の復興に向け勉強会を立ち上げ,https://www3.nhk.or.jp//news/html/20250417/k10014782201000.html,4月17日 20時18分,令和6年能登半島地震
フィギュアスケート 世界国別対抗戦が都内で開幕,https://www3.nhk.or.jp//news/html/20250417/k10014782171000.html,4月17日 20時12分,#フィギュアスケート
福島第一原発2号機 2回目の試験的取り出しで“デブリつかむ”,https://www3.nhk.or.jp//news/html/20250417/k10014781951000.html,4月17日 20時11分,福島第一原発
無料ウェブサービスに落とし穴 設定ミスで個人情報閲覧も,https://www3.nhk.or.jp//news/html/20250417/k10014781801000.html,4月17日 19時55分,IT・ネット
ウクライナ大統領府長官ら仏到着 米国務長官らと停戦へ協議か,https://www3.nhk.or.jp//news/html/20250417/k10014782221000.html,4月17日 19時51分,ウクライナ情勢
全国9地銀で17日朝からシステム障害 “サイバー攻撃の可能性”,https://www3.nhk.or.jp//news/html/20250417/k10014782241000.html,4月17日 19時48分,金融
セブン-イレブン・ジャパン 社長交代の人事発表,https://www3.nhk.or.jp//news/html/20250417/k10014782191000.html,4月17日 19時38分,小売業
東京メトロ 有楽町線の延伸区間と東武伊勢崎線など直通運転へ,https://www3.nhk.or.jp//news/html/20250417/k10014782091000.html,4月17日 19時37分,鉄道
【随時更新】ロシア ウクライナに軍事侵攻（4月17日の動き）,https://www3.nhk.or.jp//news/html/20250417/k10014753541000.html,4月17日 19時36分,ウクライナ情勢
奈良 落雷 生徒6人搬送事故 警察が現場で当時の詳しい状況確認,https://www3.nhk.or.jp//news/html/20250417/k10014781771000.html,4月17日 19時28分,奈良県
芝浦電子の買収めぐり 台湾YAGEOがTOB価格引き上げ 争奪戦激化,https://www3.nhk.or.jp//news/html/20250417/k10014782211000.html,4月17日 19時26分,台湾
アスベスト じん肺訴訟 2審は国敗訴 国の運用と異なる判断示す,https://www3.nhk.or.jp//news/html/20250417/k10014782131000.html,4月17日 19時24分,厚生労働省
自民 参院議員 消費税率引き下げなど 公約への反映目指し議論,https://www3.nhk.or.jp//news/html/20250417/k10014782101000.html,4月17日 19時17分,参議院選挙
家のリフォーム工事詐欺容疑で逮捕 男性2人不起訴に 東京地検,https://www3.nhk.or.jp//news/html/20250417/k10014782181000.html,4月17日 19時14分,事件
岩手 大船渡 山林火災 焼失面積増え約3370haに 現地調査で確認,https://www3.nhk.or.jp//news/html/20250417/k10014782111000.html,4月17日 19時13分,岩手県
自民議連 食料品など軽減税率 0％に引き下げ 提言取りまとめへ,https://www3.nhk.or.jp//news/html/20250417/k10014782161000.html,4月17日 19時12分,国会
春闘 平均賃上げ率 2年連続5％超も中小企業は下回る 連合集計,https://www3.nhk.or.jp//news/html/20250417/k10014782151000.html,4月17日 19時08分,春闘
ガザ地区 新たに50万人が避難強いられる 人道危機深刻化 国連,https://www3.nhk.or.jp//news/html/20250417/k10014782141000.html,4月17日 19時01分,イスラエル・パレスチナ
