title,link,time,category
【被害状況 17日】石川県で232人死亡 重軽傷者1037人（9時）,https://www3.nhk.or.jp//news/html/20240117/k10014323981000.html,1月17日 12時05分,令和6年能登半島地震
【能登半島地震 交通影響】鉄道・航空・道路（17日11時時点）,https://www3.nhk.or.jp//news/html/20240117/k10014323951000.html,1月17日 12時03分,令和6年能登半島地震
能登半島地震の被災地 17日夜遅くから雨の見込み 土砂災害注意,https://www3.nhk.or.jp//news/html/20240117/k10014323891000.html,1月17日 12時02分,令和6年能登半島地震
イスラエル 防衛費約2兆円増額 軍事作戦長期化辞さない姿勢,https://www3.nhk.or.jp//news/html/20240117/k10014324111000.html,1月17日 11時52分,イスラエル・パレスチナ
中国 去年のGDP伸び率 ＋5.2％ 目標達成も景気回復力強さ欠く,https://www3.nhk.or.jp//news/html/20240117/k10014324021000.html,1月17日 11時51分,中国
【ライフライン 17日】石川県内の給水 入浴支援 いつ どこで,https://www3.nhk.or.jp//news/html/20240117/k10014323841000.html,1月17日 11時50分,令和6年能登半島地震
能登半島地震対応 24日参院予算委でも首相出席求め集中審議へ,https://www3.nhk.or.jp//news/html/20240117/k10014324101000.html,1月17日 11時46分,令和6年能登半島地震
上川外相 トルコ大統領らと会談 ウクライナ復興など連携で一致,https://www3.nhk.or.jp//news/html/20240117/k10014324071000.html,1月17日 11時36分,トルコ
つくばエクスプレス 守谷～つくばの上下線で運転見合わせ,https://www3.nhk.or.jp//news/html/20240117/k10014324041000.html,1月17日 11時32分,鉄道
中国の人口 推計14億967万人 2年連続の減少,https://www3.nhk.or.jp//news/html/20240117/k10014324081000.html,1月17日 11時28分,中国
阪神・淡路大震災から29年 今の被災地支援に教訓どう生かすか,https://www3.nhk.or.jp//news/html/20240117/k10014323261000.html,1月17日 11時27分,阪神・淡路大震災
【更新中】阪神・淡路大震災29年で追悼 能登半島地震へ支援も,https://www3.nhk.or.jp//news/html/20240116/k10014322971000.html,1月17日 11時24分,阪神・淡路大震災
石川 輪島の海岸 地震で地盤隆起 船出航できず 漁師「絶望」,https://www3.nhk.or.jp//news/html/20240117/k10014324051000.html,1月17日 11時15分,令和6年能登半島地震
日経平均株価 一時600円以上値上がり 3万6200円台に,https://www3.nhk.or.jp//news/html/20240117/k10014324001000.html,1月17日 10時52分,きょうの株価
ウクライナ支援に影響か 米大統領選の行方にダボスで懸念の声,https://www3.nhk.or.jp//news/html/20240117/k10014323931000.html,1月17日 10時46分,ウクライナ情勢
能登半島地震 安否不明者21人の氏名 石川県が公表（17日9時）,https://www3.nhk.or.jp//news/html/20240103/k10014308261000.html,1月17日 10時44分,令和6年能登半島地震
仏大統領 来月ウクライナを訪問し安保協定締結する意向を表明,https://www3.nhk.or.jp//news/html/20240117/k10014324011000.html,1月17日 10時43分,フランス
ガザ地区 “停戦と人質解放が唯一の道” 仲介のカタール首相,https://www3.nhk.or.jp//news/html/20240117/k10014323911000.html,1月17日 10時35分,イスラエル・パレスチナ
プーチン大統領 北朝鮮の外相と会談 北朝鮮訪問も調整か,https://www3.nhk.or.jp//news/html/20240117/k10014323901000.html,1月17日 9時16分,プーチン大統領
米軍“フーシ派を攻撃 ミサイル破壊”と発表 緊張の高まり懸念,https://www3.nhk.or.jp//news/html/20240117/k10014323921000.html,1月17日 9時15分,イスラエル・パレスチナ
