title,link,time,category
【詳報】マラソン女子 鈴木優花1位 一山麻緒2位 パリ五輪内定,https://www3.nhk.or.jp//news/html/20231015/k10014224881000.html,10月15日 12時32分,陸上競技（マラソン）
【詳報】マラソン男子 小山直城1位 赤崎暁2位 パリ五輪内定,https://www3.nhk.or.jp//news/html/20231015/k10014224871000.html,10月15日 12時27分,陸上競技（マラソン）
関東沿岸部で雷伴った非常に激しい雨のおそれ 浸水など注意を,https://www3.nhk.or.jp//news/html/20231015/k10014225821000.html,10月15日 12時18分,気象
JR外房線 上総一ノ宮～安房鴨川 運転見合わせ 大雨のため,https://www3.nhk.or.jp//news/html/20231015/k10014225881000.html,10月15日 12時03分,鉄道
千葉 館山市 南房総市 高齢者等避難の情報 土砂災害のおそれ,https://www3.nhk.or.jp//news/html/20231015/k10014225871000.html,10月15日 11時58分,気象
【随時更新】イスラエル軍 大規模な地上侵攻の可能性高まる,https://www3.nhk.or.jp//news/html/20231015/k10014225791000.html,10月15日 11時57分,イスラエル・パレスチナ
重要文化財 ”銅御殿” 保存計画の資金募る 東京 文京区,https://www3.nhk.or.jp//news/html/20231015/k10014225851000.html,10月15日 11時48分,東京都
ラグビーW杯 ニュージーランドがアイルランドに競り勝ち4強,https://www3.nhk.or.jp//news/html/20231015/k10014225721000.html,10月15日 10時22分,ラグビーW杯 2023
【解説動画】イスラエル・ハマス衝突 今後は (15日7時),https://www3.nhk.or.jp//news/html/20231015/k10014225841000.html,10月15日 10時06分,イスラエル・パレスチナ
愛媛県中予で竜巻発生か 気象庁が竜巻注意情報を発表 08:11,https://www3.nhk.or.jp//news/html/20231015/k10014225831000.html,10月15日 8時27分,気象
新幹線0系車両の改修目指しクラウドファンディング 東京 昭島,https://www3.nhk.or.jp//news/html/20231015/k10014225811000.html,10月15日 7時43分,東京都
ロシア軍 東部の州で攻勢強める ウクライナ側 街包囲に危機感,https://www3.nhk.or.jp//news/html/20231015/k10014225671000.html,10月15日 7時37分,ウクライナ情勢
仏 ルーブル美術館などに犯行予告 観光客が避難する騒動,https://www3.nhk.or.jp//news/html/20231015/k10014225801000.html,10月15日 7時25分,フランス
「金環日食」アメリカ各地で観測 多くの人が天体ショー楽しむ,https://www3.nhk.or.jp//news/html/20231015/k10014225691000.html,10月15日 6時29分,アメリカ
スーダン 武力衝突から半年も首都中心に戦闘続く 人道危機懸念,https://www3.nhk.or.jp//news/html/20231015/k10014225661000.html,10月15日 6時19分,スーダン
新型コロナ後遺症“血液中物質に特定の変化”米研究チーム発表,https://www3.nhk.or.jp//news/html/20231015/k10014225621000.html,10月15日 6時02分,新型コロナウイルス
エクアドル大統領選挙の決選投票 治安対策が最大の争点,https://www3.nhk.or.jp//news/html/20231015/k10014225681000.html,10月15日 5時26分,海外の選挙
ニュージーランド総選挙 野党の国民党第1党 6年ぶりに政権交代,https://www3.nhk.or.jp//news/html/20231015/k10014225751000.html,10月15日 5時23分,海外の選挙
豪 先住民の声政策に反映の機関創設 国民投票 反対多数で否決,https://www3.nhk.or.jp//news/html/20231015/k10014225761000.html,10月15日 5時21分,オーストラリア
北朝鮮拉致被害者 蓮池薫さん 帰国21年 “最後のタイミング”,https://www3.nhk.or.jp//news/html/20231015/k10014225631000.html,10月15日 5時04分,拉致
