title,link,time,category
米政府 アフリカ8か国 入国禁止措置解除へ 効果薄れたと判断か,https://www3.nhk.or.jp//news/html/20211225/k10013403811000.html,12月25日 13時00分,新型コロナウイルス
【気象予報士解説】数年に一度の寒気 今後の見通しや注意点は,https://www3.nhk.or.jp//news/html/20211225/k10013403721000.html,12月25日 12時29分,気象
クリスマス仕様の蒸気機関車「SLクリスマス号」運行 JR山口線,https://www3.nhk.or.jp//news/html/20211225/k10013403781000.html,12月25日 12時29分,
生活に困窮する女性の相談会 新型コロナの影響長期化で 東京,https://www3.nhk.or.jp//news/html/20211225/k10013403801000.html,12月25日 12時24分,新型コロナウイルス
成田山新勝寺 大しめ縄の飾りつけ 新年迎える準備進む,https://www3.nhk.or.jp//news/html/20211225/k10013403771000.html,12月25日 12時10分,
東京で誰でも無料の検査始まる オミクロン株「市中感染」受け,https://www3.nhk.or.jp//news/html/20211225/k10013403791000.html,12月25日 11時57分,新型コロナウイルス
数年に一度の強い寒気 日本海側中心に大雪のおそれ 平地でも,https://www3.nhk.or.jp//news/html/20211225/k10013403761000.html,12月25日 11時45分,気象
イギリス 新型コロナ 一日の感染者12万人超 3日連続で過去最多,https://www3.nhk.or.jp//news/html/20211225/k10013403751000.html,12月25日 11時25分,新型コロナウイルス
国連分担金 日本は3番目に多い約8％負担へ 2位中国は比率上昇,https://www3.nhk.or.jp//news/html/20211225/k10013403741000.html,12月25日 11時17分,中国
米軍とカナダ軍 恒例“サンタ追跡” ことしもサンタはマスク姿,https://www3.nhk.or.jp//news/html/20211225/k10013403711000.html,12月25日 10時58分,
バチカンでクリスマス恒例のミサ 感染拡大で厳重な対策も,https://www3.nhk.or.jp//news/html/20211225/k10013403571000.html,12月25日 10時48分,新型コロナウイルス
過去最大の予算案 歳入の3割余を国債に 財政健全化が重要課題,https://www3.nhk.or.jp//news/html/20211225/k10013403531000.html,12月25日 8時12分,来年度予算案
昨年度の“貯蓄率” 最高水準に 外出自粛で消費が減り貯蓄へ,https://www3.nhk.or.jp//news/html/20211225/k10013403521000.html,12月25日 7時30分,新型コロナ 経済影響
「デジタル田園都市国家構想」デジタル化で持続可能な地域作り,https://www3.nhk.or.jp//news/html/20211225/k10013403511000.html,12月25日 6時49分,第2次岸田内閣発足
数年に一度の強い寒気 日本海側中心に大雪 猛吹雪のおそれも,https://www3.nhk.or.jp//news/html/20211225/k10013403551000.html,12月25日 6時43分,気象
ソ連崩壊から30年 ゴルバチョフ氏「対話中断してはいけない」,https://www3.nhk.or.jp//news/html/20211225/k10013403561000.html,12月25日 6時41分,ロシア
入管施設収容中に死亡 スリランカ人女性 遺族ら新たに映像視聴,https://www3.nhk.or.jp//news/html/20211225/k10013403411000.html,12月25日 6時23分,
政府 オミクロン株封じ込めに重点 感染拡大すれば行動制限も,https://www3.nhk.or.jp//news/html/20211225/k10013403491000.html,12月25日 6時18分,新型コロナウイルス
抗体カクテル療法 オミクロン株に効果期待できず 投与推奨せず,https://www3.nhk.or.jp//news/html/20211225/k10013403691000.html,12月25日 6時14分,新型コロナウイルス
フィギュア 女子シングルとアイスダンス 北京五輪代表の行方は,https://www3.nhk.or.jp//news/html/20211225/k10013403621000.html,12月25日 4時58分,フィギュアスケート
