title,link,time,category
石川県能登地方で震度4の地震 津波の心配なし,https://www3.nhk.or.jp//news/html/20240107/k10014313291000.html,1月7日 21時56分,令和6年能登半島地震
“災害医療チームを派遣し被災地で治療に従事” 石川県医師会,https://www3.nhk.or.jp//news/html/20240107/k10014313031000.html,1月7日 21時47分,令和6年能登半島地震
志賀原発 付近の海面に少量の油流出も放射性物質は含まれず,https://www3.nhk.or.jp//news/html/20240107/k10014313281000.html,1月7日 21時37分,各地の原発
石川 馳知事 “来年度当初予算案 地震対策など限定して編成”,https://www3.nhk.or.jp//news/html/20240107/k10014312941000.html,1月7日 21時36分,令和6年能登半島地震
アーティスティックS日本代表 世界選手権へ向けて演技披露,https://www3.nhk.or.jp//news/html/20240107/k10014312871000.html,1月7日 21時22分,アーティスティックスイミング
俳優 中村メイコさん死去 89歳 テレビ放送の草創期から活躍,https://www3.nhk.or.jp//news/html/20240107/k10014313091000.html,1月7日 21時04分,訃報
【ライフライン 7日】断水や停電続く 給水支援の状況は,https://www3.nhk.or.jp//news/html/20240107/k10014312301000.html,1月7日 20時55分,令和6年能登半島地震
ラグビーリーグワン 第4節  東芝ブレイブルーパス東京が4連勝,https://www3.nhk.or.jp//news/html/20240107/k10014312991000.html,1月7日 20時50分,ラグビー リーグワン
能登半島地震の被災地 平地でも大雪見込み 土砂災害に十分注意,https://www3.nhk.or.jp//news/html/20240107/k10014312321000.html,1月7日 20時41分,令和6年能登半島地震
北朝鮮軍の砲撃は“欺まん作戦” 韓国側の探知能力探るねらい,https://www3.nhk.or.jp//news/html/20240107/k10014313191000.html,1月7日 20時37分,北朝鮮情勢
【交通影響 7日】大雪 午後9時から石川県内の道路一部通行止め,https://www3.nhk.or.jp//news/html/20240107/k10014312491000.html,1月7日 20時32分,令和6年能登半島地震
【解説動画】エコノミークラス症候群 長引く避難生活 注意を,https://www3.nhk.or.jp//news/html/20240107/k10014312711000.html,1月7日 20時31分,令和6年能登半島地震
ウクライナ 軍事侵攻で多数動員も徴兵めぐり不公平感広がる,https://www3.nhk.or.jp//news/html/20240107/k10014312851000.html,1月7日 20時17分,ウクライナ情勢
羽田空港 8日に事故滑走路の運用再開 多数の欠航解消の見通し,https://www3.nhk.or.jp//news/html/20240107/k10014313001000.html,1月7日 20時06分,羽田空港事故
障害者が避難生活での不安語り合う 経験や思い共有 富山 氷見,https://www3.nhk.or.jp//news/html/20240107/k10014313011000.html,1月7日 20時05分,令和6年能登半島地震
イスラエルとハマスの戦闘3か月 紛争の拡大防止へ米が焦点,https://www3.nhk.or.jp//news/html/20240107/k10014313051000.html,1月7日 20時05分,イスラエル・パレスチナ
【7日】孤立状態 少なくとも24地区 輪島市では700人超の地区も,https://www3.nhk.or.jp//news/html/20240107/k10014313041000.html,1月7日 20時03分,令和6年能登半島地震
【随時更新】ロシア ウクライナに軍事侵攻（1月7日の動き）,https://www3.nhk.or.jp//news/html/20240107/k10014295051000.html,1月7日 19時51分,ウクライナ情勢
【随時更新】イスラエル軍とハマス戦闘開始から3か月,https://www3.nhk.or.jp//news/html/20240107/k10014312791000.html,1月7日 19時49分,イスラエル・パレスチナ
上川外相がウクライナを訪問 ゼレンスキー大統領と会談で調整,https://www3.nhk.or.jp//news/html/20240107/k10014312591000.html,1月7日 19時38分,外務省
