title,link,time,category
袴田巌さんの無罪確定受け 検察官らが被害者遺族と面会し謝罪,https://www3.nhk.or.jp//news/html/20241012/k10014608071000.html,10月12日 7時33分,静岡県
日米共同統合演習めぐり ロシア外務省が抗議 日本は反論,https://www3.nhk.or.jp//news/html/20241012/k10014608091000.html,10月12日 7時16分,ロシア
ドジャース×パドレス【速報予定】先発は山本とダルビッシュ,https://www3.nhk.or.jp//news/html/20241012/k10014607791000.html,10月12日 7時13分,#大谷翔平
NY市場 ダウ平均株価 最高値更新 金融大手決算 市場予想上回る,https://www3.nhk.or.jp//news/html/20241012/k10014608111000.html,10月12日 7時10分,株価・為替
イラン外相 “より強力な防衛行動を用意” イスラエルをけん制,https://www3.nhk.or.jp//news/html/20241012/k10014607971000.html,10月12日 6時36分,イラン
ノーベル平和賞 日本被団協きょう会見 核廃絶など改めて訴えへ,https://www3.nhk.or.jp//news/html/20241012/k10014608041000.html,10月12日 6時34分,ノーベル賞2024
JR南武線 運転再開 武蔵溝ノ口～登戸の上下線,https://www3.nhk.or.jp//news/html/20241012/k10014608101000.html,10月12日 6時14分,鉄道
能登の記録的大雨から3週間 住宅被害1300棟余 増える可能性も,https://www3.nhk.or.jp//news/html/20241012/k10014607851000.html,10月12日 6時09分,石川県
能登の記録的な大雨 氾濫5河川の復旧は国が県に代わり実施へ,https://www3.nhk.or.jp//news/html/20241012/k10014607881000.html,10月12日 6時05分,石川県
衆院選 公示まで3日 党首ら各地で活動 事実上の選挙戦本格化,https://www3.nhk.or.jp//news/html/20241012/k10014607921000.html,10月12日 5時57分,衆議院選挙
プロ野球 セ・パ きょうからCSファーストステージ,https://www3.nhk.or.jp//news/html/20241012/k10014608011000.html,10月12日 5時53分,#プロ野球クライマックスシリーズ
北朝鮮 “韓国無人機が首都にビラ” 韓国軍は否定,https://www3.nhk.or.jp//news/html/20241012/k10014608081000.html,10月12日 5時43分,北朝鮮情勢
人材サービスを利用し就職した人への“お祝い金” 原則禁止へ,https://www3.nhk.or.jp//news/html/20241012/k10014607521000.html,10月12日 5時31分,厚生労働省
HPVワクチンのキャッチアップ接種 “初回接種を11月末までに”,https://www3.nhk.or.jp//news/html/20241012/k10014607781000.html,10月12日 5時20分,厚生労働省
“鼻にスプレーのインフルエンザワクチン”子どもに接種始まる,https://www3.nhk.or.jp//news/html/20241012/k10014607861000.html,10月12日 4時59分,インフルエンザ
千葉 「佐原の大祭」秋祭りが始まる ユネスコの無形文化遺産,https://www3.nhk.or.jp//news/html/20241012/k10014607361000.html,10月12日 4時52分,千葉県
石破首相 就任後 初の外国訪問 ラオスから帰国,https://www3.nhk.or.jp//news/html/20241012/k10014607931000.html,10月12日 2時12分,ASEAN
ノーベル平和賞に日本被団協 被爆者の立場から核兵器廃絶訴え,https://www3.nhk.or.jp//news/html/20241011/k10014606851000.html,10月12日 1時06分,ノーベル賞2024
バレーボール SVリーグ開幕 高橋藍 西田有志などが躍動,https://www3.nhk.or.jp//news/html/20241011/k10014608061000.html,10月12日 0時17分,#バレーボール
バスケットボール女子 Wリーグ開幕戦 ENEOSがトヨタに競り勝つ,https://www3.nhk.or.jp//news/html/20241011/k10014608031000.html,10月11日 22時21分,#バスケットボール
