title,link,time,category
タイ拠点に特殊詐欺か 日本人の容疑者 日本に移送へ,https://www3.nhk.or.jp//news/html/20231115/k10014258231000.html,11月15日 1時29分,事件
国連 各国の温室効果ガス削減目標 “不十分 対策強化を”,https://www3.nhk.or.jp//news/html/20231115/k10014258311000.html,11月15日 1時12分,国連
電通 榑谷社長が年内で退任 新社長に佐野傑統括執行役員,https://www3.nhk.or.jp//news/html/20231115/k10014258271000.html,11月15日 1時00分,東京オリンピック・パラリンピック
中国の二酸化炭素排出量 「来年減少に転じる可能性」,https://www3.nhk.or.jp//news/html/20231115/k10014258241000.html,11月15日 0時35分,中国
日本航空・全日空 業績回復でボーナスや一時金引き上げの方針,https://www3.nhk.or.jp//news/html/20231115/k10014258181000.html,11月15日 0時14分,航空
「Rapidus」がカナダ企業と業務提携 AI向け半導体の共同開発へ,https://www3.nhk.or.jp//news/html/20231114/k10014257911000.html,11月14日 23時54分,生成AI・人工知能
宝塚歌劇団 劇団員死亡 長時間活動など強い心理的負荷の可能性,https://www3.nhk.or.jp//news/html/20231114/k10014257121000.html,11月14日 23時49分,兵庫県
米の10月消費者物価指数3.2％上昇 予想下回り円相場一時値上り,https://www3.nhk.or.jp//news/html/20231114/k10014258251000.html,11月14日 23時48分,アメリカ
早稲田大学相撲部の男子部員 大麻取締法違反の疑いで逮捕,https://www3.nhk.or.jp//news/html/20231114/k10014258221000.html,11月14日 23時37分,事件
柏崎刈羽原発の追加検査 事務局に報告書とりまとめ指示 規制委,https://www3.nhk.or.jp//news/html/20231114/k10014258091000.html,11月14日 23時15分,各地の原発
首都高速道路 霞が関トンネル補修工事で車線規制 14日夜から,https://www3.nhk.or.jp//news/html/20231114/k10014258121000.html,11月14日 22時54分,
【随時更新】ガザ地区 死者1万1200人超 深刻な燃料不足も,https://www3.nhk.or.jp//news/html/20231114/k10014256801000.html,11月14日 22時23分,イスラエル・パレスチナ
田町駅近くのビルの飲食店で火事 2人けが 東京 港区,https://www3.nhk.or.jp//news/html/20231114/k10014258111000.html,11月14日 21時54分,東京都
保育所の運営会社 約5400万円を不正受給 川崎,https://www3.nhk.or.jp//news/html/20231114/k10014258031000.html,11月14日 21時48分,神奈川県
海外ユーチューバーの新幹線無賃乗車疑われる動画 被害届受理,https://www3.nhk.or.jp//news/html/20231114/k10014258191000.html,11月14日 21時42分,鉄道
中国 習近平国家主席 アメリカへ出発 米大統領との首脳会談へ,https://www3.nhk.or.jp//news/html/20231114/k10014258151000.html,11月14日 21時39分,中国
フィリピン人女性と日本人男性の子 来日相談増え支援団体要望,https://www3.nhk.or.jp//news/html/20231114/k10014258061000.html,11月14日 21時36分,フィリピン
社会福祉法人理事長逮捕 役員選任めぐり現金受け取ったか 福岡,https://www3.nhk.or.jp//news/html/20231114/k10014258101000.html,11月14日 21時31分,事件
プロ野球 西武 無期限処分中の山川穂高が国内に限ったFA権行使,https://www3.nhk.or.jp//news/html/20231114/k10014257991000.html,11月14日 21時23分,プロ野球
来年の台湾総統選 郭台銘氏が立候補の資格得る,https://www3.nhk.or.jp//news/html/20231114/k10014258071000.html,11月14日 21時16分,台湾
