title,link,time,category
NASA 世界平均気温“去年は最も高かった” 温室効果ガスが一因,https://www3.nhk.or.jp//news/html/20240113/k10014319461000.html,1月13日 9時22分,環境
NY原油市場1バレル＝75ドル台まで上昇 フーシ派拠点への空爆で,https://www3.nhk.or.jp//news/html/20240113/k10014319481000.html,1月13日 9時18分,原油価格
カブス移籍の今永昇太 本拠地シカゴで入団会見 背番号は「18」,https://www3.nhk.or.jp//news/html/20240113/k10014319501000.html,1月13日 9時15分,大リーグ
英首相 ウクライナへの4600億円規模の軍事支援を表明,https://www3.nhk.or.jp//news/html/20240113/k10014319441000.html,1月13日 9時10分,ウクライナ情勢
軍事作戦の停止求めたICJ訴訟 イスラエル 審理で正当性を主張,https://www3.nhk.or.jp//news/html/20240113/k10014319381000.html,1月13日 8時19分,イスラエル・パレスチナ
バイデン大統領“船舶攻撃続けばさらなる措置”戦闘の拡大懸念,https://www3.nhk.or.jp//news/html/20240113/k10014319421000.html,1月13日 7時57分,イスラエル・パレスチナ
上川外相 米国務長官と会談 岸田首相訪米へ 緊密に連携で一致,https://www3.nhk.or.jp//news/html/20240113/k10014319241000.html,1月13日 7時47分,外務省
旅客機の窓パネル事故 米連邦航空局「ほかにも製造上の問題」,https://www3.nhk.or.jp//news/html/20240113/k10014319471000.html,1月13日 7時41分,航空
【13日随時更新】ガザ地区 死亡者のうち1万人以上が子どもか,https://www3.nhk.or.jp//news/html/20240113/k10014319371000.html,1月13日 7時33分,イスラエル・パレスチナ
【交通影響 13日】道路・鉄道・航空,https://www3.nhk.or.jp//news/html/20240113/k10014319491000.html,1月13日 6時57分,令和6年能登半島地震
【ライフライン 13日】給水情報・停電続く,https://www3.nhk.or.jp//news/html/20240113/k10014319401000.html,1月13日 6時56分,令和6年能登半島地震
インド最長の海上道路 日本支援で開通 交通渋滞など軽減に期待,https://www3.nhk.or.jp//news/html/20240113/k10014319281000.html,1月13日 6時52分,インド
石川 輪島 被災のグループホーム高齢者が医療態勢整った施設へ,https://www3.nhk.or.jp//news/html/20240113/k10014319391000.html,1月13日 6時32分,令和6年能登半島地震
能登半島 被災地は雨 土砂災害に十分注意 日本海側中心に雪も,https://www3.nhk.or.jp//news/html/20240113/k10014319451000.html,1月13日 5時53分,令和6年能登半島地震
自民派閥改革 岸田首相 派閥の役割や機能など意見集約へ,https://www3.nhk.or.jp//news/html/20240113/k10014319231000.html,1月13日 5時48分,政治資金
米国務長官 中国の党高官と会談 台湾圧力強めないよう求めたか,https://www3.nhk.or.jp//news/html/20240113/k10014319271000.html,1月13日 5時33分,中国
台湾総統選挙 きょう投票日 昨夜3候補が最後の訴え,https://www3.nhk.or.jp//news/html/20240113/k10014319261000.html,1月13日 4時37分,台湾
きょうから大学入学共通テスト 被災の受験生は追試験の対象も,https://www3.nhk.or.jp//news/html/20240113/k10014319251000.html,1月13日 4時24分,共通テスト
石川 志賀町で震度4の地震 津波の心配なし,https://www3.nhk.or.jp//news/html/20240113/k10014319431000.html,1月13日 4時19分,地震
「数千年に1回の現象」防潮堤や海沿い岩礁約4m隆起 石川 輪島,https://www3.nhk.or.jp//news/html/20240113/k10014319341000.html,1月13日 3時49分,令和6年能登半島地震
