title,link,time,category
連邦議会乱入事件 トランプ氏 裁判で免責特権適用されると主張,https://www3.nhk.or.jp//news/html/20240110/k10014315821000.html,1月10日 7時52分,トランプ前大統領
2024年の世界経済 成長率は2.4％ 去年より低い見通し 世界銀行,https://www3.nhk.or.jp//news/html/20240110/k10014315831000.html,1月10日 7時50分,金融
国指定の重要文化財「旧笹川家住宅」で応急危険度判定 新潟市,https://www3.nhk.or.jp//news/html/20240110/k10014315841000.html,1月10日 7時49分,令和6年能登半島地震
世界最大規模のテクノロジー見本市開幕 AI関連技術などに注目,https://www3.nhk.or.jp//news/html/20240110/k10014315571000.html,1月10日 7時36分,生成AI・人工知能
【10日随時更新】米国務長官 外交的手段での緊張緩和に期待,https://www3.nhk.or.jp//news/html/20240110/k10014315811000.html,1月10日 7時31分,イスラエル・パレスチナ
能登半島地震の被災地 厳しい寒さ続く 土砂災害にも警戒を,https://www3.nhk.or.jp//news/html/20240110/k10014315511000.html,1月10日 6時52分,令和6年能登半島地震
【交通影響 10日】一般車両 通行できない区間も,https://www3.nhk.or.jp//news/html/20240110/k10014315711000.html,1月10日 6時39分,令和6年能登半島地震
エクアドルのテレビ局に武装集団進入 生放送中のスタジオ占拠,https://www3.nhk.or.jp//news/html/20240110/k10014315801000.html,1月10日 6時32分,テロ
【随時更新】ロシア ウクライナに軍事侵攻（1月10日の動き）,https://www3.nhk.or.jp//news/html/20240110/k10014315781000.html,1月10日 6時26分,ウクライナ情勢
能登半島地震を受け東京都が災害対策強化へ 通信機器配備など,https://www3.nhk.or.jp//news/html/20240110/k10014315581000.html,1月10日 6時17分,東京都
大学入学共通テスト 石川県内で受験予定の場合 全員追試験対象,https://www3.nhk.or.jp//news/html/20240110/k10014315751000.html,1月10日 6時15分,共通テスト
千葉 八街 アパートで55歳の男性死亡 傷害の疑いで知人を逮捕,https://www3.nhk.or.jp//news/html/20240110/k10014315741000.html,1月10日 6時11分,事件
米国務長官 イスラエルの外交的手段による緊張緩和に期待,https://www3.nhk.or.jp//news/html/20240110/k10014315561000.html,1月10日 6時05分,イスラエル・パレスチナ
ロシア ショイグ国防相 「戦略的な主導権を維持」と強調,https://www3.nhk.or.jp//news/html/20240110/k10014315551000.html,1月10日 5時58分,ウクライナ情勢
上川外相 フィンランド外相と会談 安全保障などで連携強化確認,https://www3.nhk.or.jp//news/html/20240110/k10014315731000.html,1月10日 5時57分,フィンランド
ことし1月～5月値上げ予定の食品 去年比で約6割減少する見通し,https://www3.nhk.or.jp//news/html/20240110/k10014315441000.html,1月10日 5時53分,物価高騰
ことしの日本経済 堅調に推移も成長緩やかか デフレ脱却が焦点,https://www3.nhk.or.jp//news/html/20240110/k10014315481000.html,1月10日 5時51分,物価高騰
【ライフライン 10日】断水・停電続く 給水・入浴支援情報,https://www3.nhk.or.jp//news/html/20240110/k10014315641000.html,1月10日 5時50分,令和6年能登半島地震
自民 政治刷新本部を10日設置へ 政治資金問題の再発防止を検討,https://www3.nhk.or.jp//news/html/20240110/k10014315491000.html,1月10日 5時42分,政治資金
岸田首相 能登半島地震の被災地 早ければ13日にも視察で調整,https://www3.nhk.or.jp//news/html/20240110/k10014315651000.html,1月10日 5時39分,令和6年能登半島地震
