title,link,time,category
卓球 平野が新型コロナ 抗原検査陽性で全日本選手権を棄権,https://www3.nhk.or.jp//news/html/20220130/k10013457011000.html,1月30日 1時03分,卓球
スキーノルディック複合 W杯個人第16戦 渡部は17位,https://www3.nhk.or.jp//news/html/20220130/k10013457001000.html,1月30日 0時58分,スキーノルディック複合
スキージャンプ女子 W杯第10戦 伊藤有希が4位,https://www3.nhk.or.jp//news/html/20220130/k10013456991000.html,1月30日 0時17分,スキージャンプ
“羽毛のような羽”持つ小さな昆虫 その独特の飛び方を解明,https://www3.nhk.or.jp//news/html/20220129/k10013456861000.html,1月29日 23時52分,
小6 12歳 張心治さん 囲碁のプロ棋士へ 女性で史上3番目の若さ,https://www3.nhk.or.jp//news/html/20220129/k10013456781000.html,1月29日 23時47分,
フィギュアスケート ネイサン・チェン 本番のリンクで初練習,https://www3.nhk.or.jp//news/html/20220129/k10013456981000.html,1月29日 23時45分,フィギュアスケート
バイクと歩行者がからむ事故 会社員と高齢女性 死亡 愛知 豊橋,https://www3.nhk.or.jp//news/html/20220129/k10013456961000.html,1月29日 23時18分,
大型トラックと乗用車が正面衝突 男性2人死亡 山口 美祢,https://www3.nhk.or.jp//news/html/20220129/k10013456951000.html,1月29日 23時17分,
車いすラグビー 来月の日本選手権 新型コロナの感染拡大で中止,https://www3.nhk.or.jp//news/html/20220129/k10013456971000.html,1月29日 23時09分,車いすラグビー
【国内感染】新型コロナ 39人死亡 8万4933人感染,https://www3.nhk.or.jp//news/html/20220129/k10013456761000.html,1月29日 23時04分,新型コロナ 国内感染者数
山梨県 新型コロナ 新たに357人感染確認,https://www3.nhk.or.jp//news/html/20220129/k10013456621000.html,1月29日 23時01分,新型コロナ 国内感染者数
テニス 全豪オープン 女子シングルス バーティが初優勝,https://www3.nhk.or.jp//news/html/20220129/k10013456921000.html,1月29日 22時18分,テニス
J1 名古屋グランパス 選手1人コロナ感染 練習再開のめどたたず,https://www3.nhk.or.jp//news/html/20220129/k10013456911000.html,1月29日 22時04分,サッカー
京急線 運転再開 京急川崎-神奈川新町 上下線,https://www3.nhk.or.jp//news/html/20220129/k10013456931000.html,1月29日 21時37分,
スノーボード中の男性 雪崩に巻き込まれる 新潟 南魚沼,https://www3.nhk.or.jp//news/html/20220129/k10013456891000.html,1月29日 21時36分,
東京都 コロナ 新たに1万7433人感染確認 先週土曜日の約1.6倍,https://www3.nhk.or.jp//news/html/20220129/k10013456391000.html,1月29日 21時21分,新型コロナ 国内感染者数
北京五輪へ結団式 高木主将「日本中へ勇気と明るさを届ける」,https://www3.nhk.or.jp//news/html/20220129/k10013456531000.html,1月29日 21時05分,北京 冬季オリンピック・パラリンピック
ジョージアで旧ソビエト時代に作られた貴重な映画 東京で上映,https://www3.nhk.or.jp//news/html/20220129/k10013456811000.html,1月29日 20時52分,
子どもの入院急増で小児高度医療にも影響が 新型コロナ,https://www3.nhk.or.jp//news/html/20220129/k10013456841000.html,1月29日 20時48分,新型コロナウイルス
熊本県 新型コロナ 1人死亡 1040人感染確認 4日連続1000人超え,https://www3.nhk.or.jp//news/html/20220129/k10013456741000.html,1月29日 20時25分,新型コロナ 国内感染者数
