title,link,time,category
インドとバングラデシュで大雨 洪水や土砂崩れ相次ぎ60人死亡,https://www3.nhk.or.jp//news/html/20220620/k10013679521000.html,6月20日 5時26分,
“同性婚認められないのは不当”集団訴訟 きょう2件目の判決,https://www3.nhk.or.jp//news/html/20220620/k10013679431000.html,6月20日 5時12分,ジェンダー
石川 珠洲で震度6弱 今後1週間ほど同程度の地震に注意を,https://www3.nhk.or.jp//news/html/20220620/k10013679541000.html,6月20日 5時02分,
仏議会下院の決選投票 “与党連合 過半数下回ることが確実に”,https://www3.nhk.or.jp//news/html/20220620/k10013679351000.html,6月20日 4時55分,フランス
ドローン きょうから所有者情報の登録義務化 違反で罰則も,https://www3.nhk.or.jp//news/html/20220620/k10013679261000.html,6月20日 4時41分,
ロシア軍 ウクライナ東部ルハンシク州の完全掌握を目指し攻勢,https://www3.nhk.or.jp//news/html/20220620/k10013679301000.html,6月20日 4時38分,ウクライナ情勢
参議院選挙あさって公示 事実上の選挙戦本格化,https://www3.nhk.or.jp//news/html/20220620/k10013679211000.html,6月20日 4時20分,参院選
大手商社 森林への投資強化の動き 背景に脱炭素や木材需要増,https://www3.nhk.or.jp//news/html/20220620/k10013679251000.html,6月20日 4時15分,脱炭素社会への動き
美術作品などのデジタル化技術進む 地域活性化に活用の動きも,https://www3.nhk.or.jp//news/html/20220620/k10013679241000.html,6月20日 4時12分,
米財務長官 “政権内で対中関税の一部引き下げ検討”,https://www3.nhk.or.jp//news/html/20220620/k10013679531000.html,6月20日 4時10分,
鉄鋼業界で脱炭素の動き本格化 新たな技術で作った製品出荷,https://www3.nhk.or.jp//news/html/20220620/k10013679221000.html,6月20日 4時06分,脱炭素社会への動き
丸の内商業施設で転落の小学生死亡 自分で柵を乗り越え転落か,https://www3.nhk.or.jp//news/html/20220620/k10013679551000.html,6月20日 1時04分,
ロシア海軍の駆逐艦など5隻 日本列島ほぼ半周 防衛省 目的分析,https://www3.nhk.or.jp//news/html/20220620/k10013679511000.html,6月20日 0時30分,ロシア
山梨市で収穫前の桃4000個盗難か 被害額は約100万円分に,https://www3.nhk.or.jp//news/html/20220619/k10013679481000.html,6月19日 23時47分,
来月発足の香港政府 ナンバー2も保安部門出身に 中国政府任命,https://www3.nhk.or.jp//news/html/20220619/k10013679461000.html,6月19日 22時53分,
国道で3台関係する多重事故 7人搬送うち1人意識不明 宇都宮,https://www3.nhk.or.jp//news/html/20220619/k10013678571000.html,6月19日 22時49分,事故
多摩川で溺れた13歳と14歳の男の子いずれも死亡 東京 日野,https://www3.nhk.or.jp//news/html/20220619/k10013679191000.html,6月19日 22時23分,事故
レスリング全日本選抜 女子50キロ級 須崎優衣が優勝,https://www3.nhk.or.jp//news/html/20220619/k10013679391000.html,6月19日 22時23分,レスリング
鹿児島 十島村全域 369世帯650人に避難指示,https://www3.nhk.or.jp//news/html/20220619/k10013679471000.html,6月19日 22時17分,気象
日本卓球協会 新理事に平野早矢香さん就任 ロンドン五輪で銀,https://www3.nhk.or.jp//news/html/20220619/k10013679421000.html,6月19日 22時02分,卓球
