title,link,time,category
フィギュア四大陸選手権 鍵山優真 男子シングルSPで首位に,https://www3.nhk.or.jp//news/html/20240201/k10014344211000.html,2月1日 22時28分,フィギュアスケート
衆院本会議 代表質問 政治資金規正法の改正など求め議論,https://www3.nhk.or.jp//news/html/20240201/k10014343891000.html,2月1日 22時24分,衆議院
石川 珠洲と能登町 2つの郵便局 2日からすべての窓口業務再開,https://www3.nhk.or.jp//news/html/20240201/k10014343981000.html,2月1日 22時19分,令和6年能登半島地震
市民グループ 安倍派幹部ら10人の告発状提出 “所得税の脱税”,https://www3.nhk.or.jp//news/html/20240201/k10014343841000.html,2月1日 22時14分,政治資金
ミャンマー軍事クーデターから3年 各地で「沈黙のストライキ」,https://www3.nhk.or.jp//news/html/20240201/k10014343651000.html,2月1日 22時09分,ミャンマー
長野 宮田村 3年前の殺人未遂容疑で指名手配 暴力団幹部を逮捕,https://www3.nhk.or.jp//news/html/20240201/k10014342861000.html,2月1日 22時01分,事件
ユーロ圏消費者物価指数2.8％上昇 伸び率2か月ぶり前月下回る,https://www3.nhk.or.jp//news/html/20240201/k10014344101000.html,2月1日 21時59分,EU
サッカー伊東純也 日本代表を離脱 協会“一部報道で慎重対応”,https://www3.nhk.or.jp//news/html/20240201/k10014344081000.html,2月1日 21時54分,サッカー日本代表
のと里山海道 輪島方面の下り線通行止め 3月中旬までに解除へ,https://www3.nhk.or.jp//news/html/20240201/k10014344071000.html,2月1日 21時47分,令和6年能登半島地震
自民 安倍派 最後の議員総会 派閥としての活動終える,https://www3.nhk.or.jp//news/html/20240201/k10014343501000.html,2月1日 21時45分,政治資金
政府 最大300万円程度の支援金支給など 能登半島地震 追加支援,https://www3.nhk.or.jp//news/html/20240201/k10014343901000.html,2月1日 21時44分,令和6年能登半島地震
あおぞら銀行 今年度業績予想 一転 280億円の赤字見通し,https://www3.nhk.or.jp//news/html/20240201/k10014344041000.html,2月1日 21時36分,金融
サイバー攻撃でエックス線画像など漏えいおそれ 埼玉の事業団,https://www3.nhk.or.jp//news/html/20240201/k10014344051000.html,2月1日 21時34分,サイバー攻撃
プロ野球 きょうからキャンプイン 阪神は史上初の連覇目指す,https://www3.nhk.or.jp//news/html/20240201/k10014343181000.html,2月1日 21時32分,プロ野球
京アニ事件 遺族や社員“事件伝える碑の設置を” 宇治市に要望,https://www3.nhk.or.jp//news/html/20240201/k10014343991000.html,2月1日 21時30分,アニメ会社放火
イギリスの中央銀行 政策金利を据え置き 去年9月以降4回連続,https://www3.nhk.or.jp//news/html/20240201/k10014344191000.html,2月1日 21時22分,イギリス
柿沢未途 前法務副大臣が議員辞職 公選法違反などの罪で起訴,https://www3.nhk.or.jp//news/html/20240201/k10014342871000.html,2月1日 21時17分,事件
ユース五輪 工藤璃星 金 清水さら 銀 スノボ女子ハーフパイプ,https://www3.nhk.or.jp//news/html/20240201/k10014343411000.html,2月1日 21時14分,スノーボード
EU 臨時首脳会議 ウクライナへの巨額資金支援 全加盟国が合意,https://www3.nhk.or.jp//news/html/20240201/k10014343971000.html,2月1日 21時13分,ウクライナ情勢
能登半島地震1か月 石川県 1万4000人以上避難 生活支援課題に,https://www3.nhk.or.jp//news/html/20240201/k10014342491000.html,2月1日 21時04分,令和6年能登半島地震
