title,link,time,category
日本シリーズ【速報中】オリックスと阪神 3勝3敗で第7戦へ,https://www3.nhk.or.jp//news/html/20231104/k10014247151000.html,11月4日 22時05分,日本シリーズ
“ゼレンスキー大統領 欧米に裏切られたと感じている” 米雑誌,https://www3.nhk.or.jp//news/html/20231104/k10014247161000.html,11月4日 21時26分,ウクライナ情勢
Jリーグカップ アビスパ福岡 初優勝 クラブ史上初タイトル,https://www3.nhk.or.jp//news/html/20231104/k10014247121000.html,11月4日 21時14分,サッカーJリーグ
岸田首相 マレーシア到着 あす首脳会談 安保分野で協力強化へ,https://www3.nhk.or.jp//news/html/20231104/k10014247421000.html,11月4日 21時10分,安全保障
【最新】日本シリーズ 第6戦 阪神の日本一決まるか 各地の動き,https://www3.nhk.or.jp//news/html/20231104/k10014247311000.html,11月4日 20時54分,日本シリーズ
ガザ地区 国連運営の学校で爆発 15人死亡 保健当局発表,https://www3.nhk.or.jp//news/html/20231104/k10014247341000.html,11月4日 20時52分,イスラエル・パレスチナ
【随時更新】ガザ地区の学校で爆発 15人死亡 保健当局発表,https://www3.nhk.or.jp//news/html/20231104/k10014246891000.html,11月4日 20時48分,イスラエル・パレスチナ
上川外相 ヨルダン訪問 戦闘の人道的休止に向け協力で一致,https://www3.nhk.or.jp//news/html/20231104/k10014247321000.html,11月4日 20時35分,イスラエル・パレスチナ
AIアートグランプリ開催 動画やゲームなど124作品の応募 東京,https://www3.nhk.or.jp//news/html/20231104/k10014247351000.html,11月4日 20時32分,東京都
相撲 全国学生選手権 日大 草野直哉が初優勝 学生横綱に,https://www3.nhk.or.jp//news/html/20231104/k10014247301000.html,11月4日 20時25分,
“ひきこもり支援の強化を” 家族などの団体がシンポジウム,https://www3.nhk.or.jp//news/html/20231104/k10014247361000.html,11月4日 20時23分,厚生労働省
富裕層の取り込み強化 日本政府観光局 中東の産油国ターゲット,https://www3.nhk.or.jp//news/html/20231104/k10014247261000.html,11月4日 19時44分,観光
ガザ地区退避 国境なき医師団の日本人スタッフ 緊迫の日々語る,https://www3.nhk.or.jp//news/html/20231104/k10014247331000.html,11月4日 19時38分,イスラエル・パレスチナ
ロシア軍 大統領選も念頭にウクライナ東部へ大規模攻撃準備か,https://www3.nhk.or.jp//news/html/20231104/k10014247181000.html,11月4日 19時37分,ウクライナ情勢
イランでイスラエルとアメリカに対する大規模な抗議デモ,https://www3.nhk.or.jp//news/html/20231104/k10014247251000.html,11月4日 19時20分,イラン
立民 岡田幹事長“経済対策対応遅い 問題点ただす時間確保を”,https://www3.nhk.or.jp//news/html/20231104/k10014247271000.html,11月4日 19時13分,税制改正
スケートボード パーク日本選手権 女子 草木ひなのが3連覇,https://www3.nhk.or.jp//news/html/20231104/k10014247281000.html,11月4日 19時12分,スケートボード
季節外れの暑さ 都心でも11月では14年ぶり夏日 あすも夏日予想,https://www3.nhk.or.jp//news/html/20231104/k10014247031000.html,11月4日 19時10分,気象
イスラエル軍 ハマス拠点破壊進める ガザ地区 医療施設に被害,https://www3.nhk.or.jp//news/html/20231104/k10014247291000.html,11月4日 19時00分,イスラエル・パレスチナ
都内のイスラエル大使館周辺で文化人らが停戦を求め抗議活動,https://www3.nhk.or.jp//news/html/20231104/k10014247231000.html,11月4日 18時32分,東京都
