title,link,time,category
自転車 男子BMX 中村輪夢は予選6位で決勝へ パリオリンピック,https://www3.nhk.or.jp//news/html/20240731/k10014530571000.html,7月31日 1時36分,#自転車競技
パリオリンピック【速報中】7/30～31タイムライン,https://www3.nhk.or.jp//news/html/20240730/k10014529931000.html,7月31日 1時31分,#パリオリンピック
柔道 永瀬貴規が金メダル 2大会連続 男子81キロ級 パリ五輪,https://www3.nhk.or.jp//news/html/20240730/k10014530531000.html,7月31日 1時20分,#柔道
広瀬議員の公設秘書 複数の事務所関係者 “勤務実態なかった”,https://www3.nhk.or.jp//news/html/20240730/k10014530461000.html,7月31日 1時03分,
【プロ野球結果】ソフトバンク5連勝 優勝マジック「42」点灯,https://www3.nhk.or.jp//news/html/20240731/k10014530561000.html,7月31日 0時28分,#プロ野球
アーチェリー 男子個人 斉藤史弥 ２回戦敗退 パリオリンピック,https://www3.nhk.or.jp//news/html/20240731/k10014530551000.html,7月31日 0時18分,#アーチェリー
バドミントン 女子ダブルス シダマツペア 予選通過 パリ五輪,https://www3.nhk.or.jp//news/html/20240730/k10014530541000.html,7月30日 23時46分,#バドミントン
日銀 追加の利上げ検討へ 0.25％程度に引き上げる案など議論か,https://www3.nhk.or.jp//news/html/20240730/k10014530221000.html,7月30日 23時43分,日本銀行（日銀）
80代夫婦と娘が殺害された事件 指名手配の孫を鳥取市内で確保,https://www3.nhk.or.jp//news/html/20240730/k10014530471000.html,7月30日 22時52分,事件
競泳 男子200mバタフライ 本多灯 予選敗退 パリ五輪,https://www3.nhk.or.jp//news/html/20240730/k10014530441000.html,7月30日 22時42分,#競泳
競泳 渡辺と花車 男子200m平泳ぎ ともに準決勝進出 パリ五輪,https://www3.nhk.or.jp//news/html/20240730/k10014530411000.html,7月30日 22時34分,#競泳
青森 八戸 南郷の2地区 避難指示を解除,https://www3.nhk.or.jp//news/html/20240730/k10014530481000.html,7月30日 22時34分,青森県
競泳 男子800mリレー 日本 予選8位で決勝進出 パリ五輪,https://www3.nhk.or.jp//news/html/20240730/k10014530431000.html,7月30日 22時19分,#競泳
駐中国大使が山東省トップと会談 経済関係の強化で一致,https://www3.nhk.or.jp//news/html/20240730/k10014530361000.html,7月30日 22時11分,中国
九州～東北 猛暑日200地点超 31日も猛烈な暑さに 熱中症警戒を,https://www3.nhk.or.jp//news/html/20240730/k10014529591000.html,7月30日 21時28分,気象
競泳 寺門弦輝 男子200mバタフライ 準決勝進出 パリ五輪,https://www3.nhk.or.jp//news/html/20240730/k10014530151000.html,7月30日 21時21分,#競泳
パリ五輪 トライアスロン1日延期 セーヌ川の水質基準満たさず,https://www3.nhk.or.jp//news/html/20240730/k10014529581000.html,7月30日 21時21分,#パリオリンピック
能登半島地震の災害関連死 21人を答申 認定されれば100人超に,https://www3.nhk.or.jp//news/html/20240730/k10014530391000.html,7月30日 21時19分,令和6年能登半島地震
柔道 永瀬貴規 男子81キロ級 準決勝進出 パリオリンピック,https://www3.nhk.or.jp//news/html/20240730/k10014530021000.html,7月30日 21時16分,#柔道
サッカーJ1 松木玖生 イングランドのサウサンプトンに移籍決定,https://www3.nhk.or.jp//news/html/20240730/k10014530401000.html,7月30日 21時09分,#サッカー
