title,link,time,category
熊本県産として販売のアサリ 約97％ “外国産混入の可能性”,https://www3.nhk.or.jp//news/html/20220201/k10013460531000.html,2月1日 13時09分,
映画の海賊版サイトに誘導 著作権侵害の疑い 大阪の運営者逮捕,https://www3.nhk.or.jp//news/html/20220201/k10013460481000.html,2月1日 13時04分,事件
自民 茂木幹事長 自公の選挙協力「丁寧に時間かけて合意を」,https://www3.nhk.or.jp//news/html/20220201/k10013460491000.html,2月1日 12時58分,参院選
ミャンマー クーデター1年 軍の統治拒む「沈黙のストライキ」,https://www3.nhk.or.jp//news/html/20220201/k10013460391000.html,2月1日 12時55分,ミャンマー
“3回目接種 高齢者以外の人への前倒し 自治体を支援” 総務相,https://www3.nhk.or.jp//news/html/20220201/k10013460411000.html,2月1日 12時52分,新型コロナ ワクチン（日本国内）
台湾 北京五輪の開会式と閉会式 一転参加へ IOCの要請受け,https://www3.nhk.or.jp//news/html/20220201/k10013460511000.html,2月1日 12時42分,北京 冬季オリンピック・パラリンピック
政府「佐渡島の金山」世界文化遺産への推薦 閣議で了解,https://www3.nhk.or.jp//news/html/20220201/k10013460181000.html,2月1日 12時31分,日韓関係
堀内ワクチン相 閣僚にモデルナワクチン接種呼びかけ,https://www3.nhk.or.jp//news/html/20220201/k10013460471000.html,2月1日 12時30分,新型コロナウイルス
川崎 男性死亡監禁事件 逮捕の父親「外に出すと迷惑と思った」,https://www3.nhk.or.jp//news/html/20220201/k10013460501000.html,2月1日 12時27分,事件
郵政不祥事相次ぐ 総務省 監督体制強化へ 有識者会議設置,https://www3.nhk.or.jp//news/html/20220201/k10013460421000.html,2月1日 12時26分,
ウクライナ情勢 米ロ外相 きょう電話会談へ 緊張緩和の糸口は,https://www3.nhk.or.jp//news/html/20220201/k10013460441000.html,2月1日 12時13分,ロシア
“緊急事態宣言発出は制限範囲など共通認識が必要” 尾身会長,https://www3.nhk.or.jp//news/html/20220201/k10013460381000.html,2月1日 12時05分,新型コロナウイルス
石川 小松市長 F15戦闘機の飛行訓練 見合わせ要請,https://www3.nhk.or.jp//news/html/20220201/k10013460401000.html,2月1日 12時03分,自衛隊
中国海軍の艦艇 海警局の船に転用のため10隻余を大規模改修か,https://www3.nhk.or.jp//news/html/20220201/k10013460371000.html,2月1日 11時55分,中国
F15戦闘機不明 無線連絡 救難信号確認されず 急激に状況悪化か,https://www3.nhk.or.jp//news/html/20220201/k10013460461000.html,2月1日 11時53分,自衛隊
福島県 新型コロナ 新たに402人感染確認,https://www3.nhk.or.jp//news/html/20220201/k10013460431000.html,2月1日 11時51分,新型コロナ 国内感染者数
山形県 新型コロナ 新たに284人感染確認 過去最多,https://www3.nhk.or.jp//news/html/20220201/k10013460451000.html,2月1日 11時45分,新型コロナ 国内感染者数
学校などで感染拡大“オミクロン株の特性踏まえ検討”山際大臣,https://www3.nhk.or.jp//news/html/20220201/k10013460361000.html,2月1日 11時37分,新型コロナウイルス
ワクチン職域接種 人数要件を緩和 500人以上に引き下げへ,https://www3.nhk.or.jp//news/html/20220201/k10013460351000.html,2月1日 11時32分,新型コロナ ワクチン（日本国内）
F15戦闘機不明 海で機体の一部発見 パイロット2人の捜索に全力,https://www3.nhk.or.jp//news/html/20220201/k10013460091000.html,2月1日 11時27分,自衛隊
