title,link,time,category
世界の大学ランキング 東京大学29位 前年より順位上げる,https://www3.nhk.or.jp//news/html/20230928/k10014209311000.html,9月28日 16時04分,教育
川であゆ釣り中の男性 クマに襲われけが クマは逃げる 富山,https://www3.nhk.or.jp//news/html/20230928/k10014209331000.html,9月28日 16時01分,富山県
10月開始 スケートリンク 暑さで凍りにくく苦慮 東京 江戸川区,https://www3.nhk.or.jp//news/html/20230928/k10014209291000.html,9月28日 16時00分,気象
大リーグ初 アクーニャJr. 今季ホームラン40本と70盗塁を達成,https://www3.nhk.or.jp//news/html/20230928/k10014209121000.html,9月28日 15時58分,大リーグ
大型トレーラー駐車場に突っ込み約10台の車に衝突 滋賀 湖南,https://www3.nhk.or.jp//news/html/20230928/k10014209271000.html,9月28日 15時57分,滋賀県
サッカー男子 U-22日本代表 10月 アメリカに遠征し強化試合へ,https://www3.nhk.or.jp//news/html/20230928/k10014209301000.html,9月28日 15時53分,サッカー
“パンをどれだけ焼き続けられるか” ギネス世界記録達成 松江,https://www3.nhk.or.jp//news/html/20230928/k10014209281000.html,9月28日 15時49分,島根県
静岡 病院で3人死亡 夫は妻入院以降 周囲と接触避けるように,https://www3.nhk.or.jp//news/html/20230928/k10014208991000.html,9月28日 15時45分,事件
米大統領選へ 共和党 2回目候補者討論会 トランプ氏欠席の中で,https://www3.nhk.or.jp//news/html/20230928/k10014209051000.html,9月28日 15時44分,アメリカ大統領選
広島に住む在日韓国人の被爆者ら 韓国政府の招き受け訪問,https://www3.nhk.or.jp//news/html/20230928/k10014209261000.html,9月28日 15時24分,韓国
台湾 初めて自主建造した潜水艦の進水式行われる,https://www3.nhk.or.jp//news/html/20230928/k10014209251000.html,9月28日 15時18分,台湾
JR八王子駅周辺のビルや店舗など落書きか 20代容疑者2人を逮捕,https://www3.nhk.or.jp//news/html/20230928/k10014209031000.html,9月28日 15時14分,事件
運動会参加の児童30人が熱中症か 病院に搬送 滋賀 彦根,https://www3.nhk.or.jp//news/html/20230928/k10014209131000.html,9月28日 15時08分,熱中症
国内自動車メーカーの8月の販売台数 中国での減少目立つ,https://www3.nhk.or.jp//news/html/20230928/k10014209191000.html,9月28日 15時05分,自動車
静岡市や三重 桑名市で35度超 統計開始から最も遅い猛暑日に,https://www3.nhk.or.jp//news/html/20230928/k10014208621000.html,9月28日 15時04分,熱中症
公明 新たな経済対策 中小企業賃上げなど支援策を 申し入れへ,https://www3.nhk.or.jp//news/html/20230928/k10014209241000.html,9月28日 15時02分,物価高騰
そごう・西武 売却中止求め裁判起こした一部株主 訴え取り下げ,https://www3.nhk.or.jp//news/html/20230928/k10014209221000.html,9月28日 14時43分,
グループホーム職員が「心理的虐待」 食材費問題の会社が運営,https://www3.nhk.or.jp//news/html/20230928/k10014209171000.html,9月28日 14時36分,千葉県
トランプ氏 ミシガン州で自動車産業の労働組合員などへ演説,https://www3.nhk.or.jp//news/html/20230928/k10014208951000.html,9月28日 14時33分,アメリカ大統領選
洋上風力発電めぐる事件 経産省 日本風力開発に補助金停止措置,https://www3.nhk.or.jp//news/html/20230928/k10014209201000.html,9月28日 14時30分,経済産業省
