title,link,time,category
NATO 次期事務総長にオランダのルッテ首相が就任の見通し,https://www3.nhk.or.jp//news/html/20240620/k10014487421000.html,6月20日 22時01分,NATO
サッカー最新世界ランキング 日本は17位に アジア最上位を維持,https://www3.nhk.or.jp//news/html/20240620/k10014487381000.html,6月20日 21時59分,サッカー
東京地裁 秋本真利衆院議員の保釈認める決定 検察の準抗告退け,https://www3.nhk.or.jp//news/html/20240620/k10014486651000.html,6月20日 21時57分,事件
高齢者の配食事業で安否確認怠る 札幌市長は事業者の処分検討,https://www3.nhk.or.jp//news/html/20240620/k10014487281000.html,6月20日 21時50分,北海道
ロシアと北朝鮮の新条約署名 韓国「厳重な憂慮示し糾弾する」,https://www3.nhk.or.jp//news/html/20240620/k10014487371000.html,6月20日 21時49分,韓国
イングランド銀行 政策金利据え置きを発表 7会合連続,https://www3.nhk.or.jp//news/html/20240620/k10014487361000.html,6月20日 21時47分,イギリス
財務省の車が歩行者はねて逃走し横転 運転していた会社員 逮捕,https://www3.nhk.or.jp//news/html/20240620/k10014487171000.html,6月20日 21時44分,事件
叡王戦 藤井八冠が伊藤匠七段に敗れる タイトル独占崩れ七冠に,https://www3.nhk.or.jp//news/html/20240620/k10014486551000.html,6月20日 21時22分,藤井七冠
広告に「岩手山」ではなく「岩木山」掲載 不動産会社が謝罪,https://www3.nhk.or.jp//news/html/20240620/k10014487311000.html,6月20日 21時14分,岩手県
津波被害の仙台の海水浴場 震災後初のオープンへ 市が避難計画,https://www3.nhk.or.jp//news/html/20240620/k10014487081000.html,6月20日 21時08分,東日本大震災
能登半島地震の被災地 梅雨入り前に“ふだん以上に注意を”,https://www3.nhk.or.jp//news/html/20240620/k10014487001000.html,6月20日 21時04分,令和6年能登半島地震
“新紙幣で現紙幣使えず” 偽情報がSNSで広がる「詐欺に注意」,https://www3.nhk.or.jp//news/html/20240620/k10014487251000.html,6月20日 21時01分,財務省
九州南部あす午前にかけ線状降水帯おそれ 土砂災害に厳重警戒,https://www3.nhk.or.jp//news/html/20240620/k10014486461000.html,6月20日 21時00分,気象
ラグビー日本代表 イングランド戦メンバー発表 リーチが主将に,https://www3.nhk.or.jp//news/html/20240620/k10014486781000.html,6月20日 20時52分,ラグビー日本代表
熊本 苓北町 障害者施設の車 フェンスに衝突 1人死亡9人重軽傷,https://www3.nhk.or.jp//news/html/20240620/k10014486681000.html,6月20日 20時41分,事故
イスラエル軍報道官 “ハマス壊滅は不可能” 政権と軍が緊張か,https://www3.nhk.or.jp//news/html/20240620/k10014487191000.html,6月20日 20時39分,イスラエル
「地球温暖化も問題なし？」トランプ氏のエネルギー政策とは？,https://www3.nhk.or.jp//news/html/20240620/k10014487091000.html,6月20日 20時28分,アメリカ大統領選
プーチン大統領 ベトナム国家主席と会談 協力深めることで合意,https://www3.nhk.or.jp//news/html/20240620/k10014487201000.html,6月20日 20時11分,プーチン大統領
川崎市“生田緑地 公式Xで都知事選候補者に関する不適切投稿”,https://www3.nhk.or.jp//news/html/20240620/k10014487271000.html,6月20日 20時10分,神奈川県
FTXトレーディング日本法人 国内同業大手が買収の方向で調整,https://www3.nhk.or.jp//news/html/20240620/k10014487291000.html,6月20日 20時06分,暗号資産
