title,link,time,category
自宅療養者大幅増 支援ステーション運用開始 東京 杉並区,https://www3.nhk.or.jp//news/html/20210901/k10013236801000.html,9月1日 15時44分,新型コロナウイルス
アフガニスタンから完全撤退 アメリカは今後どうする?【解説】,https://www3.nhk.or.jp//news/html/20210901/k10013236751000.html,9月1日 15時41分,アフガニスタン
兵庫県 新型コロナ 新たに1018人感染確認 県内計6万6464人に,https://www3.nhk.or.jp//news/html/20210901/k10013236831000.html,9月1日 15時38分,新型コロナ 国内感染者数
群馬県 新型コロナ 新たに180人感染確認 県内計1万5099人,https://www3.nhk.or.jp//news/html/20210901/k10013236761000.html,9月1日 15時32分,新型コロナ 国内感染者数
備蓄の非常食を無償提供 コロナで経済的困窮者支援 埼玉 加須,https://www3.nhk.or.jp//news/html/20210901/k10013236731000.html,9月1日 15時30分,新型コロナ 経済影響
女子高校生 群馬の夫婦自宅に連れていかれ宿泊 山梨で殺害か,https://www3.nhk.or.jp//news/html/20210901/k10013236461000.html,9月1日 15時27分,事件
福井県 新型コロナ 新たに26人感染確認 県内累計2603人,https://www3.nhk.or.jp//news/html/20210901/k10013236741000.html,9月1日 15時17分,新型コロナ 国内感染者数
パラリンピック 射撃 混合エアライフル 水田光夏は32位,https://www3.nhk.or.jp//news/html/20210901/k10013236721000.html,9月1日 15時11分,パラ射撃
米同時多発テロ事件遺族 東日本大震災被災者 オンラインで交流,https://www3.nhk.or.jp//news/html/20210901/k10013236691000.html,9月1日 15時08分,テロ
テレビ番組「ニュース女子」で名誉毀損 制作会社に賠償命令,https://www3.nhk.or.jp//news/html/20210901/k10013236711000.html,9月1日 15時07分,基地問題
東京パラリンピック【随時更新】大会9日目 1日の結果や動き,https://www3.nhk.or.jp//news/html/20210901/k10013235941000.html,9月1日 15時03分,オリンピック・パラリンピック
柏崎刈羽原発 テロ対策不備相次ぎ 検査態勢強化の取り組み導入,https://www3.nhk.or.jp//news/html/20210901/k10013236701000.html,9月1日 15時02分,各地の原発
パラリンピック 車いすテニス男子 国枝慎吾が準決勝進出,https://www3.nhk.or.jp//news/html/20210901/k10013236631000.html,9月1日 14時55分,車いすテニス
パラリンピック 陸上男子砲丸投げ 世界新で金も招集遅れで幻に,https://www3.nhk.or.jp//news/html/20210901/k10013236661000.html,9月1日 14時38分,パラ陸上
北朝鮮 原子炉再稼働か 米研究グループが最新の衛星写真 公開,https://www3.nhk.or.jp//news/html/20210901/k10013236641000.html,9月1日 14時27分,北朝鮮情勢
高知県 新型コロナ 新たに60人感染確認 県内計3530人に,https://www3.nhk.or.jp//news/html/20210901/k10013236651000.html,9月1日 14時14分,新型コロナ 国内感染者数
パラリンピック アーチェリー 岡崎は準々決勝敗退も5位入賞,https://www3.nhk.or.jp//news/html/20210901/k10013236601000.html,9月1日 14時01分,パラアーチェリー
デジタル庁 職員の3分の1が民間出身 透明性や公平性確保が課題,https://www3.nhk.or.jp//news/html/20210901/k10013236551000.html,9月1日 13時57分,IT・ネット
サッカーJ1湘南 浮嶋監督 成績不振で退任 新監督に山口コーチ,https://www3.nhk.or.jp//news/html/20210901/k10013236561000.html,9月1日 13時45分,サッカー
パラリンピック 大会関係者など新たに7人感染 新型コロナ,https://www3.nhk.or.jp//news/html/20210901/k10013236391000.html,9月1日 13時44分,オリンピック・パラリンピック　大会運営
