title,link,time,category
【被害状況 13日】石川県で215人死亡 安否不明者26人(午前9時),https://www3.nhk.or.jp//news/html/20240113/k10014319551000.html,1月13日 11時21分,令和6年能登半島地震
これから拡散しやすいデマって？過去の災害から見えたこと,https://www3.nhk.or.jp//news/html/20240113/k10014319311000.html,1月13日 11時08分,令和6年能登半島地震
台湾総統選挙 投票始まる 中国との向き合い方が争点,https://www3.nhk.or.jp//news/html/20240113/k10014319521000.html,1月13日 11時03分,台湾
能登半島地震 安否不明者26人の氏名 石川県が公表（13日9時）,https://www3.nhk.or.jp//news/html/20240113/k10014319541000.html,1月13日 10時59分,令和6年能登半島地震
先島諸島の避難計画 検討チーム設置へ 台湾有事が念頭 政府,https://www3.nhk.or.jp//news/html/20240113/k10014319531000.html,1月13日 10時44分,沖縄県
【放送同時提供】NHK金沢発 ライフライン情報 18:10－19:00,https://www3.nhk.or.jp//news/html/20240105/k10014309981000.html,1月13日 10時20分,令和6年能登半島地震
NASA 世界平均気温“去年は最も高かった” 温室効果ガスが一因,https://www3.nhk.or.jp//news/html/20240113/k10014319461000.html,1月13日 9時22分,環境
NY原油市場1バレル＝75ドル台まで上昇 フーシ派拠点への空爆で,https://www3.nhk.or.jp//news/html/20240113/k10014319481000.html,1月13日 9時18分,原油価格
カブス移籍の今永昇太 本拠地シカゴで入団会見 背番号は「18」,https://www3.nhk.or.jp//news/html/20240113/k10014319501000.html,1月13日 9時15分,大リーグ
英首相 ウクライナへの4600億円規模の軍事支援を表明,https://www3.nhk.or.jp//news/html/20240113/k10014319441000.html,1月13日 9時10分,ウクライナ情勢
軍事作戦の停止求めたICJ訴訟 イスラエル 審理で正当性を主張,https://www3.nhk.or.jp//news/html/20240113/k10014319381000.html,1月13日 8時19分,イスラエル・パレスチナ
バイデン大統領“船舶攻撃続けばさらなる措置”戦闘の拡大懸念,https://www3.nhk.or.jp//news/html/20240113/k10014319421000.html,1月13日 7時57分,イスラエル・パレスチナ
上川外相 米国務長官と会談 岸田首相訪米へ 緊密に連携で一致,https://www3.nhk.or.jp//news/html/20240113/k10014319241000.html,1月13日 7時47分,外務省
旅客機の窓パネル事故 米連邦航空局「ほかにも製造上の問題」,https://www3.nhk.or.jp//news/html/20240113/k10014319471000.html,1月13日 7時41分,航空
【13日随時更新】ガザ地区 死亡者のうち1万人以上が子どもか,https://www3.nhk.or.jp//news/html/20240113/k10014319371000.html,1月13日 7時33分,イスラエル・パレスチナ
【交通影響 13日】道路・鉄道・航空,https://www3.nhk.or.jp//news/html/20240113/k10014319491000.html,1月13日 6時57分,令和6年能登半島地震
【ライフライン 13日】給水情報・停電続く,https://www3.nhk.or.jp//news/html/20240113/k10014319401000.html,1月13日 6時56分,令和6年能登半島地震
インド最長の海上道路 日本支援で開通 交通渋滞など軽減に期待,https://www3.nhk.or.jp//news/html/20240113/k10014319281000.html,1月13日 6時52分,インド
石川 輪島 被災のグループホーム高齢者が医療態勢整った施設へ,https://www3.nhk.or.jp//news/html/20240113/k10014319391000.html,1月13日 6時32分,令和6年能登半島地震
能登半島 被災地は雨 土砂災害に十分注意 日本海側中心に雪も,https://www3.nhk.or.jp//news/html/20240113/k10014319451000.html,1月13日 5時53分,令和6年能登半島地震
