title,link,time,category
東山魁夷などの偽物版画流通 元画商ら著作権法違反の疑い逮捕,https://www3.nhk.or.jp//news/html/20210927/k10013278261000.html,9月27日 9時29分,事件
サッカー 本田圭佑 移籍後初試合でゴール リトアニア1部リーグ,https://www3.nhk.or.jp//news/html/20210927/k10013278251000.html,9月27日 9時07分,サッカー
大リーグ【詳細】大谷翔平 7回1失点の好投も10勝目ならず,https://www3.nhk.or.jp//news/html/20210927/k10013278181000.html,9月27日 9時02分,大リーグ
アイスランド議会選挙 再集計 女性議員は過半数割り込む見通し,https://www3.nhk.or.jp//news/html/20210927/k10013278121000.html,9月27日 8時38分,海外の選挙
ドイツ連邦議会選挙 二大政党による接戦に 連立交渉は難航か,https://www3.nhk.or.jp//news/html/20210927/k10013278131000.html,9月27日 8時34分,ドイツ
【気象予報士解説】台風16号 今後の進路は？（27日朝）,https://www3.nhk.or.jp//news/html/20210927/k10013278241000.html,9月27日 8時25分,気象
災害時 高齢者などに避難促す「避難保険」 自治体向けに販売へ,https://www3.nhk.or.jp//news/html/20210927/k10013277941000.html,9月27日 7時25分,
大リーグ パイレーツ筒香 2点タイムリーヒットで勝利に貢献,https://www3.nhk.or.jp//news/html/20210927/k10013278211000.html,9月27日 6時45分,大リーグ
猛烈な台風16号 今後も勢力強めながら北上 今のうち備え確認を,https://www3.nhk.or.jp//news/html/20210927/k10013278201000.html,9月27日 6時29分,台風
厚労省 感染再拡大備え 病床確保計画見直しを都道府県に通知へ,https://www3.nhk.or.jp//news/html/20210927/k10013277931000.html,9月27日 5時52分,新型コロナウイルス
政府 次世代エネルギー 国際ルールや枠組みづくりへの関与強化,https://www3.nhk.or.jp//news/html/20210927/k10013278071000.html,9月27日 5時41分,環境
鉄道業界 最新技術で点検や保守効率化 収益悪化や人手不足で,https://www3.nhk.or.jp//news/html/20210927/k10013277921000.html,9月27日 5時38分,新型コロナ 経済影響
大学入学共通テストの出願 きょうから受け付け開始,https://www3.nhk.or.jp//news/html/20210927/k10013277951000.html,9月27日 5時36分,共通テスト
東山魁夷などの偽物版画流通 画商ら著作権法違反の疑い 逮捕へ,https://www3.nhk.or.jp//news/html/20210927/k10013278101000.html,9月27日 5時34分,事件
御嶽山噴火から7年 記憶の継承と安全対策の実行が課題,https://www3.nhk.or.jp//news/html/20210927/k10013277981000.html,9月27日 5時27分,気象
フグの本場 山口 下関 刺身や切り身の自動販売機が登場,https://www3.nhk.or.jp//news/html/20210927/k10013277971000.html,9月27日 5時26分,
大相撲 横綱 白鵬 現役引退の意向固める 史上最多45回優勝,https://www3.nhk.or.jp//news/html/20210927/k10013278171000.html,9月27日 5時19分,大相撲
女子ゴルフ 畑岡奈紗 アメリカツアー今季2勝目 通算5勝目,https://www3.nhk.or.jp//news/html/20210927/k10013278191000.html,9月27日 5時14分,ゴルフ
19都道府県の緊急事態宣言 いずれも30日解除で検討 政府,https://www3.nhk.or.jp//news/html/20210927/k10013278021000.html,9月27日 5時10分,新型コロナウイルス
立民 新たな給付金創設など 観光業の緊急支援策まとめる,https://www3.nhk.or.jp//news/html/20210927/k10013277911000.html,9月27日 5時06分,新型コロナ 経済影響
