title,link,time,category
東京パラリンピック【随時更新】大会12日目 4日の結果や動き,https://www3.nhk.or.jp//news/html/20210904/k10013242511000.html,9月4日 13時13分,オリンピック・パラリンピック
パラリンピック 陸上 銀の大矢勇気「世界選手権で金メダルを」,https://www3.nhk.or.jp//news/html/20210904/k10013243461000.html,9月4日 13時04分,パラ陸上
パラリンピック 競泳 金メダルの木村「どの幸せより大きい」,https://www3.nhk.or.jp//news/html/20210904/k10013243421000.html,9月4日 12時32分,パラ競泳
山形県 新型コロナ 新たに20人感染確認,https://www3.nhk.or.jp//news/html/20210904/k10013243381000.html,9月4日 12時31分,新型コロナ 国内感染者数
鳥取県 新型コロナ 新たに15人感染確認,https://www3.nhk.or.jp//news/html/20210904/k10013243441000.html,9月4日 12時30分,新型コロナ 国内感染者数
福島県 新型コロナ 新たに53人感染確認,https://www3.nhk.or.jp//news/html/20210904/k10013243371000.html,9月4日 12時29分,新型コロナ 国内感染者数
同時多発テロ20年 バイデン大統領 捜査資料など開示検討を指示,https://www3.nhk.or.jp//news/html/20210904/k10013243431000.html,9月4日 12時25分,米 バイデン大統領
新型コロナ 重症者2223人に 前日から2人増 過去最多 厚労省,https://www3.nhk.or.jp//news/html/20210904/k10013243411000.html,9月4日 12時17分,新型コロナウイルス
上場企業の英文での情報開示内容 海外投資家の6割近くが不満,https://www3.nhk.or.jp//news/html/20210904/k10013243391000.html,9月4日 12時11分,
パラリンピック ゴールボール“滑るコート”で日本選手けが,https://www3.nhk.or.jp//news/html/20210904/k10013243301000.html,9月4日 12時01分,オリンピック・パラリンピック　大会運営
広範囲で大気不安定続く 土砂災害や川の急な増水などに警戒を,https://www3.nhk.or.jp//news/html/20210904/k10013243401000.html,9月4日 11時58分,気象
若い世代向けの優先枠分接種始まる 東京の大規模接種センター,https://www3.nhk.or.jp//news/html/20210904/k10013243361000.html,9月4日 11時55分,新型コロナ ワクチン（日本国内）
震度7の地震から3年を前に献花台 犠牲者を悼む 北海道 厚真町,https://www3.nhk.or.jp//news/html/20210904/k10013243331000.html,9月4日 11時46分,
アフガニスタン情勢めぐり米が国際会議開催へ タリバンけん制,https://www3.nhk.or.jp//news/html/20210904/k10013243341000.html,9月4日 11時42分,アフガニスタン
パラリンピック カヌー 瀬立モニカは7位 カヤックシングル,https://www3.nhk.or.jp//news/html/20210904/k10013243311000.html,9月4日 11時42分,パラカヌー
山口 岩国市 錦川が氾濫危険水位下回る,https://www3.nhk.or.jp//news/html/20210904/k10013243351000.html,9月4日 11時35分,気象
パラリンピック 新型コロナ 大会関係者ら新たに10人感染確認,https://www3.nhk.or.jp//news/html/20210904/k10013243321000.html,9月4日 11時24分,オリンピック・パラリンピック
パラリンピック ボッチャペア 日本が初の決勝へ 銀以上が確定,https://www3.nhk.or.jp//news/html/20210904/k10013243291000.html,9月4日 11時07分,ボッチャ
パラリンピック バドミントン女子 里見が決勝へ 銀以上確定,https://www3.nhk.or.jp//news/html/20210904/k10013243281000.html,9月4日 11時00分,パラバドミントン
パラリンピック 陸上 初出場の佐々木真菜は7位 女子400m,https://www3.nhk.or.jp//news/html/20210904/k10013243271000.html,9月4日 10時47分,パラ陸上
